Judges,11,1,NOW JEPHTHAH the Gileadite was a mighty warrior but he was the son of a harlot. Gilead was Jephthah's father.
Judges,11,2,And Gilead's wife also bore him sons and when his wife's sons grew up they thrust Jephthah out and said to him You shall not have an inheritance in our father's house for you are the son of another woman.
Judges,11,3,Then Jephthah fled from his brothers and dwelt in the land of Tob; and worthless men gathered around Jephthah and went on raids with him.
Judges,11,4,And after a time the Ammonites made war against Israel.
Judges,11,5,And when the Ammonites made war against Israel the elders of Gilead went to bring Jephthah out of the land of Tob;
Judges,11,6,And they said to Jephthah Come and be our leader that we may fight with the Ammonites.
Judges,11,7,But Jephthah said to the elders of Gilead Did you not hate me and drive me out of my father's house? Why have you come to me now when you are in trouble?
Judges,11,8,And the elders of Gilead said to Jephthah This is why we have turned to you now that you may go with us and fight the Ammonites and be our head over all the citizens of Gilead.
Judges,11,9,Jephthah said to the elders of Gilead If you bring me home again to fight against the Ammonites and the Lord gives them over to me [understand that] I will be your head.
Judges,11,10,And the elders of Gilead said to Jephthah The Lord is witness between us if we do not do as you have said.
Judges,11,11,So Jephthah went with the elders of Gilead and the people made him head and leader over them. And Jephthah repeated all he had promised before the Lord at Mizpah.
Judges,11,12,And Jephthah sent messengers to the king of the Ammonites saying What have you to do with me that you have come against me to fight in my land?
Judges,11,13,The Ammonites' king replied to the messengers of Jephthah Because Israel took away my land [which was not true] when they came up out of Egypt [300 years before] from the Arnon even to Jabbok and to the Jordan; now therefore restore those lands peaceably.
Judges,11,14,And Jephthah sent messengers again to the king of the Ammonites
Judges,11,15,And said to him Thus says Jephthah Israel did not take the land of Moab or the land of the Ammonites.
Judges,11,16,But when [Israel] came up from Egypt [they] walked through the wilderness to the Red Sea and came to Kadesh.
Judges,11,17,Then Israel sent messengers to the king of Edom saying Let us we pray pass through your land but the king of Edom would not listen. Also they sent to the king of Moab but he would not consent. So Israel remained at Kadesh.
Judges,11,18,Then they went through the wilderness and went around the land of Edom and the land of Moab and came by the east side of the land of Moab and camped on the other side of the Arnon; but they came not within the territory of Moab for the Arnon was the boundary of Moab.
Judges,11,19,Then Israel sent messengers to Sihon king of the Amorites king of Heshbon and Israel said to him Let us pass we pray you through your land to our country.
Judges,11,20,But Sihon did not trust Israel to pass through his territory; so Sihon gathered all his people together and encamped at Jahaz and fought with Israel.
Judges,11,21,And the Lord the God of Israel gave Sihon and all his people into the hand of Israel and they defeated them; so Israel took possession of all the land of the Amorites the inhabitants of that country.
Judges,11,22,They possessed all the territory of the Amorites from the Arnon even to the Jabbok and from the wilderness even to the Jordan.
Judges,11,23,So now the Lord God of Israel has dispossessed the Amorites from before His people Israel and should you possess them?
Judges,11,24,Will you not possess what Chemosh your god gives you to possess? And all the Lord our God dispossessed before us we will possess.
Judges,11,25,Now are you any better than Balak son of Zippor king of Moab? Did he ever strive against Israel or did he ever go to war with them?
Judges,11,26,While Israel dwelt in Heshbon and its villages and in Aroer and its villages and in all the cities along the banks of the Arnon for 300 years why did you not recover [your lost lands] during that time?
Judges,11,27,So I have not sinned against you but you are doing me wrong to war against me. The Lord the [righteous] Judge judge this day between the Israelites and the Ammonites.
Judges,11,28,But the king of the Ammonites did not listen to the message Jephthah sent him.
Judges,11,29,Then the Spirit of the Lord came upon Jephthah and he passed through Gilead and Manasseh and Mizpah of Gilead and from Mizpah of Gilead he passed on to the Ammonites.
Judges,11,30,And Jephthah made a vow to the Lord and said If You will indeed give the Ammonites into my hand
Judges,11,31,Then whatever or whoever comes forth from the doors of my house to meet me when I return in peace from the Ammonites it shall be the Lord's and I will offer it or him up as a burnt offering.
Judges,11,32,Then Jephthah crossed over to the Ammonites to fight with them and the Lord gave them into his hand.
Judges,11,33,And from Aroer to Minnith he smote them twenty cities and as far as Abel-cheramim [the meadow of vineyards] with a very great slaughter. So the Ammonites were subdued before the Israelites.
Judges,11,34,Then Jephthah came to Mizpah to his home and behold his daughter came out to meet him with timbrels and with dances! And she was his only child; beside her he had neither son nor daughter.
Judges,11,35,And when he saw her he rent his clothes and said Alas my daughter! You have brought me very low and you are the cause of great trouble to me; for I have opened my mouth [in a vow] to the Lord and I cannot take it back.
Judges,11,36,And she said to him My father if you have opened your mouth to the Lord do to me according to what you have vowed since the Lord has taken vengeance for you on your enemies the Ammonites.
Judges,11,37,And she said to her father Let this thing be done for me; let me alone two months that I may go and wander upon the mountains and bewail my virginity I and my companions.
Judges,11,38,And he said Go. And he sent her away for two months and she went with her companions and bewailed her virginity upon the mountains.
Judges,11,39,At the end of two months she returned to her father who did with her according to his vow which he had vowed. She never mated with a man. This became a custom in Israel--
Judges,11,40,That the daughters of Israel went yearly to mourn the daughter of Jephthah the Gileadite four days in a year.
Judges,12,1,THE MEN of Ephraim were summoned together and they crossed to Zaphon and said to Jephthah Why did you cross over to fight with the Ammonites and did not summon us to go with you? We will burn your house over you with fire.
Judges,12,2,And Jephthah said to them I and my people were in a severe conflict with the Ammonites and I when I called you you did not rescue me from their hands.
Judges,12,3,And when I saw that you would not rescue me I put my life in my hands and crossed over against the Ammonites and the Lord delivered them into my hand. Why then have you come up to me this day to fight against me?
Judges,12,4,Then Jephthah gathered all the men of Gilead and fought with Ephraim; and the men of Gilead smote Ephraim because they had said You Gileadites are fugitives of Ephraim in the midst of Ephraim and Manasseh.
Judges,12,5,And the Gileadites took the fords of the Jordan before the Ephraimites; and when any of those Ephraimites who had escaped said Let me go over the men of Gilead said to him Are you an Ephraimite? If he said No
Judges,12,6,They said to him Then say Shibboleth; and he said Sibboleth for he could not pronounce it right. Then they seized him and slew him at the fords of the Jordan. And there fell at that time 42000 of the Ephraimites.
Judges,12,7,Jephthah judged Israel six years. Then Jephthah the Gileadite died and was buried in one of the cities of Gilead.
Judges,12,8,And after him Ibzan of Bethlehem judged Israel.
Judges,12,9,And he had thirty sons and thirty daughters whom he gave [to husbands] outside his tribe and thirty daughters [daughters-in-law] whom he brought in from outside his tribe for his sons. And he judged Israel seven years.
Judges,12,10,Then Ibzan died and was buried at Bethlehem.
Judges,12,11,After him Elon the Zebulunite judged Israel and he judged Israel ten years.
Judges,12,12,Then Elon the Zebulunite died and was buried at Aijalon in the land of Zebulun.
Judges,12,13,And after him Abdon son of Hillel the Pirathonite judged Israel.
Judges,12,14,And he had forty sons and thirty grandsons who rode on seventy donkey colts; and he judged Israel eight years.
Judges,12,15,Then Abdon son of Hillel the Pirathonite died and was buried at Pirathon in the land of Ephraim in the hill country of the Amalekites.
Judges,13,1,AND THE Israelites again did what was evil in the sight of the Lord and the Lord gave them into the hands of the Philistines for forty years.
Judges,13,2,And there was a certain man of Zorah of the tribe of the Danites whose name was Manoah; and his wife was barren and had no children.
Judges,13,3,And the Angel of the Lord appeared to the woman and said to her Behold you are barren and have no children but you shall become pregnant and bear a son.
Judges,13,4,Therefore beware and drink no wine or strong drink and eat nothing unclean.
Judges,13,5,For behold you shall become pregnant and bear a son. No razor shall come upon his head for the child shall be a Nazirite to God from birth and he shall begin to deliver Israel out of the hands of the Philistines.
Judges,13,6,Then the woman went and told her husband saying A Man of God came to me and his face was like the face of the Angel of God to be greatly and reverently feared. I did not ask him from where he came and he did not tell me his name.
Judges,13,7,But he said to me Behold you shall become pregnant and bear a son and now drink no wine or strong drink and eat nothing unclean for the child shall be a Nazirite to God from birth to the day of his death.
Judges,13,8,Then Manoah entreated the Lord and said O Lord let the Man of God whom You sent come again to us and teach us what we shall do with the child that shall be born.
Judges,13,9,And God listened to the voice of Manoah and the Angel of God came again to the woman as she sat in the field; but Manoah her husband was not with her.
Judges,13,10,And the woman ran in haste and told her husband and said to him Behold the Man who came to me the other day has appeared to me.
Judges,13,11,And Manoah arose and went after his wife and came to the Man and said to him Are you the Man who spoke to this woman? And he said I am.
Judges,13,12,And Manoah said Now when your words come true how shall we manage the child and what is he to do?
Judges,13,13,And the Angel of the Lord said to Manoah Let the mother beware of all that I told her.
Judges,13,14,She may not eat of anything that comes from the grapevine nor drink wine or strong drink nor eat any unclean thing. All that I commanded her let her observe.
Judges,13,15,And Manoah said to the Angel of the Lord Pray let us detain you that we may prepare a kid for you.
Judges,13,16,And the Angel of the Lord said to Manoah Though you detain me I will not eat of your food but if you make ready a burnt offering offer it to the Lord. For Manoah did not know that he was the Angel of the Lord.
Judges,13,17,And Manoah said to the Angel of the Lord What is your name so that when your words come true we may do you honor?
Judges,13,18,And the Angel of the Lord said to him Why do you ask my name seeing it is wonderful?
Judges,13,19,So Manoah took the kid with the cereal offering and offered it upon a rock to the Lord the Angel working wonders while Manoah and his wife looked on.
Judges,13,20,For when the flame went up toward the heavens from the altar the Angel of the Lord ascended in the altar flame. And Manoah and his wife looked on and they fell on their faces to the ground.
Judges,13,21,The Angel of the Lord did not appear again to Manoah or to his wife. Then Manoah knew that he was the Angel of the Lord.
Judges,13,22,And Manoah said to his wife We shall surely die because we have seen God.
Judges,13,23,But his [sensible] wife said to him If the Lord were pleased to kill us He would not have received a burnt offering and a cereal offering from our hands nor have shown us all these things or now have announced such things as these.
Judges,13,24,And the woman [in due time] bore a son and called his name Samson; and the child grew and the Lord blessed him.
Judges,13,25,And the Spirit of the Lord began to move him at times in Mahaneh-dan [the camp of Dan] between Zorah and Eshtaol.
Judges,14,1,SAMSON WENT down to Timnah and at Timnah saw one of the daughters of the Philistines.
Judges,14,2,And he came up and told his father and mother I saw one of the daughters of the Philistines at Timnah; now get her for me as my wife.
Judges,14,3,But his father and mother said to him Is there not a woman among the daughters of your kinsmen or among all our people that you must go to take a wife from the uncircumcised Philistines? And Samson said to his father Get her for me for she is all right in my eyes.
Judges,14,4,His father and mother did not know that it was of the Lord and that He sought an occasion for assailing the Philistines. At that time the Philistines had dominion over Israel.
Judges,14,5,Then Samson and his father and mother went down to Timnah and came to the vineyards of Timnah. And behold a young lion roared against him.
Judges,14,6,And the Spirit of the Lord came mightily upon him and he tore the lion as he would have torn a kid and he had nothing in his hand; but he did not tell his father or mother what he had done.
Judges,14,7,And he went down and talked with the woman and she pleased Samson well.
Judges,14,8,And after a while he returned to take her and he turned aside to see the body of the lion and behold a swarm of bees and honey were in the body of the lion.
Judges,14,9,And he scraped some of the honey out into his hands and went along eating. And he came to his father and mother and gave them some and they ate it; but he did not tell them he had taken the honey from the body of the lion.
Judges,14,10,His father went down to the woman and Samson made a feast there for that was the customary thing for young men to do.
Judges,14,11,And when the people saw him they brought thirty companions to be with him.
Judges,14,12,And Samson said to them I will now put forth a riddle to you; if you can tell me what it is within the seven days of the feast and find it out then I will give you thirty linen undergarments and thirty changes of raiment.
Judges,14,13,But if you cannot declare it to me then shall you give me thirty linen undergarments and thirty changes of festive [costly] raiment. And they said to him Put forth your riddle that we may hear it.
Judges,14,14,And he said to them Out of the eater came forth food and out of the strong came forth sweetness. And they could not solve the riddle in three days.
Judges,14,15,And on the seventh day they said to Samson's wife Entice your husband to declare to us the riddle lest we burn you and your father's household with fire. Have you invited us to make us poor? Is this not true?
Judges,14,16,And Samson's wife wept before him and said You only hate me you do not love me; you have put forth a riddle to my countrymen and have not told the answer to me. And he said to her Behold I have not told my father or my mother and shall I tell you?
Judges,14,17,And Samson's wife wept before him the seven days their feast lasted and on the seventh day he told her because she pressed him with entreaties. Then she told the riddle to her countrymen.
Judges,14,18,And the men of the city said to [Samson] on the seventh day before sundown What is sweeter than honey? What is stronger than a lion? And he said to them If you had not plowed with my heifer you would not have solved my riddle.
Judges,14,19,And the Spirit of the Lord came upon him and he went down to Ashkelon and slew thirty men of them and took their apparel [as spoil] and gave the changes of garments to those who explained the riddle. And his anger was kindled and he went up to his father's house.
Judges,14,20,But Samson's wife was [given] to his companion who was his [best] friend.
Judges,15,1,BUT SOME days later in the time of wheat harvest Samson went to visit his wife taking along a kid [as a token of reconciliation]; and he said I will go unto my wife in the inner chamber. But her father would not allow him to go in.
Judges,15,2,And her father said I truly thought you utterly hated her so I gave her to your companion. Is her younger sister not fairer than she? Take her I pray you instead.
Judges,15,3,And Samson said of them This time shall I be blameless as regards the Philistines though I do them evil.
Judges,15,4,So Samson went and caught 300 foxes or jackals and took torches and turning the foxes tail to tail he put a torch between each pair of tails.
Judges,15,5,And when he had set the torches ablaze he let the foxes go into the standing grain of the Philistines and he burned up the shocks and the standing grain along with the olive orchards.
Judges,15,6,Then the Philistines said Who has done this? And they were told Samson the son-in-law of the Timnite because he [the Timnite] has taken his [Samson's] wife and has given her to his companion. And the Philistines came up and burned her and her father with fire.
Judges,15,7,And Samson said to them If this is the way you act surely I will take revenge on you and after that I will quit.
Judges,15,8,And he smote them hip and thigh [unsparingly] a great slaughter; and he went down and dwelt in the cleft of the rock of Etam.
Judges,15,9,Then the Philistines came up and encamped in Judah and spread themselves in Lehi.
Judges,15,10,And the men of Judah said Why have you come up against us? And they answered We have come up to bind Samson to do to him as he has done to us.
Judges,15,11,Then 3000 men of Judah went down to the cleft of the rock Etam and said to Samson Have you not known that the Philistines are rulers over us? What is this that you have done to us? He said to them As they did to me so have I done to them.
Judges,15,12,And they said to him We have come down to bind you that we may deliver you into the hands of the Philistines. And Samson said to them Swear to me that you will not fall upon me yourselves.
Judges,15,13,And they said to him No we will bind you fast and give you into their hand; but surely we will not kill you. So they bound him with two new ropes and brought him up from the rock.
Judges,15,14,And when he came to Lehi the Philistines came shouting to meet him. And the Spirit of the Lord came mightily upon [Samson] and the ropes on his arms became as flax that had caught fire and his bonds melted off his hands.
Judges,15,15,And he found a still moist jawbone of a donkey and reached out and took it and slew 1000 men with it.
Judges,15,16,And Samson said With the jawbone of a donkey heaps upon heaps with the jawbone of a donkey I have slain 1000 men!
Judges,15,17,And when he stopped speaking he cast the jawbone from his hand; and that place was called Ramath-lehi [the hill of the jawbone].
Judges,15,18,Samson was very thirsty and he prayed to the Lord and said You have given this great deliverance by the hand of Your servant and now shall I die of thirst and fall into the hands of the uncircumcised?
Judges,15,19,And God split open the hollow place that was at Lehi and water came out of it. And when he drank his spirit returned and he revived. Therefore the name of it was called En-hakkore [the spring of him who prayed] which is at Lehi to this day.
Judges,15,20,And [Samson] judged (defended) Israel in the days of the Philistines twenty years.
Judges,16,1,THEN SAMSON went to Gaza and saw a harlot there and went in to her.
Judges,16,2,The Gazites were told Samson has come here. So they surrounded the place and lay in wait for him all night at the gate of the city. They were quiet all night saying In the morning when it is light we will kill him.
Judges,16,3,But Samson lay until midnight and [then] he arose and took hold of the doors of the city's gate and the two posts and pulling them up bar and all he put them on his shoulders and carried them to the top of the hill that is before Hebron.
Judges,16,4,After this he loved a woman in the Valley of Sorek whose name was Delilah.
Judges,16,5,And the lords of the Philistines came to her and said to her Entice him and see in what his great strength lies and by what means we may overpower him that we may bind him to subdue him. And we will each give you 1100 pieces of silver.
Judges,16,6,And Delilah said to Samson Tell me I pray you wherein your great strength lies and with what you might be bound to subdue you.
Judges,16,7,And Samson said to her If they bind me with seven fresh strong gutstrings still moist then shall I be weak and be like any other man.
Judges,16,8,Then the Philistine lords brought to her seven fresh strong bowstrings still moist and she bound him with them.
Judges,16,9,Now she had men lying in wait in an inner room. And she said to him The Philistines are upon you Samson! And he broke the bowstrings as a string of tow breaks when it touches the fire. So the secret of his strength was not known.
Judges,16,10,And Delilah said to Samson Behold you have mocked me and told me lies; now tell me I pray you how you might be bound.
Judges,16,11,And he said to her If they bind me fast with new ropes that have not been used then I shall become weak and be like any other man.
Judges,16,12,So Delilah took new ropes and bound him with them and said to him The Philistines are upon you Samson! And the men lying in wait were in the inner room. But he snapped the ropes off his arms like [sewing] thread.
Judges,16,13,And Delilah said to Samson Until now you have mocked me and told me lies; tell me with what you might be bound. And he said to her If you weave the seven braids of [the hair of] my head with the web.
Judges,16,14,And she did so and fastened it with the pin and said to him The Philistines are upon you Samson! And he awoke out of his sleep and went away with the pin of the [weaver's] beam and with the web.
Judges,16,15,And she said to him How can you say I love you when your heart is not with me? You have mocked me these three times and have not told me in what your great strength lies.
Judges,16,16,And when she pressed him day after day with her words and urged him he was vexed to death.
Judges,16,17,Then he told her all his mind and said to her A razor has never come upon my head for I have been a Nazirite to God from my birth. If I am shaved then my strength will go from me and I shall become weak and be like any other man.
Judges,16,18,And when Delilah saw that he had told her all his mind she went and called for the Philistine lords saying Come up this once for he has told me all he knows. Then the Philistine lords came up to her and brought the money in their hands.
Judges,16,19,And she made Samson sleep upon her knees and she called a man and caused him to shave off the seven braids of his head. Then she began to torment [Samson] and his strength went from him.
Judges,16,20,She said The Philistines are upon you Samson! And he awoke out of his sleep and said I will go out as I have time after time and shake myself free. For Samson did not know that the Lord had departed from him.
Judges,16,21,But the Philistines laid hold of him bored out his eyes and brought him down to Gaza and bound him with [two] bronze fetters; and he ground at the mill in the prison.
Judges,16,22,But the hair of his head began to grow again after it had been shaved.
Judges,16,23,Then the Philistine lords gathered together to offer a great sacrifice to Dagon their god and to rejoice for they said Our god has given Samson our enemy into our hands.
Judges,16,24,And when the people saw Samson they praised their god for they said Our god has delivered into our hands our enemy the ravager of our country who has slain many of us.
Judges,16,25,And when their hearts were merry they said Call for Samson that he may make sport for us. So they called [blind] Samson out of the prison and he made sport before them. They made him stand between the pillars.
Judges,16,26,And Samson said to the lad who held him by the hand Allow me to feel the pillars upon which the house rests that I may lean against them.
Judges,16,27,Now the house was full of men and women; all the Philistine princes were there and on the roof were about 3000 men and women who looked on while Samson made sport.
Judges,16,28,Then Samson called to the Lord and said O Lord God [earnestly] remember me I pray You and strengthen me I pray You only this once O God and let me have one vengeance upon the Philistines for both my eyes.
Judges,16,29,And Samson laid hold of the two middle pillars by which the house was borne up one with his right hand and the other with his left.
Judges,16,30,And Samson cried Let me die with the Philistines! And he bowed himself mightily and the house fell upon the princes and upon all the people that were in it. So the dead whom he slew at his death were more than they whom he slew in his life.
Judges,16,31,Then his kinsmen and all the tribal family of his father came down took his body and brought it up; and they buried him between Zorah and Eshtaol in the burial place of Manoah his father. He had judged Israel [that is had defended the Israelites] twenty years.
Judges,17,1,THERE WAS a man of the hill country of Ephraim whose name was Micah.
Judges,17,2,And he said to his mother The 1100 shekels of silver that were taken from you about which you cursed and also spoke about in my hearing behold I have the silver with me; I took it. And his mother said Blessed be you by the Lord my son!
