Deuteronomy,22,30,A man shall not take his father's former wife nor shall he uncover her who belongs to his father.
Deuteronomy,23,1,HE WHO is wounded in the testicles or has been made a eunuch shall not enter into the congregation of the Lord.
Deuteronomy,23,2,A person begotten out of wedlock shall not enter into the assembly of the Lord; even to his tenth generation shall his descendants not enter into the congregation of the Lord.
Deuteronomy,23,3,An Ammonite or Moabite shall not enter into the congregation of the Lord; even to their tenth generation their descendants shall not enter into the assembly of the Lord forever
Deuteronomy,23,4,Because they did not meet you with food and water on the way when you came forth out of Egypt and because they hired Balaam son of Beor of Pethor of Mesopotamia against you to curse you.
Deuteronomy,23,5,Nevertheless the Lord your God would not listen to Balaam but the Lord your God turned the curse into a blessing to you because the Lord your God loves you.
Deuteronomy,23,6,You shall not seek their peace or their prosperity all your days forever.
Deuteronomy,23,7,You shall not abhor an Edomite for he is your brother [Esau's descendant]. You shall not abhor an Egyptian because you were a stranger and temporary resident in his land.
Deuteronomy,23,8,Their children may enter into the congregation of the Lord in their third generation.
Deuteronomy,23,9,When you go forth against your enemies and are in camp you shall keep yourselves from every evil thing.
Deuteronomy,23,10,If there is among you any man who is not clean by reason of what happens to him at night then he shall go outside the camp; he shall not come within the camp;
Deuteronomy,23,11,But when evening comes he shall bathe himself in water and when the sun is down he may return to the camp.
Deuteronomy,23,12,You shall have a place also outside the camp to which you shall go [as a comfort station];
Deuteronomy,23,13,And you shall have a paddle or shovel among your weapons and when you sit down outside [to relieve yourself] you shall dig a hole with it and turn back and cover up what has come from you.
Deuteronomy,23,14,For the Lord your God walks in the midst of your camp to deliver you and to give up your enemies before you. Therefore shall your camp be holy that He may see nothing indecent among you and turn away from you.
Deuteronomy,23,15,You shall not give up to his master a servant who has escaped from his master to you.
Deuteronomy,23,16,He shall dwell with you in your midst wherever he chooses in one of your towns where it pleases him best. You shall not defraud or oppress him.
Deuteronomy,23,17,There shall be no cult prostitute among the daughters of Israel neither shall there be a cult prostitute (a sodomite) among the sons of Israel.
Deuteronomy,23,18,You shall not bring the hire of a harlot or the price of a dog (a sodomite) into the house of the Lord your God as payment of a vow for both of these [the gift and the giver] are an abomination to the Lord your God.
Deuteronomy,23,19,You shall not lend on interest to your brother--interest on money on victuals on anything that is lent for interest.
Deuteronomy,23,20,You may lend on interest to a foreigner but to your brother you shall not lend on interest that the Lord your God may bless you in all that you undertake in the land to which you go to possess it.
Deuteronomy,23,21,When you make a vow to the Lord your God you shall not be slack in paying it for the Lord your God will surely require it of you and slackness would be sin in you.
Deuteronomy,23,22,But if you refrain from vowing it will not be sin in you.
Deuteronomy,23,23,The vow which has passed your lips you shall be watchful to perform a voluntary offering which you have made to the Lord your God which you have promised with your mouth.
Deuteronomy,23,24,When you come into your neighbor's vineyard you may eat your fill of grapes as many as you please but you shall not put any in your vessel.
Deuteronomy,23,25,When you come into the standing grain of your neighbor you may pluck the ears with your hand but you shall not put a sickle to your neighbor's standing grain.
Deuteronomy,24,1,WHEN A man takes a wife and marries her if then she finds no favor in his eyes because he has found some indecency in her and he writes her a bill of divorce puts it in her hand and sends her out of his house
Deuteronomy,24,2,And when she departs out of his house she goes and marries another man
Deuteronomy,24,3,And if the latter husband dislikes her and writes her a bill of divorce and puts it in her hand and sends her out of his house or if the latter husband dies who took her as his wife
Deuteronomy,24,4,Then her former husband who sent her away may not take her again to be his wife after she is defiled. For that is an abomination before the Lord; and you shall not bring guilt upon the land which the Lord your God gives you as an inheritance.
Deuteronomy,24,5,When a man is newly married he shall not go out with the army or be charged with any business; he shall be free at home one year and shall cheer his wife whom he has taken.
Deuteronomy,24,6,No man shall take a mill or an upper millstone in pledge for he would be taking a life in pledge.
Deuteronomy,24,7,If a man is found kidnapping any of his brethren of the Israelites and treats him as a slave or a servant or sells him then that thief shall die. So you shall put evil from among you.
Deuteronomy,24,8,Take heed in the plague of leprosy that you watch diligently and do according to all that the Levitical priests shall teach you. As I commanded them so you shall be watchful and do.
Deuteronomy,24,9,Remember [earnestly] what the Lord your God did to Miriam on the way after you had come out of Egypt.
Deuteronomy,24,10,When you lend your brother anything you shall not go into his house to get his pledge.
Deuteronomy,24,11,You shall stand outside and the man to whom you lend shall bring the pledge out to you.
Deuteronomy,24,12,And if the man is poor you shall not keep his pledge overnight.
Deuteronomy,24,13,You shall surely restore to him the pledge at sunset that he may sleep in his garment and bless you; and it shall be credited to you as righteousness (rightness and justice) before the Lord your God.
Deuteronomy,24,14,You shall not oppress or extort from a hired servant who is poor and needy whether he is of your brethren or of your strangers and sojourners who are in your land inside your towns.
Deuteronomy,24,15,You shall give him his hire on the day he earns it before the sun goes down for he is poor and sets his heart upon it; lest he cry against you to the Lord and it be sin to you.
Deuteronomy,24,16,The fathers shall not be put to death for the children neither shall the children be put to death for the fathers; only for his own sin shall anyone be put to death.
Deuteronomy,24,17,You shall not pervert the justice due the stranger or the sojourner or the fatherless or take a widow's garment in pledge.
Deuteronomy,24,18,But you shall [earnestly] remember that you were a slave in Egypt and the Lord your God redeemed you from there; therefore I command you to do this.
Deuteronomy,24,19,When you reap your harvest in your field and have forgotten a sheaf in the field you shall not go back to get it; it shall be for the stranger and the sojourner the fatherless and the widow that the Lord your God may bless you in all the work of your hands.
Deuteronomy,24,20,When you beat your olive tree do not go over the boughs again; the leavings shall be for the stranger and the sojourner the fatherless and the widow.
Deuteronomy,24,21,When you gather the grapes of your vineyard you shall not glean it afterward; it shall be for the stranger and the sojourner the fatherless and the widow.
Deuteronomy,24,22,You shall [earnestly] remember that you were a slave in the land of Egypt; therefore I command you to do this.
Deuteronomy,25,1,IF THERE is a controversy between men and they come into court and the judges decide between them justifying the innocent and condemning the guilty
Deuteronomy,25,2,Then if the guilty man deserves to be beaten the judge shall cause him to lie down and be beaten in his presence with a certain number of stripes according to his offense.
Deuteronomy,25,3,Forty stripes may be given him but not more lest if he should be beaten with many stripes your brother should [be treated like a beast and] seem low and worthless to you.
Deuteronomy,25,4,You shall not muzzle the ox when he treads out the grain.
Deuteronomy,25,5,If brothers live together and one of them dies and has no son his wife shall not be married outside the family to a stranger [an excluded man]. Her husband's brother shall go in to her and take her as his wife and perform the duty of a husband's brother to her.
Deuteronomy,25,6,And the firstborn son shall succeed to the name of the dead brother that his name may not be blotted out of Israel.
Deuteronomy,25,7,And if the man does not want to take his brother's wife then let his brother's wife go up to the gate to the elders and say My husband's brother refuses to continue his brother's name in Israel; he will not perform the duty of my husband's brother.
Deuteronomy,25,8,Then the elders of his city shall call him and speak to him. And if he stands firm and says I do not want to take her
Deuteronomy,25,9,Then shall his brother's wife come to him in the presence of the elders and pull his shoe off his foot and spit in his face and shall answer So shall it be done to that man who does not build up his brother's house.
Deuteronomy,25,10,And his family shall be called in Israel The House of Him Whose Shoe Was Loosed.
Deuteronomy,25,11,When men strive together one with another and the wife of the one draws near to rescue her husband out of the hand of him who is beating him and puts out her hand and seizes the other man by the private parts
Deuteronomy,25,12,Then you shall cut off her hand; your eyes shall not pity her.
Deuteronomy,25,13,You shall not have in your bag true and false weights a large and a small.
Deuteronomy,25,14,You shall not have in your house true and false measures a large and a small.
Deuteronomy,25,15,But you shall have a perfect and just weight and a perfect and just measure that your days may be prolonged in the land which the Lord your God gives you.
Deuteronomy,25,16,For all who do such things all who do unrighteously are an abomination to the Lord your God.
Deuteronomy,25,17,Remember what Amalek did to you on the way when you had come forth from Egypt
Deuteronomy,25,18,How he did not fear God but when you were faint and weary he attacked you along the way and cut off all the stragglers at your rear.
Deuteronomy,25,19,Therefore when the Lord your God has given you rest from all your enemies round about in the land which the Lord your God gives you to possess as an inheritance you shall blot out the remembrance of Amalek from under the heavens; you must not forget.
Deuteronomy,26,1,WHEN YOU have come into the land which the Lord your God gives you as an inheritance and possess it and live in it
Deuteronomy,26,2,You shall take some of the first of all the produce of the soil which you harvest from the land the Lord your God gives you and put it in a basket and go to the place [the sanctuary] which the Lord your God has chosen as the abiding place for His Name [and His Presence].
Deuteronomy,26,3,And you shall go to the priest who is in office in those days and say to him I give thanks this day to the Lord your God that I have come to the land which the Lord swore to our fathers to give us.
Deuteronomy,26,4,And the priest shall take the basket from your hand and set it down before the altar of the Lord your God.
Deuteronomy,26,5,And you shall say before the Lord your God A wandering and lost Aramean ready to perish was my father [Jacob] and he went down into Egypt and sojourned there few in number and he became there a nation great mighty and numerous.
Deuteronomy,26,6,And the Egyptians treated us very badly and afflicted us and laid upon us hard bondage.
Deuteronomy,26,7,And when we cried to the Lord the God of our fathers the Lord heard our voice and looked on our affliction and our labor and our [cruel] oppression;
Deuteronomy,26,8,And the Lord brought us forth out of Egypt with a mighty hand and with an outstretched arm and with great (awesome) power and with signs and with wonders;
Deuteronomy,26,9,And He brought us into this place and gave us this land a land flowing with milk and honey.
Deuteronomy,26,10,And now behold I bring the firstfruits of the ground which You O Lord have given me. And you shall set it down before the Lord your God and worship before the Lord your God;
Deuteronomy,26,11,And you and the Levite and the stranger and the sojourner among you shall rejoice in all the good which the Lord your God has given you and your household.
Deuteronomy,26,12,When you have finished paying all the tithe of your produce the third year which is the year of tithing and have given it to the Levite the stranger and the sojourner the fatherless and to the widow that they may eat within your towns and be filled
Deuteronomy,26,13,Then you shall say before the Lord your God I have brought the hallowed things (the tithe) out of my house and moreover have given them to the Levite to the stranger and the sojourner to the fatherless and to the widow according to all Your commandments which You have commanded me; I have not transgressed any of Your commandments neither have I forgotten them.
Deuteronomy,26,14,I have not eaten of the tithe in my mourning [making the tithe unclean] nor have I handled any of it when I was unclean nor given any of it to the dead. I have hearkened to the voice of the Lord my God; I have done according to all that You have commanded me.
Deuteronomy,26,15,Look down from Your holy habitation from heaven and bless Your people Israel and the land which You have given us as You swore to our fathers a land flowing with milk and honey.
Deuteronomy,26,16,This day the Lord your God has commanded you to do these statutes and ordinances. Therefore you shall keep and do them with all your [mind and] heart and with all your being.
Deuteronomy,26,17,You have [openly] declared the Lord this day to be your God [pledging] to walk in His ways to keep His statutes and His commandments and His precepts and to hearken to His voice.
Deuteronomy,26,18,And the Lord has declared this day that you are His peculiar people as He promised you and you are to keep all His commandments;
Deuteronomy,26,19,And He will make you high above all nations which He has made in praise and in fame and in honor and that you shall be a holy people to the Lord your God as He has spoken.
Deuteronomy,27,1,AND MOSES with the elders of Israel commanded the people Keep all the commandments with which I charge you today.
Deuteronomy,27,2,And on the day when you pass over the Jordan to the land which the Lord your God gives you you shall set up great stones and cover them with plaster.
Deuteronomy,27,3,And you shall write on them all the words of this law when you have passed over that you may go into the land which the Lord your God is giving you a land flowing with milk and honey as the Lord the God of your fathers has promised you.
Deuteronomy,27,4,And when you have gone over the Jordan you shall set up these stones as I command you this day on Mount Ebal and coat them with plaster.
Deuteronomy,27,5,And there you shall build an altar to the Lord your God an altar of stones; you shall not lift up any iron tool upon them.
Deuteronomy,27,6,You shall build the altar of the Lord your God of whole stones and offer burnt offerings on it to Him;
Deuteronomy,27,7,And you shall offer peace offerings and eat there and rejoice before the Lord your God.
Deuteronomy,27,8,And you shall write upon the stones all the words of this law very plainly.
Deuteronomy,27,9,And Moses and the Levitical priests said to all Israel Keep silence and hear O Israel! This day you have become the people of the Lord your God.
Deuteronomy,27,10,So you shall obey the voice of the Lord your God and do His commandments and statutes which I command you today.
Deuteronomy,27,11,And Moses charged the people the same day saying
Deuteronomy,27,12,These [tribes] shall stand on Mount Gerizim to bless the people when you have passed over the Jordan: Simeon Levi Judah Issachar Joseph's [sons] and Benjamin.
Deuteronomy,27,13,And these [tribes] shall stand on Mount Ebal to pronounce the curse [for disobedience]: Reuben Gad Asher Zebulun Dan and Naphtali.
Deuteronomy,27,14,And the Levites shall declare with a loud voice to all the men of Israel:
Deuteronomy,27,15,Cursed is the man who makes a graven or molten image an abomination to the Lord the work of the hands of the craftsman and sets it up in secret. All the people shall answer Amen.
Deuteronomy,27,16,Cursed is he who dishonors his father or his mother. All the people shall say Amen.
Deuteronomy,27,17,Cursed is he who moves [back] his neighbor's landmark. All the people shall say Amen.
Deuteronomy,27,18,Cursed is he who misleads a blind man on his way. All the people shall say Amen.
Deuteronomy,27,19,Cursed is he who perverts the justice due to the sojourner or the stranger the fatherless and the widow. All the people shall say Amen.
Deuteronomy,27,20,Cursed is he who lies with his father's wife because he uncovers what belongs to his father. All the people shall say Amen.
Deuteronomy,27,21,Cursed is he who lies with any beast. All the people shall say Amen.
Deuteronomy,27,22,Cursed is he who lies with his half sister whether his father's or his mother's daughter. All the people shall say Amen.
Deuteronomy,27,23,Cursed is he who lies with his mother-in-law. All the people shall say Amen.
Deuteronomy,27,24,Cursed is he who slays his neighbor secretly. All the people shall say Amen.
Deuteronomy,27,25,Cursed is he who takes a bribe to slay an innocent person. All the people shall say Amen.
Deuteronomy,27,26,Cursed is he who does not support and give assent to the words of this law to do them [as the rule of his life]. All the people shall say Amen.
Deuteronomy,28,1,IF YOU will listen diligently to the voice of the Lord your God being watchful to do all His commandments which I command you this day the Lord your God will set you high above all the nations of the earth.
Deuteronomy,28,2,And all these blessings shall come upon you and overtake you if you heed the voice of the Lord your God.
Deuteronomy,28,3,Blessed shall you be in the city and blessed shall you be in the field.
Deuteronomy,28,4,Blessed shall be the fruit of your body and the fruit of your ground and the fruit of your beasts the increase of your cattle and the young of your flock.
Deuteronomy,28,5,Blessed shall be your basket and your kneading trough.
Deuteronomy,28,6,Blessed shall you be when you come in and blessed shall you be when you go out.
Deuteronomy,28,7,The Lord shall cause your enemies who rise up against you to be defeated before your face; they shall come out against you one way and flee before you seven ways.
Deuteronomy,28,8,The Lord shall command the blessing upon you in your storehouse and in all that you undertake. And He will bless you in the land which the Lord your God gives you.
Deuteronomy,28,9,The Lord will establish you as a people holy to Himself as He has sworn to you if you keep the commandments of the Lord your God and walk in His ways.
Deuteronomy,28,10,And all people of the earth shall see that you are called by the name [and in the presence of] the Lord and they shall be afraid of you.
Deuteronomy,28,11,And the Lord shall make you have a surplus of prosperity through the fruit of your body of your livestock and of your ground in the land which the Lord swore to your fathers to give you.
Deuteronomy,28,12,The Lord shall open to you His good treasury the heavens to give the rain of your land in its season and to bless all the work of your hands; and you shall lend to many nations but you shall not borrow.
Deuteronomy,28,13,And the Lord shall make you the head and not the tail; and you shall be above only and you shall not be beneath if you heed the commandments of the Lord your God which I command you this day and are watchful to do them.
Deuteronomy,28,14,And you shall not turn aside from any of the words which I command you this day to the right hand or to the left to go after other gods to serve them.
Deuteronomy,28,15,But if you will not obey the voice of the Lord your God being watchful to do all His commandments and His statutes which I command you this day then all these curses shall come upon you and overtake you:
Deuteronomy,28,16,Cursed shall you be in the city and cursed shall you be in the field.
Deuteronomy,28,17,Cursed shall be your basket and your kneading trough.
Deuteronomy,28,18,Cursed shall be the fruit of your body of your land of the increase of your cattle and the young of your sheep.
Deuteronomy,28,19,Cursed shall you be when you come in and cursed shall you be when you go out.
Deuteronomy,28,20,The Lord shall send you curses confusion and rebuke in every enterprise to which you set your hand until you are destroyed perishing quickly because of the evil of your doings by which you have forsaken me [Moses and God as one].
Deuteronomy,28,21,The Lord will make the pestilence cling to you until He has consumed you from the land into which you go to possess.
Deuteronomy,28,22,The Lord will smite you with consumption with fever and inflammation fiery heat sword and drought blasting and mildew; they shall pursue you until you perish.
Deuteronomy,28,23,The heavens over your head shall be brass and the earth under you shall be iron.
Deuteronomy,28,24,The Lord shall make the rain of your land powdered soil and dust; from the heavens it shall come down upon you until you are destroyed.
Deuteronomy,28,25,The Lord shall cause you to be struck down before your enemies; you shall go out one way against them and flee seven ways before them and you shall be tossed to and fro and be a terror among all the kingdoms of the earth. [Fulfilled in II Chron. 29:8.]
Deuteronomy,28,26,And your dead body shall be food for all the birds of the air and the beasts of the earth and there shall be no one to frighten them away.
Deuteronomy,28,27,The Lord will smite you with the boils of Egypt and the tumors the scurvy and the itch from which you cannot be healed.
Deuteronomy,28,28,The Lord will smite you with madness and blindness and dismay of [mind and] heart.
Deuteronomy,28,29,And you shall grope at noonday as the blind grope in darkness. And you shall not prosper in your ways; and you shall be only oppressed and robbed continually and there shall be no one to save you.
Deuteronomy,28,30,You shall betroth a wife but another man shall lie with her; you shall build a house but not live in it; you shall plant a vineyard but not gather its grapes.
Deuteronomy,28,31,Your ox shall be slain before your eyes but you shall not eat of it; your donkey shall be violently taken away before your face and not be restored to you; your sheep shall be given to your enemies and you shall have no one to help you.
Deuteronomy,28,32,Your sons and daughters shall be given to another people and your eyes shall look and fail with longing for them all the day; and there shall be no power in your hands to prevent it. [Fulfilled in II Chron. 29:9.]
Deuteronomy,28,33,A nation which you have not known shall eat up the fruit of your land and of all your labors and you shall be only oppressed and crushed continually [Fulfilled in Judg. 6:1-6; 13:1.]
Deuteronomy,28,34,So that you shall be driven mad by the sights which your eyes shall see.
Deuteronomy,28,35,The Lord will smite you on the knees and on the legs with a sore boil that cannot be healed from the sole of your foot to the top of your head.
Deuteronomy,28,36,The Lord shall bring you and your king whom you have set over you to a nation which neither you nor your fathers have known and there you shall [be forced to] serve other gods of wood and stone. [Fulfilled in II Kings 17:4 6; 24:12 14; 25:7 11; Dan. 6:11 12.]
Deuteronomy,28,37,And you shall become an amazement a proverb and a byword among all the peoples to which the Lord will lead you.
Deuteronomy,28,38,You shall carry much seed out into the field and shall gather little in for the locust shall consume it. [Fulfilled in Hag. 1:6.]
Deuteronomy,28,39,You shall plant vineyards and dress them but shall neither drink of the wine nor gather the grapes for the worm shall eat them.
Deuteronomy,28,40,You shall have olive trees throughout all your territory but you shall not anoint yourselves with the oil for your olive trees shall drop their fruit.
Deuteronomy,28,41,You shall beget sons and daughters but shall not enjoy them for they shall go into captivity. [Fulfilled in Lam. 1:5.]
Deuteronomy,28,42,All your trees and the fruit of your ground shall the locust possess. [Fulfilled in Joel 1:4.]
Deuteronomy,28,43,The transient (stranger) among you shall mount up higher and higher above you and you shall come down lower and lower.
Deuteronomy,28,44,He shall lend to you but you shall not lend to him; he shall be the head and you shall be the tail.
Deuteronomy,28,45,All these curses shall come upon you and shall pursue you and overtake you till you are destroyed because you do not obey the voice of the Lord your God to keep His commandments and His statutes which He commanded you.
Deuteronomy,28,46,They shall be upon you for a sign [of warning to other nations] and for a wonder and upon your descendants forever.
Deuteronomy,28,47,Because you did not serve the Lord your God with joyfulness of [mind and] heart [in gratitude] for the abundance of all [with which He had blessed you]
