1 Kings,20,33,Now the men took it as an omen and they hastily took it up and said Yes your brother Ben-hadad. Then the king said Go bring him. Then Ben-hadad came forth to him and the victorious king caused him to come up into the chariot.
1 Kings,20,34,Ben-hadad [tempting him] said The cities which my father took from your father I will restore; and you may maintain bazaars of your own in Damascus as my father did in Samaria. Then said Ahab I will send you away on these terms. So he made a covenant with him and sent him away.
1 Kings,20,35,And a certain man of the sons of the prophets said to his neighbor At the command of the Lord strike me I pray you. And the man refused to strike him.
1 Kings,20,36,Then said he to him Because you have not obeyed the voice of the Lord behold as soon as you have left me a lion will slay you. And as soon as he departed from him a lion found him and killed him.
1 Kings,20,37,Then [the prophet] found another man and said Strike me I pray you. And the man struck him so that in striking he wounded him.
1 Kings,20,38,So the prophet departed and waited for King Ahab by the way and disguised himself with ashes upon his face.
1 Kings,20,39,And as the king passed by the [prophet] cried out to him Your servant went out into the midst of the battle and behold a man turned aside and brought a man to me and said Keep this man. If for any reason he is missing then your life shall be required for his life or else you shall pay a talent of silver.
1 Kings,20,40,But while your servant was busy here and there he was gone. And the king of Israel said to him Such is your own verdict; you yourself have decided it.
1 Kings,20,41,The man hastily removed the ashes from his face and Ahab king of Israel recognized him as one of the prophets.
1 Kings,20,42,And he said to the king Thus says the Lord: Because you have let go out of your hand the man I had devoted to destruction therefore your life shall go for his life and your people for his people.
1 Kings,20,43,And King [Ahab] of Israel went to his house resentful and sullen and came to Samaria.
1 Kings,21,1,NOW NABOTH the Jezreelite had a vineyard in Jezreel close beside the palace of Ahab king of Samaria; and after these things
1 Kings,21,2,Ahab said to Naboth Give me your vineyard that I may have it for a garden of herbs because it is near my house. I will give you a better vineyard for it or if you prefer I will give you its worth in money.
1 Kings,21,3,Naboth said to Ahab The Lord forbid that I should give the inheritance of my fathers to you.
1 Kings,21,4,And Ahab [already depressed by the Lord's message to him] came into his house [more] resentful and sullen because of what Naboth the Jezreelite had said to him; for he had said I will not give you the inheritance of my fathers. And he lay down on his bed turned away his face and would eat no food.
1 Kings,21,5,But Jezebel his wife came and said to him Why is your spirit so troubled that you eat no food?
1 Kings,21,6,And he said to her Because I spoke to Naboth the Jezreelite and said to him Give me your vineyard for money; or if you prefer I will give you another vineyard for it. And he answered I will not give you my vineyard.
1 Kings,21,7,Jezebel his wife said to him Do you not govern Israel? Arise eat food and let your heart be happy. I will give you the vineyard of Naboth the Jezreelite.
1 Kings,21,8,So she wrote letters in Ahab's name and sealed them with his seal and sent them to the elders and nobles who dwelt with Naboth in his city.
1 Kings,21,9,And in the letters she said Proclaim a fast and set Naboth up high among the people.
1 Kings,21,10,And set two men base fellows before him and let them bear witness against him saying You cursed and renounced God and the king. Then carry him out and stone him to death.
1 Kings,21,11,And the men of his city the elders and the nobles who dwelt there did as Jezebel had directed in the letters sent them.
1 Kings,21,12,They proclaimed a fast and set Naboth on high among the people.
1 Kings,21,13,Two base fellows came in and sat opposite him and they charged Naboth before the people saying Naboth cursed and renounced God and the king. Then he was carried out of the city and stoned to death.
1 Kings,21,14,Then they sent to Jezebel saying Naboth has been stoned and is dead.
1 Kings,21,15,Then Jezebel said to Ahab Arise take possession of the vineyard of Naboth the Jezreelite which he refused to sell you for Naboth is not alive but dead.
1 Kings,21,16,When Ahab heard that he arose to go down to the vineyard of Naboth the Jezreelite to take possession of it.
1 Kings,21,17,Then the word of the Lord came to Elijah the Tishbite saying
1 Kings,21,18,Arise go down to meet Ahab king of Israel in Samaria. He is in the vineyard of Naboth where he has gone to possess it.
1 Kings,21,19,Say to him Thus says the Lord: Have you killed and also taken possession? Thus says the Lord: In the place where dogs licked the blood of Naboth shall dogs lick your blood even yours.
1 Kings,21,20,And Ahab said to Elijah Have you found me O my enemy? And he answered I have found you because you have sold yourself to do evil in the sight of the Lord.
1 Kings,21,21,See [says the Lord] I will bring evil on you and utterly sweep away and cut off from Ahab every male bond and free
1 Kings,21,22,And will make your household like that of Jeroboam son of Nebat and like the household of Baasha son of Ahijah for the provocation with which you have provoked Me to anger and made Israel to sin.
1 Kings,21,23,Also the Lord said of Jezebel: The dogs shall eat Jezebel by the wall of Jezreel.
1 Kings,21,24,Any belonging to Ahab who dies in the city the dogs shall eat and any who dies in the field the birds of the air shall eat.
1 Kings,21,25,For there was no one who sold himself to do evil in the sight of the Lord as did Ahab incited by his wife Jezebel.
1 Kings,21,26,He did very abominably in going after idols as had the Amorites whom the Lord cast out before the Israelites.
1 Kings,21,27,When Ahab heard those words of Elijah he tore his clothes put sackcloth on his flesh fasted lay in sackcloth and went quietly.
1 Kings,21,28,And the word of the Lord came to Elijah the Tishbite saying
1 Kings,21,29,Do you see how Ahab humbles himself before Me? Because he humbles himself before Me I will not bring the evil in his lifetime but in his son's day I will bring the evil upon his house.
1 Kings,22,1,SYRIA AND Israel continued without war for three years.
1 Kings,22,2,In the third year Jehoshaphat king of Judah came down to the king of Israel.
1 Kings,22,3,And [Ahab] king of Israel said to his servants Do you know that Ramoth in Gilead is ours and we keep silence and do not take it from the king of Syria?
1 Kings,22,4,And [Ahab] said to Jehoshaphat Will you go with me to Ramoth-gilead to battle? Jehoshaphat said to the king of Israel I am as you are my people as your people my horses as your horses.
1 Kings,22,5,But Jehoshaphat said to the king of Israel Inquire first I pray you for the word of the Lord today.
1 Kings,22,6,Then [Ahab] king of Israel gathered the prophets together about 400 men and said to them Shall I go against Ramoth-gilead to battle or shall I hold back? And they said Go up for the Lord will deliver it into the hand of the king.
1 Kings,22,7,Jehoshaphat said Is there not another prophet of the Lord here whom we may ask?
1 Kings,22,8,[Ahab] king of Israel said to Jehoshaphat There is yet one man Micaiah son of Imlah by whom we may inquire of the Lord but I hate him for he never prophesies good for me but evil. Jehoshaphat said Let not the king say that.
1 Kings,22,9,Then [Ahab] king of Israel told an officer Bring quickly Micaiah son of Imlah.
1 Kings,22,10,Now the king of Israel and Jehoshaphat king of Judah were sitting in [royal] robes [or armor] each on his throne in an open place [on a threshing floor] at the entrance of the gate of Samaria; and all the prophets prophesied before them.
1 Kings,22,11,And Zedekiah son of Chenaanah made him horns of iron and said Thus says the Lord: With these you shall push the Syrians until they are destroyed.
1 Kings,22,12,And all the prophets agreed saying Go up to Ramoth-gilead and prosper for the Lord will deliver it into the king's hand.
1 Kings,22,13,The messenger who went to call Micaiah said to him Behold now the prophets unanimously declare good to the king. Let your answer I pray you be like theirs and say what is good.
1 Kings,22,14,But Micaiah said As the Lord lives I will speak what the Lord says to me.
1 Kings,22,15,So he came to the king. King [Ahab] said Micaiah shall we go against Ramoth-gilead to battle or shall we hold back? And he answered Go and prosper for the Lord will deliver it into the king's hand.
1 Kings,22,16,And the king said to him How many times must I charge you to tell me nothing but the truth in the name of the Lord?
1 Kings,22,17,And he said I saw all Israel scattered upon the hills as sheep that have no shepherd and the Lord said These have no master. Let them return every man to his house in peace.
1 Kings,22,18,Then the king of Israel said to Jehoshaphat Did I not tell you that he would prophesy no good concerning me but evil?
1 Kings,22,19,And Micaiah said Hear the word of the Lord: I saw the Lord sitting on His throne and all the host of heaven standing by Him on His right hand and on His left.
1 Kings,22,20,And the Lord said Who will entice Ahab to go up and fall at Ramoth-gilead? One said this way another said that way.
1 Kings,22,21,Then there came forth a spirit [of whom I am about to tell] and stood before the Lord and said I will entice him.
1 Kings,22,22,The Lord said to him By what means? And he said I will go forth and be a lying spirit in the mouths of all his prophets. [The Lord] said You shall entice him and succeed also. Go forth and do it.
1 Kings,22,23,So the Lord has put a lying spirit in the mouths of all these prophets; and the Lord has spoken evil concerning you.
1 Kings,22,24,But Zedekiah son of Chenaanah went near and struck Micaiah on the cheek and said Which way went the Spirit of the Lord from me to speak to you?
1 Kings,22,25,Micaiah said Behold you shall see on that day when you go into an inner chamber to hide yourself.
1 Kings,22,26,[Ahab] king of Israel said Take Micaiah carry him back to Amon the governor of the city and to Joash the king's son
1 Kings,22,27,And say The king says Put this fellow in prison and feed him with bread and water of affliction until I come in peace.
1 Kings,22,28,Micaiah said If you return at all in peace the Lord has not spoken by me. He [added] Hear O people every one of you!
1 Kings,22,29,So [Ahab] king of Israel and Jehoshaphat the king of Judah went up to Ramoth-gilead.
1 Kings,22,30,And the king of Israel said to Jehoshaphat I will disguise myself and enter the battle but you put on your [royal] clothing. And the king of Israel disguised himself and went into the battle.
1 Kings,22,31,But the king of Syria had commanded the thirty-two captains of his chariots Fight neither with small nor great but only with [Ahab] king of Israel.
1 Kings,22,32,And when the captains of the chariots saw Jehoshaphat they said Surely it is the king of Israel. They turned to fight against him but Jehoshaphat cried out.
1 Kings,22,33,And when the captains of the chariots saw that it was not the king of Israel they turned back from pursuing him.
1 Kings,22,34,But a certain man drew a bow at a venture and smote [Ahab] the king of Israel between the joints of the armor. So he said to the driver of his chariot Turn around and carry me out of the army for I am wounded.
1 Kings,22,35,The battle increased that day and [Ahab] the king was propped up in his chariot facing the Syrians and at nightfall he died. And the blood of his wound flowed onto the floor of the chariot.
1 Kings,22,36,And there went a cry throughout the army about sundown saying Every man to his city and his own country
1 Kings,22,37,For the king is dead! And [Ahab] was brought to Samaria where they buried him.
1 Kings,22,38,And they washed [his] chariot by the pool of Samaria where the harlots bathed and the dogs licked up his blood as the Lord had predicted.
1 Kings,22,39,The rest of Ahab's acts all he did the ivory palace and all the cities he built are they not written in the Book of the Chronicles of the Kings of Israel?
1 Kings,22,40,So Ahab slept with his fathers. Ahaziah his son reigned in his stead.
1 Kings,22,41,Jehoshaphat son of Asa began to reign over Judah in the fourth year of Ahab king of Israel.
1 Kings,22,42,Jehoshaphat was thirty-five years old when he began to reign and he reigned twenty-five years in Jerusalem. His mother was Azubah daughter of Shilhi.
1 Kings,22,43,He walked in all the ways or customs of Asa his father never swerving from it doing right in the sight of the Lord. However the [idolatrous] high places were not taken away; for the people still sacrificed and burned incense in the high places.
1 Kings,22,44,And Jehoshaphat made peace with Israel's king.
1 Kings,22,45,The rest of the acts of Jehoshaphat his might that he showed and how he warred are they not written in the Book of the Chronicles of the Kings of Judah?
1 Kings,22,46,And the remnant of the sodomites (the male cult prostitutes) who remained in the days of his father Asa [Jehoshaphat] expelled from the country.
1 Kings,22,47,There was no king in Edom; a deputy was acting king.
1 Kings,22,48,Jehoshaphat ordered ships of Tarshish to go to Ophir for gold but they did not go for the ships were wrecked at Ezion-geber.
1 Kings,22,49,When Ahaziah son of Ahab said to Jehoshaphat Let my servants go with your servants in the ships Jehoshaphat refused.
1 Kings,22,50,Jehoshaphat slept with his fathers and was buried with them in the city of David his father [forefather]. And Jehoram his son reigned in his stead.
1 Kings,22,51,Ahaziah son of Ahab began his two-year reign over Israel in Samaria in the seventeenth year of Jehoshaphat king of Judah.
1 Kings,22,52,He did evil in the sight of the Lord and walked in the ways of his father [Ahab] and of his mother [Jezebel] and of Jeroboam son of Nebat who made Israel sin.
1 Kings,22,53,He served Baal and worshiped him and provoked the Lord the God of Israel to anger in all the ways his father had done.
2 Kings,1,1,MOAB REBELLED against Israel after the death of Ahab.
2 Kings,1,2,[King] Ahaziah fell down through a lattice in his upper chamber in Samaria and lay sick. He sent messengers saying Go ask Baal-zebub the god of [Philistine] Ekron if I shall recover from this illness.
2 Kings,1,3,But the angel of the Lord said to Elijah the Tishbite Arise go up to meet the messengers of the king in Samaria and say to them Is it because there is no God in Israel that you are going to inquire of Baal-zebub the god of Ekron?
2 Kings,1,4,Therefore the Lord says: You [Ahaziah] shall not leave the bed on which you lie but shall surely die. And Elijah departed.
2 Kings,1,5,When the messengers returned to Ahaziah he said Why have you turned back?
2 Kings,1,6,They replied A man came up to meet us who said Go back to the king who sent you and tell him Thus says the Lord: Is there no God in Israel that you send to inquire of Baal-zebub the god of Ekron? Therefore you shall not leave the bed on which you lie but shall surely die.
2 Kings,1,7,The king asked What was the man like who came to meet you saying these things?
2 Kings,1,8,They answered He was a hairy man with a girdle of leather about his loins. And he said It is Elijah the Tishbite.
2 Kings,1,9,Then the king sent to Elijah a captain of fifty men with his fifty [to seize him]. He found Elijah sitting on a hilltop and said Man of God the king says Come down.
2 Kings,1,10,Elijah said to the captain of fifty If I am a man of God then let fire come down from heaven and consume you and your fifty. And fire fell from heaven and consumed him and his fifty.
2 Kings,1,11,Again King [Ahaziah] sent to him another captain of fifty with his fifty. And he said to Elijah Man of God the king has said Come down quickly!
2 Kings,1,12,And Elijah answered If I am a man of God let fire come down from heaven and consume you and your fifty. And the fire of God came down from heaven and consumed him and his fifty.
2 Kings,1,13,Ahaziah sent again a captain of a third fifty with his fifty. And the third captain of fifty went up and fell on his knees before Elijah and besought him and said to him O man of God I pray you let my life and the lives of these fifty your servants be precious in your sight.
2 Kings,1,14,Behold fire came down from heaven and burned up the two captains of the former fifties with their fifties. Therefore let my life now be precious in your sight.
2 Kings,1,15,The angel of the Lord said to Elijah Go down with him; do not be afraid of him. So he arose and went with him to the king.
2 Kings,1,16,Elijah said to [King] Ahaziah Thus says the Lord: Since you have sent messengers to inquire of Baal-zebub god of Ekron is it because there is no God in Israel of Whom to inquire His word? Therefore you shall not leave the bed on which you lie but shall surely die.
2 Kings,1,17,So Ahaziah died according to the word of the Lord which Elijah had spoken. Joram [also a son of Ahab] reigned in Israel in his stead in the second year of Jehoram son of Jehoshaphat king of Judah because Ahaziah had no son [but his brother].
2 Kings,1,18,Now the rest of the acts of Ahaziah are they not written in the Book of the Chronicles of the Kings of Israel?
2 Kings,2,1,WHEN THE Lord was about to take Elijah up to heaven by a whirlwind Elijah and Elisha were going from Gilgal.
2 Kings,2,2,And Elijah said to Elisha Tarry here I pray you for the Lord has sent me to Bethel. But Elisha replied As the Lord lives and as your soul lives I will not leave you. So they went down to Bethel.
2 Kings,2,3,The prophets' sons who were at Bethel came to Elisha and said Do you know that the Lord will take your master away from you today? He said Yes I know it; hold your peace.
2 Kings,2,4,Elijah said to him Elisha tarry here I pray you for the Lord has sent me to Jericho. But he said As the Lord lives and as your soul lives I will not leave you. So they came to Jericho.
2 Kings,2,5,The sons of the prophets who were at Jericho came to Elisha and said Do you know that the Lord will take your master away from you today? And he answered Yes I know it; hold your peace.
2 Kings,2,6,Elijah said to him Tarry here I pray you for the Lord has sent me to the Jordan. But he said As the Lord lives and as your soul lives I will not leave you. And the two of them went on.
2 Kings,2,7,Fifty men of the sons of the prophets also went and stood [to watch] afar off; and the two of them stood by the Jordan.
2 Kings,2,8,And Elijah took his mantle and rolled it up and struck the waters and they divided this way and that so that the two of them went over on dry ground.
2 Kings,2,9,And when they had gone over Elijah said to Elisha Ask what I shall do for you before I am taken from you. And Elisha said I pray you let a double portion of your spirit be upon me.
2 Kings,2,10,He said You have asked a hard thing. However if you see me when I am taken from you it shall be so for you--but if not it shall not be so.
2 Kings,2,11,As they still went on and talked behold a chariot of fire and horses of fire parted the two of them and Elijah went up by a whirlwind into heaven.
2 Kings,2,12,And Elisha saw it and he cried My father my father! The chariot of Israel and its horsemen! And he saw him no more. And he took hold of his own clothes and tore them in two pieces.
2 Kings,2,13,He took up also the mantle of Elijah that fell from him and went back and stood by the bank of the Jordan.
2 Kings,2,14,And he took the mantle that fell from Elijah and struck the waters and said Where is the Lord the God of Elijah? And when he had struck the waters they parted this way and that and Elisha went over.
2 Kings,2,15,When the sons of the prophets who were [watching] at Jericho saw him they said The spirit of Elijah rests on Elisha. And they came to meet him and bowed themselves to the ground before him.
2 Kings,2,16,And they said to him Behold now there are among your servants fifty strong men; let them go we pray you and seek your master. It may be that the Spirit of the Lord has taken him up and cast him on some mountain or into some valley. And he said You shall not send.
2 Kings,2,17,But when they urged him till he was embarrassed he said Send. So they sent fifty men who sought for three days but did not find him.
2 Kings,2,18,When they returned to Elisha who had waited at Jericho he said to them Did I not tell you Do not go?
2 Kings,2,19,And the men of the city said to Elisha Behold inhabiting of this city is pleasant as my lord sees but the water is bad and the locality causes miscarriage and barrenness [in all animals].
2 Kings,2,20,He said Bring me a new bowl and put salt [the symbol of God's purifying power] in it. And they brought it to him.
2 Kings,2,21,Then Elisha went to the spring of the waters and cast the salt in it and said Thus says the Lord: I [not the salt] have healed these waters; there shall not be any more death miscarriage or barrenness [and bereavement] because of it.
2 Kings,2,22,So the waters were healed to this day as Elisha had said.
2 Kings,2,23,He went up from Jericho to Bethel. On the way young [maturing and accountable] boys came out of the city and mocked him and said to him Go up [in a whirlwind] you baldhead! Go up you baldhead!
2 Kings,2,24,And he turned around and looked at them and called a curse down on them in the name of the Lord. And two she-bears came out of the woods and ripped up forty-two of the boys.
2 Kings,2,25,Elisha went from there to Mount Carmel and from there he returned to Samaria.
2 Kings,3,1,JORAM SON of Ahab began to reign over Israel in Samaria in the eighteenth year of Jehoshaphat king of Judah and reigned twelve years.
2 Kings,3,2,He did evil in the sight of the Lord but not like his father and mother; for he put away the pillar of Baal that his father had made.
2 Kings,3,3,Yet he clung to the sins of Jeroboam son of Nebat which made Israel to sin; he departed not from them.
2 Kings,3,4,Mesha king of Moab was a sheepmaster and paid in tribute to the king of Israel [annually] 100000 lambs and 100000 rams with the wool.
2 Kings,3,5,But when Ahab died the king of Moab rebelled against the king of Israel.
2 Kings,3,6,So King Joram went out of Samaria at that time and mustered all Israel.
2 Kings,3,7,And he sent to Jehoshaphat king of Judah saying The king of Moab has rebelled against me. Will you go with me to war against Moab? And he said I will go; I am as you are my people as your people my horses as your horses.
2 Kings,3,8,Joram said Which way shall we go up? Jehoshaphat answered The way through the Wilderness of Edom.
2 Kings,3,9,So the king of Israel went with the king of Judah and the king of Edom. They made a circuit of seven days' journey but there was no water for the army or for the animals following them.
2 Kings,3,10,Then the king of Israel said Alas! The Lord has called [us] three kings together to be delivered into Moab's hand!
2 Kings,3,11,But Jehoshaphat said Is there no prophet of the Lord here by whom we may inquire of the Lord? One of the king of Israel's servants answered Elisha son of Shaphat who served Elijah is here.
2 Kings,3,12,Jehoshaphat said The word of the Lord is with him. So Joram king of Israel and Jehoshaphat and the king of Edom went down to Elisha.
2 Kings,3,13,And Elisha said to the king of Israel What have I to do with you? Go to the prophets of your [wicked] father Ahab and your [wicked] mother Jezebel. But the king of Israel said to him No for the Lord has called [us] three kings together to be delivered into the hand of Moab.
2 Kings,3,14,And Elisha said As the Lord of hosts lives before Whom I stand surely were it not that I respect the presence of Jehoshaphat king of Judah I would neither look at you nor see you [King Joram].
2 Kings,3,15,But now bring me a minstrel. And while the minstrel played the hand and power of the Lord came upon [Elisha].
2 Kings,3,16,And he said Thus says the Lord: Make this [dry] brook bed full of trenches.
2 Kings,3,17,For thus says the Lord: You shall not see wind or rain yet that ravine shall be filled with water so you your cattle and your beasts [of burden] may drink.
2 Kings,3,18,This is but a light thing in the sight of the Lord. He will deliver the Moabites also into your hands.
2 Kings,3,19,You shall smite every fenced city and every choice city and shall fell every good tree and stop all wells of water and mar every good piece of land with stones.
2 Kings,3,20,In the morning when the sacrifice was offered behold there came water by the way of Edom and the country was filled with water.
2 Kings,3,21,When all the Moabites heard that the kings had come up to fight against them all who were able to put on armor young and old gathered and drew up at the border.
2 Kings,3,22,When they rose up early next morning and the sun shone upon the water the Moabites saw the water across from them as red as blood.
2 Kings,3,23,And they said This is blood; the kings have surely been fighting and have slain one another. Now then Moab to the spoil!
2 Kings,3,24,But when they came to the camp of Israel the Israelites rose up and smote the Moabites so that they fled before them. And they went forward slaying the Moabites as they went.
2 Kings,3,25,They beat down the cities [walls] and on every good piece of land every man cast a stone covering it [with stones]. And they stopped all the springs of water and felled all the good trees until only the stones [of the walls of Moab's capital city] of Kir-hareseth were left standing and the slingers surrounded and took it.
