Leviticus,7,29,"""Speak to the people of Israel, saying, Whoever offers the sacrifice of his peace offerings to the LORD shall bring his offering to the LORD from the sacrifice of his peace offerings."
Leviticus,7,30,"His own hands shall bring the LORD's food offerings. He shall bring the fat with the breast, that the breast may be waved as a wave offering before the LORD."
Leviticus,7,31,"The priest shall burn the fat on the altar, but the breast shall be for Aaron and his sons."
Leviticus,7,32,And the right thigh you shall give to the priest as a contribution from the sacrifice of your peace offerings.
Leviticus,7,33,Whoever among the sons of Aaron offers the blood of the peace offerings and the fat shall have the right thigh for a portion.
Leviticus,7,34,"For the breast that is waved and the thigh that is contributed I have taken from the people of Israel, out of the sacrifices of their peace offerings, and have given them to Aaron the priest and to his sons, as a perpetual due from the people of Israel."
Leviticus,7,35,"This is the portion of Aaron and of his sons from the LORD's food offerings, from the day they were presented to serve as priests of the LORD."
Leviticus,7,36,"The LORD commanded this to be given them by the people of Israel, from the day that he anointed them. It is a perpetual due throughout their generations."""
Leviticus,7,37,"This is the law of the burnt offering, of the grain offering, of the sin offering, of the guilt offering, of the ordination offering, and of the peace offering,"
Leviticus,7,38,"which the LORD commanded Moses on Mount Sinai, on the day that he commanded the people of Israel to bring their offerings to the LORD, in the wilderness of Sinai."
Leviticus,8,1,"The LORD spoke to Moses, saying,"
Leviticus,8,2,"""Take Aaron and his sons with him, and the garments and the anointing oil and the bull of the sin offering and the two rams and the basket of unleavened bread."
Leviticus,8,3,"And assemble all the congregation at the entrance of the tent of meeting."""
Leviticus,8,4,"And Moses did as the LORD commanded him, and the congregation was assembled at the entrance of the tent of meeting."
Leviticus,8,5,"And Moses said to the congregation, ""This is the thing that the LORD has commanded to be done."""
Leviticus,8,6,And Moses brought Aaron and his sons and washed them with water.
Leviticus,8,7,"And he put the coat on him and tied the sash around his waist and clothed him with the robe and put the ephod on him and tied the skillfully woven band of the ephod around him, binding it to him with the band."
Leviticus,8,8,"And he placed the breastpiece on him, and in the breastpiece he put the Urim and the Thummim."
Leviticus,8,9,"And he set the turban on his head, and on the turban, in front, he set the golden plate, the holy crown, as the LORD commanded Moses."
Leviticus,8,10,"Then Moses took the anointing oil and anointed the tabernacle and all that was in it, and consecrated them."
Leviticus,8,11,"And he sprinkled some of it on the altar seven times, and anointed the altar and all its utensils and the basin and its stand, to consecrate them."
Leviticus,8,12,And he poured some of the anointing oil on Aaron's head and anointed him to consecrate him.
Leviticus,8,13,"And Moses brought Aaron's sons and clothed them with coats and tied sashes around their waists and bound caps on them, as the LORD commanded Moses."
Leviticus,8,14,"Then he brought the bull of the sin offering, and Aaron and his sons laid their hands on the head of the bull of the sin offering."
Leviticus,8,15,"And he killed it, and Moses took the blood, and with his finger put it on the horns of the altar around it and purified the altar and poured out the blood at the base of the altar and consecrated it to make atonement for it."
Leviticus,8,16,"And he took all the fat that was on the entrails and the long lobe of the liver and the two kidneys with their fat, and Moses burned them on the altar."
Leviticus,8,17,"But the bull and its skin and its flesh and its dung he burned up with fire outside the camp, as the LORD commanded Moses."
Leviticus,8,18,"Then he presented the ram of the burnt offering, and Aaron and his sons laid their hands on the head of the ram."
Leviticus,8,19,"And he killed it, and Moses threw the blood against the sides of the altar."
Leviticus,8,20,"He cut the ram into pieces, and Moses burned the head and the pieces and the fat."
Leviticus,8,21,"He washed the entrails and the legs with water, and Moses burned the whole ram on the altar. It was a burnt offering with a pleasing aroma, a food offering for the LORD, as the LORD commanded Moses."
Leviticus,8,22,"Then he presented the other ram, the ram of ordination, and Aaron and his sons laid their hands on the head of the ram."
Leviticus,8,23,"And he killed it, and Moses took some of its blood and put it on the lobe of Aaron's right ear and on the thumb of his right hand and on the big toe of his right foot."
Leviticus,8,24,"Then he presented Aaron's sons, and Moses put some of the blood on the lobes of their right ears and on the thumbs of their right hands and on the big toes of their right feet. And Moses threw the blood against the sides of the altar."
Leviticus,8,25,"Then he took the fat and the fat tail and all the fat that was on the entrails and the long lobe of the liver and the two kidneys with their fat and the right thigh,"
Leviticus,8,26,and out of the basket of unleavened bread that was before the LORD he took one unleavened loaf and one loaf of bread with oil and one wafer and placed them on the pieces of fat and on the right thigh.
Leviticus,8,27,And he put all these in the hands of Aaron and in the hands of his sons and waved them as a wave offering before the LORD.
Leviticus,8,28,"Then Moses took them from their hands and burned them on the altar with the burnt offering. This was an ordination offering with a pleasing aroma, a food offering to the LORD."
Leviticus,8,29,"And Moses took the breast and waved it for a wave offering before the LORD. It was Moses' portion of the ram of ordination, as the LORD commanded Moses."
Leviticus,8,30,"Then Moses took some of the anointing oil and of the blood that was on the altar and sprinkled it on Aaron and his garments, and also on his sons and his sons' garments. So he consecrated Aaron and his garments, and his sons and his sons' garments with him."
Leviticus,8,31,"And Moses said to Aaron and his sons, ""Boil the flesh at the entrance of the tent of meeting, and there eat it and the bread that is in the basket of ordination offerings, as I commanded, saying, 'Aaron and his sons shall eat it.'"
Leviticus,8,32,And what remains of the flesh and the bread you shall burn up with fire.
Leviticus,8,33,"And you shall not go outside the entrance of the tent of meeting for seven days, until the days of your ordination are completed, for it will take seven days to ordain you."
Leviticus,8,34,"As has been done today, the LORD has commanded to be done to make atonement for you."
Leviticus,8,35,"At the entrance of the tent of meeting you shall remain day and night for seven days, performing what the LORD has charged, so that you do not die, for so I have been commanded."""
Leviticus,8,36,And Aaron and his sons did all the things that the LORD commanded by Moses.
Leviticus,9,1,"On the eighth day Moses called Aaron and his sons and the elders of Israel,"
Leviticus,9,2,"and he said to Aaron, ""Take for yourself a bull calf for a sin offering and a ram for a burnt offering, both without blemish, and offer them before the LORD."
Leviticus,9,3,"And say to the people of Israel, 'Take a male goat for a sin offering, and a calf and a lamb, both a year old without blemish, for a burnt offering,"
Leviticus,9,4,"and an ox and a ram for peace offerings, to sacrifice before the LORD, and a grain offering mixed with oil, for today the LORD will appear to you.'"""
Leviticus,9,5,"And they brought what Moses commanded in front of the tent of meeting, and all the congregation drew near and stood before the LORD."
Leviticus,9,6,"And Moses said, ""This is the thing that the LORD commanded you to do, that the glory of the LORD may appear to you."""
Leviticus,9,7,"Then Moses said to Aaron, ""Draw near to the altar and offer your sin offering and your burnt offering and make atonement for yourself and for the people, and bring the offering of the people and make atonement for them, as the LORD has commanded."""
Leviticus,9,8,"So Aaron drew near to the altar and killed the calf of the sin offering, which was for himself."
Leviticus,9,9,"And the sons of Aaron presented the blood to him, and he dipped his finger in the blood and put it on the horns of the altar and poured out the blood at the base of the altar."
Leviticus,9,10,"But the fat and the kidneys and the long lobe of the liver from the sin offering he burned on the altar, as the LORD commanded Moses."
Leviticus,9,11,The flesh and the skin he burned up with fire outside the camp.
Leviticus,9,12,"Then he killed the burnt offering, and Aaron's sons handed him the blood, and he threw it against the sides of the altar."
Leviticus,9,13,"And they handed the burnt offering to him, piece by piece, and the head, and he burned them on the altar."
Leviticus,9,14,And he washed the entrails and the legs and burned them with the burnt offering on the altar.
Leviticus,9,15,"Then he presented the people's offering and took the goat of the sin offering that was for the people and killed it and offered it as a sin offering, like the first one."
Leviticus,9,16,And he presented the burnt offering and offered it according to the rule.
Leviticus,9,17,"And he presented the grain offering, took a handful of it, and burned it on the altar, besides the burnt offering of the morning."
Leviticus,9,18,"Then he killed the ox and the ram, the sacrifice of peace offerings for the people. And Aaron's sons handed him the blood, and he threw it against the sides of the altar."
Leviticus,9,19,"But the fat pieces of the ox and of the ram, the fat tail and that which covers the entrails and the kidneys and the long lobe of the liver--"
Leviticus,9,20,"they put the fat pieces on the breasts, and he burned the fat pieces on the altar,"
Leviticus,9,21,"but the breasts and the right thigh Aaron waved for a wave offering before the LORD, as Moses commanded."
Leviticus,9,22,"Then Aaron lifted up his hands toward the people and blessed them, and he came down from offering the sin offering and the burnt offering and the peace offerings."
Leviticus,9,23,"And Moses and Aaron went into the tent of meeting, and when they came out they blessed the people, and the glory of the LORD appeared to all the people."
Leviticus,9,24,"And fire came out from before the LORD and consumed the burnt offering and the pieces of fat on the altar, and when all the people saw it, they shouted and fell on their faces."
Leviticus,10,1,"Now Nadab and Abihu, the sons of Aaron, each took his censer and put fire in it and laid incense on it and offered unauthorized fire before the LORD, which he had not commanded them."
Leviticus,10,2,"And fire came out from before the LORD and consumed them, and they died before the LORD."
Leviticus,10,3,"Then Moses said to Aaron, ""This is what the LORD has said, 'Among those who are near me I will be sanctified, and before all the people I will be glorified.'"" And Aaron held his peace."
Leviticus,10,4,"And Moses called Mishael and Elzaphan, the sons of Uzziel the uncle of Aaron, and said to them, ""Come near; carry your brothers away from the front of the sanctuary and out of the camp."""
Leviticus,10,5,"So they came near and carried them in their coats out of the camp, as Moses had said."
Leviticus,10,6,"And Moses said to Aaron and to Eleazar and Ithamar his sons, ""Do not let the hair of your heads hang loose, and do not tear your clothes, lest you die, and wrath come upon all the congregation; but let your brothers, the whole house of Israel, bewail the burning that the LORD has kindled."
Leviticus,10,7,"And do not go outside the entrance of the tent of meeting, lest you die, for the anointing oil of the LORD is upon you."" And they did according to the word of Moses."
Leviticus,10,8,"And the LORD spoke to Aaron, saying,"
Leviticus,10,9,"""Drink no wine or strong drink, you or your sons with you, when you go into the tent of meeting, lest you die. It shall be a statute forever throughout your generations."
Leviticus,10,10,"You are to distinguish between the holy and the common, and between the unclean and the clean,"
Leviticus,10,11,"and you are to teach the people of Israel all the statutes that the LORD has spoken to them by Moses."""
Leviticus,10,12,"Moses spoke to Aaron and to Eleazar and Ithamar, his surviving sons: ""Take the grain offering that is left of the LORD's food offerings, and eat it unleavened beside the altar, for it is most holy."
Leviticus,10,13,"You shall eat it in a holy place, because it is your due and your sons' due, from the LORD's food offerings, for so I am commanded."
Leviticus,10,14,"But the breast that is waved and the thigh that is contributed you shall eat in a clean place, you and your sons and your daughters with you, for they are given as your due and your sons' due from the sacrifices of the peace offerings of the people of Israel."
Leviticus,10,15,"The thigh that is contributed and the breast that is waved they shall bring with the food offerings of the fat pieces to wave for a wave offering before the LORD, and it shall be yours and your sons' with you as a due forever, as the LORD has commanded."""
Leviticus,10,16,"Now Moses diligently inquired about the goat of the sin offering, and behold, it was burned up! And he was angry with Eleazar and Ithamar, the surviving sons of Aaron, saying,"
Leviticus,10,17,"""Why have you not eaten the sin offering in the place of the sanctuary, since it is a thing most holy and has been given to you that you may bear the iniquity of the congregation, to make atonement for them before the LORD?"
Leviticus,10,18,"Behold, its blood was not brought into the inner part of the sanctuary. You certainly ought to have eaten it in the sanctuary, as I commanded."""
Leviticus,10,19,"And Aaron said to Moses, ""Behold, today they have offered their sin offering and their burnt offering before the LORD, and yet such things as these have happened to me! If I had eaten the sin offering today, would the LORD have approved?"""
Leviticus,10,20,"And when Moses heard that, he approved."
Leviticus,11,1,"And the LORD spoke to Moses and Aaron, saying to them,"
Leviticus,11,2,"""Speak to the people of Israel, saying, These are the living things that you may eat among all the animals that are on the earth."
Leviticus,11,3,"Whatever parts the hoof and is cloven-footed and chews the cud, among the animals, you may eat."
Leviticus,11,4,"Nevertheless, among those that chew the cud or part the hoof, you shall not eat these: The camel, because it chews the cud but does not part the hoof, is unclean to you."
Leviticus,11,5,"And the rock badger, because it chews the cud but does not part the hoof, is unclean to you."
Leviticus,11,6,"And the hare, because it chews the cud but does not part the hoof, is unclean to you."
Leviticus,11,7,"And the pig, because it parts the hoof and is cloven-footed but does not chew the cud, is unclean to you."
Leviticus,11,8,"You shall not eat any of their flesh, and you shall not touch their carcasses; they are unclean to you."
Leviticus,11,9,"""These you may eat, of all that are in the waters. Everything in the waters that has fins and scales, whether in the seas or in the rivers, you may eat."
Leviticus,11,10,"But anything in the seas or the rivers that has not fins and scales, of the swarming creatures in the waters and of the living creatures that are in the waters, is detestable to you."
Leviticus,11,11,"You shall regard them as detestable; you shall not eat any of their flesh, and you shall detest their carcasses."
Leviticus,11,12,Everything in the waters that has not fins and scales is detestable to you.
Leviticus,11,13,"""And these you shall detest among the birds; they shall not be eaten; they are detestable: the eagle, the bearded vulture, the black vulture,"
Leviticus,11,14,"the kite, the falcon of any kind,"
Leviticus,11,15,"every raven of any kind,"
Leviticus,11,16,"the ostrich, the nighthawk, the sea gull, the hawk of any kind,"
Leviticus,11,17,"the little owl, the cormorant, the short-eared owl,"
Leviticus,11,18,"the barn owl, the tawny owl, the carrion vulture,"
Leviticus,11,19,"the stork, the heron of any kind, the hoopoe, and the bat."
Leviticus,11,20,"""All winged insects that go on all fours are detestable to you."
Leviticus,11,21,"Yet among the winged insects that go on all fours you may eat those that have jointed legs above their feet, with which to hop on the ground."
Leviticus,11,22,"Of them you may eat: the locust of any kind, the bald locust of any kind, the cricket of any kind, and the grasshopper of any kind."
Leviticus,11,23,But all other winged insects that have four feet are detestable to you.
Leviticus,11,24,"""And by these you shall become unclean. Whoever touches their carcass shall be unclean until the evening,"
Leviticus,11,25,and whoever carries any part of their carcass shall wash his clothes and be unclean until the evening.
Leviticus,11,26,Every animal that parts the hoof but is not cloven-footed or does not chew the cud is unclean to you. Everyone who touches them shall be unclean.
Leviticus,11,27,"And all that walk on their paws, among the animals that go on all fours, are unclean to you. Whoever touches their carcass shall be unclean until the evening,"
Leviticus,11,28,and he who carries their carcass shall wash his clothes and be unclean until the evening; they are unclean to you.
Leviticus,11,29,"""And these are unclean to you among the swarming things that swarm on the ground: the mole rat, the mouse, the great lizard of any kind,"
Leviticus,11,30,"the gecko, the monitor lizard, the lizard, the sand lizard, and the chameleon."
Leviticus,11,31,These are unclean to you among all that swarm. Whoever touches them when they are dead shall be unclean until the evening.
Leviticus,11,32,"And anything on which any of them falls when they are dead shall be unclean, whether it is an article of wood or a garment or a skin or a sack, any article that is used for any purpose. It must be put into water, and it shall be unclean until the evening; then it shall be clean."
Leviticus,11,33,"And if any of them falls into any earthenware vessel, all that is in it shall be unclean, and you shall break it."
Leviticus,11,34,"Any food in it that could be eaten, on which water comes, shall be unclean. And all drink that could be drunk from every such vessel shall be unclean."
Leviticus,11,35,"And everything on which any part of their carcass falls shall be unclean. Whether oven or stove, it shall be broken in pieces. They are unclean and shall remain unclean for you."
Leviticus,11,36,"Nevertheless, a spring or a cistern holding water shall be clean, but whoever touches a carcass in them shall be unclean."
Leviticus,11,37,"And if any part of their carcass falls upon any seed grain that is to be sown, it is clean,"
Leviticus,11,38,"but if water is put on the seed and any part of their carcass falls on it, it is unclean to you."
Leviticus,11,39,"""And if any animal which you may eat dies, whoever touches its carcass shall be unclean until the evening,"
Leviticus,11,40,and whoever eats of its carcass shall wash his clothes and be unclean until the evening. And whoever carries the carcass shall wash his clothes and be unclean until the evening.
Leviticus,11,41,"""Every swarming thing that swarms on the ground is detestable; it shall not be eaten."
Leviticus,11,42,"Whatever goes on its belly, and whatever goes on all fours, or whatever has many feet, any swarming thing that swarms on the ground, you shall not eat, for they are detestable."
Leviticus,11,43,"You shall not make yourselves detestable with any swarming thing that swarms, and you shall not defile yourselves with them, and become unclean through them."
Leviticus,11,44,"For I am the LORD your God. Consecrate yourselves therefore, and be holy, for I am holy. You shall not defile yourselves with any swarming thing that crawls on the ground."
Leviticus,11,45,"For I am the LORD who brought you up out of the land of Egypt to be your God. You shall therefore be holy, for I am holy."""
Leviticus,11,46,"This is the law about beast and bird and every living creature that moves through the waters and every creature that swarms on the ground,"
Leviticus,11,47,to make a distinction between the unclean and the clean and between the living creature that may be eaten and the living creature that may not be eaten.
Leviticus,12,1,"The LORD spoke to Moses, saying,"
Leviticus,12,2,"""Speak to the people of Israel, saying, 'If a woman conceives and bears a male child, then she shall be unclean seven days. As at the time of her menstruation, she shall be unclean."
Leviticus,12,3,And on the eighth day the flesh of his foreskin shall be circumcised.
Leviticus,12,4,"Then she shall continue for thirty-three days in the blood of her purifying. She shall not touch anything holy, nor come into the sanctuary, until the days of her purifying are completed."
Leviticus,12,5,"But if she bears a female child, then she shall be unclean two weeks, as in her menstruation. And she shall continue in the blood of her purifying for sixty-six days."
Leviticus,12,6,"""'And when the days of her purifying are completed, whether for a son or for a daughter, she shall bring to the priest at the entrance of the tent of meeting a lamb a year old for a burnt offering, and a pigeon or a turtledove for a sin offering,"
Leviticus,12,7,"and he shall offer it before the LORD and make atonement for her. Then she shall be clean from the flow of her blood. This is the law for her who bears a child, either male or female."
Leviticus,12,8,"And if she cannot afford a lamb, then she shall take two turtledoves or two pigeons, one for a burnt offering and the other for a sin offering. And the priest shall make atonement for her, and she shall be clean.'"""
Leviticus,13,1,"The LORD spoke to Moses and Aaron, saying,"
Leviticus,13,2,"""When a person has on the skin of his body a swelling or an eruption or a spot, and it turns into a case of leprous disease on the skin of his body, then he shall be brought to Aaron the priest or to one of his sons the priests,"
Leviticus,13,3,"and the priest shall examine the diseased area on the skin of his body. And if the hair in the diseased area has turned white and the disease appears to be deeper than the skin of his body, it is a case of leprous disease. When the priest has examined him, he shall pronounce him unclean."
Leviticus,13,4,"But if the spot is white in the skin of his body and appears no deeper than the skin, and the hair in it has not turned white, the priest shall shut up the diseased person for seven days."
Leviticus,13,5,"And the priest shall examine him on the seventh day, and if in his eyes the disease is checked and the disease has not spread in the skin, then the priest shall shut him up for another seven days."
Leviticus,13,6,"And the priest shall examine him again on the seventh day, and if the diseased area has faded and the disease has not spread in the skin, then the priest shall pronounce him clean; it is only an eruption. And he shall wash his clothes and be clean."
Leviticus,13,7,"But if the eruption spreads in the skin, after he has shown himself to the priest for his cleansing, he shall appear again before the priest."
Leviticus,13,8,"And the priest shall look, and if the eruption has spread in the skin, then the priest shall pronounce him unclean; it is a leprous disease."
Leviticus,13,9,"""When a man is afflicted with a leprous disease, he shall be brought to the priest,"
Leviticus,13,10,"and the priest shall look. And if there is a white swelling in the skin that has turned the hair white, and there is raw flesh in the swelling,"
Leviticus,13,11,"it is a chronic leprous disease in the skin of his body, and the priest shall pronounce him unclean. He shall not shut him up, for he is unclean."
Leviticus,13,12,"And if the leprous disease breaks out in the skin, so that the leprous disease covers all the skin of the diseased person from head to foot, so far as the priest can see,"
Leviticus,13,13,"then the priest shall look, and if the leprous disease has covered all his body, he shall pronounce him clean of the disease; it has all turned white, and he is clean."
Leviticus,13,14,"But when raw flesh appears on him, he shall be unclean."
Leviticus,13,15,"And the priest shall examine the raw flesh and pronounce him unclean. Raw flesh is unclean, for it is a leprous disease."
Leviticus,13,16,"But if the raw flesh recovers and turns white again, then he shall come to the priest,"
Leviticus,13,17,"and the priest shall examine him, and if the disease has turned white, then the priest shall pronounce the diseased person clean; he is clean."
Leviticus,13,18,"""If there is in the skin of one's body a boil and it heals,"
Leviticus,13,19,"and in the place of the boil there comes a white swelling or a reddish-white spot, then it shall be shown to the priest."
Leviticus,13,20,"And the priest shall look, and if it appears deeper than the skin and its hair has turned white, then the priest shall pronounce him unclean. It is a case of leprous disease that has broken out in the boil."
Leviticus,13,21,"But if the priest examines it and there is no white hair in it and it is not deeper than the skin, but has faded, then the priest shall shut him up seven days."
Leviticus,13,22,"And if it spreads in the skin, then the priest shall pronounce him unclean; it is a disease."
