Isaiah,28,25,"When he has leveled its surface, does he not scatter dill, sow cumin, and put in wheat in rows and barley in its proper place, and emmer as the border?"
Isaiah,28,26,For he is rightly instructed; his God teaches him.
Isaiah,28,27,"Dill is not threshed with a threshing sledge, nor is a cart wheel rolled over cumin, but dill is beaten out with a stick, and cumin with a rod."
Isaiah,28,28,"Does one crush grain for bread? No, he does not thresh it forever; when he drives his cart wheel over it with his horses, he does not crush it."
Isaiah,28,29,This also comes from the LORD of hosts; he is wonderful in counsel and excellent in wisdom.
Isaiah,29,1,"Ah, Ariel, Ariel, the city where David encamped! Add year to year; let the feasts run their round."
Isaiah,29,2,"Yet I will distress Ariel, and there shall be moaning and lamentation, and she shall be to me like an Ariel."
Isaiah,29,3,"And I will encamp against you all around, and will besiege you with towers and I will raise siegeworks against you."
Isaiah,29,4,"And you will be brought low; from the earth you shall speak, and from the dust your speech will be bowed down; your voice shall come from the ground like the voice of a ghost, and from the dust your speech shall whisper."
Isaiah,29,5,"But the multitude of your foreign foes shall be like small dust, and the multitude of the ruthless like passing chaff. And in an instant, suddenly,"
Isaiah,29,6,"you will be visited by the LORD of hosts with thunder and with earthquake and great noise, with whirlwind and tempest, and the flame of a devouring fire."
Isaiah,29,7,"And the multitude of all the nations that fight against Ariel, all that fight against her and her stronghold and distress her, shall be like a dream, a vision of the night."
Isaiah,29,8,"As when a hungry man dreams he is eating and awakes with his hunger not satisfied, or as when a thirsty man dreams he is drinking and awakes faint, with his thirst not quenched, so shall the multitude of all the nations be that fight against Mount Zion."
Isaiah,29,9,"Astonish yourselves and be astonished; blind yourselves and be blind! Be drunk, but not with wine; stagger, but not with strong drink!"
Isaiah,29,10,"For the LORD has poured out upon you a spirit of deep sleep, and has closed your eyes (the prophets), and covered your heads (the seers)."
Isaiah,29,11,"And the vision of all this has become to you like the words of a book that is sealed. When men give it to one who can read, saying, ""Read this,"" he says, ""I cannot, for it is sealed."""
Isaiah,29,12,"And when they give the book to one who cannot read, saying, ""Read this,"" he says, ""I cannot read."""
Isaiah,29,13,"And the Lord said: ""Because this people draw near with their mouth and honor me with their lips, while their hearts are far from me, and their fear of me is a commandment taught by men,"
Isaiah,29,14,"therefore, behold, I will again do wonderful things with this people, with wonder upon wonder; and the wisdom of their wise men shall perish, and the discernment of their discerning men shall be hidden."""
Isaiah,29,15,"Ah, you who hide deep from the LORD your counsel, whose deeds are in the dark, and who say, ""Who sees us? Who knows us?"""
Isaiah,29,16,"You turn things upside down! Shall the potter be regarded as the clay, that the thing made should say of its maker, ""He did not make me""; or the thing formed say of him who formed it, ""He has no understanding""?"
Isaiah,29,17,"Is it not yet a very little while until Lebanon shall be turned into a fruitful field, and the fruitful field shall be regarded as a forest?"
Isaiah,29,18,"In that day the deaf shall hear the words of a book, and out of their gloom and darkness the eyes of the blind shall see."
Isaiah,29,19,"The meek shall obtain fresh joy in the LORD, and the poor among mankind shall exult in the Holy One of Israel."
Isaiah,29,20,"For the ruthless shall come to nothing and the scoffer cease, and all who watch to do evil shall be cut off,"
Isaiah,29,21,"who by a word make a man out to be an offender, and lay a snare for him who reproves in the gate, and with an empty plea turn aside him who is in the right."
Isaiah,29,22,"Therefore thus says the LORD, who redeemed Abraham, concerning the house of Jacob: ""Jacob shall no more be ashamed, no more shall his face grow pale."
Isaiah,29,23,"For when he sees his children, the work of my hands, in his midst, they will sanctify my name; they will sanctify the Holy One of Jacob and will stand in awe of the God of Israel."
Isaiah,29,24,"And those who go astray in spirit will come to understanding, and those who murmur will accept instruction."""
Isaiah,30,1,"""Ah, stubborn children,"" declares the LORD, ""who carry out a plan, but not mine, and who make an alliance, but not of my Spirit, that they may add sin to sin;"
Isaiah,30,2,"who set out to go down to Egypt, without asking for my direction, to take refuge in the protection of Pharaoh and to seek shelter in the shadow of Egypt!"
Isaiah,30,3,"Therefore shall the protection of Pharaoh turn to your shame, and the shelter in the shadow of Egypt to your humiliation."
Isaiah,30,4,"For though his officials are at Zoan and his envoys reach Hanes,"
Isaiah,30,5,"everyone comes to shame through a people that cannot profit them, that brings neither help nor profit, but shame and disgrace."""
Isaiah,30,6,"An oracle on the beasts of the Negeb. Through a land of trouble and anguish, from where come the lioness and the lion, the adder and the flying fiery serpent, they carry their riches on the backs of donkeys, and their treasures on the humps of camels, to a people that cannot profit them."
Isaiah,30,7,"Egypt's help is worthless and empty; therefore I have called her ""Rahab who sits still."""
Isaiah,30,8,"And now, go, write it before them on a tablet and inscribe it in a book, that it may be for the time to come as a witness forever."
Isaiah,30,9,"For they are a rebellious people, lying children, children unwilling to hear the instruction of the LORD;"
Isaiah,30,10,"who say to the seers, ""Do not see,"" and to the prophets, ""Do not prophesy to us what is right; speak to us smooth things, prophesy illusions,"
Isaiah,30,11,"leave the way, turn aside from the path, let us hear no more about the Holy One of Israel."""
Isaiah,30,12,"Therefore thus says the Holy One of Israel, ""Because you despise this word and trust in oppression and perverseness and rely on them,"
Isaiah,30,13,"therefore this iniquity shall be to you like a breach in a high wall, bulging out, and about to collapse, whose breaking comes suddenly, in an instant;"
Isaiah,30,14,"and its breaking is like that of a potter's vessel that is smashed so ruthlessly that among its fragments not a shard is found with which to take fire from the hearth, or to dip up water out of the cistern."""
Isaiah,30,15,"For thus said the Lord GOD, the Holy One of Israel, ""In returning and rest you shall be saved; in quietness and in trust shall be your strength."" But you were unwilling,"
Isaiah,30,16,"and you said, ""No! We will flee upon horses""; therefore you shall flee away; and, ""We will ride upon swift steeds""; therefore your pursuers shall be swift."
Isaiah,30,17,"A thousand shall flee at the threat of one; at the threat of five you shall flee, till you are left like a flagstaff on the top of a mountain, like a signal on a hill."
Isaiah,30,18,"Therefore the LORD waits to be gracious to you, and therefore he exalts himself to show mercy to you. For the LORD is a God of justice; blessed are all those who wait for him."
Isaiah,30,19,"For a people shall dwell in Zion, in Jerusalem; you shall weep no more. He will surely be gracious to you at the sound of your cry. As soon as he hears it, he answers you."
Isaiah,30,20,"And though the Lord give you the bread of adversity and the water of affliction, yet your Teacher will not hide himself anymore, but your eyes shall see your Teacher."
Isaiah,30,21,"And your ears shall hear a word behind you, saying, ""This is the way, walk in it,"" when you turn to the right or when you turn to the left."
Isaiah,30,22,"Then you will defile your carved idols overlaid with silver and your gold-plated metal images. You will scatter them as unclean things. You will say to them, ""Be gone!"""
Isaiah,30,23,"And he will give rain for the seed with which you sow the ground, and bread, the produce of the ground, which will be rich and plenteous. In that day your livestock will graze in large pastures,"
Isaiah,30,24,"and the oxen and the donkeys that work the ground will eat seasoned fodder, which has been winnowed with shovel and fork."
Isaiah,30,25,"And on every lofty mountain and every high hill there will be brooks running with water, in the day of the great slaughter, when the towers fall."
Isaiah,30,26,"Moreover, the light of the moon will be as the light of the sun, and the light of the sun will be sevenfold, as the light of seven days, in the day when the LORD binds up the brokenness of his people, and heals the wounds inflicted by his blow."
Isaiah,30,27,"Behold, the name of the LORD comes from afar, burning with his anger, and in thick rising smoke; his lips are full of fury, and his tongue is like a devouring fire;"
Isaiah,30,28,"his breath is like an overflowing stream that reaches up to the neck; to sift the nations with the sieve of destruction, and to place on the jaws of the peoples a bridle that leads astray."
Isaiah,30,29,"You shall have a song as in the night when a holy feast is kept, and gladness of heart, as when one sets out to the sound of the flute to go to the mountain of the LORD, to the Rock of Israel."
Isaiah,30,30,"And the LORD will cause his majestic voice to be heard and the descending blow of his arm to be seen, in furious anger and a flame of devouring fire, with a cloudburst and storm and hailstones."
Isaiah,30,31,"The Assyrians will be terror-stricken at the voice of the LORD, when he strikes with his rod."
Isaiah,30,32,"And every stroke of the appointed staff that the LORD lays on them will be to the sound of tambourines and lyres. Battling with brandished arm, he will fight with them."
Isaiah,30,33,"For a burning place has long been prepared; indeed, for the king it is made ready, its pyre made deep and wide, with fire and wood in abundance; the breath of the LORD, like a stream of sulfur, kindles it."
Isaiah,31,1,"Woe to those who go down to Egypt for help and rely on horses, who trust in chariots because they are many and in horsemen because they are very strong, but do not look to the Holy One of Israel or consult the LORD!"
Isaiah,31,2,"And yet he is wise and brings disaster; he does not call back his words, but will arise against the house of the evildoers and against the helpers of those who work iniquity."
Isaiah,31,3,"The Egyptians are man, and not God, and their horses are flesh, and not spirit. When the LORD stretches out his hand, the helper will stumble, and he who is helped will fall, and they will all perish together."
Isaiah,31,4,"For thus the LORD said to me, ""As a lion or a young lion growls over his prey, and when a band of shepherds is called out against him is not terrified by their shouting or daunted at their noise, so the LORD of hosts will come down to fight on Mount Zion and on its hill."
Isaiah,31,5,"Like birds hovering, so the LORD of hosts will protect Jerusalem; he will protect and deliver it; he will spare and rescue it."""
Isaiah,31,6,"Turn to him from whom people have deeply revolted, O children of Israel."
Isaiah,31,7,"For in that day everyone shall cast away his idols of silver and his idols of gold, which your hands have sinfully made for you."
Isaiah,31,8,"""And the Assyrian shall fall by a sword, not of man; and a sword, not of man, shall devour him; and he shall flee from the sword, and his young men shall be put to forced labor."
Isaiah,31,9,"His rock shall pass away in terror, and his officers desert the standard in panic,"" declares the LORD, whose fire is in Zion, and whose furnace is in Jerusalem."
Isaiah,32,1,"Behold, a king will reign in righteousness, and princes will rule in justice."
Isaiah,32,2,"Each will be like a hiding place from the wind, a shelter from the storm, like streams of water in a dry place, like the shade of a great rock in a weary land."
Isaiah,32,3,"Then the eyes of those who see will not be closed, and the ears of those who hear will give attention."
Isaiah,32,4,"The heart of the hasty will understand and know, and the tongue of the stammerers will hasten to speak distinctly."
Isaiah,32,5,"The fool will no more be called noble, nor the scoundrel said to be honorable."
Isaiah,32,6,"For the fool speaks folly, and his heart is busy with iniquity, to practice ungodliness, to utter error concerning the LORD, to leave the craving of the hungry unsatisfied, and to deprive the thirsty of drink."
Isaiah,32,7,"As for the scoundrel--his devices are evil; he plans wicked schemes to ruin the poor with lying words, even when the plea of the needy is right."
Isaiah,32,8,"But he who is noble plans noble things, and on noble things he stands."
Isaiah,32,9,"Rise up, you women who are at ease, hear my voice; you complacent daughters, give ear to my speech."
Isaiah,32,10,"In little more than a year you will shudder, you complacent women; for the grape harvest fails, the fruit harvest will not come."
Isaiah,32,11,"Tremble, you women who are at ease, shudder, you complacent ones; strip, and make yourselves bare, and tie sackcloth around your waist."
Isaiah,32,12,"Beat your breasts for the pleasant fields, for the fruitful vine,"
Isaiah,32,13,"for the soil of my people growing up in thorns and briers, yes, for all the joyous houses in the exultant city."
Isaiah,32,14,"For the palace is forsaken, the populous city deserted; the hill and the watchtower will become dens forever, a joy of wild donkeys, a pasture of flocks;"
Isaiah,32,15,"until the Spirit is poured upon us from on high, and the wilderness becomes a fruitful field, and the fruitful field is deemed a forest."
Isaiah,32,16,"Then justice will dwell in the wilderness, and righteousness abide in the fruitful field."
Isaiah,32,17,"And the effect of righteousness will be peace, and the result of righteousness, quietness and trust forever."
Isaiah,32,18,"My people will abide in a peaceful habitation, in secure dwellings, and in quiet resting places."
Isaiah,32,19,"And it will hail when the forest falls down, and the city will be utterly laid low."
Isaiah,32,20,"Happy are you who sow beside all waters, who let the feet of the ox and the donkey range free."
Isaiah,33,1,"Ah, you destroyer, who yourself have not been destroyed, you traitor, whom none has betrayed! When you have ceased to destroy, you will be destroyed; and when you have finished betraying, they will betray you."
Isaiah,33,2,"O LORD, be gracious to us; we wait for you. Be our arm every morning, our salvation in the time of trouble."
Isaiah,33,3,"At the tumultuous noise peoples flee; when you lift yourself up, nations are scattered,"
Isaiah,33,4,"and your spoil is gathered as the caterpillar gathers; as locusts leap, it is leapt upon."
Isaiah,33,5,"The LORD is exalted, for he dwells on high; he will fill Zion with justice and righteousness,"
Isaiah,33,6,"and he will be the stability of your times, abundance of salvation, wisdom, and knowledge; the fear of the LORD is Zion's treasure."
Isaiah,33,7,"Behold, their heroes cry in the streets; the envoys of peace weep bitterly."
Isaiah,33,8,The highways lie waste; the traveler ceases. Covenants are broken; cities are despised; there is no regard for man.
Isaiah,33,9,"The land mourns and languishes; Lebanon is confounded and withers away; Sharon is like a desert, and Bashan and Carmel shake off their leaves."
Isaiah,33,10,"""Now I will arise,"" says the LORD, ""now I will lift myself up; now I will be exalted."
Isaiah,33,11,You conceive chaff; you give birth to stubble; your breath is a fire that will consume you.
Isaiah,33,12,"And the peoples will be as if burned to lime, like thorns cut down, that are burned in the fire."""
Isaiah,33,13,"Hear, you who are far off, what I have done; and you who are near, acknowledge my might."
Isaiah,33,14,"The sinners in Zion are afraid; trembling has seized the godless: ""Who among us can dwell with the consuming fire? Who among us can dwell with everlasting burnings?"""
Isaiah,33,15,"He who walks righteously and speaks uprightly, who despises the gain of oppressions, who shakes his hands, lest they hold a bribe, who stops his ears from hearing of bloodshed and shuts his eyes from looking on evil,"
Isaiah,33,16,he will dwell on the heights; his place of defense will be the fortresses of rocks; his bread will be given him; his water will be sure.
Isaiah,33,17,Your eyes will behold the king in his beauty; they will see a land that stretches afar.
Isaiah,33,18,"Your heart will muse on the terror: ""Where is he who counted, where is he who weighed the tribute? Where is he who counted the towers?"""
Isaiah,33,19,"You will see no more the insolent people, the people of an obscure speech that you cannot comprehend, stammering in a tongue that you cannot understand."
Isaiah,33,20,"Behold Zion, the city of our appointed feasts! Your eyes will see Jerusalem, an untroubled habitation, an immovable tent, whose stakes will never be plucked up, nor will any of its cords be broken."
Isaiah,33,21,"But there the LORD in majesty will be for us a place of broad rivers and streams, where no galley with oars can go, nor majestic ship can pass."
Isaiah,33,22,For the LORD is our judge; the LORD is our lawgiver; the LORD is our king; he will save us.
Isaiah,33,23,Your cords hang loose; they cannot hold the mast firm in its place or keep the sail spread out. Then prey and spoil in abundance will be divided; even the lame will take the prey.
Isaiah,33,24,"And no inhabitant will say, ""I am sick""; the people who dwell there will be forgiven their iniquity."
Isaiah,34,1,"Draw near, O nations, to hear, and give attention, O peoples! Let the earth hear, and all that fills it; the world, and all that comes from it."
Isaiah,34,2,"For the LORD is enraged against all the nations, and furious against all their host; he has devoted them to destruction, has given them over for slaughter."
Isaiah,34,3,"Their slain shall be cast out, and the stench of their corpses shall rise; the mountains shall flow with their blood."
Isaiah,34,4,"All the host of heaven shall rot away, and the skies roll up like a scroll. All their host shall fall, as leaves fall from the vine, like leaves falling from the fig tree."
Isaiah,34,5,"For my sword has drunk its fill in the heavens; behold, it descends for judgment upon Edom, upon the people I have devoted to destruction."
Isaiah,34,6,"The LORD has a sword; it is sated with blood; it is gorged with fat, with the blood of lambs and goats, with the fat of the kidneys of rams. For the LORD has a sacrifice in Bozrah, a great slaughter in the land of Edom."
Isaiah,34,7,"Wild oxen shall fall with them, and young steers with the mighty bulls. Their land shall drink its fill of blood, and their soil shall be gorged with fat."
Isaiah,34,8,"For the LORD has a day of vengeance, a year of recompense for the cause of Zion."
Isaiah,34,9,"And the streams of Edom shall be turned into pitch, and her soil into sulfur; her land shall become burning pitch."
Isaiah,34,10,Night and day it shall not be quenched; its smoke shall go up forever. From generation to generation it shall lie waste; none shall pass through it forever and ever.
Isaiah,34,11,"But the hawk and the porcupine shall possess it, the owl and the raven shall dwell in it. He shall stretch the line of confusion over it, and the plumb line of emptiness."
Isaiah,34,12,"Its nobles--there is no one there to call it a kingdom, and all its princes shall be nothing."
Isaiah,34,13,"Thorns shall grow over its strongholds, nettles and thistles in its fortresses. It shall be the haunt of jackals, an abode for ostriches."
Isaiah,34,14,"And wild animals shall meet with hyenas; the wild goat shall cry to his fellow; indeed, there the night bird settles and finds for herself a resting place."
Isaiah,34,15,"There the owl nests and lays and hatches and gathers her young in her shadow; indeed, there the hawks are gathered, each one with her mate."
Isaiah,34,16,"Seek and read from the book of the LORD: Not one of these shall be missing; none shall be without her mate. For the mouth of the LORD has commanded, and his Spirit has gathered them."
Isaiah,34,17,He has cast the lot for them; his hand has portioned it out to them with the line; they shall possess it forever; from generation to generation they shall dwell in it.
Isaiah,35,1,The wilderness and the dry land shall be glad; the desert shall rejoice and blossom like the crocus;
Isaiah,35,2,"it shall blossom abundantly and rejoice with joy and singing. The glory of Lebanon shall be given to it, the majesty of Carmel and Sharon. They shall see the glory of the LORD, the majesty of our God."
Isaiah,35,3,"Strengthen the weak hands, and make firm the feeble knees."
Isaiah,35,4,"Say to those who have an anxious heart, ""Be strong; fear not! Behold, your God will come with vengeance, with the recompense of God. He will come and save you."""
Isaiah,35,5,"Then the eyes of the blind shall be opened, and the ears of the deaf unstopped;"
Isaiah,35,6,"then shall the lame man leap like a deer, and the tongue of the mute sing for joy. For waters break forth in the wilderness, and streams in the desert;"
Isaiah,35,7,"the burning sand shall become a pool, and the thirsty ground springs of water; in the haunt of jackals, where they lie down, the grass shall become reeds and rushes."
Isaiah,35,8,"And a highway shall be there, and it shall be called the Way of Holiness; the unclean shall not pass over it. It shall belong to those who walk on the way; even if they are fools, they shall not go astray."
Isaiah,35,9,"No lion shall be there, nor shall any ravenous beast come up on it; they shall not be found there, but the redeemed shall walk there."
Isaiah,35,10,"And the ransomed of the LORD shall return and come to Zion with singing; everlasting joy shall be upon their heads; they shall obtain gladness and joy, and sorrow and sighing shall flee away."
Isaiah,36,1,"In the fourteenth year of King Hezekiah, Sennacherib king of Assyria came up against all the fortified cities of Judah and took them."
Isaiah,36,2,"And the king of Assyria sent the Rabshakeh from Lachish to King Hezekiah at Jerusalem, with a great army. And he stood by the conduit of the upper pool on the highway to the Washer's Field."
Isaiah,36,3,"And there came out to him Eliakim the son of Hilkiah, who was over the household, and Shebna the secretary, and Joah the son of Asaph, the recorder."
Isaiah,36,4,"And the Rabshakeh said to them, ""Say to Hezekiah, 'Thus says the great king, the king of Assyria: On what do you rest this trust of yours?"
Isaiah,36,5,"Do you think that mere words are strategy and power for war? In whom do you now trust, that you have rebelled against me?"
Isaiah,36,6,"Behold, you are trusting in Egypt, that broken reed of a staff, which will pierce the hand of any man who leans on it. Such is Pharaoh king of Egypt to all who trust in him."
Isaiah,36,7,"But if you say to me, ""We trust in the LORD our God,"" is it not he whose high places and altars Hezekiah has removed, saying to Judah and to Jerusalem, ""You shall worship before this altar""?"
Isaiah,36,8,"Come now, make a wager with my master the king of Assyria: I will give you two thousand horses, if you are able on your part to set riders on them."
Isaiah,36,9,"How then can you repulse a single captain among the least of my master's servants, when you trust in Egypt for chariots and for horsemen?"
Isaiah,36,10,"Moreover, is it without the LORD that I have come up against this land to destroy it? The LORD said to me, Go up against this land and destroy it.'"""
Isaiah,36,11,"Then Eliakim, Shebna, and Joah said to the Rabshakeh, ""Please speak to your servants in Aramaic, for we understand it. Do not speak to us in the language of Judah within the hearing of the people who are on the wall."""
Isaiah,36,12,"But the Rabshakeh said, ""Has my master sent me to speak these words to your master and to you, and not to the men sitting on the wall, who are doomed with you to eat their own dung and drink their own urine?"""
Isaiah,36,13,"Then the Rabshakeh stood and called out in a loud voice in the language of Judah: ""Hear the words of the great king, the king of Assyria!"
Isaiah,36,14,"Thus says the king: 'Do not let Hezekiah deceive you, for he will not be able to deliver you."
Isaiah,36,15,"Do not let Hezekiah make you trust in the LORD by saying, ""The LORD will surely deliver us. This city will not be given into the hand of the king of Assyria."""
Isaiah,36,16,"Do not listen to Hezekiah. For thus says the king of Assyria: Make your peace with me and come out to me. Then each one of you will eat of his own vine, and each one of his own fig tree, and each one of you will drink the water of his own cistern,"
Isaiah,36,17,"until I come and take you away to a land like your own land, a land of grain and wine, a land of bread and vineyards."
Isaiah,36,18,"Beware lest Hezekiah mislead you by saying, ""The LORD will deliver us."" Has any of the gods of the nations delivered his land out of the hand of the king of Assyria?"
Isaiah,36,19,Where are the gods of Hamath and Arpad? Where are the gods of Sepharvaim? Have they delivered Samaria out of my hand?
Isaiah,36,20,"Who among all the gods of these lands have delivered their lands out of my hand, that the LORD should deliver Jerusalem out of my hand?'"""
Isaiah,36,21,"But they were silent and answered him not a word, for the king's command was, ""Do not answer him."""
