Numbers,14,22,"none of the men who have seen my glory and my signs that I did in Egypt and in the wilderness, and yet have put me to the test these ten times and have not obeyed my voice,"
Numbers,14,23,shall see the land that I swore to give to their fathers. And none of those who despised me shall see it.
Numbers,14,24,"But my servant Caleb, because he has a different spirit and has followed me fully, I will bring into the land into which he went, and his descendants shall possess it."
Numbers,14,25,"Now, since the Amalekites and the Canaanites dwell in the valleys, turn tomorrow and set out for the wilderness by the way to the Red Sea."""
Numbers,14,26,"And the LORD spoke to Moses and to Aaron, saying,"
Numbers,14,27,"""How long shall this wicked congregation grumble against me? I have heard the grumblings of the people of Israel, which they grumble against me."
Numbers,14,28,"Say to them, 'As I live, declares the LORD, what you have said in my hearing I will do to you:"
Numbers,14,29,"your dead bodies shall fall in this wilderness, and of all your number, listed in the census from twenty years old and upward, who have grumbled against me,"
Numbers,14,30,"not one shall come into the land where I swore that I would make you dwell, except Caleb the son of Jephunneh and Joshua the son of Nun."
Numbers,14,31,"But your little ones, who you said would become a prey, I will bring in, and they shall know the land that you have rejected."
Numbers,14,32,"But as for you, your dead bodies shall fall in this wilderness."
Numbers,14,33,"And your children shall be shepherds in the wilderness forty years and shall suffer for your faithlessness, until the last of your dead bodies lies in the wilderness."
Numbers,14,34,"According to the number of the days in which you spied out the land, forty days, a year for each day, you shall bear your iniquity forty years, and you shall know my displeasure.'"
Numbers,14,35,"I, the LORD, have spoken. Surely this will I do to all this wicked congregation who are gathered together against me: in this wilderness they shall come to a full end, and there they shall die."""
Numbers,14,36,"And the men whom Moses sent to spy out the land, who returned and made all the congregation grumble against him by bringing up a bad report about the land--"
Numbers,14,37,the men who brought up a bad report of the land--died by plague before the LORD.
Numbers,14,38,"Of those men who went to spy out the land, only Joshua the son of Nun and Caleb the son of Jephunneh remained alive."
Numbers,14,39,"When Moses told these words to all the people of Israel, the people mourned greatly."
Numbers,14,40,"And they rose early in the morning and went up to the heights of the hill country, saying, ""Here we are. We will go up to the place that the LORD has promised, for we have sinned."""
Numbers,14,41,"But Moses said, ""Why now are you transgressing the command of the LORD, when that will not succeed?"
Numbers,14,42,"Do not go up, for the Lord is not among you, lest you be struck down before your enemies."
Numbers,14,43,"For there the Amalekites and the Canaanites are facing you, and you shall fall by the sword. Because you have turned back from following the LORD, the LORD will not be with you."""
Numbers,14,44,"But they presumed to go up to the heights of the hill country, although neither the ark of the covenant of the LORD nor Moses departed out of the camp."
Numbers,14,45,"Then the Amalekites and the Canaanites who lived in that hill country came down and defeated them and pursued them, even to Hormah."
Numbers,15,1,"The LORD spoke to Moses, saying,"
Numbers,15,2,"""Speak to the people of Israel and say to them, When you come into the land you are to inhabit, which I am giving you,"
Numbers,15,3,"and you offer to the LORD from the herd or from the flock a food offering or a burnt offering or a sacrifice, to fulfill a vow or as a freewill offering or at your appointed feasts, to make a pleasing aroma to the LORD,"
Numbers,15,4,"then he who brings his offering shall offer to the LORD a grain offering of a tenth of an ephah of fine flour, mixed with a quarter of a hin of oil;"
Numbers,15,5,"and you shall offer with the burnt offering, or for the sacrifice, a quarter of a hin of wine for the drink offering for each lamb."
Numbers,15,6,"Or for a ram, you shall offer for a grain offering two tenths of an ephah of fine flour mixed with a third of a hin of oil."
Numbers,15,7,"And for the drink offering you shall offer a third of a hin of wine, a pleasing aroma to the LORD."
Numbers,15,8,"And when you offer a bull as a burnt offering or sacrifice, to fulfill a vow or for peace offerings to the LORD,"
Numbers,15,9,"then one shall offer with the bull a grain offering of three tenths of an ephah of fine flour, mixed with half a hin of oil."
Numbers,15,10,"And you shall offer for the drink offering half a hin of wine, as a food offering, a pleasing aroma to the LORD."
Numbers,15,11,"""Thus it shall be done for each bull or ram, or for each lamb or young goat."
Numbers,15,12,"As many as you offer, so shall you do with each one, as many as there are."
Numbers,15,13,"Every native Israelite shall do these things in this way, in offering a food offering, with a pleasing aroma to the LORD."
Numbers,15,14,"And if a stranger is sojourning with you, or anyone is living permanently among you, and he wishes to offer a food offering, with a pleasing aroma to the LORD, he shall do as you do."
Numbers,15,15,"For the assembly, there shall be one statute for you and for the stranger who sojourns with you, a statute forever throughout your generations. You and the sojourner shall be alike before the LORD."
Numbers,15,16,"One law and one rule shall be for you and for the stranger who sojourns with you."""
Numbers,15,17,"The LORD spoke to Moses, saying,"
Numbers,15,18,"""Speak to the people of Israel and say to them, When you come into the land to which I bring you"
Numbers,15,19,"and when you eat of the bread of the land, you shall present a contribution to the LORD."
Numbers,15,20,"Of the first of your dough you shall present a loaf as a contribution; like a contribution from the threshing floor, so shall you present it."
Numbers,15,21,Some of the first of your dough you shall give to the LORD as a contribution throughout your generations.
Numbers,15,22,"""But if you sin unintentionally, and do not observe all these commandments that the LORD has spoken to Moses,"
Numbers,15,23,"all that the LORD has commanded you by Moses, from the day that the LORD gave commandment, and onward throughout your generations,"
Numbers,15,24,"then if it was done unintentionally without the knowledge of the congregation, all the congregation shall offer one bull from the herd for a burnt offering, a pleasing aroma to the LORD, with its grain offering and its drink offering, according to the rule, and one male goat for a sin offering."
Numbers,15,25,"And the priest shall make atonement for all the congregation of the people of Israel, and they shall be forgiven, because it was a mistake, and they have brought their offering, a food offering to the LORD, and their sin offering before the LORD for their mistake."
Numbers,15,26,"And all the congregation of the people of Israel shall be forgiven, and the stranger who sojourns among them, because the whole population was involved in the mistake."
Numbers,15,27,"""If one person sins unintentionally, he shall offer a female goat a year old for a sin offering."
Numbers,15,28,"And the priest shall make atonement before the LORD for the person who makes a mistake, when he sins unintentionally, to make atonement for him, and he shall be forgiven."
Numbers,15,29,"You shall have one law for him who does anything unintentionally, for him who is native among the people of Israel and for the stranger who sojourns among them."
Numbers,15,30,"But the person who does anything with a high hand, whether he is native or a sojourner, reviles the LORD, and that person shall be cut off from among his people."
Numbers,15,31,"Because he has despised the word of the LORD and has broken his commandment, that person shall be utterly cut off; his iniquity shall be on him."""
Numbers,15,32,"While the people of Israel were in the wilderness, they found a man gathering sticks on the Sabbath day."
Numbers,15,33,And those who found him gathering sticks brought him to Moses and Aaron and to all the congregation.
Numbers,15,34,"They put him in custody, because it had not been made clear what should be done to him."
Numbers,15,35,"And the LORD said to Moses, ""The man shall be put to death; all the congregation shall stone him with stones outside the camp."""
Numbers,15,36,"And all the congregation brought him outside the camp and stoned him to death with stones, as the LORD commanded Moses."
Numbers,15,37,"The LORD said to Moses,"
Numbers,15,38,"""Speak to the people of Israel, and tell them to make tassels on the corners of their garments throughout their generations, and to put a cord of blue on the tassel of each corner."
Numbers,15,39,"And it shall be a tassel for you to look at and remember all the commandments of the LORD, to do them, not to follow after your own heart and your own eyes, which you are inclined to whore after."
Numbers,15,40,"So you shall remember and do all my commandments, and be holy to your God."
Numbers,15,41,"I am the LORD your God, who brought you out of the land of Egypt to be your God: I am the LORD your God."""
Numbers,16,1,"Now Korah the son of Izhar, son of Kohath, son of Levi, and Dathan and Abiram the sons of Eliab, and On the son of Peleth, sons of Reuben, took men."
Numbers,16,2,"And they rose up before Moses, with a number of the people of Israel, 250 chiefs of the congregation, chosen from the assembly, well-known men."
Numbers,16,3,"They assembled themselves together against Moses and against Aaron and said to them, ""You have gone too far! For all in the congregation are holy, every one of them, and the LORD is among them. Why then do you exalt yourselves above the assembly of the LORD?"""
Numbers,16,4,"When Moses heard it, he fell on his face,"
Numbers,16,5,"and he said to Korah and all his company, ""In the morning the LORD will show who is his, and who is holy, and will bring him near to him. The one whom he chooses he will bring near to him."
Numbers,16,6,"Do this: take censers, Korah and all his company;"
Numbers,16,7,"put fire in them and put incense on them before the LORD tomorrow, and the man whom the LORD chooses shall be the holy one. You have gone too far, sons of Levi!"""
Numbers,16,8,"And Moses said to Korah, ""Hear now, you sons of Levi:"
Numbers,16,9,"is it too small a thing for you that the God of Israel has separated you from the congregation of Israel, to bring you near to himself, to do service in the tabernacle of the LORD and to stand before the congregation to minister to them,"
Numbers,16,10,"and that he has brought you near him, and all your brothers the sons of Levi with you? And would you seek the priesthood also?"
Numbers,16,11,"Therefore it is against the LORD that you and all your company have gathered together. What is Aaron that you grumble against him?"""
Numbers,16,12,"And Moses sent to call Dathan and Abiram the sons of Eliab, and they said, ""We will not come up."
Numbers,16,13,"Is it a small thing that you have brought us up out of a land flowing with milk and honey, to kill us in the wilderness, that you must also make yourself a prince over us?"
Numbers,16,14,"Moreover, you have not brought us into a land flowing with milk and honey, nor given us inheritance of fields and vineyards. Will you put out the eyes of these men? We will not come up."""
Numbers,16,15,"And Moses was very angry and said to the LORD, ""Do not respect their offering. I have not taken one donkey from them, and I have not harmed one of them."""
Numbers,16,16,"And Moses said to Korah, ""Be present, you and all your company, before the LORD, you and they, and Aaron, tomorrow."
Numbers,16,17,"And let every one of you take his censer and put incense on it, and every one of you bring before the LORD his censer, 250 censers; you also, and Aaron, each his censer."""
Numbers,16,18,So every man took his censer and put fire in them and laid incense on them and stood at the entrance of the tent of meeting with Moses and Aaron.
Numbers,16,19,Then Korah assembled all the congregation against them at the entrance of the tent of meeting. And the glory of the LORD appeared to all the congregation.
Numbers,16,20,"And the LORD spoke to Moses and to Aaron, saying,"
Numbers,16,21,"""Separate yourselves from among this congregation, that I may consume them in a moment."""
Numbers,16,22,"And they fell on their faces and said, ""O God, the God of the spirits of all flesh, shall one man sin, and will you be angry with all the congregation?"""
Numbers,16,23,"And the LORD spoke to Moses, saying,"
Numbers,16,24,"""Say to the congregation, Get away from the dwelling of Korah, Dathan, and Abiram."""
Numbers,16,25,"Then Moses rose and went to Dathan and Abiram, and the elders of Israel followed him."
Numbers,16,26,"And he spoke to the congregation, saying, ""Depart, please, from the tents of these wicked men, and touch nothing of theirs, lest you be swept away with all their sins."""
Numbers,16,27,"So they got away from the dwelling of Korah, Dathan, and Abiram. And Dathan and Abiram came out and stood at the door of their tents, together with their wives, their sons, and their little ones."
Numbers,16,28,"And Moses said, ""Hereby you shall know that the LORD has sent me to do all these works, and that it has not been of my own accord."
Numbers,16,29,"If these men die as all men die, or if they are visited by the fate of all mankind, then the LORD has not sent me."
Numbers,16,30,"But if the LORD creates something new, and the ground opens its mouth and swallows them up with all that belongs to them, and they go down alive into Sheol, then you shall know that these men have despised the LORD."""
Numbers,16,31,"And as soon as he had finished speaking all these words, the ground under them split apart."
Numbers,16,32,"And the earth opened its mouth and swallowed them up, with their households and all the people who belonged to Korah and all their goods."
Numbers,16,33,"So they and all that belonged to them went down alive into Sheol, and the earth closed over them, and they perished from the midst of the assembly."
Numbers,16,34,"And all Israel who were around them fled at their cry, for they said, ""Lest the earth swallow us up!"""
Numbers,16,35,And fire came out from the LORD and consumed the 250 men offering the incense.
Numbers,16,36,"Then the LORD spoke to Moses, saying,"
Numbers,16,37,"""Tell Eleazar the son of Aaron the priest to take up the censers out of the blaze. Then scatter the fire far and wide, for they have become holy."
Numbers,16,38,"As for the censers of these men who have sinned at the cost of their lives, let them be made into hammered plates as a covering for the altar, for they offered them before the LORD, and they became holy. Thus they shall be a sign to the people of Israel."""
Numbers,16,39,"So Eleazar the priest took the bronze censers, which those who were burned had offered, and they were hammered out as a covering for the altar,"
Numbers,16,40,"to be a reminder to the people of Israel, so that no outsider, who is not of the descendants of Aaron, should draw near to burn incense before the LORD, lest he become like Korah and his company--as the LORD said to him through Moses."
Numbers,16,41,"But on the next day all the congregation of the people of Israel grumbled against Moses and against Aaron, saying, ""You have killed the people of the LORD."""
Numbers,16,42,"And when the congregation had assembled against Moses and against Aaron, they turned toward the tent of meeting. And behold, the cloud covered it, and the glory of the LORD appeared."
Numbers,16,43,"And Moses and Aaron came to the front of the tent of meeting,"
Numbers,16,44,"and the LORD spoke to Moses, saying,"
Numbers,16,45,"""Get away from the midst of this congregation, that I may consume them in a moment."" And they fell on their faces."
Numbers,16,46,"And Moses said to Aaron, ""Take your censer, and put fire on it from off the altar and lay incense on it and carry it quickly to the congregation and make atonement for them, for wrath has gone out from the LORD; the plague has begun."""
Numbers,16,47,"So Aaron took it as Moses said and ran into the midst of the assembly. And behold, the plague had already begun among the people. And he put on the incense and made atonement for the people."
Numbers,16,48,"And he stood between the dead and the living, and the plague was stopped."
Numbers,16,49,"Now those who died in the plague were 14,700, besides those who died in the affair of Korah."
Numbers,16,50,"And Aaron returned to Moses at the entrance of the tent of meeting, when the plague was stopped."
Numbers,17,1,"The LORD spoke to Moses, saying,"
Numbers,17,2,"""Speak to the people of Israel, and get from them staffs, one for each fathers' house, from all their chiefs according to their fathers' houses, twelve staffs. Write each man's name on his staff,"
Numbers,17,3,and write Aaron's name on the staff of Levi. For there shall be one staff for the head of each fathers' house.
Numbers,17,4,"Then you shall deposit them in the tent of meeting before the testimony, where I meet with you."
Numbers,17,5,"And the staff of the man whom I choose shall sprout. Thus I will make to cease from me the grumblings of the people of Israel, which they grumble against you."""
Numbers,17,6,"Moses spoke to the people of Israel. And all their chiefs gave him staffs, one for each chief, according to their fathers' houses, twelve staffs. And the staff of Aaron was among their staffs."
Numbers,17,7,And Moses deposited the staffs before the LORD in the tent of the testimony.
Numbers,17,8,"On the next day Moses went into the tent of the testimony, and behold, the staff of Aaron for the house of Levi had sprouted and put forth buds and produced blossoms, and it bore ripe almonds."
Numbers,17,9,"Then Moses brought out all the staffs from before the LORD to all the people of Israel. And they looked, and each man took his staff."
Numbers,17,10,"And the LORD said to Moses, ""Put back the staff of Aaron before the testimony, to be kept as a sign for the rebels, that you may make an end of their grumblings against me, lest they die."""
Numbers,17,11,"Thus did Moses; as the LORD commanded him, so he did."
Numbers,17,12,"And the people of Israel said to Moses, ""Behold, we perish, we are undone, we are all undone."
Numbers,17,13,"Everyone who comes near, who comes near to the tabernacle of the LORD, shall die. Are we all to perish?"""
Numbers,18,1,"So the LORD said to Aaron, ""You and your sons and your father's house with you shall bear iniquity connected with the sanctuary, and you and your sons with you shall bear iniquity connected with your priesthood."
Numbers,18,2,"And with you bring your brothers also, the tribe of Levi, the tribe of your father, that they may join you and minister to you while you and your sons with you are before the tent of the testimony."
Numbers,18,3,"They shall keep guard over you and over the whole tent, but shall not come near to the vessels of the sanctuary or to the altar lest they, and you, die."
Numbers,18,4,"They shall join you and keep guard over the tent of meeting for all the service of the tent, and no outsider shall come near you."
Numbers,18,5,"And you shall keep guard over the sanctuary and over the altar, that there may never again be wrath on the people of Israel."
Numbers,18,6,"And behold, I have taken your brothers the Levites from among the people of Israel. They are a gift to you, given to the LORD, to do the service of the tent of meeting."
Numbers,18,7,"And you and your sons with you shall guard your priesthood for all that concerns the altar and that is within the veil; and you shall serve. I give your priesthood as a gift, and any outsider who comes near shall be put to death."""
Numbers,18,8,"Then the LORD spoke to Aaron, ""Behold, I have given you charge of the contributions made to me, all the consecrated things of the people of Israel. I have given them to you as a portion and to your sons as a perpetual due."
Numbers,18,9,"This shall be yours of the most holy things, reserved from the fire: every offering of theirs, every grain offering of theirs and every sin offering of theirs and every guilt offering of theirs, which they render to me, shall be most holy to you and to your sons."
Numbers,18,10,In a most holy place shall you eat it. Every male may eat it; it is holy to you.
Numbers,18,11,"This also is yours: the contribution of their gift, all the wave offerings of the people of Israel. I have given them to you, and to your sons and daughters with you, as a perpetual due. Everyone who is clean in your house may eat it."
Numbers,18,12,"All the best of the oil and all the best of the wine and of the grain, the firstfruits of what they give to the LORD, I give to you."
Numbers,18,13,"The first ripe fruits of all that is in their land, which they bring to the LORD, shall be yours. Everyone who is clean in your house may eat it."
Numbers,18,14,Every devoted thing in Israel shall be yours.
Numbers,18,15,"Everything that opens the womb of all flesh, whether man or beast, which they offer to the LORD, shall be yours. Nevertheless, the firstborn of man you shall redeem, and the firstborn of unclean animals you shall redeem."
Numbers,18,16,"And their redemption price (at a month old you shall redeem them) you shall fix at five shekels in silver, according to the shekel of the sanctuary, which is twenty gerahs."
Numbers,18,17,"But the firstborn of a cow, or the firstborn of a sheep, or the firstborn of a goat, you shall not redeem; they are holy. You shall sprinkle their blood on the altar and shall burn their fat as a food offering, with a pleasing aroma to the LORD."
Numbers,18,18,"But their flesh shall be yours, as the breast that is waved and as the right thigh are yours."
Numbers,18,19,"All the holy contributions that the people of Israel present to the LORD I give to you, and to your sons and daughters with you, as a perpetual due. It is a covenant of salt forever before the LORD for you and for your offspring with you."""
Numbers,18,20,"And the LORD said to Aaron, ""You shall have no inheritance in their land, neither shall you have any portion among them. I am your portion and your inheritance among the people of Israel."
Numbers,18,21,"""To the Levites I have given every tithe in Israel for an inheritance, in return for their service that they do, their service in the tent of meeting,"
Numbers,18,22,"so that the people of Israel do not come near the tent of meeting, lest they bear sin and die."
Numbers,18,23,"But the Levites shall do the service of the tent of meeting, and they shall bear their iniquity. It shall be a perpetual statute throughout your generations, and among the people of Israel they shall have no inheritance."
Numbers,18,24,"For the tithe of the people of Israel, which they present as a contribution to the LORD, I have given to the Levites for an inheritance. Therefore I have said of them that they shall have no inheritance among the people of Israel."""
Numbers,18,25,"And the LORD spoke to Moses, saying,"
Numbers,18,26,"""Moreover, you shall speak and say to the Levites, 'When you take from the people of Israel the tithe that I have given you from them for your inheritance, then you shall present a contribution from it to the LORD, a tithe of the tithe."
Numbers,18,27,"And your contribution shall be counted to you as though it were the grain of the threshing floor, and as the fullness of the winepress."
Numbers,18,28,"So you shall also present a contribution to the LORD from all your tithes, which you receive from the people of Israel. And from it you shall give the LORD's contribution to Aaron the priest."
Numbers,18,29,"Out of all the gifts to you, you shall present every contribution due to the LORD; from each its best part is to be dedicated.'"
Numbers,18,30,"Therefore you shall say to them, 'When you have offered from it the best of it, then the rest shall be counted to the Levites as produce of the threshing floor, and as produce of the winepress."
Numbers,18,31,"And you may eat it in any place, you and your households, for it is your reward in return for your service in the tent of meeting."
Numbers,18,32,"And you shall bear no sin by reason of it, when you have contributed the best of it. But you shall not profane the holy things of the people of Israel, lest you die.'"""
Numbers,19,1,"Now the LORD spoke to Moses and to Aaron, saying,"
Numbers,19,2,"""This is the statute of the law that the LORD has commanded: Tell the people of Israel to bring you a red heifer without defect, in which there is no blemish, and on which a yoke has never come."
Numbers,19,3,"And you shall give it to Eleazar the priest, and it shall be taken outside the camp and slaughtered before him."
Numbers,19,4,"And Eleazar the priest shall take some of its blood with his finger, and sprinkle some of its blood toward the front of the tent of meeting seven times."
Numbers,19,5,"And the heifer shall be burned in his sight. Its skin, its flesh, and its blood, with its dung, shall be burned."
Numbers,19,6,"And the priest shall take cedarwood and hyssop and scarlet yarn, and throw them into the fire burning the heifer."
Numbers,19,7,"Then the priest shall wash his clothes and bathe his body in water, and afterward he may come into the camp. But the priest shall be unclean until evening."
Numbers,19,8,The one who burns the heifer shall wash his clothes in water and bathe his body in water and shall be unclean until evening.
