Luke,21,29,"And he told them a parable: ""Look at the fig tree, and all the trees."
Luke,21,30,"As soon as they come out in leaf, you see for yourselves and know that the summer is already near."
Luke,21,31,"So also, when you see these things taking place, you know that the kingdom of God is near."
Luke,21,32,"Truly, I say to you, this generation will not pass away until all has taken place."
Luke,21,33,"Heaven and earth will pass away, but my words will not pass away."
Luke,21,34,"""But watch yourselves lest your hearts be weighed down with dissipation and drunkenness and cares of this life, and that day come upon you suddenly like a trap."
Luke,21,35,For it will come upon all who dwell on the face of the whole earth.
Luke,21,36,"But stay awake at all times, praying that you may have strength to escape all these things that are going to take place, and to stand before the Son of Man."""
Luke,21,37,"And every day he was teaching in the temple, but at night he went out and lodged on the mount called Olivet."
Luke,21,38,And early in the morning all the people came to him in the temple to hear him.
Luke,22,1,"Now the Feast of Unleavened Bread drew near, which is called the Passover."
Luke,22,2,"And the chief priests and the scribes were seeking how to put him to death, for they feared the people."
Luke,22,3,"Then Satan entered into Judas called Iscariot, who was of the number of the twelve."
Luke,22,4,He went away and conferred with the chief priests and officers how he might betray him to them.
Luke,22,5,"And they were glad, and agreed to give him money."
Luke,22,6,So he consented and sought an opportunity to betray him to them in the absence of a crowd.
Luke,22,7,"Then came the day of Unleavened Bread, on which the Passover lamb had to be sacrificed."
Luke,22,8,"So Jesus sent Peter and John, saying, ""Go and prepare the Passover for us, that we may eat it."""
Luke,22,9,"They said to him, ""Where will you have us prepare it?"""
Luke,22,10,"He said to them, ""Behold, when you have entered the city, a man carrying a jar of water will meet you. Follow him into the house that he enters"
Luke,22,11,"and tell the master of the house, 'The Teacher says to you, Where is the guest room, where I may eat the Passover with my disciples?'"
Luke,22,12,"And he will show you a large upper room furnished; prepare it there."""
Luke,22,13,"And they went and found it just as he had told them, and they prepared the Passover."
Luke,22,14,"And when the hour came, he reclined at table, and the apostles with him."
Luke,22,15,"And he said to them, ""I have earnestly desired to eat this Passover with you before I suffer."
Luke,22,16,"For I tell you I will not eat it until it is fulfilled in the kingdom of God."""
Luke,22,17,"And he took a cup, and when he had given thanks he said, ""Take this, and divide it among yourselves."
Luke,22,18,"For I tell you that from now on I will not drink of the fruit of the vine until the kingdom of God comes."""
Luke,22,19,"And he took bread, and when he had given thanks, he broke it and gave it to them, saying, ""This is my body, which is given for you. Do this in remembrance of me."""
Luke,22,20,"And likewise the cup after they had eaten, saying, ""This cup that is poured out for you is the new covenant in my blood."
Luke,22,21,"But behold, the hand of him who betrays me is with me on the table."
Luke,22,22,"For the Son of Man goes as it has been determined, but woe to that man by whom he is betrayed!"""
Luke,22,23,"And they began to question one another, which of them it could be who was going to do this."
Luke,22,24,"A dispute also arose among them, as to which of them was to be regarded as the greatest."
Luke,22,25,"And he said to them, ""The kings of the Gentiles exercise lordship over them, and those in authority over them are called benefactors."
Luke,22,26,"But not so with you. Rather, let the greatest among you become as the youngest, and the leader as one who serves."
Luke,22,27,"For who is the greater, one who reclines at table or one who serves? Is it not the one who reclines at table? But I am among you as the one who serves."
Luke,22,28,"""You are those who have stayed with me in my trials,"
Luke,22,29,"and I assign to you, as my Father assigned to me, a kingdom,"
Luke,22,30,that you may eat and drink at my table in my kingdom and sit on thrones judging the twelve tribes of Israel.
Luke,22,31,"""Simon, Simon, behold, Satan demanded to have you, that he might sift you like wheat,"
Luke,22,32,"but I have prayed for you that your faith may not fail. And when you have turned again, strengthen your brothers."""
Luke,22,33,"Peter said to him, ""Lord, I am ready to go with you both to prison and to death."""
Luke,22,34,"Jesus said, ""I tell you, Peter, the rooster will not crow this day, until you deny three times that you know me."""
Luke,22,35,"And he said to them, ""When I sent you out with no moneybag or knapsack or sandals, did you lack anything?"" They said, ""Nothing."""
Luke,22,36,"He said to them, ""But now let the one who has a moneybag take it, and likewise a knapsack. And let the one who has no sword sell his cloak and buy one."
Luke,22,37,"For I tell you that this Scripture must be fulfilled in me: 'And he was numbered with the transgressors.' For what is written about me has its fulfillment."""
Luke,22,38,"And they said, ""Look, Lord, here are two swords."" And he said to them, ""It is enough."""
Luke,22,39,"And he came out and went, as was his custom, to the Mount of Olives, and the disciples followed him."
Luke,22,40,"And when he came to the place, he said to them, ""Pray that you may not enter into temptation."""
Luke,22,41,"And he withdrew from them about a stone's throw, and knelt down and prayed,"
Luke,22,42,"saying, ""Father, if you are willing, remove this cup from me. Nevertheless, not my will, but yours, be done."""
Luke,22,43,"And there appeared to him an angel from heaven, strengthening him."
Luke,22,44,And being in an agony he prayed more earnestly; and his sweat became like great drops of blood falling down to the ground.
Luke,22,45,"And when he rose from prayer, he came to the disciples and found them sleeping for sorrow,"
Luke,22,46,"and he said to them, ""Why are you sleeping? Rise and pray that you may not enter into temptation."""
Luke,22,47,"While he was still speaking, there came a crowd, and the man called Judas, one of the twelve, was leading them. He drew near to Jesus to kiss him,"
Luke,22,48,"but Jesus said to him, ""Judas, would you betray the Son of Man with a kiss?"""
Luke,22,49,"And when those who were around him saw what would follow, they said, ""Lord, shall we strike with the sword?"""
Luke,22,50,And one of them struck the servant of the high priest and cut off his right ear.
Luke,22,51,"But Jesus said, ""No more of this!"" And he touched his ear and healed him."
Luke,22,52,"Then Jesus said to the chief priests and officers of the temple and elders, who had come out against him, ""Have you come out as against a robber, with swords and clubs?"
Luke,22,53,"When I was with you day after day in the temple, you did not lay hands on me. But this is your hour, and the power of darkness."""
Luke,22,54,"Then they seized him and led him away, bringing him into the high priest's house, and Peter was following at a distance."
Luke,22,55,"And when they had kindled a fire in the middle of the courtyard and sat down together, Peter sat down among them."
Luke,22,56,"Then a servant girl, seeing him as he sat in the light and looking closely at him, said, ""This man also was with him."""
Luke,22,57,"But he denied it, saying, ""Woman, I do not know him."""
Luke,22,58,"And a little later someone else saw him and said, ""You also are one of them."" But Peter said, ""Man, I am not."""
Luke,22,59,"And after an interval of about an hour still another insisted, saying, ""Certainly this man also was with him, for he too is a Galilean."""
Luke,22,60,"But Peter said, ""Man, I do not know what you are talking about."" And immediately, while he was still speaking, the rooster crowed."
Luke,22,61,"And the Lord turned and looked at Peter. And Peter remembered the saying of the Lord, how he had said to him, ""Before the rooster crows today, you will deny me three times."""
Luke,22,62,And he went out and wept bitterly.
Luke,22,63,Now the men who were holding Jesus in custody were mocking him as they beat him.
Luke,22,64,"They also blindfolded him and kept asking him, ""Prophesy! Who is it that struck you?"""
Luke,22,65,"And they said many other things against him, blaspheming him."
Luke,22,66,"When day came, the assembly of the elders of the people gathered together, both chief priests and scribes. And they led him away to their council, and they said,"
Luke,22,67,"""If you are the Christ, tell us."" But he said to them, ""If I tell you, you will not believe,"
Luke,22,68,"and if I ask you, you will not answer."
Luke,22,69,"But from now on the Son of Man shall be seated at the right hand of the power of God."""
Luke,22,70,"So they all said, ""Are you the Son of God, then?"" And he said to them, ""You say that I am."""
Luke,22,71,"Then they said, ""What further testimony do we need? We have heard it ourselves from his own lips."""
Luke,23,1,Then the whole company of them arose and brought him before Pilate.
Luke,23,2,"And they began to accuse him, saying, ""We found this man misleading our nation and forbidding us to give tribute to Caesar, and saying that he himself is Christ, a king."""
Luke,23,3,"And Pilate asked him, ""Are you the King of the Jews?"" And he answered him, ""You have said so."""
Luke,23,4,"Then Pilate said to the chief priests and the crowds, ""I find no guilt in this man."""
Luke,23,5,"But they were urgent, saying, ""He stirs up the people, teaching throughout all Judea, from Galilee even to this place."""
Luke,23,6,"When Pilate heard this, he asked whether the man was a Galilean."
Luke,23,7,"And when he learned that he belonged to Herod's jurisdiction, he sent him over to Herod, who was himself in Jerusalem at that time."
Luke,23,8,"When Herod saw Jesus, he was very glad, for he had long desired to see him, because he had heard about him, and he was hoping to see some sign done by him."
Luke,23,9,"So he questioned him at some length, but he made no answer."
Luke,23,10,"The chief priests and the scribes stood by, vehemently accusing him."
Luke,23,11,"And Herod with his soldiers treated him with contempt and mocked him. Then, arraying him in splendid clothing, he sent him back to Pilate."
Luke,23,12,"And Herod and Pilate became friends with each other that very day, for before this they had been at enmity with each other."
Luke,23,13,"Pilate then called together the chief priests and the rulers and the people,"
Luke,23,14,"and said to them, ""You brought me this man as one who was misleading the people. And after examining him before you, behold, I did not find this man guilty of any of your charges against him."
Luke,23,15,"Neither did Herod, for he sent him back to us. Look, nothing deserving death has been done by him."
Luke,23,16,"I will therefore punish and release him."""
Luke,23,17,See Footnote
Luke,23,18,"But they all cried out together, ""Away with this man, and release to us Barabbas""--"
Luke,23,19,a man who had been thrown into prison for an insurrection started in the city and for murder.
Luke,23,20,"Pilate addressed them once more, desiring to release Jesus,"
Luke,23,21,"but they kept shouting, ""Crucify, crucify him!"""
Luke,23,22,"A third time he said to them, ""Why, what evil has he done? I have found in him no guilt deserving death. I will therefore punish and release him."""
Luke,23,23,"But they were urgent, demanding with loud cries that he should be crucified. And their voices prevailed."
Luke,23,24,So Pilate decided that their demand should be granted.
Luke,23,25,"He released the man who had been thrown into prison for insurrection and murder, for whom they asked, but he delivered Jesus over to their will."
Luke,23,26,"And as they led him away, they seized one Simon of Cyrene, who was coming in from the country, and laid on him the cross, to carry it behind Jesus."
Luke,23,27,And there followed him a great multitude of the people and of women who were mourning and lamenting for him.
Luke,23,28,"But turning to them Jesus said, ""Daughters of Jerusalem, do not weep for me, but weep for yourselves and for your children."
Luke,23,29,"For behold, the days are coming when they will say, 'Blessed are the barren and the wombs that never bore and the breasts that never nursed!'"
Luke,23,30,"Then they will begin to say to the mountains, 'Fall on us,' and to the hills, 'Cover us.'"
Luke,23,31,"For if they do these things when the wood is green, what will happen when it is dry?"""
Luke,23,32,"Two others, who were criminals, were led away to be put to death with him."
Luke,23,33,"And when they came to the place that is called The Skull, there they crucified him, and the criminals, one on his right and one on his left."
Luke,23,34,"And Jesus said, ""Father, forgive them, for they know not what they do."" And they cast lots to divide his garments."
Luke,23,35,"And the people stood by, watching, but the rulers scoffed at him, saying, ""He saved others; let him save himself, if he is the Christ of God, his Chosen One!"""
Luke,23,36,"The soldiers also mocked him, coming up and offering him sour wine"
Luke,23,37,"and saying, ""If you are the King of the Jews, save yourself!"""
Luke,23,38,"There was also an inscription over him, ""This is the King of the Jews."""
Luke,23,39,"One of the criminals who were hanged railed at him, saying, ""Are you not the Christ? Save yourself and us!"""
Luke,23,40,"But the other rebuked him, saying, ""Do you not fear God, since you are under the same sentence of condemnation?"
Luke,23,41,"And we indeed justly, for we are receiving the due reward of our deeds; but this man has done nothing wrong."""
Luke,23,42,"And he said, ""Jesus, remember me when you come into your kingdom."""
Luke,23,43,"And he said to him, ""Truly, I say to you, today you will be with me in Paradise."""
Luke,23,44,"It was now about the sixth hour, and there was darkness over the whole land until the ninth hour,"
Luke,23,45,while the sun's light failed. And the curtain of the temple was torn in two.
Luke,23,46,"Then Jesus, calling out with a loud voice, said, ""Father, into your hands I commit my spirit!"" And having said this he breathed his last."
Luke,23,47,"Now when the centurion saw what had taken place, he praised God, saying, ""Certainly this man was innocent!"""
Luke,23,48,"And all the crowds that had assembled for this spectacle, when they saw what had taken place, returned home beating their breasts."
Luke,23,49,And all his acquaintances and the women who had followed him from Galilee stood at a distance watching these things.
Luke,23,50,"Now there was a man named Joseph, from the Jewish town of Arimathea. He was a member of the council, a good and righteous man,"
Luke,23,51,who had not consented to their decision and action; and he was looking for the kingdom of God.
Luke,23,52,This man went to Pilate and asked for the body of Jesus.
Luke,23,53,"Then he took it down and wrapped it in a linen shroud and laid him in a tomb cut in stone, where no one had ever yet been laid."
Luke,23,54,"It was the day of Preparation, and the Sabbath was beginning."
Luke,23,55,The women who had come with him from Galilee followed and saw the tomb and how his body was laid.
Luke,23,56,Then they returned and prepared spices and ointments.On the Sabbath they rested according to the commandment.
Luke,24,1,"But on the first day of the week, at early dawn, they went to the tomb, taking the spices they had prepared."
Luke,24,2,"And they found the stone rolled away from the tomb,"
Luke,24,3,but when they went in they did not find the body of the Lord Jesus.
Luke,24,4,"While they were perplexed about this, behold, two men stood by them in dazzling apparel."
Luke,24,5,"And as they were frightened and bowed their faces to the ground, the men said to them, ""Why do you seek the living among the dead?"
Luke,24,6,"He is not here, but has risen. Remember how he told you, while he was still in Galilee,"
Luke,24,7,"that the Son of Man must be delivered into the hands of sinful men and be crucified and on the third day rise."""
Luke,24,8,"And they remembered his words,"
Luke,24,9,and returning from the tomb they told all these things to the eleven and to all the rest.
Luke,24,10,"Now it was Mary Magdalene and Joanna and Mary the mother of James and the other women with them who told these things to the apostles,"
Luke,24,11,"but these words seemed to them an idle tale, and they did not believe them."
Luke,24,12,"But Peter rose and ran to the tomb; stooping and looking in, he saw the linen cloths by themselves; and he went home marveling at what had happened."
Luke,24,13,"That very day two of them were going to a village named Emmaus, about seven miles from Jerusalem,"
Luke,24,14,and they were talking with each other about all these things that had happened.
Luke,24,15,"While they were talking and discussing together, Jesus himself drew near and went with them."
Luke,24,16,But their eyes were kept from recognizing him.
Luke,24,17,"And he said to them, ""What is this conversation that you are holding with each other as you walk?"" And they stood still, looking sad."
Luke,24,18,"Then one of them, named Cleopas, answered him, ""Are you the only visitor to Jerusalem who does not know the things that have happened there in these days?"""
Luke,24,19,"And he said to them, ""What things?"" And they said to him, ""Concerning Jesus of Nazareth, a man who was a prophet mighty in deed and word before God and all the people,"
Luke,24,20,"and how our chief priests and rulers delivered him up to be condemned to death, and crucified him."
Luke,24,21,"But we had hoped that he was the one to redeem Israel. Yes, and besides all this, it is now the third day since these things happened."
Luke,24,22,"Moreover, some women of our company amazed us. They were at the tomb early in the morning,"
Luke,24,23,"and when they did not find his body, they came back saying that they had even seen a vision of angels, who said that he was alive."
Luke,24,24,"Some of those who were with us went to the tomb and found it just as the women had said, but him they did not see."""
Luke,24,25,"And he said to them, ""O foolish ones, and slow of heart to believe all that the prophets have spoken!"
Luke,24,26,"Was it not necessary that the Christ should suffer these things and enter into his glory?"""
Luke,24,27,"And beginning with Moses and all the Prophets, he interpreted to them in all the Scriptures the things concerning himself."
Luke,24,28,"So they drew near to the village to which they were going. He acted as if he were going farther,"
Luke,24,29,"but they urged him strongly, saying, ""Stay with us, for it is toward evening and the day is now far spent."" So he went in to stay with them."
Luke,24,30,"When he was at table with them, he took the bread and blessed and broke it and gave it to them."
Luke,24,31,"And their eyes were opened, and they recognized him. And he vanished from their sight."
Luke,24,32,"They said to each other, ""Did not our hearts burn within us while he talked to us on the road, while he opened to us the Scriptures?"""
Luke,24,33,"And they rose that same hour and returned to Jerusalem. And they found the eleven and those who were with them gathered together,"
Luke,24,34,"saying, ""The Lord has risen indeed, and has appeared to Simon!"""
Luke,24,35,"Then they told what had happened on the road, and how he was known to them in the breaking of the bread."
Luke,24,36,"As they were talking about these things, Jesus himself stood among them, and said to them, ""Peace to you!"""
Luke,24,37,But they were startled and frightened and thought they saw a spirit.
Luke,24,38,"And he said to them, ""Why are you troubled, and why do doubts arise in your hearts?"
Luke,24,39,"See my hands and my feet, that it is I myself. Touch me, and see. For a spirit does not have flesh and bones as you see that I have."""
Luke,24,40,"And when he had said this, he showed them his hands and his feet."
Luke,24,41,"And while they still disbelieved for joy and were marveling, he said to them, ""Have you anything here to eat?"""
Luke,24,42,"They gave him a piece of broiled fish,"
Luke,24,43,and he took it and ate before them.
Luke,24,44,"Then he said to them, ""These are my words that I spoke to you while I was still with you, that everything written about me in the Law of Moses and the Prophets and the Psalms must be fulfilled."""
Luke,24,45,"Then he opened their minds to understand the Scriptures,"
Luke,24,46,"and said to them, ""Thus it is written, that the Christ should suffer and on the third day rise from the dead,"
Luke,24,47,"and that repentance and forgiveness of sins should be proclaimed in his name to all nations, beginning from Jerusalem."
Luke,24,48,You are witnesses of these things.
Luke,24,49,"And behold, I am sending the promise of my Father upon you. But stay in the city until you are clothed with power from on high."""
Luke,24,50,"Then he led them out as far as Bethany, and lifting up his hands he blessed them."
Luke,24,51,"While he blessed them, he parted from them and was carried up into heaven."
Luke,24,52,"And they worshiped him and returned to Jerusalem with great joy,"
Luke,24,53,and were continually in the temple blessing God.
John,1,1,"In the beginning was the Word, and the Word was with God, and the Word was God."
John,1,2,He was in the beginning with God.
John,1,3,"All things were made through him, and without him was not any thing made that was made."
John,1,4,"In him was life, and the life was the light of men."
John,1,5,"The light shines in the darkness, and the darkness has not overcome it."
John,1,6,"There was a man sent from God, whose name was John."
John,1,7,"He came as a witness, to bear witness about the light, that all might believe through him."
John,1,8,"He was not the light, but came to bear witness about the light."
John,1,9,"The true light, which enlightens everyone, was coming into the world."
John,1,10,"He was in the world, and the world was made through him, yet the world did not know him."
John,1,11,"He came to his own, and his own people did not receive him."
John,1,12,"But to all who did receive him, who believed in his name, he gave the right to become children of God,"
John,1,13,"who were born, not of blood nor of the will of the flesh nor of the will of man, but of God."
John,1,14,"And the Word became flesh and dwelt among us, and we have seen his glory, glory as of the only Son from the Father, full of grace and truth."
John,1,15,"(John bore witness about him, and cried out, ""This was he of whom I said, 'He who comes after me ranks before me, because he was before me.'"")"
John,1,16,"And from his fullness we have all received, grace upon grace."
John,1,17,For the law was given through Moses; grace and truth came through Jesus Christ.
John,1,18,"No one has ever seen God; the only God, who is at the Father's side, he has made him known."
John,1,19,"And this is the testimony of John, when the Jews sent priests and Levites from Jerusalem to ask him, ""Who are you?"""
John,1,20,"He confessed, and did not deny, but confessed, ""I am not the Christ."""
John,1,21,"And they asked him, ""What then? Are you Elijah?"" He said, ""I am not.Are you the Prophet?"" And he answered, ""No."""
John,1,22,"So they said to him, ""Who are you? We need to give an answer to those who sent us. What do you say about yourself?"""
John,1,23,"He said, ""I am the voice of one crying out in the wilderness, 'Make straight the way of the Lord,' as the prophet Isaiah said."""
John,1,24,(Now they had been sent from the Pharisees.)
John,1,25,"They asked him, ""Then why are you baptizing, if you are neither the Christ, nor Elijah, nor the Prophet?"""
John,1,26,"John answered them, ""I baptize with water, but among you stands one you do not know,"
John,1,27,"even he who comes after me, the strap of whose sandal I am not worthy to untie."""
John,1,28,"These things took place in Bethany across the Jordan, where John was baptizing."
John,1,29,"The next day he saw Jesus coming toward him, and said, ""Behold, the Lamb of God, who takes away the sin of the world!"
John,1,30,"This is he of whom I said, 'After me comes a man who ranks before me, because he was before me.'"
John,1,31,"I myself did not know him, but for this purpose I came baptizing with water, that he might be revealed to Israel."""
John,1,32,"And John bore witness: ""I saw the Spirit descend from heaven like a dove, and it remained on him."
John,1,33,"I myself did not know him, but he who sent me to baptize with water said to me, 'He on whom you see the Spirit descend and remain, this is he who baptizes with the Holy Spirit.'"
John,1,34,"And I have seen and have borne witness that this is the Son of God."""
John,1,35,"The next day again John was standing with two of his disciples,"
John,1,36,"and he looked at Jesus as he walked by and said, ""Behold, the Lamb of God!"""
John,1,37,"The two disciples heard him say this, and they followed Jesus."
John,1,38,"Jesus turned and saw them following and said to them, ""What are you seeking?"" And they said to him, ""Rabbi"" (which means Teacher), ""where are you staying?"""
John,1,39,"He said to them, ""Come and you will see."" So they came and saw where he was staying, and they stayed with him that day, for it was about the tenth hour."
John,1,40,"One of the two who heard John speak and followed Jesus was Andrew, Simon Peter's brother."
John,1,41,"He first found his own brother Simon and said to him, ""We have found the Messiah"" (which means Christ)."
John,1,42,"He brought him to Jesus. Jesus looked at him and said, ""So you are Simon the son of John? You shall be called Cephas"" (which means Peter )."
