Genesis,49,29,"Then he commanded them and said to them, ""I am to be gathered to my people; bury me with my fathers in the cave that is in the field of Ephron the Hittite,"
Genesis,49,30,"in the cave that is in the field at Machpelah, to the east of Mamre, in the land of Canaan, which Abraham bought with the field from Ephron the Hittite to possess as a burying place."
Genesis,49,31,"There they buried Abraham and Sarah his wife. There they buried Isaac and Rebekah his wife, and there I buried Leah--"
Genesis,49,32,"the field and the cave that is in it were bought from the Hittites."""
Genesis,49,33,"When Jacob finished commanding his sons, he drew up his feet into the bed and breathed his last and was gathered to his people."
Genesis,50,1,Then Joseph fell on his father's face and wept over him and kissed him.
Genesis,50,2,And Joseph commanded his servants the physicians to embalm his father. So the physicians embalmed Israel.
Genesis,50,3,"Forty days were required for it, for that is how many are required for embalming. And the Egyptians wept for him seventy days."
Genesis,50,4,"And when the days of weeping for him were past, Joseph spoke to the household of Pharaoh, saying, ""If now I have found favor in your eyes, please speak in the ears of Pharaoh, saying,"
Genesis,50,5,"My father made me swear, saying, 'I am about to die: in my tomb that I hewed out for myself in the land of Canaan, there shall you bury me.' Now therefore, let me please go up and bury my father. Then I will return."""
Genesis,50,6,"And Pharaoh answered, ""Go up, and bury your father, as he made you swear."""
Genesis,50,7,"So Joseph went up to bury his father. With him went up all the servants of Pharaoh, the elders of his household, and all the elders of the land of Egypt,"
Genesis,50,8,"as well as all the household of Joseph, his brothers, and his father's household. Only their children, their flocks, and their herds were left in the land of Goshen."
Genesis,50,9,And there went up with him both chariots and horsemen. It was a very great company.
Genesis,50,10,"When they came to the threshing floor of Atad, which is beyond the Jordan, they lamented there with a very great and grievous lamentation, and he made a mourning for his father seven days."
Genesis,50,11,"When the inhabitants of the land, the Canaanites, saw the mourning on the threshing floor of Atad, they said, ""This is a grievous mourning by the Egyptians."" Therefore the place was named Abel-mizraim; it is beyond the Jordan."
Genesis,50,12,"Thus his sons did for him as he had commanded them,"
Genesis,50,13,"for his sons carried him to the land of Canaan and buried him in the cave of the field at Machpelah, to the east of Mamre, which Abraham bought with the field from Ephron the Hittite to possess as a burying place."
Genesis,50,14,"After he had buried his father, Joseph returned to Egypt with his brothers and all who had gone up with him to bury his father."
Genesis,50,15,"When Joseph's brothers saw that their father was dead, they said, ""It may be that Joseph will hate us and pay us back for all the evil that we did to him."""
Genesis,50,16,"So they sent a message to Joseph, saying, ""Your father gave this command before he died,"
Genesis,50,17,"'Say to Joseph, Please forgive the transgression of your brothers and their sin, because they did evil to you.' And now, please forgive the transgression of the servants of the God of your father."" Joseph wept when they spoke to him."
Genesis,50,18,"His brothers also came and fell down before him and said, ""Behold, we are your servants."""
Genesis,50,19,"But Joseph said to them, ""Do not fear, for am I in the place of God?"
Genesis,50,20,"As for you, you meant evil against me, but God meant it for good, to bring it about that many people should be kept alive, as they are today."
Genesis,50,21,"So do not fear; I will provide for you and your little ones."" Thus he comforted them and spoke kindly to them."
Genesis,50,22,"So Joseph remained in Egypt, he and his father's house. Joseph lived 110 years."
Genesis,50,23,And Joseph saw Ephraim's children of the third generation. The children also of Machir the son of Manasseh were counted as Joseph's own.
Genesis,50,24,"And Joseph said to his brothers, ""I am about to die, but God will visit you and bring you up out of this land to the land that he swore to Abraham, to Isaac, and to Jacob."""
Genesis,50,25,"Then Joseph made the sons of Israel swear, saying, ""God will surely visit you, and you shall carry up my bones from here."""
Genesis,50,26,"So Joseph died, being 110 years old. They embalmed him, and he was put in a coffin in Egypt."
Exodus,1,1,"These are the names of the sons of Israel who came to Egypt with Jacob, each with his household:"
Exodus,1,2,"Reuben, Simeon, Levi, and Judah,"
Exodus,1,3,"Issachar, Zebulun, and Benjamin,"
Exodus,1,4,"Dan and Naphtali, Gad and Asher."
Exodus,1,5,All the descendants of Jacob were seventy persons; Joseph was already in Egypt.
Exodus,1,6,"Then Joseph died, and all his brothers and all that generation."
Exodus,1,7,"But the people of Israel were fruitful and increased greatly; they multiplied and grew exceedingly strong, so that the land was filled with them."
Exodus,1,8,"Now there arose a new king over Egypt, who did not know Joseph."
Exodus,1,9,"And he said to his people, ""Behold, the people of Israel are too many and too mighty for us."
Exodus,1,10,"Come, let us deal shrewdly with them, lest they multiply, and, if war breaks out, they join our enemies and fight against us and escape from the land."""
Exodus,1,11,"Therefore they set taskmasters over them to afflict them with heavy burdens. They built for Pharaoh store cities, Pithom and Raamses."
Exodus,1,12,"But the more they were oppressed, the more they multiplied and the more they spread abroad. And the Egyptians were in dread of the people of Israel."
Exodus,1,13,So they ruthlessly made the people of Israel work as slaves
Exodus,1,14,"and made their lives bitter with hard service, in mortar and brick, and in all kinds of work in the field. In all their work they ruthlessly made them work as slaves."
Exodus,1,15,"Then the king of Egypt said to the Hebrew midwives, one of whom was named Shiphrah and the other Puah,"
Exodus,1,16,"""When you serve as midwife to the Hebrew women and see them on the birthstool, if it is a son, you shall kill him, but if it is a daughter, she shall live."""
Exodus,1,17,"But the midwives feared God and did not do as the king of Egypt commanded them, but let the male children live."
Exodus,1,18,"So the king of Egypt called the midwives and said to them, ""Why have you done this, and let the male children live?"""
Exodus,1,19,"The midwives said to Pharaoh, ""Because the Hebrew women are not like the Egyptian women, for they are vigorous and give birth before the midwife comes to them."""
Exodus,1,20,So God dealt well with the midwives. And the people multiplied and grew very strong.
Exodus,1,21,"And because the midwives feared God, he gave them families."
Exodus,1,22,"Then Pharaoh commanded all his people, ""Every son that is born to the Hebrews you shall cast into the Nile, but you shall let every daughter live."""
Exodus,2,1,Now a man from the house of Levi went and took as his wife a Levite woman.
Exodus,2,2,"The woman conceived and bore a son, and when she saw that he was a fine child, she hid him three months."
Exodus,2,3,"When she could hide him no longer, she took for him a basket made of bulrushes and daubed it with bitumen and pitch. She put the child in it and placed it among the reeds by the river bank."
Exodus,2,4,And his sister stood at a distance to know what would be done to him.
Exodus,2,5,"Now the daughter of Pharaoh came down to bathe at the river, while her young women walked beside the river. She saw the basket among the reeds and sent her servant woman, and she took it."
Exodus,2,6,"When she opened it, she saw the child, and behold, the baby was crying. She took pity on him and said, ""This is one of the Hebrews' children."""
Exodus,2,7,"Then his sister said to Pharaoh's daughter, ""Shall I go and call you a nurse from the Hebrew women to nurse the child for you?"""
Exodus,2,8,"And Pharaoh's daughter said to her, ""Go."" So the girl went and called the child's mother."
Exodus,2,9,"And Pharaoh's daughter said to her, ""Take this child away and nurse him for me, and I will give you your wages."" So the woman took the child and nursed him."
Exodus,2,10,"When the child grew up, she brought him to Pharaoh's daughter, and he became her son. She named him Moses, ""Because,"" she said, ""I drew him out of the water."""
Exodus,2,11,"One day, when Moses had grown up, he went out to his people and looked on their burdens, and he saw an Egyptian beating a Hebrew, one of his people."
Exodus,2,12,"He looked this way and that, and seeing no one, he struck down the Egyptian and hid him in the sand."
Exodus,2,13,"When he went out the next day, behold, two Hebrews were struggling together. And he said to the man in the wrong, ""Why do you strike your companion?"""
Exodus,2,14,"He answered, ""Who made you a prince and a judge over us? Do you mean to kill me as you killed the Egyptian?"" Then Moses was afraid, and thought, ""Surely the thing is known."""
Exodus,2,15,"When Pharaoh heard of it, he sought to kill Moses. But Moses fled from Pharaoh and stayed in the land of Midian. And he sat down by a well."
Exodus,2,16,"Now the priest of Midian had seven daughters, and they came and drew water and filled the troughs to water their father's flock."
Exodus,2,17,"The shepherds came and drove them away, but Moses stood up and saved them, and watered their flock."
Exodus,2,18,"When they came home to their father Reuel, he said, ""How is it that you have come home so soon today?"""
Exodus,2,19,"They said, ""An Egyptian delivered us out of the hand of the shepherds and even drew water for us and watered the flock."""
Exodus,2,20,"He said to his daughters, ""Then where is he? Why have you left the man? Call him, that he may eat bread."""
Exodus,2,21,"And Moses was content to dwell with the man, and he gave Moses his daughter Zipporah."
Exodus,2,22,"She gave birth to a son, and he called his name Gershom, for he said, ""I have been a sojourner in a foreign land."""
Exodus,2,23,"During those many days the king of Egypt died, and the people of Israel groaned because of their slavery and cried out for help. Their cry for rescue from slavery came up to God."
Exodus,2,24,"And God heard their groaning, and God remembered his covenant with Abraham, with Isaac, and with Jacob."
Exodus,2,25,God saw the people of Israel--and God knew.
Exodus,3,1,"Now Moses was keeping the flock of his father-in-law, Jethro, the priest of Midian, and he led his flock to the west side of the wilderness and came to Horeb, the mountain of God."
Exodus,3,2,"And the angel of the LORD appeared to him in a flame of fire out of the midst of a bush. He looked, and behold, the bush was burning, yet it was not consumed."
Exodus,3,3,"And Moses said, ""I will turn aside to see this great sight, why the bush is not burned."""
Exodus,3,4,"When the LORD saw that he turned aside to see, God called to him out of the bush, ""Moses, Moses!"" And he said, ""Here I am."""
Exodus,3,5,"Then he said, ""Do not come near; take your sandals off your feet, for the place on which you are standing is holy ground."""
Exodus,3,6,"And he said, ""I am the God of your father, the God of Abraham, the God of Isaac, and the God of Jacob."" And Moses hid his face, for he was afraid to look at God."
Exodus,3,7,"Then the LORD said, ""I have surely seen the affliction of my people who are in Egypt and have heard their cry because of their taskmasters. I know their sufferings,"
Exodus,3,8,"and I have come down to deliver them out of the hand of the Egyptians and to bring them up out of that land to a good and broad land, a land flowing with milk and honey, to the place of the Canaanites, the Hittites, the Amorites, the Perizzites, the Hivites, and the Jebusites."
Exodus,3,9,"And now, behold, the cry of the people of Israel has come to me, and I have also seen the oppression with which the Egyptians oppress them."
Exodus,3,10,"Come, I will send you to Pharaoh that you may bring my people, the children of Israel, out of Egypt."""
Exodus,3,11,"But Moses said to God, ""Who am I that I should go to Pharaoh and bring the children of Israel out of Egypt?"""
Exodus,3,12,"He said, ""But I will be with you, and this shall be the sign for you, that I have sent you: when you have brought the people out of Egypt, you shall serve God on this mountain."""
Exodus,3,13,"Then Moses said to God, ""If I come to the people of Israel and say to them, 'The God of your fathers has sent me to you,' and they ask me, 'What is his name?' what shall I say to them?"""
Exodus,3,14,"God said to Moses, ""I AM WHO I AM."" And he said, ""Say this to the people of Israel, 'I AM has sent me to you.'"""
Exodus,3,15,"God also said to Moses, ""Say this to the people of Israel, 'The LORD, the God of your fathers, the God of Abraham, the God of Isaac, and the God of Jacob, has sent me to you.' This is my name forever, and thus I am to be remembered throughout all generations."
Exodus,3,16,"Go and gather the elders of Israel together and say to them, 'The LORD, the God of your fathers, the God of Abraham, of Isaac, and of Jacob, has appeared to me, saying, ""I have observed you and what has been done to you in Egypt,"
Exodus,3,17,"and I promise that I will bring you up out of the affliction of Egypt to the land of the Canaanites, the Hittites, the Amorites, the Perizzites, the Hivites, and the Jebusites, a land flowing with milk and honey.""'"
Exodus,3,18,"And they will listen to your voice, and you and the elders of Israel shall go to the king of Egypt and say to him, 'The LORD, the God of the Hebrews, has met with us; and now, please let us go a three days' journey into the wilderness, that we may sacrifice to the LORD our God.'"
Exodus,3,19,But I know that the king of Egypt will not let you go unless compelled by a mighty hand.
Exodus,3,20,So I will stretch out my hand and strike Egypt with all the wonders that I will do in it; after that he will let you go.
Exodus,3,21,"And I will give this people favor in the sight of the Egyptians; and when you go, you shall not go empty,"
Exodus,3,22,"but each woman shall ask of her neighbor, and any woman who lives in her house, for silver and gold jewelry, and for clothing. You shall put them on your sons and on your daughters. So you shall plunder the Egyptians."""
Exodus,4,1,"Then Moses answered, ""But behold, they will not believe me or listen to my voice, for they will say, 'The LORD did not appear to you.'"""
Exodus,4,2,"The LORD said to him, ""What is that in your hand?"" He said, ""A staff."""
Exodus,4,3,"And he said, ""Throw it on the ground."" So he threw it on the ground, and it became a serpent, and Moses ran from it."
Exodus,4,4,"But the LORD said to Moses, ""Put out your hand and catch it by the tail""--so he put out his hand and caught it, and it became a staff in his hand--"
Exodus,4,5,"""that they may believe that the LORD, the God of their fathers, the God of Abraham, the God of Isaac, and the God of Jacob, has appeared to you."""
Exodus,4,6,"Again, the LORD said to him, ""Put your hand inside your cloak."" And he put his hand inside his cloak, and when he took it out, behold, his hand was leprous like snow."
Exodus,4,7,"Then God said, ""Put your hand back inside your cloak."" So he put his hand back inside his cloak, and when he took it out, behold, it was restored like the rest of his flesh."
Exodus,4,8,"""If they will not believe you,"" God said, ""or listen to the first sign, they may believe the latter sign."
Exodus,4,9,"If they will not believe even these two signs or listen to your voice, you shall take some water from the Nile and pour it on the dry ground, and the water that you shall take from the Nile will become blood on the dry ground."""
Exodus,4,10,"But Moses said to the LORD, ""Oh, my Lord, I am not eloquent, either in the past or since you have spoken to your servant, but I am slow of speech and of tongue."""
Exodus,4,11,"Then the LORD said to him, ""Who has made man's mouth? Who makes him mute, or deaf, or seeing, or blind? Is it not I, the LORD?"
Exodus,4,12,"Now therefore go, and I will be with your mouth and teach you what you shall speak."""
Exodus,4,13,"But he said, ""Oh, my Lord, please send someone else."""
Exodus,4,14,"Then the anger of the LORD was kindled against Moses and he said, ""Is there not Aaron, your brother, the Levite? I know that he can speak well. Behold, he is coming out to meet you, and when he sees you, he will be glad in his heart."
Exodus,4,15,"You shall speak to him and put the words in his mouth, and I will be with your mouth and with his mouth and will teach you both what to do."
Exodus,4,16,"He shall speak for you to the people, and he shall be your mouth, and you shall be as God to him."
Exodus,4,17,"And take in your hand this staff, with which you shall do the signs."""
Exodus,4,18,"Moses went back to Jethro his father-in-law and said to him, ""Please let me go back to my brothers in Egypt to see whether they are still alive."" And Jethro said to Moses, ""Go in peace."""
Exodus,4,19,"And the LORD said to Moses in Midian, ""Go back to Egypt, for all the men who were seeking your life are dead."""
Exodus,4,20,"So Moses took his wife and his sons and had them ride on a donkey, and went back to the land of Egypt. And Moses took the staff of God in his hand."
Exodus,4,21,"And the LORD said to Moses, ""When you go back to Egypt, see that you do before Pharaoh all the miracles that I have put in your power. But I will harden his heart, so that he will not let the people go."
Exodus,4,22,"Then you shall say to Pharaoh, 'Thus says the LORD, Israel is my firstborn son,"
Exodus,4,23,"and I say to you, ""Let my son go that he may serve me."" If you refuse to let him go, behold, I will kill your firstborn son.'"""
Exodus,4,24,At a lodging place on the way the LORD met him and sought to put him to death.
Exodus,4,25,"Then Zipporah took a flint and cut off her son's foreskin and touched Moses' feet with it and said, ""Surely you are a bridegroom of blood to me!"""
Exodus,4,26,"So he let him alone. It was then that she said, ""A bridegroom of blood,"" because of the circumcision."
Exodus,4,27,"The LORD said to Aaron, ""Go into the wilderness to meet Moses."" So he went and met him at the mountain of God and kissed him."
Exodus,4,28,"And Moses told Aaron all the words of the LORD with which he had sent him to speak, and all the signs that he had commanded him to do."
Exodus,4,29,Then Moses and Aaron went and gathered together all the elders of the people of Israel.
Exodus,4,30,Aaron spoke all the words that the LORD had spoken to Moses and did the signs in the sight of the people.
Exodus,4,31,"And the people believed; and when they heard that the LORD had visited the people of Israel and that he had seen their affliction, they bowed their heads and worshiped."
Exodus,5,1,"Afterward Moses and Aaron went and said to Pharaoh, ""Thus says the LORD, the God of Israel, 'Let my people go, that they may hold a feast to me in the wilderness.'"""
Exodus,5,2,"But Pharaoh said, ""Who is the LORD, that I should obey his voice and let Israel go? I do not know the LORD, and moreover, I will not let Israel go."""
Exodus,5,3,"Then they said, ""The God of the Hebrews has met with us. Please let us go a three days' journey into the wilderness that we may sacrifice to the LORD our God, lest he fall upon us with pestilence or with the sword."""
Exodus,5,4,"But the king of Egypt said to them, ""Moses and Aaron, why do you take the people away from their work? Get back to your burdens."""
Exodus,5,5,"And Pharaoh said, ""Behold, the people of the land are now many, and you make them rest from their burdens!"""
Exodus,5,6,"The same day Pharaoh commanded the taskmasters of the people and their foremen,"
Exodus,5,7,"""You shall no longer give the people straw to make bricks, as in the past; let them go and gather straw for themselves."
Exodus,5,8,"But the number of bricks that they made in the past you shall impose on them, you shall by no means reduce it, for they are idle. Therefore they cry, 'Let us go and offer sacrifice to our God.'"
Exodus,5,9,"Let heavier work be laid on the men that they may labor at it and pay no regard to lying words."""
Exodus,5,10,"So the taskmasters and the foremen of the people went out and said to the people, ""Thus says Pharaoh, 'I will not give you straw."
Exodus,5,11,"Go and get your straw yourselves wherever you can find it, but your work will not be reduced in the least.'"""
Exodus,5,12,So the people were scattered throughout all the land of Egypt to gather stubble for straw.
Exodus,5,13,"The taskmasters were urgent, saying, ""Complete your work, your daily task each day, as when there was straw."""
Exodus,5,14,"And the foremen of the people of Israel, whom Pharaoh's taskmasters had set over them, were beaten and were asked, ""Why have you not done all your task of making bricks today and yesterday, as in the past?"""
Exodus,5,15,"Then the foremen of the people of Israel came and cried to Pharaoh, ""Why do you treat your servants like this?"
Exodus,5,16,"No straw is given to your servants, yet they say to us, 'Make bricks!' And behold, your servants are beaten; but the fault is in your own people."""
Exodus,5,17,"But he said, ""You are idle, you are idle; that is why you say, 'Let us go and sacrifice to the LORD.'"
Exodus,5,18,"Go now and work. No straw will be given you, but you must still deliver the same number of bricks."""
Exodus,5,19,"The foremen of the people of Israel saw that they were in trouble when they said, ""You shall by no means reduce your number of bricks, your daily task each day."""
Exodus,5,20,"They met Moses and Aaron, who were waiting for them, as they came out from Pharaoh;"
Exodus,5,21,"and they said to them, ""The LORD look on you and judge, because you have made us stink in the sight of Pharaoh and his servants, and have put a sword in their hand to kill us."""
Exodus,5,22,"Then Moses turned to the LORD and said, ""O LORD, why have you done evil to this people? Why did you ever send me?"
Exodus,5,23,"For since I came to Pharaoh to speak in your name, he has done evil to this people, and you have not delivered your people at all."""
Exodus,6,1,"But the LORD said to Moses, ""Now you shall see what I will do to Pharaoh; for with a strong hand he will send them out, and with a strong hand he will drive them out of his land."""
Exodus,6,2,"God spoke to Moses and said to him, ""I am the LORD."
Exodus,6,3,"I appeared to Abraham, to Isaac, and to Jacob, as God Almighty, but by my name the LORD I did not make myself known to them."
Exodus,6,4,"I also established my covenant with them to give them the land of Canaan, the land in which they lived as sojourners."
Exodus,6,5,"Moreover, I have heard the groaning of the people of Israel whom the Egyptians hold as slaves, and I have remembered my covenant."
Exodus,6,6,"Say therefore to the people of Israel, 'I am the LORD, and I will bring you out from under the burdens of the Egyptians, and I will deliver you from slavery to them, and I will redeem you with an outstretched arm and with great acts of judgment."
Exodus,6,7,"I will take you to be my people, and I will be your God, and you shall know that I am the LORD your God, who has brought you out from under the burdens of the Egyptians."
Exodus,6,8,"I will bring you into the land that I swore to give to Abraham, to Isaac, and to Jacob. I will give it to you for a possession. I am the LORD.'"""
Exodus,6,9,"Moses spoke thus to the people of Israel, but they did not listen to Moses, because of their broken spirit and harsh slavery."
Exodus,6,10,"So the LORD said to Moses,"
Exodus,6,11,"""Go in, tell Pharaoh king of Egypt to let the people of Israel go out of his land."""
Exodus,6,12,"But Moses said to the LORD, ""Behold, the people of Israel have not listened to me. How then shall Pharaoh listen to me, for I am of uncircumcised lips?"""
Exodus,6,13,But the LORD spoke to Moses and Aaron and gave them a charge about the people of Israel and about Pharaoh king of Egypt: to bring the people of Israel out of the land of Egypt.
Exodus,6,14,"These are the heads of their fathers' houses: the sons of Reuben, the firstborn of Israel: Hanoch, Pallu, Hezron, and Carmi; these are the clans of Reuben."
Exodus,6,15,"The sons of Simeon: Jemuel, Jamin, Ohad, Jachin, Zohar, and Shaul, the son of a Canaanite woman; these are the clans of Simeon."
Exodus,6,16,"These are the names of the sons of Levi according to their generations: Gershon, Kohath, and Merari, the years of the life of Levi being 137 years."
Exodus,6,17,"The sons of Gershon: Libni and Shimei, by their clans."
Exodus,6,18,"The sons of Kohath: Amram, Izhar, Hebron, and Uzziel, the years of the life of Kohath being 133 years."
Exodus,6,19,The sons of Merari: Mahli and Mushi. These are the clans of the Levites according to their generations.
Exodus,6,20,"Amram took as his wife Jochebed his father's sister, and she bore him Aaron and Moses, the years of the life of Amram being 137 years."
Exodus,6,21,"The sons of Izhar: Korah, Nepheg, and Zichri."
Exodus,6,22,"The sons of Uzziel: Mishael, Elzaphan, and Sithri."
Exodus,6,23,"Aaron took as his wife Elisheba, the daughter of Amminadab and the sister of Nahshon, and she bore him Nadab, Abihu, Eleazar, and Ithamar."
Exodus,6,24,"The sons of Korah: Assir, Elkanah, and Abiasaph; these are the clans of the Korahites."
Exodus,6,25,"Eleazar, Aaron's son, took as his wife one of the daughters of Putiel, and she bore him Phinehas. These are the heads of the fathers' houses of the Levites by their clans."
