Proverbs,4,10,"Hear, my son, and accept my words, that the years of your life may be many."
Proverbs,4,11,I have taught you the way of wisdom; I have led you in the paths of uprightness.
Proverbs,4,12,"When you walk, your step will not be hampered, and if you run, you will not stumble."
Proverbs,4,13,"Keep hold of instruction; do not let go; guard her, for she is your life."
Proverbs,4,14,"Do not enter the path of the wicked, and do not walk in the way of the evil."
Proverbs,4,15,Avoid it; do not go on it; turn away from it and pass on.
Proverbs,4,16,For they cannot sleep unless they have done wrong; they are robbed of sleep unless they have made someone stumble.
Proverbs,4,17,For they eat the bread of wickedness and drink the wine of violence.
Proverbs,4,18,"But the path of the righteous is like the light of dawn, which shines brighter and brighter until full day."
Proverbs,4,19,The way of the wicked is like deep darkness; they do not know over what they stumble.
Proverbs,4,20,"My son, be attentive to my words; incline your ear to my sayings."
Proverbs,4,21,Let them not escape from your sight; keep them within your heart.
Proverbs,4,22,"For they are life to those who find them, and healing to all their flesh."
Proverbs,4,23,"Keep your heart with all vigilance, for from it flow the springs of life."
Proverbs,4,24,"Put away from you crooked speech, and put devious talk far from you."
Proverbs,4,25,"Let your eyes look directly forward, and your gaze be straight before you."
Proverbs,4,26,Ponder the path of your feet; then all your ways will be sure.
Proverbs,4,27,Do not swerve to the right or to the left; turn your foot away from evil.
Proverbs,5,1,"My son, be attentive to my wisdom; incline your ear to my understanding,"
Proverbs,5,2,"that you may keep discretion, and your lips may guard knowledge."
Proverbs,5,3,"For the lips of a forbidden woman drip honey, and her speech is smoother than oil,"
Proverbs,5,4,"but in the end she is bitter as wormwood, sharp as a two-edged sword."
Proverbs,5,5,Her feet go down to death; her steps follow the path to Sheol;
Proverbs,5,6,"she does not ponder the path of life; her ways wander, and she does not know it."
Proverbs,5,7,"And now, O sons, listen to me, and do not depart from the words of my mouth."
Proverbs,5,8,"Keep your way far from her, and do not go near the door of her house,"
Proverbs,5,9,"lest you give your honor to others and your years to the merciless,"
Proverbs,5,10,"lest strangers take their fill of your strength, and your labors go to the house of a foreigner,"
Proverbs,5,11,"and at the end of your life you groan, when your flesh and body are consumed,"
Proverbs,5,12,"and you say, ""How I hated discipline, and my heart despised reproof!"
Proverbs,5,13,I did not listen to the voice of my teachers or incline my ear to my instructors.
Proverbs,5,14,"I am at the brink of utter ruin in the assembled congregation."""
Proverbs,5,15,"Drink water from your own cistern, flowing water from your own well."
Proverbs,5,16,"Should your springs be scattered abroad, streams of water in the streets?"
Proverbs,5,17,"Let them be for yourself alone, and not for strangers with you."
Proverbs,5,18,"Let your fountain be blessed, and rejoice in the wife of your youth,"
Proverbs,5,19,"a lovely deer, a graceful doe. Let her breasts fill you at all times with delight; be intoxicated always in her love."
Proverbs,5,20,"Why should you be intoxicated, my son, with a forbidden woman and embrace the bosom of an adulteress?"
Proverbs,5,21,"For a man's ways are before the eyes of the LORD, and he ponders all his paths."
Proverbs,5,22,"The iniquities of the wicked ensnare him, and he is held fast in the cords of his sin."
Proverbs,5,23,"He dies for lack of discipline, and because of his great folly he is led astray."
Proverbs,6,1,"My son, if you have put up security for your neighbor, have given your pledge for a stranger,"
Proverbs,6,2,"if you are snared in the words of your mouth, caught in the words of your mouth,"
Proverbs,6,3,"then do this, my son, and save yourself, for you have come into the hand of your neighbor: go, hasten, and plead urgently with your neighbor."
Proverbs,6,4,Give your eyes no sleep and your eyelids no slumber;
Proverbs,6,5,"save yourself like a gazelle from the hand of the hunter, like a bird from the hand of the fowler."
Proverbs,6,6,"Go to the ant, O sluggard; consider her ways, and be wise."
Proverbs,6,7,"Without having any chief, officer, or ruler,"
Proverbs,6,8,she prepares her bread in summer and gathers her food in harvest.
Proverbs,6,9,"How long will you lie there, O sluggard? When will you arise from your sleep?"
Proverbs,6,10,"A little sleep, a little slumber, a little folding of the hands to rest,"
Proverbs,6,11,"and poverty will come upon you like a robber, and want like an armed man."
Proverbs,6,12,"A worthless person, a wicked man, goes about with crooked speech,"
Proverbs,6,13,"winks with his eyes, signals with his feet, points with his finger,"
Proverbs,6,14,"with perverted heart devises evil, continually sowing discord;"
Proverbs,6,15,therefore calamity will come upon him suddenly; in a moment he will be broken beyond healing.
Proverbs,6,16,"There are six things that the LORD hates, seven that are an abomination to him:"
Proverbs,6,17,"haughty eyes, a lying tongue, and hands that shed innocent blood,"
Proverbs,6,18,"a heart that devises wicked plans, feet that make haste to run to evil,"
Proverbs,6,19,"a false witness who breathes out lies, and one who sows discord among brothers."
Proverbs,6,20,"My son, keep your father's commandment, and forsake not your mother's teaching."
Proverbs,6,21,Bind them on your heart always; tie them around your neck.
Proverbs,6,22,"When you walk, they will lead you; when you lie down, they will watch over you; and when you awake, they will talk with you."
Proverbs,6,23,"For the commandment is a lamp and the teaching a light, and the reproofs of discipline are the way of life,"
Proverbs,6,24,"to preserve you from the evil woman, from the smooth tongue of the adulteress."
Proverbs,6,25,"Do not desire her beauty in your heart, and do not let her capture you with her eyelashes;"
Proverbs,6,26,"for the price of a prostitute is only a loaf of bread, but a married woman hunts down a precious life."
Proverbs,6,27,Can a man carry fire next to his chest and his clothes not be burned?
Proverbs,6,28,Or can one walk on hot coals and his feet not be scorched?
Proverbs,6,29,So is he who goes in to his neighbor's wife; none who touches her will go unpunished.
Proverbs,6,30,"People do not despise a thief if he steals to satisfy his appetite when he is hungry,"
Proverbs,6,31,"but if he is caught, he will pay sevenfold; he will give all the goods of his house."
Proverbs,6,32,He who commits adultery lacks sense; he who does it destroys himself.
Proverbs,6,33,"Wounds and dishonor will he get, and his disgrace will not be wiped away."
Proverbs,6,34,"For jealousy makes a man furious, and he will not spare when he takes revenge."
Proverbs,6,35,He will accept no compensation; he will refuse though you multiply gifts.
Proverbs,7,1,"My son, keep my words and treasure up my commandments with you;"
Proverbs,7,2,keep my commandments and live; keep my teaching as the apple of your eye;
Proverbs,7,3,bind them on your fingers; write them on the tablet of your heart.
Proverbs,7,4,"Say to wisdom, ""You are my sister,"" and call insight your intimate friend,"
Proverbs,7,5,"to keep you from the forbidden woman, from the adulteress with her smooth words."
Proverbs,7,6,"For at the window of my house I have looked out through my lattice,"
Proverbs,7,7,"and I have seen among the simple, I have perceived among the youths, a young man lacking sense,"
Proverbs,7,8,"passing along the street near her corner, taking the road to her house"
Proverbs,7,9,"in the twilight, in the evening, at the time of night and darkness."
Proverbs,7,10,"And behold, the woman meets him, dressed as a prostitute, wily of heart."
Proverbs,7,11,She is loud and wayward; her feet do not stay at home;
Proverbs,7,12,"now in the street, now in the market, and at every corner she lies in wait."
Proverbs,7,13,"She seizes him and kisses him, and with bold face she says to him,"
Proverbs,7,14,"""I had to offer sacrifices, and today I have paid my vows;"
Proverbs,7,15,"so now I have come out to meet you, to seek you eagerly, and I have found you."
Proverbs,7,16,"I have spread my couch with coverings, colored linens from Egyptian linen;"
Proverbs,7,17,"I have perfumed my bed with myrrh, aloes, and cinnamon."
Proverbs,7,18,"Come, let us take our fill of love till morning; let us delight ourselves with love."
Proverbs,7,19,For my husband is not at home; he has gone on a long journey;
Proverbs,7,20,"he took a bag of money with him; at full moon he will come home."""
Proverbs,7,21,With much seductive speech she persuades him; with her smooth talk she compels him.
Proverbs,7,22,"All at once he follows her, as an ox goes to the slaughter, or as a stag is caught fast"
Proverbs,7,23,till an arrow pierces its liver; as a bird rushes into a snare; he does not know that it will cost him his life.
Proverbs,7,24,"And now, O sons, listen to me, and be attentive to the words of my mouth."
Proverbs,7,25,"Let not your heart turn aside to her ways; do not stray into her paths,"
Proverbs,7,26,"for many a victim has she laid low, and all her slain are a mighty throng."
Proverbs,7,27,"Her house is the way to Sheol, going down to the chambers of death."
Proverbs,8,1,Does not wisdom call? Does not understanding raise her voice?
Proverbs,8,2,"On the heights beside the way, at the crossroads she takes her stand;"
Proverbs,8,3,"beside the gates in front of the town, at the entrance of the portals she cries aloud:"
Proverbs,8,4,"""To you, O men, I call, and my cry is to the children of man."
Proverbs,8,5,"O simple ones, learn prudence; O fools, learn sense."
Proverbs,8,6,"Hear, for I will speak noble things, and from my lips will come what is right,"
Proverbs,8,7,for my mouth will utter truth; wickedness is an abomination to my lips.
Proverbs,8,8,All the words of my mouth are righteous; there is nothing twisted or crooked in them.
Proverbs,8,9,"They are all straight to him who understands, and right to those who find knowledge."
Proverbs,8,10,"Take my instruction instead of silver, and knowledge rather than choice gold,"
Proverbs,8,11,"for wisdom is better than jewels, and all that you may desire cannot compare with her."
Proverbs,8,12,"""I, wisdom, dwell with prudence, and I find knowledge and discretion."
Proverbs,8,13,The fear of the LORD is hatred of evil. Pride and arrogance and the way of evil and perverted speech I hate.
Proverbs,8,14,I have counsel and sound wisdom; I have insight; I have strength.
Proverbs,8,15,"By me kings reign, and rulers decree what is just;"
Proverbs,8,16,"by me princes rule, and nobles, all who govern justly."
Proverbs,8,17,"I love those who love me, and those who seek me diligently find me."
Proverbs,8,18,"Riches and honor are with me, enduring wealth and righteousness."
Proverbs,8,19,"My fruit is better than gold, even fine gold, and my yield than choice silver."
Proverbs,8,20,"I walk in the way of righteousness, in the paths of justice,"
Proverbs,8,21,"granting an inheritance to those who love me, and filling their treasuries."
Proverbs,8,22,"""The LORD possessed me at the beginning of his work, the first of his acts of old."
Proverbs,8,23,"Ages ago I was set up, at the first, before the beginning of the earth."
Proverbs,8,24,"When there were no depths I was brought forth, when there were no springs abounding with water."
Proverbs,8,25,"Before the mountains had been shaped, before the hills, I was brought forth,"
Proverbs,8,26,"before he had made the earth with its fields, or the first of the dust of the world."
Proverbs,8,27,"When he established the heavens, I was there; when he drew a circle on the face of the deep,"
Proverbs,8,28,"when he made firm the skies above, when he established the fountains of the deep,"
Proverbs,8,29,"when he assigned to the sea its limit, so that the waters might not transgress his command, when he marked out the foundations of the earth,"
Proverbs,8,30,"then I was beside him, like a master workman, and I was daily his delight, rejoicing before him always,"
Proverbs,8,31,rejoicing in his inhabited world and delighting in the children of man.
Proverbs,8,32,"""And now, O sons, listen to me: blessed are those who keep my ways."
Proverbs,8,33,"Hear instruction and be wise, and do not neglect it."
Proverbs,8,34,"Blessed is the one who listens to me, watching daily at my gates, waiting beside my doors."
Proverbs,8,35,"For whoever finds me finds life and obtains favor from the LORD,"
Proverbs,8,36,"but he who fails to find me injures himself; all who hate me love death."""
Proverbs,9,1,Wisdom has built her house; she has hewn her seven pillars.
Proverbs,9,2,She has slaughtered her beasts; she has mixed her wine; she has also set her table.
Proverbs,9,3,"She has sent out her young women to call from the highest places in the town,"
Proverbs,9,4,"""Whoever is simple, let him turn in here!"" To him who lacks sense she says,"
Proverbs,9,5,"""Come, eat of my bread and drink of the wine I have mixed."
Proverbs,9,6,"Leave your simple ways, and live, and walk in the way of insight."""
Proverbs,9,7,"Whoever corrects a scoffer gets himself abuse, and he who reproves a wicked man incurs injury."
Proverbs,9,8,"Do not reprove a scoffer, or he will hate you; reprove a wise man, and he will love you."
Proverbs,9,9,"Give instruction to a wise man, and he will be still wiser; teach a righteous man, and he will increase in learning."
Proverbs,9,10,"The fear of the LORD is the beginning of wisdom, and the knowledge of the Holy One is insight."
Proverbs,9,11,"For by me your days will be multiplied, and years will be added to your life."
Proverbs,9,12,"If you are wise, you are wise for yourself; if you scoff, you alone will bear it."
Proverbs,9,13,The woman Folly is loud; she is seductive and knows nothing.
Proverbs,9,14,"She sits at the door of her house; she takes a seat on the highest places of the town,"
Proverbs,9,15,"calling to those who pass by, who are going straight on their way,"
Proverbs,9,16,"""Whoever is simple, let him turn in here!"" And to him who lacks sense she says,"
Proverbs,9,17,"""Stolen water is sweet, and bread eaten in secret is pleasant."""
Proverbs,9,18,"But he does not know that the dead are there, that her guests are in the depths of Sheol."
Proverbs,10,1,"The proverbs of Solomon. A wise son makes a glad father, but a foolish son is a sorrow to his mother."
Proverbs,10,2,"Treasures gained by wickedness do not profit, but righteousness delivers from death."
Proverbs,10,3,"The LORD does not let the righteous go hungry, but he thwarts the craving of the wicked."
Proverbs,10,4,"A slack hand causes poverty, but the hand of the diligent makes rich."
Proverbs,10,5,"He who gathers in summer is a prudent son, but he who sleeps in harvest is a son who brings shame."
Proverbs,10,6,"Blessings are on the head of the righteous, but the mouth of the wicked conceals violence."
Proverbs,10,7,"The memory of the righteous is a blessing, but the name of the wicked will rot."
Proverbs,10,8,"The wise of heart will receive commandments, but a babbling fool will come to ruin."
Proverbs,10,9,"Whoever walks in integrity walks securely, but he who makes his ways crooked will be found out."
Proverbs,10,10,"Whoever winks the eye causes trouble, but a babbling fool will come to ruin."
Proverbs,10,11,"The mouth of the righteous is a fountain of life, but the mouth of the wicked conceals violence."
Proverbs,10,12,"Hatred stirs up strife, but love covers all offenses."
Proverbs,10,13,"On the lips of him who has understanding, wisdom is found, but a rod is for the back of him who lacks sense."
Proverbs,10,14,"The wise lay up knowledge, but the mouth of a fool brings ruin near."
Proverbs,10,15,A rich man's wealth is his strong city; the poverty of the poor is their ruin.
Proverbs,10,16,"The wage of the righteous leads to life, the gain of the wicked to sin."
Proverbs,10,17,"Whoever heeds instruction is on the path to life, but he who rejects reproof leads others astray."
Proverbs,10,18,"The one who conceals hatred has lying lips, and whoever utters slander is a fool."
Proverbs,10,19,"When words are many, transgression is not lacking, but whoever restrains his lips is prudent."
Proverbs,10,20,The tongue of the righteous is choice silver; the heart of the wicked is of little worth.
Proverbs,10,21,"The lips of the righteous feed many, but fools die for lack of sense."
Proverbs,10,22,"The blessing of the LORD makes rich, and he adds no sorrow with it."
Proverbs,10,23,"Doing wrong is like a joke to a fool, but wisdom is pleasure to a man of understanding."
Proverbs,10,24,"What the wicked dreads will come upon him, but the desire of the righteous will be granted."
Proverbs,10,25,"When the tempest passes, the wicked is no more, but the righteous is established forever."
Proverbs,10,26,"Like vinegar to the teeth and smoke to the eyes, so is the sluggard to those who send him."
Proverbs,10,27,"The fear of the LORD prolongs life, but the years of the wicked will be short."
Proverbs,10,28,"The hope of the righteous brings joy, but the expectation of the wicked will perish."
Proverbs,10,29,"The way of the LORD is a stronghold to the blameless, but destruction to evildoers."
Proverbs,10,30,"The righteous will never be removed, but the wicked will not dwell in the land."
Proverbs,10,31,"The mouth of the righteous brings forth wisdom, but the perverse tongue will be cut off."
Proverbs,10,32,"The lips of the righteous know what is acceptable, but the mouth of the wicked, what is perverse."
Proverbs,11,1,"A false balance is an abomination to the LORD, but a just weight is his delight."
Proverbs,11,2,"When pride comes, then comes disgrace, but with the humble is wisdom."
Proverbs,11,3,"The integrity of the upright guides them, but the crookedness of the treacherous destroys them."
Proverbs,11,4,"Riches do not profit in the day of wrath, but righteousness delivers from death."
Proverbs,11,5,"The righteousness of the blameless keeps his way straight, but the wicked falls by his own wickedness."
Proverbs,11,6,"The righteousness of the upright delivers them, but the treacherous are taken captive by their lust."
Proverbs,11,7,"When the wicked dies, his hope will perish, and the expectation of wealth perishes too."
Proverbs,11,8,"The righteous is delivered from trouble, and the wicked walks into it instead."
Proverbs,11,9,"With his mouth the godless man would destroy his neighbor, but by knowledge the righteous are delivered."
Proverbs,11,10,"When it goes well with the righteous, the city rejoices, and when the wicked perish there are shouts of gladness."
Proverbs,11,11,"By the blessing of the upright a city is exalted, but by the mouth of the wicked it is overthrown."
Proverbs,11,12,"Whoever belittles his neighbor lacks sense, but a man of understanding remains silent."
Proverbs,11,13,"Whoever goes about slandering reveals secrets, but he who is trustworthy in spirit keeps a thing covered."
Proverbs,11,14,"Where there is no guidance, a people falls, but in an abundance of counselors there is safety."
Proverbs,11,15,"Whoever puts up security for a stranger will surely suffer harm, but he who hates striking hands in pledge is secure."
Proverbs,11,16,"A gracious woman gets honor, and violent men get riches."
Proverbs,11,17,"A man who is kind benefits himself, but a cruel man hurts himself."
Proverbs,11,18,"The wicked earns deceptive wages, but one who sows righteousness gets a sure reward."
Proverbs,11,19,"Whoever is steadfast in righteousness will live, but he who pursues evil will die."
Proverbs,11,20,"Those of crooked heart are an abomination to the LORD, but those of blameless ways are his delight."
Proverbs,11,21,"Be assured, an evil person will not go unpunished, but the offspring of the righteous will be delivered."
Proverbs,11,22,Like a gold ring in a pig's snout is a beautiful woman without discretion.
Proverbs,11,23,The desire of the righteous ends only in good; the expectation of the wicked in wrath.
Proverbs,11,24,"One gives freely, yet grows all the richer; another withholds what he should give, and only suffers want."
Proverbs,11,25,"Whoever brings blessing will be enriched, and one who waters will himself be watered."
Proverbs,11,26,"The people curse him who holds back grain, but a blessing is on the head of him who sells it."
Proverbs,11,27,"Whoever diligently seeks good seeks favor, but evil comes to him who searches for it."
Proverbs,11,28,"Whoever trusts in his riches will fall, but the righteous will flourish like a green leaf."
Proverbs,11,29,"Whoever troubles his own household will inherit the wind, and the fool will be servant to the wise of heart."
Proverbs,11,30,"The fruit of the righteous is a tree of life, and whoever captures souls is wise."
Proverbs,11,31,"If the righteous is repaid on earth, how much more the wicked and the sinner!"
Proverbs,12,1,"Whoever loves discipline loves knowledge, but he who hates reproof is stupid."
Proverbs,12,2,"A good man obtains favor from the LORD, but a man of evil devices he condemns."
Proverbs,12,3,"No one is established by wickedness, but the root of the righteous will never be moved."
Proverbs,12,4,"An excellent wife is the crown of her husband, but she who brings shame is like rottenness in his bones."
Proverbs,12,5,The thoughts of the righteous are just; the counsels of the wicked are deceitful.
Proverbs,12,6,"The words of the wicked lie in wait for blood, but the mouth of the upright delivers them."
Proverbs,12,7,"The wicked are overthrown and are no more, but the house of the righteous will stand."
Proverbs,12,8,"A man is commended according to his good sense, but one of twisted mind is despised."
Proverbs,12,9,Better to be lowly and have a servant than to play the great man and lack bread.
Proverbs,12,10,"Whoever is righteous has regard for the life of his beast, but the mercy of the wicked is cruel."
Proverbs,12,11,"Whoever works his land will have plenty of bread, but he who follows worthless pursuits lacks sense."
Proverbs,12,12,"Whoever is wicked covets the spoil of evildoers, but the root of the righteous bears fruit."
Proverbs,12,13,"An evil man is ensnared by the transgression of his lips, but the righteous escapes from trouble."
Proverbs,12,14,"From the fruit of his mouth a man is satisfied with good, and the work of a man's hand comes back to him."
Proverbs,12,15,"The way of a fool is right in his own eyes, but a wise man listens to advice."
Proverbs,12,16,"The vexation of a fool is known at once, but the prudent ignores an insult."
Proverbs,12,17,"Whoever speaks the truth gives honest evidence, but a false witness utters deceit."
Proverbs,12,18,"There is one whose rash words are like sword thrusts, but the tongue of the wise brings healing."
Proverbs,12,19,"Truthful lips endure forever, but a lying tongue is but for a moment."
Proverbs,12,20,"Deceit is in the heart of those who devise evil, but those who plan peace have joy."
Proverbs,12,21,"No ill befalls the righteous, but the wicked are filled with trouble."
Proverbs,12,22,"Lying lips are an abomination to the LORD, but those who act faithfully are his delight."
Proverbs,12,23,"A prudent man conceals knowledge, but the heart of fools proclaims folly."
Proverbs,12,24,"The hand of the diligent will rule, while the slothful will be put to forced labor."
Proverbs,12,25,"Anxiety in a man's heart weighs him down, but a good word makes him glad."
Proverbs,12,26,"One who is righteous is a guide to his neighbor, but the way of the wicked leads them astray."
Proverbs,12,27,"Whoever is slothful will not roast his game, but the diligent man will get precious wealth."
Proverbs,12,28,"In the path of righteousness is life, and in its pathway there is no death."
Proverbs,13,1,"A wise son hears his father's instruction, but a scoffer does not listen to rebuke."
Proverbs,13,2,"From the fruit of his mouth a man eats what is good, but the desire of the treacherous is for violence."
Proverbs,13,3,Whoever guards his mouth preserves his life; he who opens wide his lips comes to ruin.
Proverbs,13,4,"The soul of the sluggard craves and gets nothing, while the soul of the diligent is richly supplied."
Proverbs,13,5,"The righteous hates falsehood, but the wicked brings shame and disgrace."
Proverbs,13,6,"Righteousness guards him whose way is blameless, but sin overthrows the wicked."
Proverbs,13,7,"One pretends to be rich, yet has nothing; another pretends to be poor, yet has great wealth."
Proverbs,13,8,"The ransom of a man's life is his wealth, but a poor man hears no threat."
Proverbs,13,9,"The light of the righteous rejoices, but the lamp of the wicked will be put out."
Proverbs,13,10,"By insolence comes nothing but strife, but with those who take advice is wisdom."
Proverbs,13,11,"Wealth gained hastily will dwindle, but whoever gathers little by little will increase it."
Proverbs,13,12,"Hope deferred makes the heart sick, but a desire fulfilled is a tree of life."
Proverbs,13,13,"Whoever despises the word brings destruction on himself, but he who reveres the commandment will be rewarded."
Proverbs,13,14,"The teaching of the wise is a fountain of life, that one may turn away from the snares of death."
Proverbs,13,15,"Good sense wins favor, but the way of the treacherous is their ruin."
Proverbs,13,16,"In everything the prudent acts with knowledge, but a fool flaunts his folly."
Proverbs,13,17,"A wicked messenger falls into trouble, but a faithful envoy brings healing."
Proverbs,13,18,"Poverty and disgrace come to him who ignores instruction, but whoever heeds reproof is honored."
Proverbs,13,19,"A desire fulfilled is sweet to the soul, but to turn away from evil is an abomination to fools."
