Malachi,3,10,"Yo, make sure you bring all your tithes to the storehouse so there's enough food in my crib. And check this, the LORD of hosts challenges you to test Him on this – if He won't open up the heavens for you and shower you with so many blessings that you won't even have space to contain them. It's gonna be like heaven's faucets wide open, pouring out blessings non-stop!"
Malachi,3,11,"And I will totally shut down anyone or anything trying to wreck your blessings, so your crops won't get ruined and your vines won't drop their fruit too early, says the powerful LORD."
Malachi,3,12,"And everyone will think you're so blessed: because you'll be a super awesome place to live, says the LORD of all the cool stuff."
Malachi,3,13,"You've been talking tough against me, says the LORD. But you're like, 'What did we even say to offend you?'"
Malachi,3,14,"So, like, y'all be saying, 'What's the point of serving God?' and like, 'What do we gain from following His rules and acting all sad in front of the big man upstairs?'"
Malachi,3,15,"And now we're like, giving props to the arrogant and stuff, like those who do evil are getting all the attention; even those who dare to test God seem to come out on top. Like, they're straight up winning or something."
Malachi,3,16,"So, like, those who respected and honored the LORD, they, like, totally had a bunch of conversations with each other. And guess what? The LORD was, like, totally listening and paying attention! And get this, a super cool book of memories was, like, written right in front of Him for those who had mad respect for the LORD and, like, always remembered His name."
Malachi,3,17,"And they'll be mine, God says, when the time comes for me to gather up my prized possessions. I'll protect them and treat them with love, just like a caring father does with his dedicated son."
Malachi,3,18,"So, like, you're gonna come back and totally tell the difference between the people who do good stuff and those who are all, like, sketchy and wicked. You'll know who's all about serving God and who's not really into it."
Malachi,4,1,"Yo, listen up! There's a day coming that's gonna be hotter than an oven, and all the proud and wicked people are gonna go up in smoke like stubble. The LORD of hosts says that day is gonna burn 'em up so completely, there won't be a trace of 'em left!"
Malachi,4,2,"But for those of you who show respect for me, the Sun of righteousness will rise up, bringing healing in his wings; and you will go out, and flourish like stall-fed calves."
Malachi,4,3,"And you'll totally crush the wicked; they'll be like, totally reduced to ashes beneath your sneakers on the epic day when I make it happen, says the LORD of all the cool squads."
Malachi,4,4,"Yo, don't forget about the law of Moses, my OG servant. I straight up told him what's up on Mount Horeb for all of Israel, complete with all the rules and fairness."
Malachi,4,5,"Yo, listen up! Before the super intense and scary day when the LORD arrives, I'm gonna hook you up with Elijah the prophet, no cap!"
Malachi,4,6,"He will make parents and kids understand each other better, so the earth doesn't get messed up and bring trouble."
Matthew,1,1,"This is how the story starts: Jesus Christ, the homie who's descended from David and Abraham."
Matthew,1,2,"Abraham was the OG daddy to Isaac, who then became the ultimate dad to Jacob, and Jacob was the proud papa of Judas and his crew."
Matthew,1,3,"Judas had kids named Phares and Zara with Thamar. Then, Phares had a son named Esrom, and Esrom had a son named Aram."
Matthew,1,4,And Aram had a kid named Aminadab; and Aminadab had a kid named Naasson; and Naasson had a kid named Salmon;
Matthew,1,5,And Salmon had a child named Booz with Rachab; and Booz had a child named Obed with Ruth; and Obed had a child named Jesse;
Matthew,1,6,"So Jesse was like, the dad of King David, and King David was like, the dad of Solomon. Solomon's mom was actually Urias' wife, just so you know."
Matthew,1,7,"So, Solomon had a son named Roboam, who then had a dude called Abia, and Abia was the father of Asa."
Matthew,1,8,And Asa had a kid named Josaphat; and Josaphat had a kid named Joram; and Joram had a kid named Ozias;
Matthew,1,9,And Ozias had a kid named Joatham; and Joatham had a kid named Achaz; and Achaz had a kid named Ezekias;
Matthew,1,10,"Ezekias had a son named Manasses, who then had a son named Amon, and Amon became the father of Josias."
Matthew,1,11,"Josias became the dad of Jechonias and his bros right around the time they got taken to Babylon. (Some people say, Josias became the dad of Jakim, and Jakim became the dad of Jechonias.)"
Matthew,1,12,"And once they got taken to Babylon, Jechonias had a child named Salathiel; and Salathiel had a child named Zorobabel;"
Matthew,1,13,"And Zorobabel had a son named Abiud, who then had a son named Eliakim, who in turn had a son named Azor;"
Matthew,1,14,And Azor had a kid named Sadoc; then Sadoc had a kid named Achim; and Achim had a kid named Eliud;
Matthew,1,15,"And Eliud was like the OG, he had a son named Eleazar; Eleazar was all about that generational flow and he had a son named Matthan; Matthan was the real deal and he became a proud father to Jacob;"
Matthew,1,16,"So, like, Jacob was the dad of Joseph who was totally married to Mary, and they had a kid named Jesus, who everyone calls Christ."
Matthew,1,17,"So like, from Abraham to David, there were exactly fourteen generations. And from David until the whole Babylon exile thing, also fourteen generations. And then, from the exile until Christ, guess what? Yep, fourteen more generations!"
Matthew,1,18,"So, this is how it went down when Jesus Christ was born: Mary, Jesus' mom, was engaged to Joseph, but before they actually got together, she ended up preggers thanks to the Holy Ghost."
Matthew,1,19,"So, like, Joseph, her husband, he was a really righteous guy and didn't want to humiliate her publicly or anything, so he thought about just breaking up with her quietly."
Matthew,1,20,"Yo, so Joseph was deep in thought when the angel of the Lord popped up in his dream. The angel was like, Josephh, bro, don't stress. Go ahead and marry Mary, she's legit. The baby she's carrying is from the Holy Ghost, no doubt.'"
Matthew,1,21,"And she's gonna have a baby boy, and you gotta name him JESUS: 'cause he's gonna save his peeps from all their mess-ups. {JESUS: which means, Savior, in Hebrew}"
Matthew,1,22,"So basically, everything that went down was just to fulfill what the Lord had said through the prophet, like he predicted, you know?"
Matthew,1,23,"Yo, check it out! This cool virgin is gonna have a baby boy and they gonna name him Emmanuel, which means God is kickin' it with us. And by the way, people gonna be callin' him that."
Matthew,1,24,"So, like, Joseph woke up from his nap and was all like, 'Okay, I got this.' And he did what the angel of the Lord told him to do, and he married his wife and stuff."
Matthew,1,25,"And he didn't hook up with her until after she gave birth to her first kid, and he named him JESUS."
Matthew,2,1,"So, Jesus was like totally born in Bethlehem, you know, in Judaea during the time when Herod was the king. And guess what? There were these really wise dudes who came from the east all the way to Jerusalem, like wow!"
Matthew,2,2,"Yo, like, where's the dude who's supposed to be the King of the Jews? 'Cause we totally spotted his star in the east and rolled through here to pay our respects."
Matthew,2,3,"When Herod the king found out what was up, he got super stressed, and everyone in Jerusalem felt the same."
Matthew,2,4,"So, like, this dude gathered all the top religious peeps and asked them, 'Yo, where exactly is the birthplace of the Messiah gonna be?'"
Matthew,2,5,"And they were like, 'Dude, it's in Bethlehem of Judaea. The prophet totally wrote it down.'"
Matthew,2,6,"Yo, Bethlehem, in the land of Juda, you may not be the most popular place among the bigshots, but don't sleep on it: a straight up boss is gonna come outta there, one who's gonna lead and take care of my people, Israel. (And by 'rule,' I mean 'feed,' y'know?)"
Matthew,2,7,"So Herod, like low-key secretly called the dudes who were wise, and was all like, 'Yo, when exactly did you see that epic star shining in the sky?'"
Matthew,2,8,"So he told them to head to Bethlehem and be all like, go on an intense search for the little kid. And once you find him, hit me up and let me know, so I can roll through and pay my respects to him too."
Matthew,2,9,"After listening to the king, they bounced; and whoa, the star they spotted in the east led them ahead until it reached and hovered right over the spot where the little kid was."
Matthew,2,10,"When they spotted the star, they were stoked and filled with hardcore happiness."
Matthew,2,11,"So when they went inside the house and saw the baby with his mom Mary, they were totally amazed and showed their respect by bowing down to worship him. Then, they opened their awesome presents and gave him gold, frankincense, and myrrh. Woah, what a gift!"
Matthew,2,12,"So, like, God totally warned them in a dream not to go back to Herod. And guess what? They listened and took a different route back to their own country. Cool, right?"
Matthew,2,13,"So, after they left, dude, check it, the angel of the Lord shows up in Joseph's dream and goes like, 'Yo, get up, grab the baby and his mom, and run off to Egypt, and stay there until I give you the signal. 'Cause Herod is gonna try to search for the little one and harm him.'"
Matthew,2,14,"So, like, when he woke up, he totally grabbed the young child and his mom in the middle of the night and peaced out to Egypt:"
Matthew,2,15,"And stayed there until Herod died, so that what the Lord had spoken through the prophet would come true: 'I have called my son out of Egypt.'"
Matthew,2,16,"And just like Jeremy, the prophet said, it all came true, he said,"
Matthew,2,17,"Bro, in Rama there was hella crying and mourning, like Rachel was sobbing for her kids and couldn't find no comfort, cuz they ain't here no more."
Matthew,2,18,"But like, right after Herod was like, dead and stuff, yo, this angel of the Lord popped up in Joe's dream while he was chillin' in Egypt,"
Matthew,2,19,"So, like, they were all, 'Dude, get up and grab the baby and his mom, and head over to Israel, you know? 'Cause those peeps who wanted to kill the baby are totally dead now."
Matthew,2,20,"So, he got up, grabbed the little kiddo and his mom, and headed back to Israel."
Matthew,2,21,"But when he found out that Archelaus was in charge in Judea instead of his dad, Herod, he got totally freaked out and didn't wanna go there. But then, God hit him up in a dream and told him to head over to Galilee instead. So that's what he did, you know?"
Matthew,2,22,"And he moved to this city called Nazareth, just like the prophets said he would, and that's why people started calling him a Nazarene."
Matthew,3,1,"Back in the day, John the Baptist showed up, dropping some serious teachings in the desert of Judaea,"
Matthew,3,2,"And like, yo, listen up! You gotta change your ways and stuff, 'cause the kingdom of heaven is like right around the corner, you know?"
Matthew,3,3,"Yo, this is the dude Isaiah was talking about: The voice of someone shouting in the middle of nowhere, telling ya to get ready for the Lord and make his paths straight."
Matthew,3,4,"Yo, this dude named John was rockin' a sick outfit made of camel's hair, topped off with a cool leather belt 'round his waist. And get this, his diet was straight-up locusts and wild honey—pretty unconventional, but hey, you do you, John!"
Matthew,3,5,"So, like, Jerusalem, all of Judaea, and even the whole area around Jordan went out to him, you know?"
Matthew,3,6,"And they got baptized by him in the Jordan River, openly admitting their mistakes."
Matthew,3,7,"But yo, when he peeped some of the Pharisees and Sadducees showin' up at his baptism, he straight up told 'em, 'Yo, y'all be some snakes, who told you to dip out and avoid the comin' heat?'"
Matthew,3,8,"So, like, make sure you show some legit good behavior to prove you're really sorry and changing for the better, ya know?"
Matthew,3,9,"And don't even think about boasting, saying to yourselves, 'We're genetically linked to Abraham, so we're all good.' Let me tell you, God can easily create new descendants of Abraham from literal rocks if He wanted to."
Matthew,3,10,"Yo, listen up! It's about to go down. Picture this: The axe is ready to chop at the roots of the trees. So, any tree that doesn't produce good fruit? It's getting cut down and tossed into the fire, no second chances."
Matthew,3,11,"I'm all about that water baptism for repentance, but the real deal is coming right up. This dude who's coming after me? Yeah, he's way more powerful than I am. I mean, I ain't even fit to carry his shoes, man. This guy is gonna hook you up with a baptism that's next level - we're talking about getting baptized with the Holy Ghost, and let me tell you, even with fire! It's gonna be lit!"
Matthew,3,12,"He's got a fan in his hand, and he's gonna clean up his place real good, sorting out the good stuff and throwing away the worthless stuff. The good stuff gets saved, but the worthless stuff? It's gonna get burned up, no escape."
Matthew,3,13,So Jesus rolls up from Galilee to the Jordan to meet up with John and get baptized by him.
Matthew,3,14,"But John was like, 'Nah bro, I should be the one getting baptized by you. Why you comin' to me?'"
Matthew,3,15,"Jesus replied, 'Just let it happen for now, bro. It's like, necessary for us to do the right thing and complete all righteousness. So, he allowed it.'"
Matthew,3,16,"And Jesus, after getting baptized, totally came out of the water like a boss. And, guess what, the sky opened up for him and he saw the Spirit of God coming down like a chill dove, landing right on him with style:"
Matthew,3,17,"And yo, a voice straight from the heavens, like, totally said, 'This is my ultimate favorite Son, like, seriously, I'm super stoked about him and stuff.'"
Matthew,4,1,"So like, Jesus was totally taken by the Spirit and led into this desert place, right? And guess what? The devil thought he could tempt Jesus there too."
Matthew,4,2,"And like, after not eating anything for like forty days and forty nights, dude was totally starving."
Matthew,4,3,"And when this person who tried to distract him approached him, they said, like, 'If you're really God's child, do your thing and turn these rocks into bread.'"
Matthew,4,4,"But yo, he replied like, it's written, people can't survive off bread only, ya know? We need every word that comes from God's mouth to really thrive."
Matthew,4,5,"Next, the devil vibes with him and whisks him away to the lit city, putting him on the highest point of the temple."
Matthew,4,6,"And he's like, yo, if you're really God's Son, why don't you jump off this thing? 'Cause it says in the book, the angels got your back and they'll catch you, so you won't even stub your toe, bro."
Matthew,4,7,"Jesus was like, 'Bro, it's already written down, don't even think about testing the Lord, He's the real deal. #NoTemptingAllowed"
Matthew,4,8,"Once again, the devil brings him up to a super high mountain and flexes, showing him all the lit kingdoms of the world and their fantastic glory!"
Matthew,4,9,"And he's like, yo, I'll hook you up with all this stuff if you just bow down and worship me."
Matthew,4,10,"And Jesus was like, 'Yo, Satan, peace out! The scriptures say you should only worship and serve the Lord your God, no one else!'"
Matthew,4,11,"And then Satan left him, and boom, angels showed up and started taking care of him."
Matthew,4,12,"So like, when Jesus found out that John got thrown into prison, he was like peacee out' and went to Galilee, you know?"
Matthew,4,13,"So Jesus bounced from Nazareth and set up shop in Capernaum, a lit coastal town in the outskirts of Zabulon and Nephthalim."
Matthew,4,14,"So that what Esaias the prophet said would come true, he said,"
Matthew,4,15,"The places called Zabulon and Nephthalim, along with the cool coastal vibe, beyond the Jordan River, Galilee where people from different backgrounds hang out;"
Matthew,4,16,The peeps chillin' in darkness totally saw this epic bright light; and those stuck in the place of death's gloomy vibe got blessed with some lit illumination.
Matthew,4,17,"Bruh, Jesus started preaching and he was straight up like, 'Yo, y'all need to repent ASAP, 'cause the kingdom of heaven is right around the corner.'"
Matthew,4,18,"Jesus was strolling by the sea of Galilee and spotted two dudes, Simon aka Peter, and Andrew, his bro, throwing a net into the sea. These guys were all about that fishing life."
Matthew,4,19,"And he's like, 'Yo, come with me, and I'll teach you how to catch people.'"
Matthew,4,20,"And like, they totally ditched their nets right away and started following him, no hesitation, no second thoughts."
Matthew,4,21,"And as he moved on, he spotted two other dudes, James sonn of Zebedee) and John, chilling in a boat with Zebedee, their old man, fixing their nets. Then he was like, 'Yo, come hang with me!'"
Matthew,4,22,"And they dipped out of the ship real quick, leaving their dad behind and bounced to follow him."
Matthew,4,23,"So Jesus was like, going all around Galilee, dropping some knowledge in their synagogues, preaching about the kingdom and straight up healing all sorts of sickness and diseases among the people."
Matthew,4,24,"And word got out all over Syria about how awesome he was, so they brought him all the sick peeps with different kinds of illnesses and suffering, including those who were possessed by demons, those who were acting all crazy, and those who couldn't move because of some condition. And guess what? He totally healed them all!"
Matthew,4,25,"So like, a bunch of people from Galilee, Decapolis, Jerusalem, Judaea, and even from beyond the Jordan, all started following him, ya know?"
Matthew,5,1,"So, like, Jesus looked out and saw a bunch of people, and he was like, 'Okay, time to get my zen on.' So he went up this mountain and sat down, and his crew of disciples was like, 'Hey Jesus, what's up?'"
Matthew,5,2,"So, like, he started talking and dropped some knowledge, saying,"
Matthew,5,3,"Those who have a humble mindset are blessed, 'cause they got the hookup to heaven's kingdom."
Matthew,5,4,"Those who feel down vibes will be uplifted, yo: they'll find some genuine comfort in the game of life."
Matthew,5,5,"Happy are the chill ones, 'cause they'll totally score the whole planet."
Matthew,5,6,"Happy are those who crave justice and righteousness, because they will find fulfillment."
Matthew,5,7,"Those who show kindness are totally blessed, 'coz they'll definitely receive kindness back."
Matthew,5,8,"So like, those who are genuine and have like, no hidden agenda or bad vibes in their hearts, they're totally #blessed 'cause they'll get to experience the awesomeness of encountering God and stuff."
Matthew,5,9,"Those who bring peace are so epic, bro, 'cause they'll totally be known as God's squad. 🙌"
Matthew,5,10,"Hella fortunate are the ones who get persecuted for doing what's right, 'cause they're the kings and queens of heaven."
Matthew,5,11,"You're lucky when people trash talk you, harass you, and spread all sorts of lies about you just because you believe in me. Like, they're totally making things up, you know? But hey, keep your head up! It's all because of me."
Matthew,5,12,"Yo, listen up! Be stoked and totally hype, 'cause your reward in heaven is gonna be lit AF! Just think about it, the prophets before you got mad persecuted. You're in good company, fam!"
Matthew,5,13,"You all are like the seasoning that makes the earth taste better: but if the seasoning loses its flavor, how can it be seasoned again? It's worthless then, just thrown away and stepped on by everyone."
Matthew,5,14,You all are like the coolest influencers ever. A lit city on a sick hill that's impossible to miss.
Matthew,5,15,"Yo, you don't light a candle and then hide it under a boring old container. Nah, you put it on a dope candle holder where it can shine bright and illuminate the whole house. By the way, in the original language, that 'container' word means a measurement that's slightly smaller than a peck."
Matthew,5,16,"Yo, like, shine your light so everyone can see your dope deeds and give props to your Dad up in heaven."
Matthew,5,17,"Don't even think that I'm here to wreck the rules or the words of the spiritual leaders. Nah, I'm not here to ruin anything - I'm here to make it all complete and meaningful."
Matthew,5,18,"Honestly, listen up peeps, heaven and earth won't go outta style before every little rule in the law gets totally crossed off the list. It's gotta be completed, no doubts about it."
Matthew,5,19,"So like, anyone who breaks even the tiniest commandment and spreads the idea that it's cool, they'll be considered the lowest in the heavenly kingdom. But those who actually follow the commandments and spread the good word, they'll be seen as super awesome in the heavenly kingdom."
Matthew,5,20,"Listen up, fam. If you wanna get into the kingdom of heaven, your righteousness gotta be on a different level than them scribes and Pharisees. No cap, it's gotta be on point."
Matthew,5,21,"You know how it goes, back in the day they used to say, 'Don't take someone's life, and if you do, you better watch out for the consequences!"
Matthew,5,22,"But listen up, fam. Anybody who gets mad at their bro for no legit reason is asking for some serious judgment, ya feel? And anyone who straight up disses their bro, calling them a nobody, better watch out for the council. But here's the real deal: if you call your bro a fool, you're seriously tempting the fires of hell. Oh, and just so you know, 'Raca' basically means 'useless loser'."
Matthew,5,23,"So, like, if you're gonna give your gift at the altar and then you suddenly remember that your bro isn't cool with you, ya know..."
Matthew,5,24,"Yo, before you go all spiritual and stuff, leave your gift in front of the altar, dip out for a sec, and make things right with your brother first. Then you can come back and offer your gift like it's all good."
Matthew,5,25,"Yo, like, if you got beef with someone, try to squash it ASAP while you're still chillin' together. 'Cause if you let it drag on, next thing you know, that person might snitch on you to the authorities, then the authorities pass you on to some enforcer, and before you know it, you're locked up."
Matthew,5,26,"Listen up, I'm telling you straight up, there's no way you're getting out of there until you've paid every last penny you owe."
Matthew,5,27,"Okay listen up, you've probably heard the old folks saying something like 'Don't cheat on your partner:'"
Matthew,5,28,"But listen up, y'all. If you're checkin' out a girl just to get all thirsty for her, you've already broken the commitment in your heart and technically cheated on her."
Matthew,5,29,"And if something you see online upsets you, block it, and remove it from your feed: because it's better for you to lose one follower, than for your entire online presence to be tainted. #SelfCare"
Matthew,5,30,"And if your right hand is causing problems for you, just get rid of it and throw it away. It's better for you to lose one of your body parts than for your whole body to end up in hell."
Matthew,5,31,"So, like, people used to say that if you wanted to ditch your wife, you had to give her, like, a legal paper to make it official and stuff:"
Matthew,5,32,"But listen up, y'all. If anyone breaks up with their spouse, except for cheating, they're basically making their ex commit adultery. And anyone who marries a divorced person is also commiting adultery."
Matthew,5,33,"Yo, you probably heard the old folks talking about this, but they said you shouldn't break your promises and instead keep them for the big man upstairs. Like, you gotta stay true to your word and honor your commitments, dude."
Matthew,5,34,"Yo guys, listen up. Don't be using swear words, like, at all. And I'm talking about not even swearing by heaven, 'cause that's where God's chillin' on His throne, ya know?"
Matthew,5,35,"And not even the earth, 'cause that's just where he rests his feet. And not even Jerusalem, 'cause that's like the city of the ultimate boss."
Matthew,5,36,"Don't go like, promising on your own head and stuff, 'cause let's be real, you can't even control the color of a single strand of hair."
Matthew,5,37,"Here's the deal: just be straightforward and honest with your words, none of that extra fluff. Anything more than that is just plain wrong."
Matthew,5,38,"So basically, you've probably heard people say 'Do unto others as they do unto you', eye for an eye and tooth for a tooth kind of deal:"
Matthew,5,39,"Yo, listen up! Check it - I got a real talk for ya. Don't let evil get to ya, keep your chill. If someone decides to throw shade at you and hits you on the right cheek, don't hit 'em back. Instead, show 'em your other cheek. Yeah, it's all about taking the high road, no need for revenge or negativity."
Matthew,5,40,"If someone wants to take you to court and take your clothes, let them take your jacket too."
Matthew,5,41,"If someone asks you to go the extra mile, go even further with them."
Matthew,5,42,"If someone asks you for something, be willing to give it to them. Don't refuse to lend things to those who need them."
Matthew,5,43,"So, like, you know how people have always been saying Lovee your neighbor and hate your enemy', right?"
Matthew,5,44,"But listen, fam, here's the deal: show mad love to your haters, speak blessings over those who curse you, do good for the ones who straight up hate you, and pray for those who treat you like trash or straight up go against you;"
