2 Corinthians,10,17,"But if someone wants to show off, let them impress us with their devotion to the Lord."
2 Corinthians,10,18,"It's not about hyping yourself up to impress others, it's about receiving recognition from the Lord."
2 Corinthians,11,1,"Yo, I wish you could just like, hang with me for a sec and tolerate my foolishness, like seriously, put up with me. Like, for real, put up with me."
2 Corinthians,11,2,"I'm super protective of you, like in a godly way: because I've committed you to one main squeeze, so that I can totally show off a pure, clean-cut version of you to Christ."
2 Corinthians,11,3,"But I'm lowkey worried, like, seriously, because, you know, the serpent totally tricked Eve with his sneaky ways. I'm just scared that your minds might get messed up and stray away from the pure and simple truth that's found in Christ."
2 Corinthians,11,4,"So, like, if someone comes and starts preaching about a totally different Jesus than the one we've been talking about, or if you start believing in a whole different kind of spiritual energy that you haven't experienced before, or if you start accepting a completely different message about the good news, like, I guess you could totally put up with them. Like, it's up to you, man. Just sayin'!"
2 Corinthians,11,5,"Because, like, I totally think I'm just as legit as those top-notch apostles, ya know?"
2 Corinthians,11,6,"Even though I may not be the smoothest talker, I've got the wisdom game on lock. Trust me, we've proven ourselves completely in every way to you."
2 Corinthians,11,7,"Did I do something wrong by humbling myself so that you could be uplifted, just because I shared the good news of God with you without expecting anything in return?"
2 Corinthians,11,8,I borrowed some supplies from other churches to be able to help you.
2 Corinthians,11,9,"When I was hanging out with you guys and low on cash, I never relied on anyone to cover my expenses. The crew from Macedonia always had my back and filled in the gaps for me. I made sure not to be a burden on any of y'all, and I plan on keeping it that way."
2 Corinthians,11,10,"Yo, fam, let me tell you, I ain't gonna let nobody shut me down when it comes to sharing the real facts about Jesus Christ, especially in Achaia. Trust, ain't nobody gonna be able to silence me, you feel me?"
2 Corinthians,11,11,"So, like, why does it seem like I don't love you? But, hey, God actually knows what's up."
2 Corinthians,11,12,"So, like, whatever I do, I'm gonna keep doing it, just to make sure those who are looking for a reason to criticize have no chance. I want them to realize that they're no better than us, no matter what they boast about."
2 Corinthians,11,13,"These people who pretend to be apostles but are actually deceivers, they're just faking it and trying to pass off as followers of Christ."
2 Corinthians,11,14,"No cap, it's no surprise; 'cause Satan be out here flexin', lookin' like an angel with them bright vibes."
2 Corinthians,11,15,"So like, it totally makes sense if his squad also starts living righteously and doing good deeds. In the end, they'll get what they deserve based on their actions."
2 Corinthians,11,16,"Yo, listen up! Don't underestimate me, okay? Even if you do, just humor me for a sec, alright? It's time for me to flex a bit."
2 Corinthians,11,17,"I gotta be real with you, what I'm about to say isn't exactly what the Big Man upstairs would say. It's more like some silly bragging, but I'm feeling pretty confident about it."
2 Corinthians,11,18,"Since so many people flex their physical appearance, I'll flex too."
2 Corinthians,11,19,"You actually vibe with ignorant peeps, 'cause y'all are wise AF."
2 Corinthians,11,20,"Because it's a real struggle when someone tries to control you, exploit you, take advantage of you, or even tries to show off and disrespect you."
2 Corinthians,11,21,"I'm just gonna keep it real, I wanna address the haters who think we're weak. But hey, I gotta admit, whoever's out here flexin' (I'm saying some dumb stuff right now), I can flex too."
2 Corinthians,11,22,"Bruh, they Hebrews? Same here. They Israelites? Yup, me too. They got that Abraham bloodline? Well, guess what? Got that in me too."
2 Corinthians,11,23,"Are they really on Team Jesus? (No offense, but I totally got this) I've got them beat; I've hustled harder, taken more hits, gotten thrown behind bars more times, and come face to face with death more often."
2 Corinthians,11,24,"Bruh, I got whipped by those Jewish peeps like 5 times, 40 lashes minus one."
2 Corinthians,11,25,"I got beat up three times with rods, got stoned once (not the fun kind), had my ship wrecked three times, and spent a whole day and night deep underwater."
2 Corinthians,11,26,"Like, I've been on so many trips, and let me tell you, it's been wild! I've faced dangerous waters, encountered sketchy robbers, dealt with trouble from my own people, and faced all kinds of chaos in the city, the wilderness, and even at sea. And to top it off, I've had to watch out for fake friends!"
2 Corinthians,11,27,"Feelin' exhausted and in major pain, stayin' up all night, being hella hungry and thirsty, goin' on mad diets, dealin' with freezing cold and bein' totally naked."
2 Corinthians,11,28,"Other than dealing with external stuff, I've got this daily concern for all the churches on my plate."
2 Corinthians,11,29,Who's feeling down? Me too. Who's getting upset? I can totally relate.
2 Corinthians,11,30,"If I gotta flex, I'mma flex about the stuff that's got me down."
2 Corinthians,11,31,"The OG God and Dad of our main man Jesus Christ, who's totally epic and blessed for all eternity, knows I'm keeping it real, no cap."
2 Corinthians,11,32,"So, like, in Damascus, the ruler dude under King Aretas had, like, this strong crew guarding the city, wanting to catch me and all:"
2 Corinthians,11,33,"So, I was basically lowered down from a window using a basket and managed to sneak away from the clutches of the person chasing me."
2 Corinthians,12,1,"Honestly, I shouldn't brag about myself. Let's talk about the amazing things God has shown me in visions and revelations."
2 Corinthians,12,2,"So, like, I once heard about this dude who was connected with Jesus, like, more than fourteen years ago or something. I have no idea if he was physically there or had some kind of out-of-body experience, man. Only God knows for sure. But this guy, he got taken all the way up to the third heaven, dude. Crazy stuff, right?"
2 Corinthians,12,3,"So I met this guy, can't really say if I saw him in person or in spirit, I don't know, only God knows what's up;"
2 Corinthians,12,4,"So, like, he totally got taken up to paradise and heard like, super indescribable words that, like, no one is allowed to even say. {lawful: or, possible}"
2 Corinthians,12,5,"I want to give props to someone like that, but when it comes to me, I won't boast except in my weaknesses."
2 Corinthians,12,6,"Even though I might want to flex, I won't act stupid; I'll keep it real and speak the truth. But right now, I'll chill so nobody thinks I'm bragging more than what they see or hear about me."
2 Corinthians,12,7,"And like, just to keep me in check and stuff, because I totally didn't want to get all high and mighty with all these amazing things I've seen and experienced, there was this annoying thing that came my way. It was like an annoying message from Satan himself, just to remind me not to get too full of myself, you know?"
2 Corinthians,12,8,"So, I like totally begged the Lord three times to make this thing go away from me, you know?"
2 Corinthians,12,9,"And he was like, yo, my grace got you covered, no worries. Like, my strength is at its highest when you feel weak, you know? So, I'm totally cool with boasting about my flaws, because that's when the power of Christ really shows up in my life."
2 Corinthians,12,10,"So, like, I actually find joy in all the hardships, the haters, the struggles, the tough times, all because of Jesus, you know? 'Cause when I'm feeling weak, that's when I'm actually strong."
2 Corinthians,12,11,"I feel like an idiot for boasting, but you made me do it. I should've received praise from you, because I'm on par with the top apostles, even though I'm nothing special."
2 Corinthians,12,12,"Seriously, the signs of a legit apostle were happening right before your eyes, showing crazy patience, performing mind-blowing miracles, and pulling off some seriously awesome feats."
2 Corinthians,12,13,"So, like, what made you guys any different from other churches? The only thing was that I didn't, like, rely on you for financial stuff. Sorry if that bothered you."
2 Corinthians,12,14,"Yo, listen up! This is gonna be my third visit to you, and don't worry, I won't be a hassle. You see, I ain't in this for what you can give me, but rather for you. 'Cause it's the parents' job to provide for their kids, not the other way around."
2 Corinthians,12,15,"And I'm totally down to go all out for you, even if it means giving everything I've got; but the more I show my love for you, the less love I seem to get in return. {for your souls: in the original Greek, it means for the sake of your souls}"
2 Corinthians,12,16,"But, like, yeah, I didn't wanna bother you or anything, but honestly, I managed to outsmart you with some clever tricks."
2 Corinthians,12,17,Did I flex on you by any of the peeps I sent your way?
2 Corinthians,12,18,I was really looking forward to seeing Titus and I sent a brother with him. Did Titus take advantage of you? Didn't we both follow the same mindset and walk together on the same path?
2 Corinthians,12,19,"Do you really think we're just making excuses to you? We're speaking openly before God through Christ, but hey, fam, everything we do is for your growth and development."
2 Corinthians,12,20,"I'm kinda worried that when I show up, you won't be the people I hoped you'd be and I'll end up being someone you don't want me to be. Like, I don't want us to get all caught up in arguing, being jealous of each other, getting all angry and causing drama, talking badly about each other behind our backs, spreading rumors, or causing chaos."
2 Corinthians,12,21,"And like, just in case, when I pull up again, my God will totally humble me in front of all y'all, and I'll be all devastated for real by the fact that many of y'all had already messed up big time, but still haven't turned away from all the impurity, sexual immorality, and wild behavior that y'all were into."
2 Corinthians,13,1,"Bruh, this is gonna be my third visit to y'all. You know the drill - when a couple of homies vouch for something, you know it's legit."
2 Corinthians,13,2,"Just FYI, I've already mentioned this before and I'm mentioning it again even though I'm not physically there right now. I'm writing to those who messed up in the past and to everyone else, letting you know that if I come back, I won't go easy on you."
2 Corinthians,13,3,"Y'all looking for evidence that Christ's words in me are legit? Well, let me tell ya, it ain't no weak sauce, it's straight up powerful in y'all."
2 Corinthians,13,4,"Even though he was nailed to the cross because he seemed weak, he's actually alive because of God's awesome power. We're pretty weak too, but we'll stay alive with him all because of God's amazing power that's directed toward you."
2 Corinthians,13,5,"Yo, check yourselves, like seriously, to make sure you're still holding onto your faith. Evaluate your own selves, and I mean really dig deep. Don't you realize that Jesus Christ is chillin' in you? Unless, of course, you're straight-up not about it."
2 Corinthians,13,6,"But I'm confident that you'll get it, we're definitely not losers."
2 Corinthians,13,7,"Yo, I'm straight up praying to God that y'all don't do any shady stuff. Not because we tryna look good or anything, but 'cause it's all about doing what's right, even if others think we're a bunch of losers."
2 Corinthians,13,8,"Like, we can't do anything to, like, oppose the truth, but we're totally down for spreading the truth."
2 Corinthians,13,9,We're stoked when we're feeling low and you're crushing it: and we're all about your growth and being on top of your game. Keep leveling up! #goals
2 Corinthians,13,10,"So, like, I'm writing this stuff even though I'm not there with you right now. I don't wanna come off as harsh when I'm actually there, you know? The Lord has given me this power to lift you up, not to tear you down."
2 Corinthians,13,11,"Yo, fam, before I bounce, listen up. Strive for greatness, stay positive, stay united, keep the peace. And trust, the God who's all about love and peace will roll with ya."
2 Corinthians,13,12,"Show some love with a sacred smooch, fam."
2 Corinthians,13,13,"Yo, all the saints be sendin' their love to you."
2 Corinthians,13,14,"Yo, may the Lord Jesus Christ hook you up with mad grace, and God shower you with love, and the Holy Ghost keep y'all connected. Amen. Oh, by the way, Titus and Lucas wrote this second letter to the Corinthians from Philippi in Macedonia."
Galatians,1,1,"Yo, it's Paul, a legit apostle, not chosen by any random dudes or through human means, but directly by Jesus Christ and God the Father, who totally raised Jesus from the dead and all that, no cap!"
Galatians,1,2,"Yo, shoutout to all the homies rollin' with me, sending love to the churches in Galatia:"
Galatians,1,3,"Yo, may you be blessed with mad grace and peace from God the Father and our homie, Jesus Christ,"
Galatians,1,4,"He like totally sacrificed himself for our sins, so we could like totally escape this messed up world we're living in, all in line with God's plan and our heavenly Father, you know?"
Galatians,1,5,Shout out to the one who deserves all the praise for eternity. Amen.
Galatians,1,6,"I'm shocked how quickly y'all switched up on the one who invited you to experience the goodness of Christ, and fell for another gospel:"
Galatians,1,7,"But hold up, there's actually no other gospel out there. Some people, though, are causing a ruckus and trying to twist up the good news of Christ."
Galatians,1,8,"But, like, even if we, or an angel straight from heaven, start preaching a different gospel to you than the one we've already told you, like, let him be totally cursed."
Galatians,1,9,"Just like I told you before, I'm saying it again: If anyone starts preaching a different gospel than what you already know, they better watch out for some serious consequences."
Galatians,1,10,"Do I even care about what people think? Nah, it's all about pleasing God. I'm not out here trying to impress anyone, 'cause if I was, I wouldn't be a true follower of Christ."
Galatians,1,11,"Just so you know, fam, the good news I preached to you didn't come from any human source."
Galatians,1,12,"Because, like, no one taught me this or anything, I straight up got it from Jesus himself, through His divine revelation, you know?"
Galatians,1,13,"Yo, y'all probably know about my past hustle when I was deep into the Jewish scene. I straight up went ham on God's church, no cap, and left it in ruins:"
Galatians,1,14,"And I was really into the whole Jewish religion thing, even more than others my age from my own country. I was super passionate about all the traditions my ancestors followed."
Galatians,1,15,"But when God, who like totally separated me from my mom's womb, and like called me by his amazing grace,"
Galatians,1,16,"To make his Son known in me, so that I can spread the word about him to all people, I didn't waste time talking to human beings about it:"
Galatians,1,17,"I didn't even bother heading to Jerusalem to meet up with the OG apostles before me. Instead, I jetted off to Arabia for a bit, then made my way back to Damascus."
Galatians,1,18,"So, like, after three years I went to Jerusalem to hang with Peter, and I stayed with him for fifteen days. {went up: or, returned}"
Galatians,1,19,"But I didn't come across any of the other apostles, just James, who was actually the brother of the Lord."
Galatians,1,20,"Yo, let me tell you something real, straight up, no cap, before the big man upstairs, I ain't about to front or lie or anything."
Galatians,1,21,"Then I, like, ended up in Syria and Cilicia, you know?"
Galatians,1,22,"And nobody knew what he looked like in the churches of Judaea, where all the believers in Christ were."
Galatians,1,23,"But like, they were only aware that, the dude who used to like totally harass us in the past, now he's like preaching the faith that he once totally destroyed."
Galatians,1,24,"And they were like, 'Yo, God is straight up lit in me!"
Galatians,2,1,"So, like, fourteen years later, I went to Jerusalem again with my homie Barnabas, and I brought along my boy Titus too."
Galatians,2,2,"So, like, I had this total revelation and I went to them and shared the gospel I'm preaching to the non-Jewish peeps. But I only talked to those who are kinda respected, you know? I didn't want all my hard work to be a waste or anything. {privately: or, separately}"
Galatians,2,3,"But even Titus, my Greek bro, wasn't pressured to get circumcised while kickin' it with me:"
Galatians,2,4,"And that's because of these fake friends who sneaked in without us noticing, trying to secretly check if our freedom in Christ Jesus is real, just so they can control us and take away our freedom:"
Galatians,2,5,"We didn't let them take control, not even for a minute, so that the real deal of the gospel sticks with you."
Galatians,2,6,"But to be honest, those who were supposedly important (whatever they were, it doesn't matter to me: God doesn't show favoritism to anyone) didn't add anything to my knowledge during our meeting."
Galatians,2,7,"But on the flip side, when they realized that spreading the good news to those who are not circumcised was entrusted to me, just as the mission to spread the good news to the circumcised was entrusted to Peter;"
Galatians,2,8,"For the one who did big things in Peter, making him an apostle to the Jewish people, also worked powerfully in me for the non-Jewish people."
Galatians,2,9,"And when James, Cephas, and John, who were like total legends, realized the mad blessings that were given to me, they gave me and Barnabas the warmest welcome, signifying that we should head off to spread the word to non-believers, and they should focus on our fellow Jews."
Galatians,2,10,"It's important for us to look out for the less fortunate, something that I was totally all about."
Galatians,2,11,"But yo, when Peter pulled up in Antioch, I straight up called him out, 'cause he was in the wrong, no cap."
Galatians,2,12,"Like, before the dude came from James, he was totally chillin' and eating with the non-Jewish peeps. But when those other dudes showed up, he straight up dipped and distanced himself, 'cause he was scared of the circumcision gang."
Galatians,2,13,"And like, the rest of the Jewish people were also pretending with him, to the point that Barnabas got caught up in their fake act too."
Galatians,2,14,"So, like, when I peeped that they weren't really keeping it real with the whole gospel thing, I straight up called out Peter in front of everyone. I was like, 'Yo, Peter, my dude, if you, as a Jewish homie, can live like a Gentile and not follow all the Jewish customs, why you gotta force the Gentiles to do the same? Like, that ain't cool, bro.'"
Galatians,2,15,"We, born Jewish, not out here sinning like the Gentiles,"
Galatians,2,16,"Yo fam, peep this: You gotta know that trying to be a good person and follow all the rules ain't gonna make you legit in God's eyes. It's all about puttin' your faith in Jesus Christ. We all believed in Him, not because of what we do, but because of faith. You can't earn your way into heaven by following the law, no way, it doesn't work like that."
Galatians,2,17,"But, like, if we're all about being made right with Christ and stuff, and then we turn out to still mess up and make mistakes, does that mean Christ is, like, encouraging us to sin? Absolutely not, dude."
Galatians,2,18,"Like, if I start rebuilding the stuff I already wrecked, I'm totally going against the rules, man."
Galatians,2,19,"So like, I totally died to the law because of the law, you know? Like, I did it so I can live my best life for God."
Galatians,2,20,"I'm down with Christ: still living my life, but it's not just about me, it's about Christ living through me. The way I go about this earthly existence is by having faith in the Son of God, who loved me and sacrificed himself for me."
Galatians,2,21,"I ain't gonna mess with God's grace, 'cause if being right with Him depended on following the rules, then Jesus died for nothing."
Galatians,3,1,"Yo, Galatians, seriously? Who put a spell on you so you wouldn't listen to the truth? It's like you totally missed seeing Jesus Christ right in front of you, crucified for all to see!"
Galatians,3,2,"Hey, here's something I'm curious about: Did you get the Spirit because you followed all the rules, or was it because you believed and trusted in what you heard?"
Galatians,3,3,"Are you guys like, seriously making that dumb mistake? Like, you started off with the Spirit and now you think you can become perfect just by relying on your own strength and abilities? SMH."
Galatians,3,4,"Bruh, did you go through all that struggle for nothing? Like, was it all for nothin'? So not cool, if it was for nothin'. I mean, it's like a huge waste, you know?"
Galatians,3,5,"So, the person who blesses you with the Spirit and pulls off epic miracles, does he do it through following a bunch of rules, or by simply trusting in your beliefs?"
Galatians,3,6,"Just like how Abraham totally believed in God, and bam, it was like total righteousness on his account, you feel me? {accounted: or, imputed}"
Galatians,3,7,"Just so you know, if you believe, then you're totally part of Abraham's crew."
Galatians,3,8,"And like, the scripture totally predicted that God would make the non-believers righteous through faith, and even way back then, it was preaching the good news to Abraham, sayin' like, 'Yo, all the nations are gonna be blessed through you!'"
Galatians,3,9,"So, like, all those who have faith are totally blessed, just like our homie Abraham, who was super faithful and all."
Galatians,3,10,"Those who rely solely on following the rules are in a tough spot, ya feel me? 'Cause if you don't keep up with every single thing written in the rulebook, you're cursed, man."
Galatians,3,11,"Okay, so listen up guys, it's pretty obvious that no one can impress God by following a bunch of rules. Seriously, it's crystal clear! Instead, the righteous ones are the ones who live by faith. Like, they trust in God and stuff, rather than relying on their own good deeds."
Galatians,3,12,"And the whole rule thing doesn't require just believing, but the dude who actually follows it will live a good life."
Galatians,3,13,"Yo, Christ totally saved us from being cursed by the law. He became the curse in our place, 'cause the book says, anyone who hangs on a tree is cursed, man."
Galatians,3,14,"So basically, thanks to Jesus Christ, even us non-Jews can get in on the whole Abraham blessing thing. And by having faith, we can totally score that promise of the Spirit."
Galatians,3,15,"Yo, fam, I'm just speaking in a relatable way here. When humans make a deal, even if it's just between them, once it's confirmed, no one can cancel it or change the terms. Just FYI, covenantt' can also mean 'testament'."
Galatians,3,16,"So, like, the promises made to Abraham and his descendants, right? He didn't say 'seeds' as in a bunch of people, but 'seed' as in one, and that's Christ."
Galatians,3,17,"So, like, check it out, God made this promise to like, Abraham, right? And then, like, four hundred and thirty years later, He brought in the whole law thing through Moses. But here's the deal, guys: that law can't just cancel out the promise God made. It's, like, totally ineffective against it."
Galatians,3,18,"If the whole deal is about following the rules, then it's not really about the promise. But instead, God straight-up promised Abraham this inheritance."
Galatians,3,19,"So, what's the deal with the law, you ask? Well, it was added because people were messing up left and right. It was only there temporarily, until the person that the promise was made to arrived. And get this, it was even put in place by angels, with the help of a mediator."
Galatians,3,20,"So, like, a mediator is not just there for one person, you know? God is like, the one and only, man."
Galatians,3,21,"So, like, is the law, like, totally going against what God promised? No way, dude! Like, if there was a law that could've given life, then, like, being righteous would've totally depended on following the law."
Galatians,3,22,"But yo, the Bible said everyone's got sin on lock, so that the promise of Jesus Christ through faith can be straight up given to those who believe."
Galatians,3,23,"But like, before we had faith, we were totally bound by this set of rules, like trapped until the time when our faith would be fully revealed, you know?"
Galatians,3,24,"So, like, the law was basically our guide, you know, to lead us to Christ, so that we could be made right with God through faith."
Galatians,3,25,"Once we've embraced faith, we no longer need someone bossing us around like a teacher."
Galatians,3,26,"You're all squad members of God, believing in Christ Jesus."
Galatians,3,27,"Yo, all y'all who got baptized in the name of Christ, you straight up rockin' Christ now."
Galatians,3,28,"In Christ Jesus, it doesn't matter if you're Jewish or Greek, if you're enslaved or free, or if you're a guy or a girl - we're all equal and united."
Galatians,3,29,"And if you're part of Team Christ, then you're like a descendant of Abraham and, like, entitled to all the good stuff that was promised."
