Titus,1,14,Don't waste your time on those made-up stories and rules made by others that lead you away from what's real and true.
Titus,1,15,"Just so you know, to those who keep it real, everything is all good. But to those who are out of touch and skeptical, nothing is cool; in fact, even their thoughts and conscience are all messed up."
Titus,1,16,"So like, they're all about talking about how they know God, but their actions don't match up, you know? Like, they're acting all gross and disobedient, and they're like a total fail when it comes to doing anything good. No judgment skills whatsoever."
Titus,2,1,"But like, make sure what you say lines up with solid teachings, ya know?"
Titus,2,2,"The older dudes should be chill, wise, not too extreme, strong in their beliefs, full of love, and hella patient. {sober: or, vigilant}"
Titus,2,3,"The older women should also act in a way that reflects their dedication to righteousness. They should avoid spreading false rumors, not drink excessively, and be wise in teaching good things."
Titus,2,4,"So they can teach young women to be chill, to have a solid relationship with their partners, to love their children"
Titus,2,5,"Wise move, staying pure, owning your space, being awesome, respecting your partners, so God's word doesn't get dissed."
Titus,2,6,"Yo dudes, I'm telling you young fellas to keep it cool and grounded. {cool...: or, wise}"
Titus,2,7,"When it comes to everything you do, be a role model for good deeds. Teach others with integrity, seriousness, and honesty."
Titus,2,8,"Speak in a respectful and unassailable way, so that even your opponents can't find any fault with you and feel ashamed for having nothing negative to say about you."
Titus,2,9,"Encourage workers to be respectful and obedient to their bosses, making an effort to meet their expectations in all areas; not talking back or arguing."
Titus,2,10,"Don't be stealing stuff, but be trustworthy and faithful in everything, so that you can make God our Savior's teachings look awesome."
Titus,2,11,"Yo, check it out: God's amazing grace that brings salvation has totally shown up for everyone, yeah. It's like a big, awesome gift available to all, you know what I mean?"
Titus,2,12,"Teaching us that we gotta ditch the uncool stuff and the worldly desires, and start living our lives with self-control, fairness, and godliness right here in this world."
Titus,2,13,"Searching for that lit AF hope, and the epic arrival of the legendary God and our Savior Jesus Christ; {glorious...: Gr. the awesome manifestation of the greatness of God, and of our Savior Jesus Christ}"
Titus,2,14,"He totally sacrificed himself for us, like, seriously! His whole mission was to save us from all the bad stuff we do, and make us, like, his own special squad of people who are totally obsessed with doing good things."
Titus,2,15,"Speak up and encourage others, and if necessary, call them out with confidence. Don't let anyone look down on you."
Titus,3,1,"Just a friendly reminder to respect authority figures, follow the rules, and be open to doing good things."
Titus,3,2,"Don't trash talk anyone, avoid being a drama queen, and always be kind and humble to everyone."
Titus,3,3,"Yo, we used to do some stupid stuff, not following the rules, getting tricked, doing whatever we wanted to fulfill our desires and seeking pleasure, living in a bad way full of hate and jealousy, being all mean and hating on each other."
Titus,3,4,"But then God, our Savior, showed us His mad kindness and love for us humans. It was like pure fire, man. {love: or, pity}"
Titus,3,5,"We didn't earn our salvation by being all righteous and stuff, but it's all thanks to God's mercy. He saved us by giving us a fresh start and renewing our spirit with the Holy Ghost."
Titus,3,6,"He totally poured out his blessings on us, big time, thanks to Jesus Christ our ultimate lifesaver; {big time: Gr. seriously}"
Titus,3,7,"By his grace, we've been made legit and now we're set up to inherit the promise of eternal life."
Titus,3,8,"Yo, listen up! This be a real deal truth talk, fam. I'm straight up telling ya to keep preaching this stuff and make sure you and your crew stay committed to doing good stuff. 'Cause trust me, it's not just some basic thing - it's actually super dope and beneficial for everyone involved."
Titus,3,9,"Don't waste your time on dumb questions, family trees, arguments, or debates about the law, 'cause they're totally pointless and useless."
Titus,3,10,"If someone keeps spreading false beliefs even after being warned twice, don't give them any attention anymore."
Titus,3,11,"Like, anyone who acts like that is totally messed up, and they're sinning big time. They're just condemning themselves, you know?"
Titus,3,12,"Hey, when I send Artemas or Tychicus your way, make sure you come visit me in Nicopolis ASAP. I've planned to hang out there for winter, you know."
Titus,3,13,"Make sure to hook Zenas, the legal genius, and Apollos up with a solid ride, so they have everything they need for their trip."
Titus,3,14,"And we should all learn to do good things for important reasons, so that we don't end up being unproductive. (or, be skilled in honest jobs)"
Titus,3,15,"Yo, everyone rollin' with me sends their regards. Say what up to those homies who show us love and faith. May grace be with all y'all. Amen. 'This letter was written to Titus, who was chosen as the top dog bishop of the Cretians, yo. It's from Nicopolis of Macedonia, in case you were wonderin'.'"
Philemon,1,1,"Yo, it's Paul, locked up for Jesus Christ, and my bro Timothy, hittin' up Philemon, our beloved partner in crime,"
Philemon,1,2,"And shoutout to our homie Apphia, and Archippus, our fellow warrior, and to the squad in your crib:"
Philemon,1,3,"Yo, sending you mad grace and peace vibes from God our Father and the one and only Lord Jesus Christ."
Philemon,1,4,"Yo, shoutout to my God, I always bringin' you up in my prayers."
Philemon,1,5,"Yo, I heard about your mad love and faith for the Lord Jesus and all the homies in the faith squad;"
Philemon,1,6,"So that when you share your faith, it'll have a real impact by recognizing all the awesome things inside you because of Jesus."
Philemon,1,7,"Dude, we're totally stoked and comforted by your love, 'cause you've been showing mad love and support to the squad, bro."
Philemon,1,8,"So, even though I could totally flex in Christ and tell you what's right,"
Philemon,1,9,"But yo, for the love of it, I'm straight up calling on you, like, I'm Paul the wise OG, and right now I'm locked up for Jesus, you feel me?"
Philemon,1,10,"Yo, listen up! I'm seriously asking you for a huge favor regarding my dude Onesimus, who's like my own son. I actually brought him up while I was locked up, so you know he's important to me."
Philemon,1,11,"Back in the day, it was worthless to you, but now it's actually beneficial for both of us:"
Philemon,1,12,"Yo, I'm sending him back, so you better welcome him like he's my fam,"
Philemon,1,13,"I wanted to keep you by my side, so that instead of you, he could've helped me spread the message of the gospel:"
Philemon,1,14,"But I wouldn't do anything without your consent; I want your help to be genuine, not forced."
Philemon,1,15,"Maybe he dipped out for a bit so you could have him for good, ya know?"
Philemon,1,16,"Right now, I don't see you as just a servant, but more like a super cool bro who I really care about. And guess what? You're even more important to me than that! We're totally tight, both in the physical world and in our spiritual connection with the Lord."
Philemon,1,17,"Yo, if you consider me as your homie, then treat my boy like you would treat me fam."
Philemon,1,18,"If he's done you dirty, or owes you anything, charge it to my account fam;"
Philemon,1,19,"Yo, it's your boy Paul writing this letter with my own hand. Just want you to know that I got you covered and I'll pay you back, no doubt. But, I'm not trying to flex or anything, but you do owe me big time. Like, you owe me your whole self, bro."
Philemon,1,20,"Hey, bro, I would be so stoked if you brought me joy in the Lord: uplift my spirit in the Lord."
Philemon,1,21,"I'm hella confident that you'll do even more than what I tell you, so I hit you up with this message."
Philemon,1,22,"Yo, can you hook me up with a place to crash? I know if you all pray for me, I'll be able to join you."
Philemon,1,23,"Hey, shoutout to Epaphras, my bro locked up for Jesus, too! 🙌"
Philemon,1,24,"Yo, Marcus, Aristarchus, Demas, Lucas, my homies grindin' with me."
Philemon,1,25,"May the radical grace of our dude Jesus Christ vibe with your spirit, ya feel me? Amen. - Sent from Rome to Philemon, by Onesimus, like, totally his servant."
Hebrews,1,1,"Yo, so back in the day, God used to talk to our ancestors through prophets and stuff, you know, in different ways and at different times."
Hebrews,1,2,"Basically, God has recently been speaking to us through his Son. He's like the rightful owner of everything and he's the one who created everything too."
Hebrews,1,3,"So, like, this person is basically the epic representation of God's awesomeness. They legit hold everything together with their powerful words. And get this, they wiped out all our sins all on their own, and now they're chilling in the VIP section next to the Most High."
Hebrews,1,4,"He's, like, way cooler than the angels 'cause he totally inherited a way better name than them."
Hebrews,1,5,"Yo, God never said to any of the angels like, 'Hey bro, you're my Son and I've begotten you today'. And also, He straight up said, 'I'm gonna be a Father to Him and He's gonna be my Son'."
Hebrews,1,6,"And once again, when he introduces his firstborn into the world, he says, 'Let all the angel squad show some respect and worship him.'"
Hebrews,1,7,"God be like, 'Angels, they're all about those good vibes and fiery passion. They're pure spirits, serving up heat and intensity, just like flames on fire. 🔥'"
Hebrews,1,8,"But to the Son, it's like, 'Your throne, O God, is gonna be there forever and ever: a righteous rule is what's gonna go down in your kingdom. Righteousnesss means being all straight and right.)'"
Hebrews,1,9,"You totally rock righteousness and despise all the bad stuff. That's why God, your personal God, has crowned you with the happiest vibes, more than any of your crew."
Hebrews,1,10,"And yo, Lord, from the get-go, you totally set up the whole earth, and the skies are totally your masterpiece, man:"
Hebrews,1,11,"They're gonna fade away, but you're gonna stay strong. They're all gonna get old like an out-of-style outfit."
Hebrews,1,12,"You're gonna wrap those up like a cool outfit, and they're gonna go through some changes, but you, my friend, will always stay the same and never run out of time."
Hebrews,1,13,"Yo, fam, God never once said to any angel, 'Chillax on my right side until I crush all your haters under your feet.'"
Hebrews,1,14,"Bruh, like, aren't they all, like, these cool spirit angels that, you know, got sent to help out those who are gonna inherit salvation?"
Hebrews,2,1,"So, like, we really gotta pay super close attention to the stuff we've been told, you know? 'Cause otherwise, there's a chance it might just slip right through our fingers. (Think of it like those leaky water bottles, y'know?)"
Hebrews,2,2,"Like, if what the angels said was totally legit, and every act of going against that and not following their instructions got what they deserved in return;"
Hebrews,2,3,"Yo, if we straight up ignore this amazing salvation, how are we supposed to bounce back? It all started when the Lord started preaching it, and then homies who heard him confirmed it for us, ya know?"
Hebrews,2,4,"Did God like totally showed off, like with signs, miracles, and lit gifts from the Holy Ghost, because that's just how he rolls? #blessed #accordingtoHiswill #divergifts"
Hebrews,2,5,He hasn't made angels in charge of the future world we're talking about.
Hebrews,2,6,"But there was this one person who said, like, why do You even care about us humans? Like, what makes us so special that You would come visit us?"
Hebrews,2,7,"You made him slightly less powerful than the angels; you gave him honor and glory, and made him in charge of everything you created."
Hebrews,2,8,"You made everything subject to him, like totally under his control. Like, seriously, there's nothing that isn't under him. But, it's like, right now we can't see everything being under him yet."
Hebrews,2,9,"But check it, we peep Jesus, who was flexin' a bit lower than the angels to go through that pain of death, but then dude got crowned with mad glory and honor. It's like, God's grace hooked him up so he could actually experience death for every single person. {for the: or, by the}"
Hebrews,2,10,"It's just, like, totally perfect for the one who made everything and controls everything to make the ultimate leader of our salvation super flawless by going through tough times and all."
Hebrews,2,11,The one who makes things holy and the ones who are made holy are all connected as one fam. That's why he ain't embarrassed to call them his bros and sistas.
Hebrews,2,12,"I'm gonna shout out your name to my squad, and when we all hang out, I'll serenade you with mad love and props!"
Hebrews,2,13,"And once again, I'm gonna have faith in him. And again, check it out, me and the squad that God has blessed me with."
Hebrews,2,14,"So, like, since us kids are all human and stuff, Jesus, like, totally became human too, ya know? He did it so that, by dying, he could totally wreck the dude who had the power over death, AKA the devil."
Hebrews,2,15,And rescue those who were trapped in a lifetime of bondage due to the fear of death.
Hebrews,2,16,"Like, for real, he didn't become an angel or anything; instead, he became one of Abraham's descendants. It's not like he chose to stick with angels, but he actually chose to be connected with Abraham's fam."
Hebrews,2,17,"So, like, it was super important for him to be, like, just like his peeps, so he could be this compassionate and loyal high priest for all things related to God, ya know? His main gig was to make things right with the people's sins and stuff."
Hebrews,2,18,"Because he himself has gone through temptation and suffering, he's totally equipped to help out those who are going through the same."
Hebrews,3,1,"Yo, fam, listen up. So, like, you're all blessed and stuff, in on this heavenly mission, right? Well, make sure you give mad props to Jesus, the ultimate boss who's both an Apostle and a High Priest for us all. He's legit!"
Hebrews,3,2,"He stayed loyal to the one who chose him, just like Moses was also faithful in everything he did for God's people."
Hebrews,3,3,This guy deserves way more clout than Moses because the one who built the house is always more important than the house itself.
Hebrews,3,4,"Like, every crib is made by someone, but the one who built everything is God, you know."
Hebrews,3,5,"And Moses was totally loyal in everything he did, like a servant, as a proof of the stuff that was gonna be said later;"
Hebrews,3,6,"So, like Christ is totally in charge of his own crib, and we're a part of his crew if we stay solid in our confidence and stay hyped about that hope until the very end."
Hebrews,3,7,"Yo, listen up! The Holy Ghost be like, if you're down to hear His voice today,"
Hebrews,3,8,"Don't be closed-minded, like those who acted defiantly, when faced with challenges in the wilderness:"
Hebrews,3,9,"When your parents tested me, challenged me, and witnessed my miracles for a whole forty years."
Hebrews,3,10,"I was so bummed out by that generation, like seriously, they were always messing up and not getting what I'm all about."
Hebrews,3,11,"So I promise, in my anger, they won't be able to chill with me in my peaceful place. (If they try, they won't make it)"
Hebrews,3,12,"Yo, listen up, fam. Don't let it go unnoticed, my squad. None of y'all should let a wicked mind of disbelief creep in and separate you from the almighty God."
Hebrews,3,13,"Yo, like, make sure you're always encouraging each other, ya know? Don't wait 'til tomorrow, do it today! 'Cause sin can totally mess you up if you're not careful."
Hebrews,3,14,"Like, if we stay totally loyal to Jesus from the start to the finish, we'll totally be part of His crew, too!"
Hebrews,3,15,"So like, people say, if you hear his voice today, don't be all closed off and stubborn like back in the day when everyone was rebelling."
Hebrews,3,16,"Like, there were some people who straight up got triggered when they heard it, you know? But not everyone who left Egypt with Moses."
Hebrews,3,17,But who was he really mad at for forty years? Wasn't it those dudes who messed up and ended up biting the dust in the middle of nowhere?
Hebrews,3,18,"And who did he promise that they wouldn't enter his chill zone, except those who didn't have faith?"
Hebrews,3,19,"So basically, they couldn't get in because they just didn't believe enough."
Hebrews,4,1,"So, like, we better be careful not to miss out on this promised rest opportunity, ya know? We don't wanna be the ones who fall short, you feel me?"
Hebrews,4,2,"So, like, the good news was shared with us, just like it was with them. But, the thing is, it didn't really benefit them because they didn't have faith in what they heard, you know? It's like they couldn't connect with it on a deeper level because they weren't believing in it."
Hebrews,4,3,"Yo, us who have believed, we get to chill and find peace, just like he said, you know, when he was all like, 'I swear, if they try to enter my chill zone, they ain't gonna make it!' But hey, let's not forget, the works were done way back since the beginning of time."
Hebrews,4,4,"So, like, there's this part in the Bible where it talks about how God took a break on the seventh day after doing everything, you know? He just needed some chill time, man. No more work for Him."
Hebrews,4,5,"And, like, once again in this, it's like if they try to enter my chill zone."
Hebrews,4,6,"So, like, there are still some peeps who gotta go in there, but the OG peeps who first heard about it didn't go in 'cause they didn't believe, ya know? Like, the gospel and stuff."
Hebrews,4,7,"Once again, he's like, setting a specific day and everything. And he's all like, quoting David and stuff, saying, 'Yo, today is the day! After such a long time, you guys gotta listen up and not let your hearts get all cold and closed off.'"
Hebrews,4,8,"Like, if Jesus had already given them a break, then he wouldn't have been like 'yo, there's another day coming up, guys'. (btw, Jesus means Joshua, just so you know)"
Hebrews,4,9,"So, like, God still has this awesome chill time planned for His squad, ya know? It's all about taking a break and vibing with Him. #SabbathGoals"
Hebrews,4,10,"Once you're in chill mode, you're totally done with your own hustle, just like God took a break from his grind."
Hebrews,4,11,"So, like, we should totally hustle to get into that chill zone, or else we might end up like those dudes who didn't believe. {unbelief: or, disobedience}"
Hebrews,4,12,"Yo, the word of God is straight fire! It's got that power and cuts through anything like a double-edged sword. It can even split apart your soul and spirit, and your bones and marrow. Plus, it knows what's up in your thoughts and heart. No joke!"
Hebrews,4,13,"There's literally no being that can hide from him, like, seriously! He sees everything, and I mean everything. It's like everything's laid out with zero filter for him to see. And like, he's the one we gotta deal with, you feel me?"
Hebrews,4,14,"So, like, we've got this totally awesome high priest, Jesus, who's like, already up in the heavens and everything since he's the Son of God. So, let's, like, hold onto our faith and keep professing it, you know what I mean?"
Hebrews,4,15,"We've got a super relatable high priest who totally gets us and our struggles, because he's been through it all too - like seriously, every single temptation - but he never ever sinned."
Hebrews,4,16,"So, like, let's totally approach the throne of grace with confidence, you know? That's where we can score some serious mercy and find grace to help us out when we're in a tough spot."
Hebrews,5,1,"Like, every high priest that's chosen from the peeps is there for the people, ya know? They're all about doing their thing for God and all, offering gifts and sacrifices to make up for sins and stuff, you feel me?"
Hebrews,5,2,"Who can understand and empathize with those who lack knowledge and wander astray, because they too have their own struggles and flaws."
Hebrews,5,3,"And because of this, he should offer sacrifices not only for the people but also for himself, to atone for sins."
Hebrews,5,4,"No one just decides they're worthy of this honor on their own, it's only for those chosen by God, like Aaron was."
Hebrews,5,5,"Yo, Christ didn't flex to become a high priest on His own. It was the one who said to Him, 'You're my Son, I've brought you into this world today.'"
Hebrews,5,6,"Like, he also says in another passage, You're like a forever priest, just like Melchisedec, you know?"
Hebrews,5,7,"Back in the day when Jesus was a human, he was all about that prayer and supplication game. He cried out real loud and shed some legit tears to God, the ultimate savior, who actually heard him because he had deep respect and fear. Like, for real."
Hebrews,5,8,"Even though he was totally the Son, he actually learned how to obey by going through some really tough stuff;"
Hebrews,5,9,"And once he achieved peak awesomeness, he totally became the ultimate boss of eternal salvation for all those who totally follow him;"
Hebrews,5,10,"Like, chosen by God to be a super legit high priest, just like Melchisedec and stuff."
Hebrews,5,11,"There's a lot we could say about this, but it's kinda hard to explain 'cause y'all seem to have trouble paying attention."
Hebrews,5,12,"So, like, yeah, at this point you should already be experts, but you still need someone to re-teach you the basics of God's teachings. It's like you're still babies in the faith, only able to handle milk and not solid food."
Hebrews,5,13,"If you're still on that milk, you're like a total newbie when it comes to understanding righteousness. You're basically a baby, lacking experience and all that. #NoobLife"
Hebrews,5,14,"But, like, the deep stuff is for those who are mature enough to handle it, ya know? It's for those who have practiced and honed their senses to distinguish what's right and what's wrong."
Hebrews,6,1,"So, like, let's level up and move on from the basic teachings of Jesus, without going back and repeating stuff like repenting from useless actions and having faith in God."
Hebrews,6,2,"Regarding the teachings about baptisms, the power of touch, the revival of the deceased, and the never-ending evaluation."
Hebrews,6,3,"And we'll totally go for it, if God gives us the green light."
Hebrews,6,4,"Like, you know, it's totally impossible for those who were once all like, super enlightened and have gotten a taste of that divine gift and like, experienced the Holy Ghost, ya know?"
Hebrews,6,5,"And we've actually experienced the dope message of God and the super cool things that are gonna happen in the future,"
Hebrews,6,6,"If they mess up and turn away, it's hard to bring them back to change their ways again because it's like they're crucifying Jesus all over again and making a big embarrassment out of it."
Hebrews,6,7,"Like, the earth totally soaks up all the rain that falls on it, you know, all the time, and as a result, it produces like, the dopest plants that are totally useful for the peeps who take care of it. And because of this, it totally receives blessings from God, ya know? #blessed"
Hebrews,6,8,"But anything that's full of negativity and toxic vibes gets left behind and is basically toast; it's just asking for trouble, destined to be burned."
Hebrews,6,9,"Yo fam, listen up! We truly believe in you and expect great things that come with salvation, even though we're talking like this."
Hebrews,6,10,"God isn't unfair or anything, He doesn't forget the hard work and love you've shown in His name by helping out the saints, both now and in the past."
Hebrews,6,11,And we want each and every one of you to put in the same effort to be totally confident in your hopes until the very end:
Hebrews,6,12,"Don't be lazy, but be like the squad who, by having faith and staying patient, cash in on those promises."
Hebrews,6,13,"So, like, when God made a promise to Abraham, there wasn't anyone or anything greater for Him to swear by, so He was like, 'I swear, man, I'm staking everything I got on this promise!'"
Hebrews,6,14,"Like, I promise you, you're gonna be blessed AF and your blessings are gonna multiply like crazy. No cap, fam."
Hebrews,6,15,"And like, after he, like, totally kept his chill and didn't give up or anything, he, like, totally got what he was promised, you know?"
Hebrews,6,16,"Dude, like seriously, when guys swear on something super important, it's like the ultimate way to settle any argument."
Hebrews,6,17,"So basically, God really wanted to make it crystal clear to the future inheritors of His promises that His plans are unchanging and reliable. And He went above and beyond by sealing the deal with an oath, just to make sure everyone got the memo. #Trustworthy"
Hebrews,6,18,"So, like, God made some promises that can't change, and, like, He's totally incapable of lying. This brings us so much comfort and hope, especially those of us who have run to Him for safety and grabbed onto the awesome hope He's given us."
Hebrews,6,19,"This hope we've got is like a solid anchor for the soul, totally reliable and unwavering, and it reaches deep into the core of things."
