Psalm,25,10,All the ways of the LORD are loving and faithful toward those who keep the demands of his covenant.
Psalm,25,11,"For the sake of your name, LORD, forgive my iniquity, though it is great."
Psalm,25,12,"Who, then, are those who fear the LORD? He will instruct them in the ways they should choose."
Psalm,25,13,"They will spend their days in prosperity, and their descendants will inherit the land."
Psalm,25,14,The LORD confides in those who fear him; he makes his covenant known to them.
Psalm,25,15,"My eyes are ever on the LORD, for only he will release my feet from the snare."
Psalm,25,16,"Turn to me and be gracious to me, for I am lonely and afflicted."
Psalm,25,17,Relieve the troubles of my heart and free me from my anguish.
Psalm,25,18,Look on my affliction and my distress and take away all my sins.
Psalm,25,19,See how numerous are my enemies and how fiercely they hate me!
Psalm,25,20,"Guard my life and rescue me; do not let me be put to shame, for I take refuge in you."
Psalm,25,21,"May integrity and uprightness protect me, because my hope, LORD, is in you."
Psalm,25,22,"Deliver Israel, O God, from all their troubles!"
Psalm,26,1,"Of David. Vindicate me, LORD, for I have led a blameless life; I have trusted in the LORD and have not faltered."
Psalm,26,2,"Test me, LORD, and try me, examine my heart and my mind;"
Psalm,26,3,for I have always been mindful of your unfailing love and have lived in reliance on your faithfulness.
Psalm,26,4,"I do not sit with the deceitful, nor do I associate with hypocrites."
Psalm,26,5,I abhor the assembly of evildoers and refuse to sit with the wicked.
Psalm,26,6,"I wash my hands in innocence, and go about your altar, LORD,"
Psalm,26,7,proclaiming aloud your praise and telling of all your wonderful deeds.
Psalm,26,8,"LORD, I love the house where you live, the place where your glory dwells."
Psalm,26,9,"Do not take away my soul along with sinners, my life with those who are bloodthirsty,"
Psalm,26,10,"in whose hands are wicked schemes, whose right hands are full of bribes."
Psalm,26,11,I lead a blameless life; deliver me and be merciful to me.
Psalm,26,12,My feet stand on level ground; in the great congregation I will praise the LORD.
Psalm,27,1,Of David. The LORD is my light and my salvation— whom shall I fear? The LORD is the stronghold of my life— of whom shall I be afraid?
Psalm,27,2,"When the wicked advance against me to devour me, it is my enemies and my foes who will stumble and fall."
Psalm,27,3,"Though an army besiege me, my heart will not fear; though war break out against me, even then I will be confident."
Psalm,27,4,"One thing I ask from the LORD, this only do I seek: that I may dwell in the house of the LORD all the days of my life, to gaze on the beauty of the LORD and to seek him in his temple."
Psalm,27,5,For in the day of trouble he will keep me safe in his dwelling; he will hide me in the shelter of his sacred tent and set me high upon a rock.
Psalm,27,6,Then my head will be exalted above the enemies who surround me; at his sacred tent I will sacrifice with shouts of joy; I will sing and make music to the LORD.
Psalm,27,7,"Hear my voice when I call, LORD; be merciful to me and answer me."
Psalm,27,8,"My heart says of you, “Seek his face!” Your face, LORD, I will seek."
Psalm,27,9,"Do not hide your face from me, do not turn your servant away in anger; you have been my helper. Do not reject me or forsake me, God my Savior."
Psalm,27,10,"Though my father and mother forsake me, the LORD will receive me."
Psalm,27,11,"Teach me your way, LORD; lead me in a straight path because of my oppressors."
Psalm,27,12,"Do not turn me over to the desire of my foes, for false witnesses rise up against me, spouting malicious accusations."
Psalm,27,13,I remain confident of this: I will see the goodness of the LORD in the land of the living.
Psalm,27,14,Wait for the LORD; be strong and take heart and wait for the LORD.
Psalm,28,1,"Of David. To you, LORD, I call; you are my Rock, do not turn a deaf ear to me. For if you remain silent, I will be like those who go down to the pit."
Psalm,28,2,"Hear my cry for mercy as I call to you for help, as I lift up my hands toward your Most Holy Place."
Psalm,28,3,"Do not drag me away with the wicked, with those who do evil, who speak cordially with their neighbors but harbor malice in their hearts."
Psalm,28,4,Repay them for their deeds and for their evil work; repay them for what their hands have done and bring back on them what they deserve.
Psalm,28,5,"Because they have no regard for the deeds of the LORD and what his hands have done, he will tear them down and never build them up again."
Psalm,28,6,"Praise be to the LORD, for he has heard my cry for mercy."
Psalm,28,7,"The LORD is my strength and my shield; my heart trusts in him, and he helps me. My heart leaps for joy, and with my song I praise him."
Psalm,28,8,"The LORD is the strength of his people, a fortress of salvation for his anointed one."
Psalm,28,9,Save your people and bless your inheritance; be their shepherd and carry them forever.
Psalm,29,1,"A psalm of David. Ascribe to the LORD, you heavenly beings, ascribe to the LORD glory and strength."
Psalm,29,2,Ascribe to the LORD the glory due his name; worship the LORD in the splendor of his holiness.
Psalm,29,3,"The voice of the LORD is over the waters; the God of glory thunders, the LORD thunders over the mighty waters."
Psalm,29,4,The voice of the LORD is powerful; the voice of the LORD is majestic.
Psalm,29,5,The voice of the LORD breaks the cedars; the LORD breaks in pieces the cedars of Lebanon.
Psalm,29,6,"He makes Lebanon leap like a calf, Sirion like a young wild ox."
Psalm,29,7,The voice of the LORD strikes with flashes of lightning.
Psalm,29,8,The voice of the LORD shakes the desert; the LORD shakes the Desert of Kadesh.
Psalm,29,9,"The voice of the LORD twists the oaks and strips the forests bare. And in his temple all cry, “Glory!”"
Psalm,29,10,The LORD sits enthroned over the flood; the LORD is enthroned as King forever.
Psalm,29,11,The LORD gives strength to his people; the LORD blesses his people with peace.
Psalm,30,1,"A psalm. A song. For the dedication of the temple. Of David. I will exalt you, LORD, for you lifted me out of the depths and did not let my enemies gloat over me."
Psalm,30,2,"LORD my God, I called to you for help, and you healed me."
Psalm,30,3,"You, LORD, brought me up from the realm of the dead; you spared me from going down to the pit."
Psalm,30,4,"Sing the praises of the LORD, you his faithful people; praise his holy name."
Psalm,30,5,"For his anger lasts only a moment, but his favor lasts a lifetime; weeping may stay for the night, but rejoicing comes in the morning."
Psalm,30,6,"When I felt secure, I said, “I will never be shaken.”"
Psalm,30,7,"LORD, when you favored me, you made my royal mountain stand firm; but when you hid your face, I was dismayed."
Psalm,30,8,"To you, LORD, I called; to the Lord I cried for mercy:"
Psalm,30,9,"“What is gained if I am silenced, if I go down to the pit? Will the dust praise you? Will it proclaim your faithfulness?"
Psalm,30,10,"Hear, LORD, and be merciful to me; LORD, be my help.”"
Psalm,30,11,"You turned my wailing into dancing; you removed my sackcloth and clothed me with joy,"
Psalm,30,12,"that my heart may sing your praises and not be silent. LORD my God, I will praise you forever."
Psalm,31,1,"For the director of music. A psalm of David. In you, LORD, I have taken refuge; let me never be put to shame; deliver me in your righteousness."
Psalm,31,2,"Turn your ear to me, come quickly to my rescue; be my rock of refuge, a strong fortress to save me."
Psalm,31,3,"Since you are my rock and my fortress, for the sake of your name lead and guide me."
Psalm,31,4,"Keep me free from the trap that is set for me, for you are my refuge."
Psalm,31,5,"Into your hands I commit my spirit; deliver me, LORD, my faithful God."
Psalm,31,6,"I hate those who cling to worthless idols; as for me, I trust in the LORD."
Psalm,31,7,"I will be glad and rejoice in your love, for you saw my affliction and knew the anguish of my soul."
Psalm,31,8,You have not given me into the hands of the enemy but have set my feet in a spacious place.
Psalm,31,9,"Be merciful to me, LORD, for I am in distress; my eyes grow weak with sorrow, my soul and body with grief."
Psalm,31,10,"My life is consumed by anguish and my years by groaning; my strength fails because of my affliction, and my bones grow weak."
Psalm,31,11,"Because of all my enemies, I am the utter contempt of my neighbors and an object of dread to my closest friends— those who see me on the street flee from me."
Psalm,31,12,I am forgotten as though I were dead; I have become like broken pottery.
Psalm,31,13,"For I hear many whispering, “Terror on every side!” They conspire against me and plot to take my life."
Psalm,31,14,"But I trust in you, LORD; I say, “You are my God.”"
Psalm,31,15,"My times are in your hands; deliver me from the hands of my enemies, from those who pursue me."
Psalm,31,16,Let your face shine on your servant; save me in your unfailing love.
Psalm,31,17,"Let me not be put to shame, LORD, for I have cried out to you; but let the wicked be put to shame and be silent in the realm of the dead."
Psalm,31,18,"Let their lying lips be silenced, for with pride and contempt they speak arrogantly against the righteous."
Psalm,31,19,"How abundant are the good things that you have stored up for those who fear you, that you bestow in the sight of all, on those who take refuge in you."
Psalm,31,20,In the shelter of your presence you hide them from all human intrigues; you keep them safe in your dwelling from accusing tongues.
Psalm,31,21,"Praise be to the LORD, for he showed me the wonders of his love when I was in a city under siege."
Psalm,31,22,"In my alarm I said, “I am cut off from your sight!” Yet you heard my cry for mercy when I called to you for help."
Psalm,31,23,"Love the LORD, all his faithful people! The LORD preserves those who are true to him, but the proud he pays back in full."
Psalm,31,24,"Be strong and take heart, all you who hope in the LORD."
Psalm,32,1,"Of David. A maskil. Blessed is the one whose transgressions are forgiven, whose sins are covered."
Psalm,32,2,Blessed is the one whose sin the LORD does not count against them and in whose spirit is no deceit.
Psalm,32,3,"When I kept silent, my bones wasted away through my groaning all day long."
Psalm,32,4,For day and night your hand was heavy on me; my strength was sapped as in the heat of summer.
Psalm,32,5,"Then I acknowledged my sin to you and did not cover up my iniquity. I said, “I will confess my transgressions to the LORD.” And you forgave the guilt of my sin."
Psalm,32,6,Therefore let all the faithful pray to you while you may be found; surely the rising of the mighty waters will not reach them.
Psalm,32,7,You are my hiding place; you will protect me from trouble and surround me with songs of deliverance.
Psalm,32,8,I will instruct you and teach you in the way you should go; I will counsel you with my loving eye on you.
Psalm,32,9,"Do not be like the horse or the mule, which have no understanding but must be controlled by bit and bridle or they will not come to you."
Psalm,32,10,"Many are the woes of the wicked, but the LORD’s unfailing love surrounds the one who trusts in him."
Psalm,32,11,"Rejoice in the LORD and be glad, you righteous; sing, all you who are upright in heart!"
Psalm,33,1,"Sing joyfully to the LORD, you righteous; it is fitting for the upright to praise him."
Psalm,33,2,Praise the LORD with the harp; make music to him on the ten-stringed lyre.
Psalm,33,3,"Sing to him a new song; play skillfully, and shout for joy."
Psalm,33,4,For the word of the LORD is right and true; he is faithful in all he does.
Psalm,33,5,The LORD loves righteousness and justice; the earth is full of his unfailing love.
Psalm,33,6,"By the word of the LORD the heavens were made, their starry host by the breath of his mouth."
Psalm,33,7,He gathers the waters of the sea into jars; he puts the deep into storehouses.
Psalm,33,8,Let all the earth fear the LORD; let all the people of the world revere him.
Psalm,33,9,"For he spoke, and it came to be; he commanded, and it stood firm."
Psalm,33,10,The LORD foils the plans of the nations; he thwarts the purposes of the peoples.
Psalm,33,11,"But the plans of the LORD stand firm forever, the purposes of his heart through all generations."
Psalm,33,12,"Blessed is the nation whose God is the LORD, the people he chose for his inheritance."
Psalm,33,13,From heaven the LORD looks down and sees all mankind;
Psalm,33,14,from his dwelling place he watches all who live on earth—
Psalm,33,15,"he who forms the hearts of all, who considers everything they do."
Psalm,33,16,No king is saved by the size of his army; no warrior escapes by his great strength.
Psalm,33,17,A horse is a vain hope for deliverance; despite all its great strength it cannot save.
Psalm,33,18,"But the eyes of the LORD are on those who fear him, on those whose hope is in his unfailing love,"
Psalm,33,19,to deliver them from death and keep them alive in famine.
Psalm,33,20,We wait in hope for the LORD; he is our help and our shield.
Psalm,33,21,"In him our hearts rejoice, for we trust in his holy name."
Psalm,33,22,"May your unfailing love be with us, LORD, even as we put our hope in you."
Psalm,34,1,"Of David. When he pretended to be insane before Abimelek, who drove him away, and he left. I will extol the LORD at all times; his praise will always be on my lips."
Psalm,34,2,I will glory in the LORD; let the afflicted hear and rejoice.
Psalm,34,3,Glorify the LORD with me; let us exalt his name together.
Psalm,34,4,"I sought the LORD, and he answered me; he delivered me from all my fears."
Psalm,34,5,Those who look to him are radiant; their faces are never covered with shame.
Psalm,34,6,"This poor man called, and the LORD heard him; he saved him out of all his troubles."
Psalm,34,7,"The angel of the LORD encamps around those who fear him, and he delivers them."
Psalm,34,8,Taste and see that the LORD is good; blessed is the one who takes refuge in him.
Psalm,34,9,"Fear the LORD, you his holy people, for those who fear him lack nothing."
Psalm,34,10,"The lions may grow weak and hungry, but those who seek the LORD lack no good thing."
Psalm,34,11,"Come, my children, listen to me; I will teach you the fear of the LORD."
Psalm,34,12,"Whoever of you loves life and desires to see many good days,"
Psalm,34,13,keep your tongue from evil and your lips from telling lies.
Psalm,34,14,Turn from evil and do good; seek peace and pursue it.
Psalm,34,15,"The eyes of the LORD are on the righteous, and his ears are attentive to their cry;"
Psalm,34,16,"but the face of the LORD is against those who do evil, to blot out their name from the earth."
Psalm,34,17,"The righteous cry out, and the LORD hears them; he delivers them from all their troubles."
Psalm,34,18,The LORD is close to the brokenhearted and saves those who are crushed in spirit.
Psalm,34,19,"The righteous person may have many troubles, but the LORD delivers him from them all;"
Psalm,34,20,"he protects all his bones, not one of them will be broken."
Psalm,34,21,Evil will slay the wicked; the foes of the righteous will be condemned.
Psalm,34,22,The LORD will rescue his servants; no one who takes refuge in him will be condemned.
Psalm,35,1,"Of David. Contend, LORD, with those who contend with me; fight against those who fight against me."
Psalm,35,2,Take up shield and armor; arise and come to my aid.
Psalm,35,3,"Brandish spear and javelin against those who pursue me. Say to me, “I am your salvation.”"
Psalm,35,4,May those who seek my life be disgraced and put to shame; may those who plot my ruin be turned back in dismay.
Psalm,35,5,"May they be like chaff before the wind, with the angel of the LORD driving them away;"
Psalm,35,6,"may their path be dark and slippery, with the angel of the LORD pursuing them."
Psalm,35,7,"Since they hid their net for me without cause and without cause dug a pit for me,"
Psalm,35,8,"may ruin overtake them by surprise— may the net they hid entangle them, may they fall into the pit, to their ruin."
Psalm,35,9,Then my soul will rejoice in the LORD and delight in his salvation.
Psalm,35,10,"My whole being will exclaim, “Who is like you, LORD? You rescue the poor from those too strong for them, the poor and needy from those who rob them.”"
Psalm,35,11,Ruthless witnesses come forward; they question me on things I know nothing about.
Psalm,35,12,They repay me evil for good and leave me like one bereaved.
Psalm,35,13,"Yet when they were ill, I put on sackcloth and humbled myself with fasting. When my prayers returned to me unanswered,"
Psalm,35,14,I went about mourning as though for my friend or brother. I bowed my head in grief as though weeping for my mother.
Psalm,35,15,"But when I stumbled, they gathered in glee; assailants gathered against me without my knowledge. They slandered me without ceasing."
Psalm,35,16,Like the ungodly they maliciously mocked; they gnashed their teeth at me.
Psalm,35,17,"How long, Lord, will you look on? Rescue me from their ravages, my precious life from these lions."
Psalm,35,18,I will give you thanks in the great assembly; among the throngs I will praise you.
Psalm,35,19,Do not let those gloat over me who are my enemies without cause; do not let those who hate me without reason maliciously wink the eye.
Psalm,35,20,"They do not speak peaceably, but devise false accusations against those who live quietly in the land."
Psalm,35,21,"They sneer at me and say, “Aha! Aha! With our own eyes we have seen it.”"
Psalm,35,22,"LORD, you have seen this; do not be silent. Do not be far from me, Lord."
Psalm,35,23,"Awake, and rise to my defense! Contend for me, my God and Lord."
Psalm,35,24,"Vindicate me in your righteousness, LORD my God; do not let them gloat over me."
Psalm,35,25,"Do not let them think, “Aha, just what we wanted!” or say, “We have swallowed him up.”"
Psalm,35,26,May all who gloat over my distress be put to shame and confusion; may all who exalt themselves over me be clothed with shame and disgrace.
Psalm,35,27,"May those who delight in my vindication shout for joy and gladness; may they always say, “The LORD be exalted, who delights in the well-being of his servant.”"
Psalm,35,28,"My tongue will proclaim your righteousness, your praises all day long."
Psalm,36,1,For the director of music. Of David the servant of the LORD. I have a message from God in my heart concerning the sinfulness of the wicked: There is no fear of God before their eyes.
Psalm,36,2,In their own eyes they flatter themselves too much to detect or hate their sin.
Psalm,36,3,The words of their mouths are wicked and deceitful; they fail to act wisely or do good.
Psalm,36,4,Even on their beds they plot evil; they commit themselves to a sinful course and do not reject what is wrong.
Psalm,36,5,"Your love, LORD, reaches to the heavens, your faithfulness to the skies."
Psalm,36,6,"Your righteousness is like the highest mountains, your justice like the great deep. You, LORD, preserve both people and animals."
Psalm,36,7,"How priceless is your unfailing love, O God! People take refuge in the shadow of your wings."
Psalm,36,8,They feast on the abundance of your house; you give them drink from your river of delights.
Psalm,36,9,For with you is the fountain of life; in your light we see light.
Psalm,36,10,"Continue your love to those who know you, your righteousness to the upright in heart."
Psalm,36,11,"May the foot of the proud not come against me, nor the hand of the wicked drive me away."
Psalm,36,12,"See how the evildoers lie fallen— thrown down, not able to rise!"
Psalm,37,1,Of David. Do not fret because of those who are evil or be envious of those who do wrong;
Psalm,37,2,"for like the grass they will soon wither, like green plants they will soon die away."
Psalm,37,3,Trust in the LORD and do good; dwell in the land and enjoy safe pasture.
Psalm,37,4,"Take delight in the LORD, and he will give you the desires of your heart."
Psalm,37,5,Commit your way to the LORD; trust in him and he will do this:
Psalm,37,6,"He will make your righteous reward shine like the dawn, your vindication like the noonday sun."
Psalm,37,7,"Be still before the LORD and wait patiently for him; do not fret when people succeed in their ways, when they carry out their wicked schemes."
Psalm,37,8,Refrain from anger and turn from wrath; do not fret—it leads only to evil.
Psalm,37,9,"For those who are evil will be destroyed, but those who hope in the LORD will inherit the land."
Psalm,37,10,"A little while, and the wicked will be no more; though you look for them, they will not be found."
Psalm,37,11,But the meek will inherit the land and enjoy peace and prosperity.
Psalm,37,12,The wicked plot against the righteous and gnash their teeth at them;
Psalm,37,13,"but the Lord laughs at the wicked, for he knows their day is coming."
Psalm,37,14,"The wicked draw the sword and bend the bow to bring down the poor and needy, to slay those whose ways are upright."
Psalm,37,15,"But their swords will pierce their own hearts, and their bows will be broken."
Psalm,37,16,Better the little that the righteous have than the wealth of many wicked;
Psalm,37,17,"for the power of the wicked will be broken, but the LORD upholds the righteous."
Psalm,37,18,"The blameless spend their days under the LORD’s care, and their inheritance will endure forever."
Psalm,37,19,In times of disaster they will not wither; in days of famine they will enjoy plenty.
Psalm,37,20,"But the wicked will perish: Though the LORD’s enemies are like the flowers of the field, they will be consumed, they will go up in smoke."
Psalm,37,21,"The wicked borrow and do not repay, but the righteous give generously;"
Psalm,37,22,"those the LORD blesses will inherit the land, but those he curses will be destroyed."
Psalm,37,23,The LORD makes firm the steps of the one who delights in him;
Psalm,37,24,"though he may stumble, he will not fall, for the LORD upholds him with his hand."
Psalm,37,25,"I was young and now I am old, yet I have never seen the righteous forsaken or their children begging bread."
Psalm,37,26,They are always generous and lend freely; their children will be a blessing.
Psalm,37,27,Turn from evil and do good; then you will dwell in the land forever.
Psalm,37,28,For the LORD loves the just and will not forsake his faithful ones. Wrongdoers will be completely destroyed; the offspring of the wicked will perish.
Psalm,37,29,The righteous will inherit the land and dwell in it forever.
Psalm,37,30,"The mouths of the righteous utter wisdom, and their tongues speak what is just."
Psalm,37,31,The law of their God is in their hearts; their feet do not slip.
Psalm,37,32,"The wicked lie in wait for the righteous, intent on putting them to death;"
Psalm,37,33,but the LORD will not leave them in the power of the wicked or let them be condemned when brought to trial.
Psalm,37,34,"Hope in the LORD and keep his way. He will exalt you to inherit the land; when the wicked are destroyed, you will see it."
Psalm,37,35,"I have seen a wicked and ruthless man flourishing like a luxuriant native tree,"
Psalm,37,36,"but he soon passed away and was no more; though I looked for him, he could not be found."
Psalm,37,37,"Consider the blameless, observe the upright; a future awaits those who seek peace."
Psalm,37,38,But all sinners will be destroyed; there will be no future for the wicked.
Psalm,37,39,The salvation of the righteous comes from the LORD; he is their stronghold in time of trouble.
Psalm,37,40,"The LORD helps them and delivers them; he delivers them from the wicked and saves them, because they take refuge in him."
Psalm,38,1,"A psalm of David. A petition. LORD, do not rebuke me in your anger or discipline me in your wrath."
Psalm,38,2,"Your arrows have pierced me, and your hand has come down on me."
Psalm,38,3,Because of your wrath there is no health in my body; there is no soundness in my bones because of my sin.
Psalm,38,4,My guilt has overwhelmed me like a burden too heavy to bear.
Psalm,38,5,My wounds fester and are loathsome because of my sinful folly.
Psalm,38,6,I am bowed down and brought very low; all day long I go about mourning.
Psalm,38,7,My back is filled with searing pain; there is no health in my body.
Psalm,38,8,I am feeble and utterly crushed; I groan in anguish of heart.
Psalm,38,9,"All my longings lie open before you, Lord; my sighing is not hidden from you."
Psalm,38,10,"My heart pounds, my strength fails me; even the light has gone from my eyes."
Psalm,38,11,My friends and companions avoid me because of my wounds; my neighbors stay far away.
Psalm,38,12,"Those who want to kill me set their traps, those who would harm me talk of my ruin; all day long they scheme and lie."
Psalm,38,13,"I am like the deaf, who cannot hear, like the mute, who cannot speak;"
Psalm,38,14,"I have become like one who does not hear, whose mouth can offer no reply."
Psalm,38,15,"LORD, I wait for you; you will answer, Lord my God."
Psalm,38,16,"For I said, “Do not let them gloat or exalt themselves over me when my feet slip.”"
Psalm,38,17,"For I am about to fall, and my pain is ever with me."
Psalm,38,18,I confess my iniquity; I am troubled by my sin.
Psalm,38,19,Many have become my enemies without cause; those who hate me without reason are numerous.
Psalm,38,20,"Those who repay my good with evil lodge accusations against me, though I seek only to do what is good."
Psalm,38,21,"LORD, do not forsake me; do not be far from me, my God."
Psalm,38,22,"Come quickly to help me, my Lord and my Savior."
Psalm,39,1,"For the director of music. For Jeduthun. A psalm of David. I said, “I will watch my ways and keep my tongue from sin; I will put a muzzle on my mouth while in the presence of the wicked.”"
