Jeremiah,52,25,"Of those still in the city, he took the officer in charge of the fighting men, and seven royal advisers. He also took the secretary who was chief officer in charge of conscripting the people of the land, sixty of whom were found in the city."
Jeremiah,52,26,Nebuzaradan the commander took them all and brought them to the king of Babylon at Riblah.
Jeremiah,52,27,"There at Riblah, in the land of Hamath, the king had them executed. So Judah went into captivity, away from her land."
Jeremiah,52,28,"This is the number of the people Nebuchadnezzar carried into exile: in the seventh year, 3,023 Jews;"
Jeremiah,52,29,"in Nebuchadnezzar’s eighteenth year, 832 people from Jerusalem;"
Jeremiah,52,30,"in his twenty-third year, 745 Jews taken into exile by Nebuzaradan the commander of the imperial guard. There were 4,600 people in all."
Jeremiah,52,31,"In the thirty-seventh year of the exile of Jehoiachin king of Judah, in the year Awel-Marduk became king of Babylon, on the twenty-fifth day of the twelfth month, he released Jehoiachin king of Judah and freed him from prison."
Jeremiah,52,32,He spoke kindly to him and gave him a seat of honor higher than those of the other kings who were with him in Babylon.
Jeremiah,52,33,So Jehoiachin put aside his prison clothes and for the rest of his life ate regularly at the king’s table.
Jeremiah,52,34,"Day by day the king of Babylon gave Jehoiachin a regular allowance as long as he lived, till the day of his death."
Lamentations,1,1,"How deserted lies the city, once so full of people! How like a widow is she, who once was great among the nations! She who was queen among the provinces has now become a slave."
Lamentations,1,2,"Bitterly she weeps at night, tears are on her cheeks. Among all her lovers there is no one to comfort her. All her friends have betrayed her; they have become her enemies."
Lamentations,1,3,"After affliction and harsh labor, Judah has gone into exile. She dwells among the nations; she finds no resting place. All who pursue her have overtaken her in the midst of her distress."
Lamentations,1,4,"The roads to Zion mourn, for no one comes to her appointed festivals. All her gateways are desolate, her priests groan, her young women grieve, and she is in bitter anguish."
Lamentations,1,5,"Her foes have become her masters; her enemies are at ease. The LORD has brought her grief because of her many sins. Her children have gone into exile, captive before the foe."
Lamentations,1,6,All the splendor has departed from Daughter Zion. Her princes are like deer that find no pasture; in weakness they have fled before the pursuer.
Lamentations,1,7,"In the days of her affliction and wandering Jerusalem remembers all the treasures that were hers in days of old. When her people fell into enemy hands, there was no one to help her. Her enemies looked at her and laughed at her destruction."
Lamentations,1,8,"Jerusalem has sinned greatly and so has become unclean. All who honored her despise her, for they have all seen her naked; she herself groans and turns away."
Lamentations,1,9,"Her filthiness clung to her skirts; she did not consider her future. Her fall was astounding; there was none to comfort her. “Look, LORD, on my affliction, for the enemy has triumphed.”"
Lamentations,1,10,The enemy laid hands on all her treasures; she saw pagan nations enter her sanctuary— those you had forbidden to enter your assembly.
Lamentations,1,11,"All her people groan as they search for bread; they barter their treasures for food to keep themselves alive. “Look, LORD, and consider, for I am despised.”"
Lamentations,1,12,"“Is it nothing to you, all you who pass by? Look around and see. Is any suffering like my suffering that was inflicted on me, that the LORD brought on me in the day of his fierce anger?"
Lamentations,1,13,"“From on high he sent fire, sent it down into my bones. He spread a net for my feet and turned me back. He made me desolate, faint all the day long."
Lamentations,1,14,"“My sins have been bound into a yoke; by his hands they were woven together. They have been hung on my neck, and the Lord has sapped my strength. He has given me into the hands of those I cannot withstand."
Lamentations,1,15,“The Lord has rejected all the warriors in my midst; he has summoned an army against me to crush my young men. In his winepress the Lord has trampled Virgin Daughter Judah.
Lamentations,1,16,"“This is why I weep and my eyes overflow with tears. No one is near to comfort me, no one to restore my spirit. My children are destitute because the enemy has prevailed.”"
Lamentations,1,17,"Zion stretches out her hands, but there is no one to comfort her. The LORD has decreed for Jacob that his neighbors become his foes; Jerusalem has become an unclean thing among them."
Lamentations,1,18,"“The LORD is righteous, yet I rebelled against his command. Listen, all you peoples; look on my suffering. My young men and young women have gone into exile."
Lamentations,1,19,“I called to my allies but they betrayed me. My priests and my elders perished in the city while they searched for food to keep themselves alive.
Lamentations,1,20,"“See, LORD, how distressed I am! I am in torment within, and in my heart I am disturbed, for I have been most rebellious. Outside, the sword bereaves; inside, there is only death."
Lamentations,1,21,"“People have heard my groaning, but there is no one to comfort me. All my enemies have heard of my distress; they rejoice at what you have done. May you bring the day you have announced so they may become like me."
Lamentations,1,22,“Let all their wickedness come before you; deal with them as you have dealt with me because of all my sins. My groans are many and my heart is faint.”
Lamentations,2,1,How the Lord has covered Daughter Zion with the cloud of his anger! He has hurled down the splendor of Israel from heaven to earth; he has not remembered his footstool in the day of his anger.
Lamentations,2,2,Without pity the Lord has swallowed up all the dwellings of Jacob; in his wrath he has torn down the strongholds of Daughter Judah. He has brought her kingdom and its princes down to the ground in dishonor.
Lamentations,2,3,In fierce anger he has cut off every horn of Israel. He has withdrawn his right hand at the approach of the enemy. He has burned in Jacob like a flaming fire that consumes everything around it.
Lamentations,2,4,Like an enemy he has strung his bow; his right hand is ready. Like a foe he has slain all who were pleasing to the eye; he has poured out his wrath like fire on the tent of Daughter Zion.
Lamentations,2,5,The Lord is like an enemy; he has swallowed up Israel. He has swallowed up all her palaces and destroyed her strongholds. He has multiplied mourning and lamentation for Daughter Judah.
Lamentations,2,6,He has laid waste his dwelling like a garden; he has destroyed his place of meeting. The LORD has made Zion forget her appointed festivals and her Sabbaths; in his fierce anger he has spurned both king and priest.
Lamentations,2,7,The Lord has rejected his altar and abandoned his sanctuary. He has given the walls of her palaces into the hands of the enemy; they have raised a shout in the house of the LORD as on the day of an appointed festival.
Lamentations,2,8,The LORD determined to tear down the wall around Daughter Zion. He stretched out a measuring line and did not withhold his hand from destroying. He made ramparts and walls lament; together they wasted away.
Lamentations,2,9,"Her gates have sunk into the ground; their bars he has broken and destroyed. Her king and her princes are exiled among the nations, the law is no more, and her prophets no longer find visions from the LORD."
Lamentations,2,10,The elders of Daughter Zion sit on the ground in silence; they have sprinkled dust on their heads and put on sackcloth. The young women of Jerusalem have bowed their heads to the ground.
Lamentations,2,11,"My eyes fail from weeping, I am in torment within; my heart is poured out on the ground because my people are destroyed, because children and infants faint in the streets of the city."
Lamentations,2,12,"They say to their mothers, “Where is bread and wine?” as they faint like the wounded in the streets of the city, as their lives ebb away in their mothers’ arms."
Lamentations,2,13,"What can I say for you? With what can I compare you, Daughter Jerusalem? To what can I liken you, that I may comfort you, Virgin Daughter Zion? Your wound is as deep as the sea. Who can heal you?"
Lamentations,2,14,The visions of your prophets were false and worthless; they did not expose your sin to ward off your captivity. The prophecies they gave you were false and misleading.
Lamentations,2,15,"All who pass your way clap their hands at you; they scoff and shake their heads at Daughter Jerusalem: “Is this the city that was called the perfection of beauty, the joy of the whole earth?”"
Lamentations,2,16,"All your enemies open their mouths wide against you; they scoff and gnash their teeth and say, “We have swallowed her up. This is the day we have waited for; we have lived to see it.”"
Lamentations,2,17,"The LORD has done what he planned; he has fulfilled his word, which he decreed long ago. He has overthrown you without pity, he has let the enemy gloat over you, he has exalted the horn of your foes."
Lamentations,2,18,"The hearts of the people cry out to the Lord. You walls of Daughter Zion, let your tears flow like a river day and night; give yourself no relief, your eyes no rest."
Lamentations,2,19,"Arise, cry out in the night, as the watches of the night begin; pour out your heart like water in the presence of the Lord. Lift up your hands to him for the lives of your children, who faint from hunger at every street corner."
Lamentations,2,20,"“Look, LORD, and consider: Whom have you ever treated like this? Should women eat their offspring, the children they have cared for? Should priest and prophet be killed in the sanctuary of the Lord?"
Lamentations,2,21,“Young and old lie together in the dust of the streets; my young men and young women have fallen by the sword. You have slain them in the day of your anger; you have slaughtered them without pity.
Lamentations,2,22,"“As you summon to a feast day, so you summoned against me terrors on every side. In the day of the LORD’s anger no one escaped or survived; those I cared for and reared my enemy has destroyed.”"
Lamentations,3,1,I am the man who has seen affliction by the rod of the LORD’s wrath.
Lamentations,3,2,He has driven me away and made me walk in darkness rather than light;
Lamentations,3,3,"indeed, he has turned his hand against me again and again, all day long."
Lamentations,3,4,He has made my skin and my flesh grow old and has broken my bones.
Lamentations,3,5,He has besieged me and surrounded me with bitterness and hardship.
Lamentations,3,6,He has made me dwell in darkness like those long dead.
Lamentations,3,7,He has walled me in so I cannot escape; he has weighed me down with chains.
Lamentations,3,8,"Even when I call out or cry for help, he shuts out my prayer."
Lamentations,3,9,He has barred my way with blocks of stone; he has made my paths crooked.
Lamentations,3,10,"Like a bear lying in wait, like a lion in hiding,"
Lamentations,3,11,he dragged me from the path and mangled me and left me without help.
Lamentations,3,12,He drew his bow and made me the target for his arrows.
Lamentations,3,13,He pierced my heart with arrows from his quiver.
Lamentations,3,14,I became the laughingstock of all my people; they mock me in song all day long.
Lamentations,3,15,He has filled me with bitter herbs and given me gall to drink.
Lamentations,3,16,He has broken my teeth with gravel; he has trampled me in the dust.
Lamentations,3,17,I have been deprived of peace; I have forgotten what prosperity is.
Lamentations,3,18,"So I say, “My splendor is gone and all that I had hoped from the LORD.”"
Lamentations,3,19,"I remember my affliction and my wandering, the bitterness and the gall."
Lamentations,3,20,"I well remember them, and my soul is downcast within me."
Lamentations,3,21,Yet this I call to mind and therefore I have hope:
Lamentations,3,22,"Because of the LORD’s great love we are not consumed, for his compassions never fail."
Lamentations,3,23,They are new every morning; great is your faithfulness.
Lamentations,3,24,"I say to myself, “The LORD is my portion; therefore I will wait for him.”"
Lamentations,3,25,"The LORD is good to those whose hope is in him, to the one who seeks him;"
Lamentations,3,26,it is good to wait quietly for the salvation of the LORD.
Lamentations,3,27,It is good for a man to bear the yoke while he is young.
Lamentations,3,28,"Let him sit alone in silence, for the LORD has laid it on him."
Lamentations,3,29,Let him bury his face in the dust— there may yet be hope.
Lamentations,3,30,"Let him offer his cheek to one who would strike him, and let him be filled with disgrace."
Lamentations,3,31,For no one is cast off by the Lord forever.
Lamentations,3,32,"Though he brings grief, he will show compassion, so great is his unfailing love."
Lamentations,3,33,For he does not willingly bring affliction or grief to anyone.
Lamentations,3,34,"To crush underfoot all prisoners in the land,"
Lamentations,3,35,"to deny people their rights before the Most High,"
Lamentations,3,36,to deprive them of justice— would not the Lord see such things?
Lamentations,3,37,Who can speak and have it happen if the Lord has not decreed it?
Lamentations,3,38,Is it not from the mouth of the Most High that both calamities and good things come?
Lamentations,3,39,Why should the living complain when punished for their sins?
Lamentations,3,40,"Let us examine our ways and test them, and let us return to the LORD."
Lamentations,3,41,"Let us lift up our hearts and our hands to God in heaven, and say:"
Lamentations,3,42,“We have sinned and rebelled and you have not forgiven.
Lamentations,3,43,“You have covered yourself with anger and pursued us; you have slain without pity.
Lamentations,3,44,You have covered yourself with a cloud so that no prayer can get through.
Lamentations,3,45,You have made us scum and refuse among the nations.
Lamentations,3,46,“All our enemies have opened their mouths wide against us.
Lamentations,3,47,"We have suffered terror and pitfalls, ruin and destruction.”"
Lamentations,3,48,Streams of tears flow from my eyes because my people are destroyed.
Lamentations,3,49,"My eyes will flow unceasingly, without relief,"
Lamentations,3,50,until the LORD looks down from heaven and sees.
Lamentations,3,51,What I see brings grief to my soul because of all the women of my city.
Lamentations,3,52,Those who were my enemies without cause hunted me like a bird.
Lamentations,3,53,They tried to end my life in a pit and threw stones at me;
Lamentations,3,54,"the waters closed over my head, and I thought I was about to perish."
Lamentations,3,55,"I called on your name, LORD, from the depths of the pit."
Lamentations,3,56,You heard my plea: “Do not close your ears to my cry for relief.”
Lamentations,3,57,"You came near when I called you, and you said, “Do not fear.”"
Lamentations,3,58,"You, Lord, took up my case; you redeemed my life."
Lamentations,3,59,"LORD, you have seen the wrong done to me. Uphold my cause!"
Lamentations,3,60,"You have seen the depth of their vengeance, all their plots against me."
Lamentations,3,61,"LORD, you have heard their insults, all their plots against me—"
Lamentations,3,62,what my enemies whisper and mutter against me all day long.
Lamentations,3,63,"Look at them! Sitting or standing, they mock me in their songs."
Lamentations,3,64,"Pay them back what they deserve, LORD, for what their hands have done."
Lamentations,3,65,"Put a veil over their hearts, and may your curse be on them!"
Lamentations,3,66,Pursue them in anger and destroy them from under the heavens of the LORD.
Lamentations,4,1,"How the gold has lost its luster, the fine gold become dull! The sacred gems are scattered at every street corner."
Lamentations,4,2,"How the precious children of Zion, once worth their weight in gold, are now considered as pots of clay, the work of a potter’s hands!"
Lamentations,4,3,"Even jackals offer their breasts to nurse their young, but my people have become heartless like ostriches in the desert."
Lamentations,4,4,"Because of thirst the infant’s tongue sticks to the roof of its mouth; the children beg for bread, but no one gives it to them."
Lamentations,4,5,Those who once ate delicacies are destitute in the streets. Those brought up in royal purple now lie on ash heaps.
Lamentations,4,6,"The punishment of my people is greater than that of Sodom, which was overthrown in a moment without a hand turned to help her."
Lamentations,4,7,"Their princes were brighter than snow and whiter than milk, their bodies more ruddy than rubies, their appearance like lapis lazuli."
Lamentations,4,8,But now they are blacker than soot; they are not recognized in the streets. Their skin has shriveled on their bones; it has become as dry as a stick.
Lamentations,4,9,"Those killed by the sword are better off than those who die of famine; racked with hunger, they waste away for lack of food from the field."
Lamentations,4,10,"With their own hands compassionate women have cooked their own children, who became their food when my people were destroyed."
Lamentations,4,11,The LORD has given full vent to his wrath; he has poured out his fierce anger. He kindled a fire in Zion that consumed her foundations.
Lamentations,4,12,"The kings of the earth did not believe, nor did any of the peoples of the world, that enemies and foes could enter the gates of Jerusalem."
Lamentations,4,13,"But it happened because of the sins of her prophets and the iniquities of her priests, who shed within her the blood of the righteous."
Lamentations,4,14,Now they grope through the streets as if they were blind. They are so defiled with blood that no one dares to touch their garments.
Lamentations,4,15,"“Go away! You are unclean!” people cry to them. “Away! Away! Don’t touch us!” When they flee and wander about, people among the nations say, “They can stay here no longer.”"
Lamentations,4,16,"The LORD himself has scattered them; he no longer watches over them. The priests are shown no honor, the elders no favor."
Lamentations,4,17,"Moreover, our eyes failed, looking in vain for help; from our towers we watched for a nation that could not save us."
Lamentations,4,18,"People stalked us at every step, so we could not walk in our streets. Our end was near, our days were numbered, for our end had come."
Lamentations,4,19,Our pursuers were swifter than eagles in the sky; they chased us over the mountains and lay in wait for us in the desert.
Lamentations,4,20,"The LORD’s anointed, our very life breath, was caught in their traps. We thought that under his shadow we would live among the nations."
Lamentations,4,21,"Rejoice and be glad, Daughter Edom, you who live in the land of Uz. But to you also the cup will be passed; you will be drunk and stripped naked."
Lamentations,4,22,"Your punishment will end, Daughter Zion; he will not prolong your exile. But he will punish your sin, Daughter Edom, and expose your wickedness."
Lamentations,5,1,"Remember, LORD, what has happened to us; look, and see our disgrace."
Lamentations,5,2,"Our inheritance has been turned over to strangers, our homes to foreigners."
Lamentations,5,3,"We have become fatherless, our mothers are widows."
Lamentations,5,4,We must buy the water we drink; our wood can be had only at a price.
Lamentations,5,5,Those who pursue us are at our heels; we are weary and find no rest.
Lamentations,5,6,We submitted to Egypt and Assyria to get enough bread.
Lamentations,5,7,"Our ancestors sinned and are no more, and we bear their punishment."
Lamentations,5,8,"Slaves rule over us, and there is no one to free us from their hands."
Lamentations,5,9,We get our bread at the risk of our lives because of the sword in the desert.
Lamentations,5,10,"Our skin is hot as an oven, feverish from hunger."
Lamentations,5,11,"Women have been violated in Zion, and virgins in the towns of Judah."
Lamentations,5,12,Princes have been hung up by their hands; elders are shown no respect.
Lamentations,5,13,Young men toil at the millstones; boys stagger under loads of wood.
Lamentations,5,14,The elders are gone from the city gate; the young men have stopped their music.
Lamentations,5,15,Joy is gone from our hearts; our dancing has turned to mourning.
Lamentations,5,16,"The crown has fallen from our head. Woe to us, for we have sinned!"
Lamentations,5,17,"Because of this our hearts are faint, because of these things our eyes grow dim"
Lamentations,5,18,"for Mount Zion, which lies desolate, with jackals prowling over it."
Lamentations,5,19,"You, LORD, reign forever; your throne endures from generation to generation."
Lamentations,5,20,Why do you always forget us? Why do you forsake us so long?
Lamentations,5,21,"Restore us to yourself, LORD, that we may return; renew our days as of old"
Lamentations,5,22,unless you have utterly rejected us and are angry with us beyond measure.
Ezekiel,1,1,"In my thirtieth year, in the fourth month on the fifth day, while I was among the exiles by the Kebar River, the heavens were opened and I saw visions of God."
Ezekiel,1,2,On the fifth of the month—it was the fifth year of the exile of King Jehoiachin—
Ezekiel,1,3,"the word of the LORD came to Ezekiel the priest, the son of Buzi, by the Kebar River in the land of the Babylonians. There the hand of the LORD was on him."
Ezekiel,1,4,"I looked, and I saw a windstorm coming out of the north—an immense cloud with flashing lightning and surrounded by brilliant light. The center of the fire looked like glowing metal,"
Ezekiel,1,5,"and in the fire was what looked like four living creatures. In appearance their form was human,"
Ezekiel,1,6,but each of them had four faces and four wings.
Ezekiel,1,7,Their legs were straight; their feet were like those of a calf and gleamed like burnished bronze.
Ezekiel,1,8,"Under their wings on their four sides they had human hands. All four of them had faces and wings,"
Ezekiel,1,9,and the wings of one touched the wings of another. Each one went straight ahead; they did not turn as they moved.
Ezekiel,1,10,"Their faces looked like this: Each of the four had the face of a human being, and on the right side each had the face of a lion, and on the left the face of an ox; each also had the face of an eagle."
Ezekiel,1,11,"Such were their faces. They each had two wings spreading out upward, each wing touching that of the creature on either side; and each had two other wings covering its body."
Ezekiel,1,12,"Each one went straight ahead. Wherever the spirit would go, they would go, without turning as they went."
Ezekiel,1,13,"The appearance of the living creatures was like burning coals of fire or like torches. Fire moved back and forth among the creatures; it was bright, and lightning flashed out of it."
Ezekiel,1,14,The creatures sped back and forth like flashes of lightning.
Ezekiel,1,15,"As I looked at the living creatures, I saw a wheel on the ground beside each creature with its four faces."
Ezekiel,1,16,"This was the appearance and structure of the wheels: They sparkled like topaz, and all four looked alike. Each appeared to be made like a wheel intersecting a wheel."
Ezekiel,1,17,"As they moved, they would go in any one of the four directions the creatures faced; the wheels did not change direction as the creatures went."
Ezekiel,1,18,"Their rims were high and awesome, and all four rims were full of eyes all around."
Ezekiel,1,19,"When the living creatures moved, the wheels beside them moved; and when the living creatures rose from the ground, the wheels also rose."
Ezekiel,1,20,"Wherever the spirit would go, they would go, and the wheels would rise along with them, because the spirit of the living creatures was in the wheels."
Ezekiel,1,21,"When the creatures moved, they also moved; when the creatures stood still, they also stood still; and when the creatures rose from the ground, the wheels rose along with them, because the spirit of the living creatures was in the wheels."
Ezekiel,1,22,"Spread out above the heads of the living creatures was what looked something like a vault, sparkling like crystal, and awesome."
Ezekiel,1,23,"Under the vault their wings were stretched out one toward the other, and each had two wings covering its body."
Ezekiel,1,24,"When the creatures moved, I heard the sound of their wings, like the roar of rushing waters, like the voice of the Almighty, like the tumult of an army. When they stood still, they lowered their wings."
Ezekiel,1,25,Then there came a voice from above the vault over their heads as they stood with lowered wings.
Ezekiel,1,26,"Above the vault over their heads was what looked like a throne of lapis lazuli, and high above on the throne was a figure like that of a man."
Ezekiel,1,27,"I saw that from what appeared to be his waist up he looked like glowing metal, as if full of fire, and that from there down he looked like fire; and brilliant light surrounded him."
Ezekiel,1,28,"Like the appearance of a rainbow in the clouds on a rainy day, so was the radiance around him. This was the appearance of the likeness of the glory of the LORD. When I saw it, I fell facedown, and I heard the voice of one speaking."
Ezekiel,2,1,"He said to me, “Son of man, stand up on your feet and I will speak to you.”"
Ezekiel,2,2,"As he spoke, the Spirit came into me and raised me to my feet, and I heard him speaking to me."
Ezekiel,2,3,"He said: “Son of man, I am sending you to the Israelites, to a rebellious nation that has rebelled against me; they and their ancestors have been in revolt against me to this very day."
