Daniel,1,13,"Then compare our appearance with that of the young men who eat the royal food, and treat your servants in accordance with what you see.”"
Daniel,1,14,So he agreed to this and tested them for ten days.
Daniel,1,15,At the end of the ten days they looked healthier and better nourished than any of the young men who ate the royal food.
Daniel,1,16,So the guard took away their choice food and the wine they were to drink and gave them vegetables instead.
Daniel,1,17,To these four young men God gave knowledge and understanding of all kinds of literature and learning. And Daniel could understand visions and dreams of all kinds.
Daniel,1,18,"At the end of the time set by the king to bring them into his service, the chief official presented them to Nebuchadnezzar."
Daniel,1,19,"The king talked with them, and he found none equal to Daniel, Hananiah, Mishael and Azariah; so they entered the king’s service."
Daniel,1,20,"In every matter of wisdom and understanding about which the king questioned them, he found them ten times better than all the magicians and enchanters in his whole kingdom."
Daniel,1,21,And Daniel remained there until the first year of King Cyrus.
Daniel,2,1,"In the second year of his reign, Nebuchadnezzar had dreams; his mind was troubled and he could not sleep."
Daniel,2,2,"So the king summoned the magicians, enchanters, sorcerers and astrologers to tell him what he had dreamed. When they came in and stood before the king,"
Daniel,2,3,"he said to them, “I have had a dream that troubles me and I want to know what it means.”"
Daniel,2,4,"Then the astrologers answered the king, “May the king live forever! Tell your servants the dream, and we will interpret it.”"
Daniel,2,5,"The king replied to the astrologers, “This is what I have firmly decided: If you do not tell me what my dream was and interpret it, I will have you cut into pieces and your houses turned into piles of rubble."
Daniel,2,6,"But if you tell me the dream and explain it, you will receive from me gifts and rewards and great honor. So tell me the dream and interpret it for me.”"
Daniel,2,7,"Once more they replied, “Let the king tell his servants the dream, and we will interpret it.”"
Daniel,2,8,"Then the king answered, “I am certain that you are trying to gain time, because you realize that this is what I have firmly decided:"
Daniel,2,9,"If you do not tell me the dream, there is only one penalty for you. You have conspired to tell me misleading and wicked things, hoping the situation will change. So then, tell me the dream, and I will know that you can interpret it for me.”"
Daniel,2,10,"The astrologers answered the king, “There is no one on earth who can do what the king asks! No king, however great and mighty, has ever asked such a thing of any magician or enchanter or astrologer."
Daniel,2,11,"What the king asks is too difficult. No one can reveal it to the king except the gods, and they do not live among humans.”"
Daniel,2,12,This made the king so angry and furious that he ordered the execution of all the wise men of Babylon.
Daniel,2,13,"So the decree was issued to put the wise men to death, and men were sent to look for Daniel and his friends to put them to death."
Daniel,2,14,"When Arioch, the commander of the king’s guard, had gone out to put to death the wise men of Babylon, Daniel spoke to him with wisdom and tact."
Daniel,2,15,"He asked the king’s officer, “Why did the king issue such a harsh decree?” Arioch then explained the matter to Daniel."
Daniel,2,16,"At this, Daniel went in to the king and asked for time, so that he might interpret the dream for him."
Daniel,2,17,"Then Daniel returned to his house and explained the matter to his friends Hananiah, Mishael and Azariah."
Daniel,2,18,"He urged them to plead for mercy from the God of heaven concerning this mystery, so that he and his friends might not be executed with the rest of the wise men of Babylon."
Daniel,2,19,During the night the mystery was revealed to Daniel in a vision. Then Daniel praised the God of heaven
Daniel,2,20,and said: “Praise be to the name of God for ever and ever; wisdom and power are his.
Daniel,2,21,He changes times and seasons; he deposes kings and raises up others. He gives wisdom to the wise and knowledge to the discerning.
Daniel,2,22,"He reveals deep and hidden things; he knows what lies in darkness, and light dwells with him."
Daniel,2,23,"I thank and praise you, God of my ancestors: You have given me wisdom and power, you have made known to me what we asked of you, you have made known to us the dream of the king.”"
Daniel,2,24,"Then Daniel went to Arioch, whom the king had appointed to execute the wise men of Babylon, and said to him, “Do not execute the wise men of Babylon. Take me to the king, and I will interpret his dream for him.”"
Daniel,2,25,"Arioch took Daniel to the king at once and said, “I have found a man among the exiles from Judah who can tell the king what his dream means.”"
Daniel,2,26,"The king asked Daniel (also called Belteshazzar), “Are you able to tell me what I saw in my dream and interpret it?”"
Daniel,2,27,"Daniel replied, “No wise man, enchanter, magician or diviner can explain to the king the mystery he has asked about,"
Daniel,2,28,but there is a God in heaven who reveals mysteries. He has shown King Nebuchadnezzar what will happen in days to come. Your dream and the visions that passed through your mind as you were lying in bed are these:
Daniel,2,29,"“As Your Majesty was lying there, your mind turned to things to come, and the revealer of mysteries showed you what is going to happen."
Daniel,2,30,"As for me, this mystery has been revealed to me, not because I have greater wisdom than anyone else alive, but so that Your Majesty may know the interpretation and that you may understand what went through your mind."
Daniel,2,31,"“Your Majesty looked, and there before you stood a large statue—an enormous, dazzling statue, awesome in appearance."
Daniel,2,32,"The head of the statue was made of pure gold, its chest and arms of silver, its belly and thighs of bronze,"
Daniel,2,33,"its legs of iron, its feet partly of iron and partly of baked clay."
Daniel,2,34,"While you were watching, a rock was cut out, but not by human hands. It struck the statue on its feet of iron and clay and smashed them."
Daniel,2,35,"Then the iron, the clay, the bronze, the silver and the gold were all broken to pieces and became like chaff on a threshing floor in the summer. The wind swept them away without leaving a trace. But the rock that struck the statue became a huge mountain and filled the whole earth."
Daniel,2,36,"“This was the dream, and now we will interpret it to the king."
Daniel,2,37,"Your Majesty, you are the king of kings. The God of heaven has given you dominion and power and might and glory;"
Daniel,2,38,"in your hands he has placed all mankind and the beasts of the field and the birds in the sky. Wherever they live, he has made you ruler over them all. You are that head of gold."
Daniel,2,39,"“After you, another kingdom will arise, inferior to yours. Next, a third kingdom, one of bronze, will rule over the whole earth."
Daniel,2,40,"Finally, there will be a fourth kingdom, strong as iron—for iron breaks and smashes everything—and as iron breaks things to pieces, so it will crush and break all the others."
Daniel,2,41,"Just as you saw that the feet and toes were partly of baked clay and partly of iron, so this will be a divided kingdom; yet it will have some of the strength of iron in it, even as you saw iron mixed with clay."
Daniel,2,42,"As the toes were partly iron and partly clay, so this kingdom will be partly strong and partly brittle."
Daniel,2,43,"And just as you saw the iron mixed with baked clay, so the people will be a mixture and will not remain united, any more than iron mixes with clay."
Daniel,2,44,"“In the time of those kings, the God of heaven will set up a kingdom that will never be destroyed, nor will it be left to another people. It will crush all those kingdoms and bring them to an end, but it will itself endure forever."
Daniel,2,45,"This is the meaning of the vision of the rock cut out of a mountain, but not by human hands—a rock that broke the iron, the bronze, the clay, the silver and the gold to pieces. “The great God has shown the king what will take place in the future. The dream is true and its interpretation is trustworthy.”"
Daniel,2,46,Then King Nebuchadnezzar fell prostrate before Daniel and paid him honor and ordered that an offering and incense be presented to him.
Daniel,2,47,"The king said to Daniel, “Surely your God is the God of gods and the Lord of kings and a revealer of mysteries, for you were able to reveal this mystery.”"
Daniel,2,48,Then the king placed Daniel in a high position and lavished many gifts on him. He made him ruler over the entire province of Babylon and placed him in charge of all its wise men.
Daniel,2,49,"Moreover, at Daniel’s request the king appointed Shadrach, Meshach and Abednego administrators over the province of Babylon, while Daniel himself remained at the royal court."
Daniel,3,1,"King Nebuchadnezzar made an image of gold, sixty cubits high and six cubits wide, and set it up on the plain of Dura in the province of Babylon."
Daniel,3,2,"He then summoned the satraps, prefects, governors, advisers, treasurers, judges, magistrates and all the other provincial officials to come to the dedication of the image he had set up."
Daniel,3,3,"So the satraps, prefects, governors, advisers, treasurers, judges, magistrates and all the other provincial officials assembled for the dedication of the image that King Nebuchadnezzar had set up, and they stood before it."
Daniel,3,4,"Then the herald loudly proclaimed, “Nations and peoples of every language, this is what you are commanded to do:"
Daniel,3,5,"As soon as you hear the sound of the horn, flute, zither, lyre, harp, pipe and all kinds of music, you must fall down and worship the image of gold that King Nebuchadnezzar has set up."
Daniel,3,6,Whoever does not fall down and worship will immediately be thrown into a blazing furnace.”
Daniel,3,7,"Therefore, as soon as they heard the sound of the horn, flute, zither, lyre, harp and all kinds of music, all the nations and peoples of every language fell down and worshiped the image of gold that King Nebuchadnezzar had set up."
Daniel,3,8,At this time some astrologers came forward and denounced the Jews.
Daniel,3,9,"They said to King Nebuchadnezzar, “May the king live forever!"
Daniel,3,10,"Your Majesty has issued a decree that everyone who hears the sound of the horn, flute, zither, lyre, harp, pipe and all kinds of music must fall down and worship the image of gold,"
Daniel,3,11,and that whoever does not fall down and worship will be thrown into a blazing furnace.
Daniel,3,12,"But there are some Jews whom you have set over the affairs of the province of Babylon—Shadrach, Meshach and Abednego—who pay no attention to you, Your Majesty. They neither serve your gods nor worship the image of gold you have set up.”"
Daniel,3,13,"Furious with rage, Nebuchadnezzar summoned Shadrach, Meshach and Abednego. So these men were brought before the king,"
Daniel,3,14,"and Nebuchadnezzar said to them, “Is it true, Shadrach, Meshach and Abednego, that you do not serve my gods or worship the image of gold I have set up?"
Daniel,3,15,"Now when you hear the sound of the horn, flute, zither, lyre, harp, pipe and all kinds of music, if you are ready to fall down and worship the image I made, very good. But if you do not worship it, you will be thrown immediately into a blazing furnace. Then what god will be able to rescue you from my hand?”"
Daniel,3,16,"Shadrach, Meshach and Abednego replied to him, “King Nebuchadnezzar, we do not need to defend ourselves before you in this matter."
Daniel,3,17,"If we are thrown into the blazing furnace, the God we serve is able to deliver us from it, and he will deliver us from Your Majesty’s hand."
Daniel,3,18,"But even if he does not, we want you to know, Your Majesty, that we will not serve your gods or worship the image of gold you have set up.”"
Daniel,3,19,"Then Nebuchadnezzar was furious with Shadrach, Meshach and Abednego, and his attitude toward them changed. He ordered the furnace heated seven times hotter than usual"
Daniel,3,20,"and commanded some of the strongest soldiers in his army to tie up Shadrach, Meshach and Abednego and throw them into the blazing furnace."
Daniel,3,21,"So these men, wearing their robes, trousers, turbans and other clothes, were bound and thrown into the blazing furnace."
Daniel,3,22,"The king’s command was so urgent and the furnace so hot that the flames of the fire killed the soldiers who took up Shadrach, Meshach and Abednego,"
Daniel,3,23,"and these three men, firmly tied, fell into the blazing furnace."
Daniel,3,24,"Then King Nebuchadnezzar leaped to his feet in amazement and asked his advisers, “Weren’t there three men that we tied up and threw into the fire?” They replied, “Certainly, Your Majesty.”"
Daniel,3,25,"He said, “Look! I see four men walking around in the fire, unbound and unharmed, and the fourth looks like a son of the gods.”"
Daniel,3,26,"Nebuchadnezzar then approached the opening of the blazing furnace and shouted, “Shadrach, Meshach and Abednego, servants of the Most High God, come out! Come here!” So Shadrach, Meshach and Abednego came out of the fire,"
Daniel,3,27,"and the satraps, prefects, governors and royal advisers crowded around them. They saw that the fire had not harmed their bodies, nor was a hair of their heads singed; their robes were not scorched, and there was no smell of fire on them."
Daniel,3,28,"Then Nebuchadnezzar said, “Praise be to the God of Shadrach, Meshach and Abednego, who has sent his angel and rescued his servants! They trusted in him and defied the king’s command and were willing to give up their lives rather than serve or worship any god except their own God."
Daniel,3,29,"Therefore I decree that the people of any nation or language who say anything against the God of Shadrach, Meshach and Abednego be cut into pieces and their houses be turned into piles of rubble, for no other god can save in this way.”"
Daniel,3,30,"Then the king promoted Shadrach, Meshach and Abednego in the province of Babylon."
Daniel,4,1,"King Nebuchadnezzar, To the nations and peoples of every language, who live in all the earth: May you prosper greatly!"
Daniel,4,2,It is my pleasure to tell you about the miraculous signs and wonders that the Most High God has performed for me.
Daniel,4,3,"How great are his signs, how mighty his wonders! His kingdom is an eternal kingdom; his dominion endures from generation to generation."
Daniel,4,4,"I, Nebuchadnezzar, was at home in my palace, contented and prosperous."
Daniel,4,5,"I had a dream that made me afraid. As I was lying in bed, the images and visions that passed through my mind terrified me."
Daniel,4,6,So I commanded that all the wise men of Babylon be brought before me to interpret the dream for me.
Daniel,4,7,"When the magicians, enchanters, astrologers and diviners came, I told them the dream, but they could not interpret it for me."
Daniel,4,8,"Finally, Daniel came into my presence and I told him the dream. (He is called Belteshazzar, after the name of my god, and the spirit of the holy gods is in him.)"
Daniel,4,9,"I said, “Belteshazzar, chief of the magicians, I know that the spirit of the holy gods is in you, and no mystery is too difficult for you. Here is my dream; interpret it for me."
Daniel,4,10,"These are the visions I saw while lying in bed: I looked, and there before me stood a tree in the middle of the land. Its height was enormous."
Daniel,4,11,The tree grew large and strong and its top touched the sky; it was visible to the ends of the earth.
Daniel,4,12,"Its leaves were beautiful, its fruit abundant, and on it was food for all. Under it the wild animals found shelter, and the birds lived in its branches; from it every creature was fed."
Daniel,4,13,"“In the visions I saw while lying in bed, I looked, and there before me was a holy one, a messenger, coming down from heaven."
Daniel,4,14,He called in a loud voice: ‘Cut down the tree and trim off its branches; strip off its leaves and scatter its fruit. Let the animals flee from under it and the birds from its branches.
Daniel,4,15,"But let the stump and its roots, bound with iron and bronze, remain in the ground, in the grass of the field. “‘Let him be drenched with the dew of heaven, and let him live with the animals among the plants of the earth."
Daniel,4,16,"Let his mind be changed from that of a man and let him be given the mind of an animal, till seven times pass by for him."
Daniel,4,17,"“‘The decision is announced by messengers, the holy ones declare the verdict, so that the living may know that the Most High is sovereign over all kingdoms on earth and gives them to anyone he wishes and sets over them the lowliest of people.’"
Daniel,4,18,"“This is the dream that I, King Nebuchadnezzar, had. Now, Belteshazzar, tell me what it means, for none of the wise men in my kingdom can interpret it for me. But you can, because the spirit of the holy gods is in you.”"
Daniel,4,19,"Then Daniel (also called Belteshazzar) was greatly perplexed for a time, and his thoughts terrified him. So the king said, “Belteshazzar, do not let the dream or its meaning alarm you.” Belteshazzar answered, “My lord, if only the dream applied to your enemies and its meaning to your adversaries!"
Daniel,4,20,"The tree you saw, which grew large and strong, with its top touching the sky, visible to the whole earth,"
Daniel,4,21,"with beautiful leaves and abundant fruit, providing food for all, giving shelter to the wild animals, and having nesting places in its branches for the birds—"
Daniel,4,22,"Your Majesty, you are that tree! You have become great and strong; your greatness has grown until it reaches the sky, and your dominion extends to distant parts of the earth."
Daniel,4,23,"“Your Majesty saw a holy one, a messenger, coming down from heaven and saying, ‘Cut down the tree and destroy it, but leave the stump, bound with iron and bronze, in the grass of the field, while its roots remain in the ground. Let him be drenched with the dew of heaven; let him live with the wild animals, until seven times pass by for him.’"
Daniel,4,24,"“This is the interpretation, Your Majesty, and this is the decree the Most High has issued against my lord the king:"
Daniel,4,25,You will be driven away from people and will live with the wild animals; you will eat grass like the ox and be drenched with the dew of heaven. Seven times will pass by for you until you acknowledge that the Most High is sovereign over all kingdoms on earth and gives them to anyone he wishes.
Daniel,4,26,The command to leave the stump of the tree with its roots means that your kingdom will be restored to you when you acknowledge that Heaven rules.
Daniel,4,27,"Therefore, Your Majesty, be pleased to accept my advice: Renounce your sins by doing what is right, and your wickedness by being kind to the oppressed. It may be that then your prosperity will continue.”"
Daniel,4,28,All this happened to King Nebuchadnezzar.
Daniel,4,29,"Twelve months later, as the king was walking on the roof of the royal palace of Babylon,"
Daniel,4,30,"he said, “Is not this the great Babylon I have built as the royal residence, by my mighty power and for the glory of my majesty?”"
Daniel,4,31,"Even as the words were on his lips, a voice came from heaven, “This is what is decreed for you, King Nebuchadnezzar: Your royal authority has been taken from you."
Daniel,4,32,You will be driven away from people and will live with the wild animals; you will eat grass like the ox. Seven times will pass by for you until you acknowledge that the Most High is sovereign over all kingdoms on earth and gives them to anyone he wishes.”
Daniel,4,33,Immediately what had been said about Nebuchadnezzar was fulfilled. He was driven away from people and ate grass like the ox. His body was drenched with the dew of heaven until his hair grew like the feathers of an eagle and his nails like the claws of a bird.
Daniel,4,34,"At the end of that time, I, Nebuchadnezzar, raised my eyes toward heaven, and my sanity was restored. Then I praised the Most High; I honored and glorified him who lives forever. His dominion is an eternal dominion; his kingdom endures from generation to generation."
Daniel,4,35,All the peoples of the earth are regarded as nothing. He does as he pleases with the powers of heaven and the peoples of the earth. No one can hold back his hand or say to him: “What have you done?”
Daniel,4,36,"At the same time that my sanity was restored, my honor and splendor were returned to me for the glory of my kingdom. My advisers and nobles sought me out, and I was restored to my throne and became even greater than before."
Daniel,4,37,"Now I, Nebuchadnezzar, praise and exalt and glorify the King of heaven, because everything he does is right and all his ways are just. And those who walk in pride he is able to humble."
Daniel,5,1,King Belshazzar gave a great banquet for a thousand of his nobles and drank wine with them.
Daniel,5,2,"While Belshazzar was drinking his wine, he gave orders to bring in the gold and silver goblets that Nebuchadnezzar his father had taken from the temple in Jerusalem, so that the king and his nobles, his wives and his concubines might drink from them."
Daniel,5,3,"So they brought in the gold goblets that had been taken from the temple of God in Jerusalem, and the king and his nobles, his wives and his concubines drank from them."
Daniel,5,4,"As they drank the wine, they praised the gods of gold and silver, of bronze, iron, wood and stone."
Daniel,5,5,"Suddenly the fingers of a human hand appeared and wrote on the plaster of the wall, near the lampstand in the royal palace. The king watched the hand as it wrote."
Daniel,5,6,His face turned pale and he was so frightened that his legs became weak and his knees were knocking.
Daniel,5,7,"The king summoned the enchanters, astrologers and diviners. Then he said to these wise men of Babylon, “Whoever reads this writing and tells me what it means will be clothed in purple and have a gold chain placed around his neck, and he will be made the third highest ruler in the kingdom.”"
Daniel,5,8,"Then all the king’s wise men came in, but they could not read the writing or tell the king what it meant."
Daniel,5,9,So King Belshazzar became even more terrified and his face grew more pale. His nobles were baffled.
Daniel,5,10,"The queen, hearing the voices of the king and his nobles, came into the banquet hall. “May the king live forever!” she said. “Don’t be alarmed! Don’t look so pale!"
Daniel,5,11,"There is a man in your kingdom who has the spirit of the holy gods in him. In the time of your father he was found to have insight and intelligence and wisdom like that of the gods. Your father, King Nebuchadnezzar, appointed him chief of the magicians, enchanters, astrologers and diviners."
Daniel,5,12,"He did this because Daniel, whom the king called Belteshazzar, was found to have a keen mind and knowledge and understanding, and also the ability to interpret dreams, explain riddles and solve difficult problems. Call for Daniel, and he will tell you what the writing means.”"
Daniel,5,13,"So Daniel was brought before the king, and the king said to him, “Are you Daniel, one of the exiles my father the king brought from Judah?"
Daniel,5,14,"I have heard that the spirit of the gods is in you and that you have insight, intelligence and outstanding wisdom."
Daniel,5,15,"The wise men and enchanters were brought before me to read this writing and tell me what it means, but they could not explain it."
Daniel,5,16,"Now I have heard that you are able to give interpretations and to solve difficult problems. If you can read this writing and tell me what it means, you will be clothed in purple and have a gold chain placed around your neck, and you will be made the third highest ruler in the kingdom.”"
Daniel,5,17,"Then Daniel answered the king, “You may keep your gifts for yourself and give your rewards to someone else. Nevertheless, I will read the writing for the king and tell him what it means."
Daniel,5,18,"“Your Majesty, the Most High God gave your father Nebuchadnezzar sovereignty and greatness and glory and splendor."
Daniel,5,19,"Because of the high position he gave him, all the nations and peoples of every language dreaded and feared him. Those the king wanted to put to death, he put to death; those he wanted to spare, he spared; those he wanted to promote, he promoted; and those he wanted to humble, he humbled."
Daniel,5,20,"But when his heart became arrogant and hardened with pride, he was deposed from his royal throne and stripped of his glory."
Daniel,5,21,"He was driven away from people and given the mind of an animal; he lived with the wild donkeys and ate grass like the ox; and his body was drenched with the dew of heaven, until he acknowledged that the Most High God is sovereign over all kingdoms on earth and sets over them anyone he wishes."
Daniel,5,22,"“But you, Belshazzar, his son, have not humbled yourself, though you knew all this."
Daniel,5,23,"Instead, you have set yourself up against the Lord of heaven. You had the goblets from his temple brought to you, and you and your nobles, your wives and your concubines drank wine from them. You praised the gods of silver and gold, of bronze, iron, wood and stone, which cannot see or hear or understand. But you did not honor the God who holds in his hand your life and all your ways."
Daniel,5,24,Therefore he sent the hand that wrote the inscription.
