Psalm,120,1,"A song of ascents. I call on the LORD in my distress, and he answers me."
Psalm,120,2,"Save me, LORD, from lying lips and from deceitful tongues."
Psalm,120,3,"What will he do to you, and what more besides, you deceitful tongue?"
Psalm,120,4,"He will punish you with a warrior’s sharp arrows, with burning coals of the broom bush."
Psalm,120,5,"Woe to me that I dwell in Meshek, that I live among the tents of Kedar!"
Psalm,120,6,Too long have I lived among those who hate peace.
Psalm,120,7,"I am for peace; but when I speak, they are for war."
Psalm,121,1,A song of ascents. I lift up my eyes to the mountains— where does my help come from?
Psalm,121,2,"My help comes from the LORD, the Maker of heaven and earth."
Psalm,121,3,He will not let your foot slip— he who watches over you will not slumber;
Psalm,121,4,"indeed, he who watches over Israel will neither slumber nor sleep."
Psalm,121,5,The LORD watches over you— the LORD is your shade at your right hand;
Psalm,121,6,"the sun will not harm you by day, nor the moon by night."
Psalm,121,7,The LORD will keep you from all harm— he will watch over your life;
Psalm,121,8,the LORD will watch over your coming and going both now and forevermore.
Psalm,122,1,"A song of ascents. Of David. I rejoiced with those who said to me, “Let us go to the house of the LORD.”"
Psalm,122,2,"Our feet are standing in your gates, Jerusalem."
Psalm,122,3,Jerusalem is built like a city that is closely compacted together.
Psalm,122,4,That is where the tribes go up— the tribes of the LORD— to praise the name of the LORD according to the statute given to Israel.
Psalm,122,5,"There stand the thrones for judgment, the thrones of the house of David."
Psalm,122,6,Pray for the peace of Jerusalem: “May those who love you be secure.
Psalm,122,7,May there be peace within your walls and security within your citadels.”
Psalm,122,8,"For the sake of my family and friends, I will say, “Peace be within you.”"
Psalm,122,9,"For the sake of the house of the LORD our God, I will seek your prosperity."
Psalm,123,1,"A song of ascents. I lift up my eyes to you, to you who sit enthroned in heaven."
Psalm,123,2,"As the eyes of slaves look to the hand of their master, as the eyes of a female slave look to the hand of her mistress, so our eyes look to the LORD our God, till he shows us his mercy."
Psalm,123,3,"Have mercy on us, LORD, have mercy on us, for we have endured no end of contempt."
Psalm,123,4,"We have endured no end of ridicule from the arrogant, of contempt from the proud."
Psalm,124,1,A song of ascents. Of David. If the LORD had not been on our side— let Israel say—
Psalm,124,2,"if the LORD had not been on our side when people attacked us,"
Psalm,124,3,they would have swallowed us alive when their anger flared against us;
Psalm,124,4,"the flood would have engulfed us, the torrent would have swept over us,"
Psalm,124,5,the raging waters would have swept us away.
Psalm,124,6,"Praise be to the LORD, who has not let us be torn by their teeth."
Psalm,124,7,"We have escaped like a bird from the fowler’s snare; the snare has been broken, and we have escaped."
Psalm,124,8,"Our help is in the name of the LORD, the Maker of heaven and earth."
Psalm,125,1,"A song of ascents. Those who trust in the LORD are like Mount Zion, which cannot be shaken but endures forever."
Psalm,125,2,"As the mountains surround Jerusalem, so the LORD surrounds his people both now and forevermore."
Psalm,125,3,"The scepter of the wicked will not remain over the land allotted to the righteous, for then the righteous might use their hands to do evil."
Psalm,125,4,"LORD, do good to those who are good, to those who are upright in heart."
Psalm,125,5,But those who turn to crooked ways the LORD will banish with the evildoers. Peace be on Israel.
Psalm,126,1,"A song of ascents. When the LORD restored the fortunes of Zion, we were like those who dreamed."
Psalm,126,2,"Our mouths were filled with laughter, our tongues with songs of joy. Then it was said among the nations, “The LORD has done great things for them.”"
Psalm,126,3,"The LORD has done great things for us, and we are filled with joy."
Psalm,126,4,"Restore our fortunes, LORD, like streams in the Negev."
Psalm,126,5,Those who sow with tears will reap with songs of joy.
Psalm,126,6,"Those who go out weeping, carrying seed to sow, will return with songs of joy, carrying sheaves with them."
Psalm,127,1,"A song of ascents. Of Solomon. Unless the LORD builds the house, the builders labor in vain. Unless the LORD watches over the city, the guards stand watch in vain."
Psalm,127,2,"In vain you rise early and stay up late, toiling for food to eat— for he grants sleep to those he loves."
Psalm,127,3,"Children are a heritage from the LORD, offspring a reward from him."
Psalm,127,4,Like arrows in the hands of a warrior are children born in one’s youth.
Psalm,127,5,Blessed is the man whose quiver is full of them. They will not be put to shame when they contend with their opponents in court.
Psalm,128,1,"A song of ascents. Blessed are all who fear the LORD, who walk in obedience to him."
Psalm,128,2,You will eat the fruit of your labor; blessings and prosperity will be yours.
Psalm,128,3,Your wife will be like a fruitful vine within your house; your children will be like olive shoots around your table.
Psalm,128,4,"Yes, this will be the blessing for the man who fears the LORD."
Psalm,128,5,May the LORD bless you from Zion; may you see the prosperity of Jerusalem all the days of your life.
Psalm,128,6,May you live to see your children’s children— peace be on Israel.
Psalm,129,1,"A song of ascents. “They have greatly oppressed me from my youth,” let Israel say;"
Psalm,129,2,"“they have greatly oppressed me from my youth, but they have not gained the victory over me."
Psalm,129,3,Plowmen have plowed my back and made their furrows long.
Psalm,129,4,But the LORD is righteous; he has cut me free from the cords of the wicked.”
Psalm,129,5,May all who hate Zion be turned back in shame.
Psalm,129,6,"May they be like grass on the roof, which withers before it can grow;"
Psalm,129,7,"a reaper cannot fill his hands with it, nor one who gathers fill his arms."
Psalm,129,8,"May those who pass by not say to them, “The blessing of the LORD be on you; we bless you in the name of the LORD.”"
Psalm,130,1,"A song of ascents. Out of the depths I cry to you, LORD;"
Psalm,130,2,"Lord, hear my voice. Let your ears be attentive to my cry for mercy."
Psalm,130,3,"If you, LORD, kept a record of sins, Lord, who could stand?"
Psalm,130,4,"But with you there is forgiveness, so that we can, with reverence, serve you."
Psalm,130,5,"I wait for the LORD, my whole being waits, and in his word I put my hope."
Psalm,130,6,"I wait for the Lord more than watchmen wait for the morning, more than watchmen wait for the morning."
Psalm,130,7,"Israel, put your hope in the LORD, for with the LORD is unfailing love and with him is full redemption."
Psalm,130,8,He himself will redeem Israel from all their sins.
Psalm,131,1,"A song of ascents. Of David. My heart is not proud, LORD, my eyes are not haughty; I do not concern myself with great matters or things too wonderful for me."
Psalm,131,2,"But I have calmed and quieted myself, I am like a weaned child with its mother; like a weaned child I am content."
Psalm,131,3,"Israel, put your hope in the LORD both now and forevermore."
Psalm,132,1,"A song of ascents. LORD, remember David and all his self-denial."
Psalm,132,2,"He swore an oath to the LORD, he made a vow to the Mighty One of Jacob:"
Psalm,132,3,"“I will not enter my house or go to my bed,"
Psalm,132,4,"I will allow no sleep to my eyes or slumber to my eyelids,"
Psalm,132,5,"till I find a place for the LORD, a dwelling for the Mighty One of Jacob.”"
Psalm,132,6,"We heard it in Ephrathah, we came upon it in the fields of Jaar:"
Psalm,132,7,"“Let us go to his dwelling place, let us worship at his footstool, saying,"
Psalm,132,8,"‘Arise, LORD, and come to your resting place, you and the ark of your might."
Psalm,132,9,May your priests be clothed with your righteousness; may your faithful people sing for joy.’”
Psalm,132,10,"For the sake of your servant David, do not reject your anointed one."
Psalm,132,11,"The LORD swore an oath to David, a sure oath he will not revoke: “One of your own descendants I will place on your throne."
Psalm,132,12,"If your sons keep my covenant and the statutes I teach them, then their sons will sit on your throne for ever and ever.”"
Psalm,132,13,"For the LORD has chosen Zion, he has desired it for his dwelling, saying,"
Psalm,132,14,"“This is my resting place for ever and ever; here I will sit enthroned, for I have desired it."
Psalm,132,15,I will bless her with abundant provisions; her poor I will satisfy with food.
Psalm,132,16,"I will clothe her priests with salvation, and her faithful people will ever sing for joy."
Psalm,132,17,“Here I will make a horn grow for David and set up a lamp for my anointed one.
Psalm,132,18,"I will clothe his enemies with shame, but his head will be adorned with a radiant crown.”"
Psalm,133,1,A song of ascents. Of David. How good and pleasant it is when God’s people live together in unity!
Psalm,133,2,"It is like precious oil poured on the head, running down on the beard, running down on Aaron’s beard, down on the collar of his robe."
Psalm,133,3,"It is as if the dew of Hermon were falling on Mount Zion. For there the LORD bestows his blessing, even life forevermore."
Psalm,134,1,"A song of ascents. Praise the LORD, all you servants of the LORD who minister by night in the house of the LORD."
Psalm,134,2,Lift up your hands in the sanctuary and praise the LORD.
Psalm,134,3,"May the LORD bless you from Zion, he who is the Maker of heaven and earth."
Psalm,135,1,"Praise the LORD. Praise the name of the LORD; praise him, you servants of the LORD,"
Psalm,135,2,"you who minister in the house of the LORD, in the courts of the house of our God."
Psalm,135,3,"Praise the LORD, for the LORD is good; sing praise to his name, for that is pleasant."
Psalm,135,4,"For the LORD has chosen Jacob to be his own, Israel to be his treasured possession."
Psalm,135,5,"I know that the LORD is great, that our Lord is greater than all gods."
Psalm,135,6,"The LORD does whatever pleases him, in the heavens and on the earth, in the seas and all their depths."
Psalm,135,7,He makes clouds rise from the ends of the earth; he sends lightning with the rain and brings out the wind from his storehouses.
Psalm,135,8,"He struck down the firstborn of Egypt, the firstborn of people and animals."
Psalm,135,9,"He sent his signs and wonders into your midst, Egypt, against Pharaoh and all his servants."
Psalm,135,10,He struck down many nations and killed mighty kings—
Psalm,135,11,"Sihon king of the Amorites, Og king of Bashan, and all the kings of Canaan—"
Psalm,135,12,"and he gave their land as an inheritance, an inheritance to his people Israel."
Psalm,135,13,"Your name, LORD, endures forever, your renown, LORD, through all generations."
Psalm,135,14,For the LORD will vindicate his people and have compassion on his servants.
Psalm,135,15,"The idols of the nations are silver and gold, made by human hands."
Psalm,135,16,"They have mouths, but cannot speak, eyes, but cannot see."
Psalm,135,17,"They have ears, but cannot hear, nor is there breath in their mouths."
Psalm,135,18,"Those who make them will be like them, and so will all who trust in them."
Psalm,135,19,"All you Israelites, praise the LORD; house of Aaron, praise the LORD;"
Psalm,135,20,"house of Levi, praise the LORD; you who fear him, praise the LORD."
Psalm,135,21,"Praise be to the LORD from Zion, to him who dwells in Jerusalem. Praise the LORD."
Psalm,136,1,"Give thanks to the LORD, for he is good. His love endures forever."
Psalm,136,2,Give thanks to the God of gods. His love endures forever.
Psalm,136,3,Give thanks to the Lord of lords: His love endures forever.
Psalm,136,4,"to him who alone does great wonders, His love endures forever."
Psalm,136,5,"who by his understanding made the heavens, His love endures forever."
Psalm,136,6,"who spread out the earth upon the waters, His love endures forever."
Psalm,136,7,who made the great lights— His love endures forever.
Psalm,136,8,"the sun to govern the day, His love endures forever."
Psalm,136,9,the moon and stars to govern the night; His love endures forever.
Psalm,136,10,to him who struck down the firstborn of Egypt His love endures forever.
Psalm,136,11,and brought Israel out from among them His love endures forever.
Psalm,136,12,with a mighty hand and outstretched arm; His love endures forever.
Psalm,136,13,to him who divided the Red Sea asunder His love endures forever.
Psalm,136,14,"and brought Israel through the midst of it, His love endures forever."
Psalm,136,15,but swept Pharaoh and his army into the Red Sea; His love endures forever.
Psalm,136,16,to him who led his people through the wilderness; His love endures forever.
Psalm,136,17,"to him who struck down great kings, His love endures forever."
Psalm,136,18,and killed mighty kings— His love endures forever.
Psalm,136,19,Sihon king of the Amorites His love endures forever.
Psalm,136,20,and Og king of Bashan— His love endures forever.
Psalm,136,21,"and gave their land as an inheritance, His love endures forever."
Psalm,136,22,an inheritance to his servant Israel. His love endures forever.
Psalm,136,23,He remembered us in our low estate His love endures forever.
Psalm,136,24,and freed us from our enemies. His love endures forever.
Psalm,136,25,He gives food to every creature. His love endures forever.
Psalm,136,26,Give thanks to the God of heaven. His love endures forever.
Psalm,137,1,By the rivers of Babylon we sat and wept when we remembered Zion.
Psalm,137,2,"There on the poplars we hung our harps,"
Psalm,137,3,"for there our captors asked us for songs, our tormentors demanded songs of joy; they said, “Sing us one of the songs of Zion!”"
Psalm,137,4,How can we sing the songs of the LORD while in a foreign land?
Psalm,137,5,"If I forget you, Jerusalem, may my right hand forget its skill."
Psalm,137,6,"May my tongue cling to the roof of my mouth if I do not remember you, if I do not consider Jerusalem my highest joy."
Psalm,137,7,"Remember, LORD, what the Edomites did on the day Jerusalem fell. “Tear it down,” they cried, “tear it down to its foundations!”"
Psalm,137,8,"Daughter Babylon, doomed to destruction, happy is the one who repays you according to what you have done to us."
Psalm,137,9,Happy is the one who seizes your infants and dashes them against the rocks.
Psalm,138,1,"Of David. I will praise you, LORD, with all my heart; before the “gods” I will sing your praise."
Psalm,138,2,"I will bow down toward your holy temple and will praise your name for your unfailing love and your faithfulness, for you have so exalted your solemn decree that it surpasses your fame."
Psalm,138,3,"When I called, you answered me; you greatly emboldened me."
Psalm,138,4,"May all the kings of the earth praise you, LORD, when they hear what you have decreed."
Psalm,138,5,"May they sing of the ways of the LORD, for the glory of the LORD is great."
Psalm,138,6,"Though the LORD is exalted, he looks kindly on the lowly; though lofty, he sees them from afar."
Psalm,138,7,"Though I walk in the midst of trouble, you preserve my life. You stretch out your hand against the anger of my foes; with your right hand you save me."
Psalm,138,8,"The LORD will vindicate me; your love, LORD, endures forever— do not abandon the works of your hands."
Psalm,139,1,"For the director of music. Of David. A psalm. You have searched me, LORD, and you know me."
Psalm,139,2,You know when I sit and when I rise; you perceive my thoughts from afar.
Psalm,139,3,You discern my going out and my lying down; you are familiar with all my ways.
Psalm,139,4,"Before a word is on my tongue you, LORD, know it completely."
Psalm,139,5,"You hem me in behind and before, and you lay your hand upon me."
Psalm,139,6,"Such knowledge is too wonderful for me, too lofty for me to attain."
Psalm,139,7,Where can I go from your Spirit? Where can I flee from your presence?
Psalm,139,8,"If I go up to the heavens, you are there; if I make my bed in the depths, you are there."
Psalm,139,9,"If I rise on the wings of the dawn, if I settle on the far side of the sea,"
Psalm,139,10,"even there your hand will guide me, your right hand will hold me fast."
Psalm,139,11,"If I say, “Surely the darkness will hide me and the light become night around me,”"
Psalm,139,12,"even the darkness will not be dark to you; the night will shine like the day, for darkness is as light to you."
Psalm,139,13,For you created my inmost being; you knit me together in my mother’s womb.
Psalm,139,14,"I praise you because I am fearfully and wonderfully made; your works are wonderful, I know that full well."
Psalm,139,15,"My frame was not hidden from you when I was made in the secret place, when I was woven together in the depths of the earth."
Psalm,139,16,Your eyes saw my unformed body; all the days ordained for me were written in your book before one of them came to be.
Psalm,139,17,"How precious to me are your thoughts, God! How vast is the sum of them!"
Psalm,139,18,"Were I to count them, they would outnumber the grains of sand— when I awake, I am still with you."
Psalm,139,19,"If only you, God, would slay the wicked! Away from me, you who are bloodthirsty!"
Psalm,139,20,They speak of you with evil intent; your adversaries misuse your name.
Psalm,139,21,"Do I not hate those who hate you, LORD, and abhor those who are in rebellion against you?"
Psalm,139,22,I have nothing but hatred for them; I count them my enemies.
Psalm,139,23,"Search me, God, and know my heart; test me and know my anxious thoughts."
Psalm,139,24,"See if there is any offensive way in me, and lead me in the way everlasting."
Psalm,140,1,"For the director of music. A psalm of David. Rescue me, LORD, from evildoers; protect me from the violent,"
Psalm,140,2,who devise evil plans in their hearts and stir up war every day.
Psalm,140,3,They make their tongues as sharp as a serpent’s; the poison of vipers is on their lips.
Psalm,140,4,"Keep me safe, LORD, from the hands of the wicked; protect me from the violent, who devise ways to trip my feet."
Psalm,140,5,The arrogant have hidden a snare for me; they have spread out the cords of their net and have set traps for me along my path.
Psalm,140,6,"I say to the LORD, “You are my God.” Hear, LORD, my cry for mercy."
Psalm,140,7,"Sovereign LORD, my strong deliverer, you shield my head in the day of battle."
Psalm,140,8,"Do not grant the wicked their desires, LORD; do not let their plans succeed."
Psalm,140,9,Those who surround me proudly rear their heads; may the mischief of their lips engulf them.
Psalm,140,10,"May burning coals fall on them; may they be thrown into the fire, into miry pits, never to rise."
Psalm,140,11,May slanderers not be established in the land; may disaster hunt down the violent.
Psalm,140,12,I know that the LORD secures justice for the poor and upholds the cause of the needy.
Psalm,140,13,"Surely the righteous will praise your name, and the upright will live in your presence."
Psalm,141,1,"A psalm of David. I call to you, LORD, come quickly to me; hear me when I call to you."
Psalm,141,2,May my prayer be set before you like incense; may the lifting up of my hands be like the evening sacrifice.
Psalm,141,3,"Set a guard over my mouth, LORD; keep watch over the door of my lips."
Psalm,141,4,Do not let my heart be drawn to what is evil so that I take part in wicked deeds along with those who are evildoers; do not let me eat their delicacies.
Psalm,141,5,"Let a righteous man strike me—that is a kindness; let him rebuke me—that is oil on my head. My head will not refuse it, for my prayer will still be against the deeds of evildoers."
Psalm,141,6,"Their rulers will be thrown down from the cliffs, and the wicked will learn that my words were well spoken."
Psalm,141,7,"They will say, “As one plows and breaks up the earth, so our bones have been scattered at the mouth of the grave.”"
Psalm,141,8,"But my eyes are fixed on you, Sovereign LORD; in you I take refuge—do not give me over to death."
Psalm,141,9,"Keep me safe from the traps set by evildoers, from the snares they have laid for me."
Psalm,141,10,"Let the wicked fall into their own nets, while I pass by in safety."
Psalm,142,1,A maskil of David. When he was in the cave. A prayer. I cry aloud to the LORD; I lift up my voice to the LORD for mercy.
Psalm,142,2,I pour out before him my complaint; before him I tell my trouble.
Psalm,142,3,"When my spirit grows faint within me, it is you who watch over my way. In the path where I walk people have hidden a snare for me."
Psalm,142,4,"Look and see, there is no one at my right hand; no one is concerned for me. I have no refuge; no one cares for my life."
Psalm,142,5,"I cry to you, LORD; I say, “You are my refuge, my portion in the land of the living.”"
Psalm,142,6,"Listen to my cry, for I am in desperate need; rescue me from those who pursue me, for they are too strong for me."
Psalm,142,7,"Set me free from my prison, that I may praise your name. Then the righteous will gather about me because of your goodness to me."
Psalm,143,1,"A psalm of David. LORD, hear my prayer, listen to my cry for mercy; in your faithfulness and righteousness come to my relief."
Psalm,143,2,"Do not bring your servant into judgment, for no one living is righteous before you."
Psalm,143,3,"The enemy pursues me, he crushes me to the ground; he makes me dwell in the darkness like those long dead."
Psalm,143,4,So my spirit grows faint within me; my heart within me is dismayed.
Psalm,143,5,I remember the days of long ago; I meditate on all your works and consider what your hands have done.
Psalm,143,6,I spread out my hands to you; I thirst for you like a parched land.
Psalm,143,7,"Answer me quickly, LORD; my spirit fails. Do not hide your face from me or I will be like those who go down to the pit."
Psalm,143,8,"Let the morning bring me word of your unfailing love, for I have put my trust in you. Show me the way I should go, for to you I entrust my life."
Psalm,143,9,"Rescue me from my enemies, LORD, for I hide myself in you."
Psalm,143,10,"Teach me to do your will, for you are my God; may your good Spirit lead me on level ground."
Psalm,143,11,"For your name’s sake, LORD, preserve my life; in your righteousness, bring me out of trouble."
Psalm,143,12,"In your unfailing love, silence my enemies; destroy all my foes, for I am your servant."
Psalm,144,1,"Of David. Praise be to the LORD my Rock, who trains my hands for war, my fingers for battle."
Psalm,144,2,"He is my loving God and my fortress, my stronghold and my deliverer, my shield, in whom I take refuge, who subdues peoples under me."
Psalm,144,3,"LORD, what are human beings that you care for them, mere mortals that you think of them?"
Psalm,144,4,They are like a breath; their days are like a fleeting shadow.
Psalm,144,5,"Part your heavens, LORD, and come down; touch the mountains, so that they smoke."
Psalm,144,6,Send forth lightning and scatter the enemy; shoot your arrows and rout them.
Psalm,144,7,"Reach down your hand from on high; deliver me and rescue me from the mighty waters, from the hands of foreigners"
Psalm,144,8,"whose mouths are full of lies, whose right hands are deceitful."
Psalm,144,9,"I will sing a new song to you, my God; on the ten-stringed lyre I will make music to you,"
Psalm,144,10,"to the One who gives victory to kings, who delivers his servant David. From the deadly sword"
Psalm,144,11,"deliver me; rescue me from the hands of foreigners whose mouths are full of lies, whose right hands are deceitful."
Psalm,144,12,"Then our sons in their youth will be like well-nurtured plants, and our daughters will be like pillars carved to adorn a palace."
Psalm,144,13,"Our barns will be filled with every kind of provision. Our sheep will increase by thousands, by tens of thousands in our fields;"
Psalm,144,14,"our oxen will draw heavy loads. There will be no breaching of walls, no going into captivity, no cry of distress in our streets."
Psalm,144,15,Blessed is the people of whom this is true; blessed is the people whose God is the LORD.
Psalm,145,1,"A psalm of praise. Of David. I will exalt you, my God the King; I will praise your name for ever and ever."
Psalm,145,2,Every day I will praise you and extol your name for ever and ever.
Psalm,145,3,Great is the LORD and most worthy of praise; his greatness no one can fathom.
Psalm,145,4,One generation commends your works to another; they tell of your mighty acts.
Psalm,145,5,They speak of the glorious splendor of your majesty— and I will meditate on your wonderful works.
Psalm,145,6,They tell of the power of your awesome works— and I will proclaim your great deeds.
Psalm,145,7,They celebrate your abundant goodness and joyfully sing of your righteousness.
Psalm,145,8,"The LORD is gracious and compassionate, slow to anger and rich in love."
Psalm,145,9,The LORD is good to all; he has compassion on all he has made.
Psalm,145,10,"All your works praise you, LORD; your faithful people extol you."
Psalm,145,11,"They tell of the glory of your kingdom and speak of your might,"
Psalm,145,12,so that all people may know of your mighty acts and the glorious splendor of your kingdom.
Psalm,145,13,"Your kingdom is an everlasting kingdom, and your dominion endures through all generations. The LORD is trustworthy in all he promises and faithful in all he does."
Psalm,145,14,The LORD upholds all who fall and lifts up all who are bowed down.
Psalm,145,15,"The eyes of all look to you, and you give them their food at the proper time."
Psalm,145,16,You open your hand and satisfy the desires of every living thing.
