2 Chronicles,33,6,"He sacrificed his children in the fire in the Valley of Ben Hinnom, practiced divination and witchcraft, sought omens, and consulted mediums and spiritists. He did much evil in the eyes of the LORD, arousing his anger."
2 Chronicles,33,7,"He took the image he had made and put it in God’s temple, of which God had said to David and to his son Solomon, “In this temple and in Jerusalem, which I have chosen out of all the tribes of Israel, I will put my Name forever."
2 Chronicles,33,8,"I will not again make the feet of the Israelites leave the land I assigned to your ancestors, if only they will be careful to do everything I commanded them concerning all the laws, decrees and regulations given through Moses.”"
2 Chronicles,33,9,"But Manasseh led Judah and the people of Jerusalem astray, so that they did more evil than the nations the LORD had destroyed before the Israelites."
2 Chronicles,33,10,"The LORD spoke to Manasseh and his people, but they paid no attention."
2 Chronicles,33,11,"So the LORD brought against them the army commanders of the king of Assyria, who took Manasseh prisoner, put a hook in his nose, bound him with bronze shackles and took him to Babylon."
2 Chronicles,33,12,In his distress he sought the favor of the LORD his God and humbled himself greatly before the God of his ancestors.
2 Chronicles,33,13,"And when he prayed to him, the LORD was moved by his entreaty and listened to his plea; so he brought him back to Jerusalem and to his kingdom. Then Manasseh knew that the LORD is God."
2 Chronicles,33,14,"Afterward he rebuilt the outer wall of the City of David, west of the Gihon spring in the valley, as far as the entrance of the Fish Gate and encircling the hill of Ophel; he also made it much higher. He stationed military commanders in all the fortified cities in Judah."
2 Chronicles,33,15,"He got rid of the foreign gods and removed the image from the temple of the LORD, as well as all the altars he had built on the temple hill and in Jerusalem; and he threw them out of the city."
2 Chronicles,33,16,"Then he restored the altar of the LORD and sacrificed fellowship offerings and thank offerings on it, and told Judah to serve the LORD, the God of Israel."
2 Chronicles,33,17,"The people, however, continued to sacrifice at the high places, but only to the LORD their God."
2 Chronicles,33,18,"The other events of Manasseh’s reign, including his prayer to his God and the words the seers spoke to him in the name of the LORD, the God of Israel, are written in the annals of the kings of Israel."
2 Chronicles,33,19,"His prayer and how God was moved by his entreaty, as well as all his sins and unfaithfulness, and the sites where he built high places and set up Asherah poles and idols before he humbled himself—all these are written in the records of the seers."
2 Chronicles,33,20,Manasseh rested with his ancestors and was buried in his palace. And Amon his son succeeded him as king.
2 Chronicles,33,21,"Amon was twenty-two years old when he became king, and he reigned in Jerusalem two years."
2 Chronicles,33,22,"He did evil in the eyes of the LORD, as his father Manasseh had done. Amon worshiped and offered sacrifices to all the idols Manasseh had made."
2 Chronicles,33,23,"But unlike his father Manasseh, he did not humble himself before the LORD; Amon increased his guilt."
2 Chronicles,33,24,Amon’s officials conspired against him and assassinated him in his palace.
2 Chronicles,33,25,"Then the people of the land killed all who had plotted against King Amon, and they made Josiah his son king in his place."
2 Chronicles,34,1,"Josiah was eight years old when he became king, and he reigned in Jerusalem thirty-one years."
2 Chronicles,34,2,"He did what was right in the eyes of the LORD and followed the ways of his father David, not turning aside to the right or to the left."
2 Chronicles,34,3,"In the eighth year of his reign, while he was still young, he began to seek the God of his father David. In his twelfth year he began to purge Judah and Jerusalem of high places, Asherah poles and idols."
2 Chronicles,34,4,"Under his direction the altars of the Baals were torn down; he cut to pieces the incense altars that were above them, and smashed the Asherah poles and the idols. These he broke to pieces and scattered over the graves of those who had sacrificed to them."
2 Chronicles,34,5,"He burned the bones of the priests on their altars, and so he purged Judah and Jerusalem."
2 Chronicles,34,6,"In the towns of Manasseh, Ephraim and Simeon, as far as Naphtali, and in the ruins around them,"
2 Chronicles,34,7,he tore down the altars and the Asherah poles and crushed the idols to powder and cut to pieces all the incense altars throughout Israel. Then he went back to Jerusalem.
2 Chronicles,34,8,"In the eighteenth year of Josiah’s reign, to purify the land and the temple, he sent Shaphan son of Azaliah and Maaseiah the ruler of the city, with Joah son of Joahaz, the recorder, to repair the temple of the LORD his God."
2 Chronicles,34,9,"They went to Hilkiah the high priest and gave him the money that had been brought into the temple of God, which the Levites who were the gatekeepers had collected from the people of Manasseh, Ephraim and the entire remnant of Israel and from all the people of Judah and Benjamin and the inhabitants of Jerusalem."
2 Chronicles,34,10,Then they entrusted it to the men appointed to supervise the work on the LORD’s temple. These men paid the workers who repaired and restored the temple.
2 Chronicles,34,11,"They also gave money to the carpenters and builders to purchase dressed stone, and timber for joists and beams for the buildings that the kings of Judah had allowed to fall into ruin."
2 Chronicles,34,12,"The workers labored faithfully. Over them to direct them were Jahath and Obadiah, Levites descended from Merari, and Zechariah and Meshullam, descended from Kohath. The Levites—all who were skilled in playing musical instruments—"
2 Chronicles,34,13,"had charge of the laborers and supervised all the workers from job to job. Some of the Levites were secretaries, scribes and gatekeepers."
2 Chronicles,34,14,"While they were bringing out the money that had been taken into the temple of the LORD, Hilkiah the priest found the Book of the Law of the LORD that had been given through Moses."
2 Chronicles,34,15,"Hilkiah said to Shaphan the secretary, “I have found the Book of the Law in the temple of the LORD.” He gave it to Shaphan."
2 Chronicles,34,16,Then Shaphan took the book to the king and reported to him: “Your officials are doing everything that has been committed to them.
2 Chronicles,34,17,They have paid out the money that was in the temple of the LORD and have entrusted it to the supervisors and workers.”
2 Chronicles,34,18,"Then Shaphan the secretary informed the king, “Hilkiah the priest has given me a book.” And Shaphan read from it in the presence of the king."
2 Chronicles,34,19,"When the king heard the words of the Law, he tore his robes."
2 Chronicles,34,20,"He gave these orders to Hilkiah, Ahikam son of Shaphan, Abdon son of Micah, Shaphan the secretary and Asaiah the king’s attendant:"
2 Chronicles,34,21,“Go and inquire of the LORD for me and for the remnant in Israel and Judah about what is written in this book that has been found. Great is the LORD’s anger that is poured out on us because those who have gone before us have not kept the word of the LORD; they have not acted in accordance with all that is written in this book.”
2 Chronicles,34,22,"Hilkiah and those the king had sent with him went to speak to the prophet Huldah, who was the wife of Shallum son of Tokhath, the son of Hasrah, keeper of the wardrobe. She lived in Jerusalem, in the New Quarter."
2 Chronicles,34,23,"She said to them, “This is what the LORD, the God of Israel, says: Tell the man who sent you to me,"
2 Chronicles,34,24,‘This is what the LORD says: I am going to bring disaster on this place and its people—all the curses written in the book that has been read in the presence of the king of Judah.
2 Chronicles,34,25,"Because they have forsaken me and burned incense to other gods and aroused my anger by all that their hands have made, my anger will be poured out on this place and will not be quenched.’"
2 Chronicles,34,26,"Tell the king of Judah, who sent you to inquire of the LORD, ‘This is what the LORD, the God of Israel, says concerning the words you heard:"
2 Chronicles,34,27,"Because your heart was responsive and you humbled yourself before God when you heard what he spoke against this place and its people, and because you humbled yourself before me and tore your robes and wept in my presence, I have heard you, declares the LORD."
2 Chronicles,34,28,"Now I will gather you to your ancestors, and you will be buried in peace. Your eyes will not see all the disaster I am going to bring on this place and on those who live here.’” So they took her answer back to the king."
2 Chronicles,34,29,Then the king called together all the elders of Judah and Jerusalem.
2 Chronicles,34,30,"He went up to the temple of the LORD with the people of Judah, the inhabitants of Jerusalem, the priests and the Levites—all the people from the least to the greatest. He read in their hearing all the words of the Book of the Covenant, which had been found in the temple of the LORD."
2 Chronicles,34,31,"The king stood by his pillar and renewed the covenant in the presence of the LORD—to follow the LORD and keep his commands, statutes and decrees with all his heart and all his soul, and to obey the words of the covenant written in this book."
2 Chronicles,34,32,"Then he had everyone in Jerusalem and Benjamin pledge themselves to it; the people of Jerusalem did this in accordance with the covenant of God, the God of their ancestors."
2 Chronicles,34,33,"Josiah removed all the detestable idols from all the territory belonging to the Israelites, and he had all who were present in Israel serve the LORD their God. As long as he lived, they did not fail to follow the LORD, the God of their ancestors."
2 Chronicles,35,1,"Josiah celebrated the Passover to the LORD in Jerusalem, and the Passover lamb was slaughtered on the fourteenth day of the first month."
2 Chronicles,35,2,He appointed the priests to their duties and encouraged them in the service of the LORD’s temple.
2 Chronicles,35,3,"He said to the Levites, who instructed all Israel and who had been consecrated to the LORD: “Put the sacred ark in the temple that Solomon son of David king of Israel built. It is not to be carried about on your shoulders. Now serve the LORD your God and his people Israel."
2 Chronicles,35,4,"Prepare yourselves by families in your divisions, according to the instructions written by David king of Israel and by his son Solomon."
2 Chronicles,35,5,"“Stand in the holy place with a group of Levites for each subdivision of the families of your fellow Israelites, the lay people."
2 Chronicles,35,6,"Slaughter the Passover lambs, consecrate yourselves and prepare the lambs for your fellow Israelites, doing what the LORD commanded through Moses.”"
2 Chronicles,35,7,"Josiah provided for all the lay people who were there a total of thirty thousand lambs and goats for the Passover offerings, and also three thousand cattle—all from the king’s own possessions."
2 Chronicles,35,8,"His officials also contributed voluntarily to the people and the priests and Levites. Hilkiah, Zechariah and Jehiel, the officials in charge of God’s temple, gave the priests twenty-six hundred Passover offerings and three hundred cattle."
2 Chronicles,35,9,"Also Konaniah along with Shemaiah and Nethanel, his brothers, and Hashabiah, Jeiel and Jozabad, the leaders of the Levites, provided five thousand Passover offerings and five hundred head of cattle for the Levites."
2 Chronicles,35,10,The service was arranged and the priests stood in their places with the Levites in their divisions as the king had ordered.
2 Chronicles,35,11,"The Passover lambs were slaughtered, and the priests splashed against the altar the blood handed to them, while the Levites skinned the animals."
2 Chronicles,35,12,"They set aside the burnt offerings to give them to the subdivisions of the families of the people to offer to the LORD, as it is written in the Book of Moses. They did the same with the cattle."
2 Chronicles,35,13,"They roasted the Passover animals over the fire as prescribed, and boiled the holy offerings in pots, caldrons and pans and served them quickly to all the people."
2 Chronicles,35,14,"After this, they made preparations for themselves and for the priests, because the priests, the descendants of Aaron, were sacrificing the burnt offerings and the fat portions until nightfall. So the Levites made preparations for themselves and for the Aaronic priests."
2 Chronicles,35,15,"The musicians, the descendants of Asaph, were in the places prescribed by David, Asaph, Heman and Jeduthun the king’s seer. The gatekeepers at each gate did not need to leave their posts, because their fellow Levites made the preparations for them."
2 Chronicles,35,16,"So at that time the entire service of the LORD was carried out for the celebration of the Passover and the offering of burnt offerings on the altar of the LORD, as King Josiah had ordered."
2 Chronicles,35,17,The Israelites who were present celebrated the Passover at that time and observed the Festival of Unleavened Bread for seven days.
2 Chronicles,35,18,"The Passover had not been observed like this in Israel since the days of the prophet Samuel; and none of the kings of Israel had ever celebrated such a Passover as did Josiah, with the priests, the Levites and all Judah and Israel who were there with the people of Jerusalem."
2 Chronicles,35,19,This Passover was celebrated in the eighteenth year of Josiah’s reign.
2 Chronicles,35,20,"After all this, when Josiah had set the temple in order, Necho king of Egypt went up to fight at Carchemish on the Euphrates, and Josiah marched out to meet him in battle."
2 Chronicles,35,21,"But Necho sent messengers to him, saying, “What quarrel is there, king of Judah, between you and me? It is not you I am attacking at this time, but the house with which I am at war. God has told me to hurry; so stop opposing God, who is with me, or he will destroy you.”"
2 Chronicles,35,22,"Josiah, however, would not turn away from him, but disguised himself to engage him in battle. He would not listen to what Necho had said at God’s command but went to fight him on the plain of Megiddo."
2 Chronicles,35,23,"Archers shot King Josiah, and he told his officers, “Take me away; I am badly wounded.”"
2 Chronicles,35,24,"So they took him out of his chariot, put him in his other chariot and brought him to Jerusalem, where he died. He was buried in the tombs of his ancestors, and all Judah and Jerusalem mourned for him."
2 Chronicles,35,25,"Jeremiah composed laments for Josiah, and to this day all the male and female singers commemorate Josiah in the laments. These became a tradition in Israel and are written in the Laments."
2 Chronicles,35,26,The other events of Josiah’s reign and his acts of devotion in accordance with what is written in the Law of the LORD—
2 Chronicles,35,27,"all the events, from beginning to end, are written in the book of the kings of Israel and Judah."
2 Chronicles,36,1,And the people of the land took Jehoahaz son of Josiah and made him king in Jerusalem in place of his father.
2 Chronicles,36,2,"Jehoahaz was twenty-three years old when he became king, and he reigned in Jerusalem three months."
2 Chronicles,36,3,The king of Egypt dethroned him in Jerusalem and imposed on Judah a levy of a hundred talents of silver and a talent of gold.
2 Chronicles,36,4,"The king of Egypt made Eliakim, a brother of Jehoahaz, king over Judah and Jerusalem and changed Eliakim’s name to Jehoiakim. But Necho took Eliakim’s brother Jehoahaz and carried him off to Egypt."
2 Chronicles,36,5,"Jehoiakim was twenty-five years old when he became king, and he reigned in Jerusalem eleven years. He did evil in the eyes of the LORD his God."
2 Chronicles,36,6,Nebuchadnezzar king of Babylon attacked him and bound him with bronze shackles to take him to Babylon.
2 Chronicles,36,7,Nebuchadnezzar also took to Babylon articles from the temple of the LORD and put them in his temple there.
2 Chronicles,36,8,"The other events of Jehoiakim’s reign, the detestable things he did and all that was found against him, are written in the book of the kings of Israel and Judah. And Jehoiachin his son succeeded him as king."
2 Chronicles,36,9,"Jehoiachin was eighteen years old when he became king, and he reigned in Jerusalem three months and ten days. He did evil in the eyes of the LORD."
2 Chronicles,36,10,"In the spring, King Nebuchadnezzar sent for him and brought him to Babylon, together with articles of value from the temple of the LORD, and he made Jehoiachin’s uncle, Zedekiah, king over Judah and Jerusalem."
2 Chronicles,36,11,"Zedekiah was twenty-one years old when he became king, and he reigned in Jerusalem eleven years."
2 Chronicles,36,12,"He did evil in the eyes of the LORD his God and did not humble himself before Jeremiah the prophet, who spoke the word of the LORD."
2 Chronicles,36,13,"He also rebelled against King Nebuchadnezzar, who had made him take an oath in God’s name. He became stiff-necked and hardened his heart and would not turn to the LORD, the God of Israel."
2 Chronicles,36,14,"Furthermore, all the leaders of the priests and the people became more and more unfaithful, following all the detestable practices of the nations and defiling the temple of the LORD, which he had consecrated in Jerusalem."
2 Chronicles,36,15,"The LORD, the God of their ancestors, sent word to them through his messengers again and again, because he had pity on his people and on his dwelling place."
2 Chronicles,36,16,"But they mocked God’s messengers, despised his words and scoffed at his prophets until the wrath of the LORD was aroused against his people and there was no remedy."
2 Chronicles,36,17,"He brought up against them the king of the Babylonians, who killed their young men with the sword in the sanctuary, and did not spare young men or young women, the elderly or the infirm. God gave them all into the hands of Nebuchadnezzar."
2 Chronicles,36,18,"He carried to Babylon all the articles from the temple of God, both large and small, and the treasures of the LORD’s temple and the treasures of the king and his officials."
2 Chronicles,36,19,They set fire to God’s temple and broke down the wall of Jerusalem; they burned all the palaces and destroyed everything of value there.
2 Chronicles,36,20,"He carried into exile to Babylon the remnant, who escaped from the sword, and they became servants to him and his successors until the kingdom of Persia came to power."
2 Chronicles,36,21,"The land enjoyed its sabbath rests; all the time of its desolation it rested, until the seventy years were completed in fulfillment of the word of the LORD spoken by Jeremiah."
2 Chronicles,36,22,"In the first year of Cyrus king of Persia, in order to fulfill the word of the LORD spoken by Jeremiah, the LORD moved the heart of Cyrus king of Persia to make a proclamation throughout his realm and also to put it in writing:"
2 Chronicles,36,23,"“This is what Cyrus king of Persia says: “‘The LORD, the God of heaven, has given me all the kingdoms of the earth and he has appointed me to build a temple for him at Jerusalem in Judah. Any of his people among you may go up, and may the LORD their God be with them.’”"
Ezra,1,1,"In the first year of Cyrus king of Persia, in order to fulfill the word of the LORD spoken by Jeremiah, the LORD moved the heart of Cyrus king of Persia to make a proclamation throughout his realm and also to put it in writing:"
Ezra,1,2,"“This is what Cyrus king of Persia says: “‘The LORD, the God of heaven, has given me all the kingdoms of the earth and he has appointed me to build a temple for him at Jerusalem in Judah."
Ezra,1,3,"Any of his people among you may go up to Jerusalem in Judah and build the temple of the LORD, the God of Israel, the God who is in Jerusalem, and may their God be with them."
Ezra,1,4,"And in any locality where survivors may now be living, the people are to provide them with silver and gold, with goods and livestock, and with freewill offerings for the temple of God in Jerusalem.’”"
Ezra,1,5,"Then the family heads of Judah and Benjamin, and the priests and Levites—everyone whose heart God had moved—prepared to go up and build the house of the LORD in Jerusalem."
Ezra,1,6,"All their neighbors assisted them with articles of silver and gold, with goods and livestock, and with valuable gifts, in addition to all the freewill offerings."
Ezra,1,7,"Moreover, King Cyrus brought out the articles belonging to the temple of the LORD, which Nebuchadnezzar had carried away from Jerusalem and had placed in the temple of his god."
Ezra,1,8,"Cyrus king of Persia had them brought by Mithredath the treasurer, who counted them out to Sheshbazzar the prince of Judah."
Ezra,1,9,"This was the inventory: gold dishes 30 silver dishes 1,000 silver pans 29"
Ezra,1,10,"gold bowls 30 matching silver bowls 410 other articles 1,000"
Ezra,1,11,"In all, there were 5,400 articles of gold and of silver. Sheshbazzar brought all these along with the exiles when they came up from Babylon to Jerusalem."
Ezra,2,1,"Now these are the people of the province who came up from the captivity of the exiles, whom Nebuchadnezzar king of Babylon had taken captive to Babylon (they returned to Jerusalem and Judah, each to their own town,"
Ezra,2,2,"in company with Zerubbabel, Joshua, Nehemiah, Seraiah, Reelaiah, Mordecai, Bilshan, Mispar, Bigvai, Rehum and Baanah): The list of the men of the people of Israel:"
Ezra,2,3,"the descendants of Parosh 2,172"
Ezra,2,4,of Shephatiah 372
Ezra,2,5,of Arah 775
Ezra,2,6,"of Pahath-Moab (through the line of Jeshua and Joab) 2,812"
Ezra,2,7,"of Elam 1,254"
Ezra,2,8,of Zattu 945
Ezra,2,9,of Zakkai 760
Ezra,2,10,of Bani 642
Ezra,2,11,of Bebai 623
Ezra,2,12,"of Azgad 1,222"
Ezra,2,13,of Adonikam 666
Ezra,2,14,"of Bigvai 2,056"
Ezra,2,15,of Adin 454
Ezra,2,16,of Ater (through Hezekiah) 98
Ezra,2,17,of Bezai 323
Ezra,2,18,of Jorah 112
Ezra,2,19,of Hashum 223
Ezra,2,20,of Gibbar 95
Ezra,2,21,the men of Bethlehem 123
Ezra,2,22,of Netophah 56
Ezra,2,23,of Anathoth 128
Ezra,2,24,of Azmaveth 42
Ezra,2,25,"of Kiriath Jearim, Kephirah and Beeroth 743"
Ezra,2,26,of Ramah and Geba 621
Ezra,2,27,of Mikmash 122
Ezra,2,28,of Bethel and Ai 223
Ezra,2,29,of Nebo 52
Ezra,2,30,of Magbish 156
Ezra,2,31,"of the other Elam 1,254"
Ezra,2,32,of Harim 320
Ezra,2,33,"of Lod, Hadid and Ono 725"
Ezra,2,34,of Jericho 345
Ezra,2,35,"of Senaah 3,630"
Ezra,2,36,The priests: the descendants of Jedaiah (through the family of Jeshua) 973
Ezra,2,37,"of Immer 1,052"
Ezra,2,38,"of Pashhur 1,247"
Ezra,2,39,"of Harim 1,017"
Ezra,2,40,The Levites: the descendants of Jeshua and Kadmiel (of the line of Hodaviah) 74
Ezra,2,41,The musicians: the descendants of Asaph 128
Ezra,2,42,"The gatekeepers of the temple: the descendants of Shallum, Ater, Talmon, Akkub, Hatita and Shobai 139"
Ezra,2,43,"The temple servants: the descendants of Ziha, Hasupha, Tabbaoth,"
Ezra,2,44,"Keros, Siaha, Padon,"
Ezra,2,45,"Lebanah, Hagabah, Akkub,"
Ezra,2,46,"Hagab, Shalmai, Hanan,"
Ezra,2,47,"Giddel, Gahar, Reaiah,"
Ezra,2,48,"Rezin, Nekoda, Gazzam,"
Ezra,2,49,"Uzza, Paseah, Besai,"
Ezra,2,50,"Asnah, Meunim, Nephusim,"
Ezra,2,51,"Bakbuk, Hakupha, Harhur,"
Ezra,2,52,"Bazluth, Mehida, Harsha,"
Ezra,2,53,"Barkos, Sisera, Temah,"
Ezra,2,54,Neziah and Hatipha
Ezra,2,55,"The descendants of the servants of Solomon: the descendants of Sotai, Hassophereth, Peruda,"
Ezra,2,56,"Jaala, Darkon, Giddel,"
Ezra,2,57,"Shephatiah, Hattil, Pokereth-Hazzebaim and Ami"
Ezra,2,58,The temple servants and the descendants of the servants of Solomon 392
Ezra,2,59,"The following came up from the towns of Tel Melah, Tel Harsha, Kerub, Addon and Immer, but they could not show that their families were descended from Israel:"
Ezra,2,60,"The descendants of Delaiah, Tobiah and Nekoda 652"
Ezra,2,61,"And from among the priests: The descendants of Hobaiah, Hakkoz and Barzillai (a man who had married a daughter of Barzillai the Gileadite and was called by that name)."
Ezra,2,62,"These searched for their family records, but they could not find them and so were excluded from the priesthood as unclean."
Ezra,2,63,The governor ordered them not to eat any of the most sacred food until there was a priest ministering with the Urim and Thummim.
Ezra,2,64,"The whole company numbered 42,360,"
Ezra,2,65,"besides their 7,337 male and female slaves; and they also had 200 male and female singers."
Ezra,2,66,"They had 736 horses, 245 mules,"
Ezra,2,67,"435 camels and 6,720 donkeys."
Ezra,2,68,"When they arrived at the house of the LORD in Jerusalem, some of the heads of the families gave freewill offerings toward the rebuilding of the house of God on its site."
Ezra,2,69,"According to their ability they gave to the treasury for this work 61,000 darics of gold, 5,000 minas of silver and 100 priestly garments."
Ezra,2,70,"The priests, the Levites, the musicians, the gatekeepers and the temple servants settled in their own towns, along with some of the other people, and the rest of the Israelites settled in their towns."
Ezra,3,1,"When the seventh month came and the Israelites had settled in their towns, the people assembled together as one in Jerusalem."
Ezra,3,2,"Then Joshua son of Jozadak and his fellow priests and Zerubbabel son of Shealtiel and his associates began to build the altar of the God of Israel to sacrifice burnt offerings on it, in accordance with what is written in the Law of Moses the man of God."
