1 Chronicles,23,17,"The descendants of Eliezer: Rehabiah was the first. Eliezer had no other sons, but the sons of Rehabiah were very numerous."
1 Chronicles,23,18,The sons of Izhar: Shelomith was the first.
1 Chronicles,23,19,"The sons of Hebron: Jeriah the first, Amariah the second, Jahaziel the third and Jekameam the fourth."
1 Chronicles,23,20,The sons of Uzziel: Micah the first and Ishiah the second.
1 Chronicles,23,21,The sons of Merari: Mahli and Mushi. The sons of Mahli: Eleazar and Kish.
1 Chronicles,23,22,"Eleazar died without having sons: he had only daughters. Their cousins, the sons of Kish, married them."
1 Chronicles,23,23,"The sons of Mushi: Mahli, Eder and Jerimoth—three in all."
1 Chronicles,23,24,"These were the descendants of Levi by their families—the heads of families as they were registered under their names and counted individually, that is, the workers twenty years old or more who served in the temple of the LORD."
1 Chronicles,23,25,"For David had said, “Since the LORD, the God of Israel, has granted rest to his people and has come to dwell in Jerusalem forever,"
1 Chronicles,23,26,the Levites no longer need to carry the tabernacle or any of the articles used in its service.”
1 Chronicles,23,27,"According to the last instructions of David, the Levites were counted from those twenty years old or more."
1 Chronicles,23,28,"The duty of the Levites was to help Aaron’s descendants in the service of the temple of the LORD: to be in charge of the courtyards, the side rooms, the purification of all sacred things and the performance of other duties at the house of God."
1 Chronicles,23,29,"They were in charge of the bread set out on the table, the special flour for the grain offerings, the thin loaves made without yeast, the baking and the mixing, and all measurements of quantity and size."
1 Chronicles,23,30,They were also to stand every morning to thank and praise the LORD. They were to do the same in the evening
1 Chronicles,23,31,"and whenever burnt offerings were presented to the LORD on the Sabbaths, at the New Moon feasts and at the appointed festivals. They were to serve before the LORD regularly in the proper number and in the way prescribed for them."
1 Chronicles,23,32,"And so the Levites carried out their responsibilities for the tent of meeting, for the Holy Place and, under their relatives the descendants of Aaron, for the service of the temple of the LORD."
1 Chronicles,24,1,"These were the divisions of the descendants of Aaron: The sons of Aaron were Nadab, Abihu, Eleazar and Ithamar."
1 Chronicles,24,2,"But Nadab and Abihu died before their father did, and they had no sons; so Eleazar and Ithamar served as the priests."
1 Chronicles,24,3,"With the help of Zadok a descendant of Eleazar and Ahimelek a descendant of Ithamar, David separated them into divisions for their appointed order of ministering."
1 Chronicles,24,4,"A larger number of leaders were found among Eleazar’s descendants than among Ithamar’s, and they were divided accordingly: sixteen heads of families from Eleazar’s descendants and eight heads of families from Ithamar’s descendants."
1 Chronicles,24,5,"They divided them impartially by casting lots, for there were officials of the sanctuary and officials of God among the descendants of both Eleazar and Ithamar."
1 Chronicles,24,6,"The scribe Shemaiah son of Nethanel, a Levite, recorded their names in the presence of the king and of the officials: Zadok the priest, Ahimelek son of Abiathar and the heads of families of the priests and of the Levites—one family being taken from Eleazar and then one from Ithamar."
1 Chronicles,24,7,"The first lot fell to Jehoiarib, the second to Jedaiah,"
1 Chronicles,24,8,"the third to Harim, the fourth to Seorim,"
1 Chronicles,24,9,"the fifth to Malkijah, the sixth to Mijamin,"
1 Chronicles,24,10,"the seventh to Hakkoz, the eighth to Abijah,"
1 Chronicles,24,11,"the ninth to Jeshua, the tenth to Shekaniah,"
1 Chronicles,24,12,"the eleventh to Eliashib, the twelfth to Jakim,"
1 Chronicles,24,13,"the thirteenth to Huppah, the fourteenth to Jeshebeab,"
1 Chronicles,24,14,"the fifteenth to Bilgah, the sixteenth to Immer,"
1 Chronicles,24,15,"the seventeenth to Hezir, the eighteenth to Happizzez,"
1 Chronicles,24,16,"the nineteenth to Pethahiah, the twentieth to Jehezkel,"
1 Chronicles,24,17,"the twenty-first to Jakin, the twenty-second to Gamul,"
1 Chronicles,24,18,the twenty-third to Delaiah and the twenty-fourth to Maaziah.
1 Chronicles,24,19,"This was their appointed order of ministering when they entered the temple of the LORD, according to the regulations prescribed for them by their ancestor Aaron, as the LORD, the God of Israel, had commanded him."
1 Chronicles,24,20,As for the rest of the descendants of Levi: from the sons of Amram: Shubael; from the sons of Shubael: Jehdeiah.
1 Chronicles,24,21,"As for Rehabiah, from his sons: Ishiah was the first."
1 Chronicles,24,22,From the Izharites: Shelomoth; from the sons of Shelomoth: Jahath.
1 Chronicles,24,23,"The sons of Hebron: Jeriah the first, Amariah the second, Jahaziel the third and Jekameam the fourth."
1 Chronicles,24,24,The son of Uzziel: Micah; from the sons of Micah: Shamir.
1 Chronicles,24,25,The brother of Micah: Ishiah; from the sons of Ishiah: Zechariah.
1 Chronicles,24,26,The sons of Merari: Mahli and Mushi. The son of Jaaziah: Beno.
1 Chronicles,24,27,"The sons of Merari: from Jaaziah: Beno, Shoham, Zakkur and Ibri."
1 Chronicles,24,28,"From Mahli: Eleazar, who had no sons."
1 Chronicles,24,29,From Kish: the son of Kish: Jerahmeel.
1 Chronicles,24,30,"And the sons of Mushi: Mahli, Eder and Jerimoth. These were the Levites, according to their families."
1 Chronicles,24,31,"They also cast lots, just as their relatives the descendants of Aaron did, in the presence of King David and of Zadok, Ahimelek, and the heads of families of the priests and of the Levites. The families of the oldest brother were treated the same as those of the youngest."
1 Chronicles,25,1,"David, together with the commanders of the army, set apart some of the sons of Asaph, Heman and Jeduthun for the ministry of prophesying, accompanied by harps, lyres and cymbals. Here is the list of the men who performed this service:"
1 Chronicles,25,2,"From the sons of Asaph: Zakkur, Joseph, Nethaniah and Asarelah. The sons of Asaph were under the supervision of Asaph, who prophesied under the king’s supervision."
1 Chronicles,25,3,"As for Jeduthun, from his sons: Gedaliah, Zeri, Jeshaiah, Shimei, Hashabiah and Mattithiah, six in all, under the supervision of their father Jeduthun, who prophesied, using the harp in thanking and praising the LORD."
1 Chronicles,25,4,"As for Heman, from his sons: Bukkiah, Mattaniah, Uzziel, Shubael and Jerimoth; Hananiah, Hanani, Eliathah, Giddalti and Romamti-Ezer; Joshbekashah, Mallothi, Hothir and Mahazioth."
1 Chronicles,25,5,(All these were sons of Heman the king’s seer. They were given him through the promises of God to exalt him. God gave Heman fourteen sons and three daughters.)
1 Chronicles,25,6,"All these men were under the supervision of their father for the music of the temple of the LORD, with cymbals, lyres and harps, for the ministry at the house of God. Asaph, Jeduthun and Heman were under the supervision of the king."
1 Chronicles,25,7,Along with their relatives—all of them trained and skilled in music for the LORD—they numbered 288.
1 Chronicles,25,8,"Young and old alike, teacher as well as student, cast lots for their duties."
1 Chronicles,25,9,"The first lot, which was for Asaph, fell to Joseph, his sons and relatives 12 the second to Gedaliah, him and his relatives and sons 12"
1 Chronicles,25,10,"the third to Zakkur, his sons and relatives 12"
1 Chronicles,25,11,"the fourth to Izri, his sons and relatives 12"
1 Chronicles,25,12,"the fifth to Nethaniah, his sons and relatives 12"
1 Chronicles,25,13,"the sixth to Bukkiah, his sons and relatives 12"
1 Chronicles,25,14,"the seventh to Jesarelah, his sons and relatives 12"
1 Chronicles,25,15,"the eighth to Jeshaiah, his sons and relatives 12"
1 Chronicles,25,16,"the ninth to Mattaniah, his sons and relatives 12"
1 Chronicles,25,17,"the tenth to Shimei, his sons and relatives 12"
1 Chronicles,25,18,"the eleventh to Azarel, his sons and relatives 12"
1 Chronicles,25,19,"the twelfth to Hashabiah, his sons and relatives 12"
1 Chronicles,25,20,"the thirteenth to Shubael, his sons and relatives 12"
1 Chronicles,25,21,"the fourteenth to Mattithiah, his sons and relatives 12"
1 Chronicles,25,22,"the fifteenth to Jerimoth, his sons and relatives 12"
1 Chronicles,25,23,"the sixteenth to Hananiah, his sons and relatives 12"
1 Chronicles,25,24,"the seventeenth to Joshbekashah, his sons and relatives 12"
1 Chronicles,25,25,"the eighteenth to Hanani, his sons and relatives 12"
1 Chronicles,25,26,"the nineteenth to Mallothi, his sons and relatives 12"
1 Chronicles,25,27,"the twentieth to Eliathah, his sons and relatives 12"
1 Chronicles,25,28,"the twenty-first to Hothir, his sons and relatives 12"
1 Chronicles,25,29,"the twenty-second to Giddalti, his sons and relatives 12"
1 Chronicles,25,30,"the twenty-third to Mahazioth, his sons and relatives 12"
1 Chronicles,25,31,"the twenty-fourth to Romamti-Ezer, his sons and relatives 12."
1 Chronicles,26,1,"The divisions of the gatekeepers: From the Korahites: Meshelemiah son of Kore, one of the sons of Asaph."
1 Chronicles,26,2,"Meshelemiah had sons: Zechariah the firstborn, Jediael the second, Zebadiah the third, Jathniel the fourth,"
1 Chronicles,26,3,"Elam the fifth, Jehohanan the sixth and Eliehoenai the seventh."
1 Chronicles,26,4,"Obed-Edom also had sons: Shemaiah the firstborn, Jehozabad the second, Joah the third, Sakar the fourth, Nethanel the fifth,"
1 Chronicles,26,5,"Ammiel the sixth, Issachar the seventh and Peullethai the eighth. (For God had blessed Obed-Edom.)"
1 Chronicles,26,6,"Obed-Edom’s son Shemaiah also had sons, who were leaders in their father’s family because they were very capable men."
1 Chronicles,26,7,"The sons of Shemaiah: Othni, Rephael, Obed and Elzabad; his relatives Elihu and Semakiah were also able men."
1 Chronicles,26,8,"All these were descendants of Obed-Edom; they and their sons and their relatives were capable men with the strength to do the work—descendants of Obed-Edom, 62 in all."
1 Chronicles,26,9,"Meshelemiah had sons and relatives, who were able men—18 in all."
1 Chronicles,26,10,"Hosah the Merarite had sons: Shimri the first (although he was not the firstborn, his father had appointed him the first),"
1 Chronicles,26,11,"Hilkiah the second, Tabaliah the third and Zechariah the fourth. The sons and relatives of Hosah were 13 in all."
1 Chronicles,26,12,"These divisions of the gatekeepers, through their leaders, had duties for ministering in the temple of the LORD, just as their relatives had."
1 Chronicles,26,13,"Lots were cast for each gate, according to their families, young and old alike."
1 Chronicles,26,14,"The lot for the East Gate fell to Shelemiah. Then lots were cast for his son Zechariah, a wise counselor, and the lot for the North Gate fell to him."
1 Chronicles,26,15,"The lot for the South Gate fell to Obed-Edom, and the lot for the storehouse fell to his sons."
1 Chronicles,26,16,The lots for the West Gate and the Shalleketh Gate on the upper road fell to Shuppim and Hosah. Guard was alongside of guard:
1 Chronicles,26,17,"There were six Levites a day on the east, four a day on the north, four a day on the south and two at a time at the storehouse."
1 Chronicles,26,18,"As for the court to the west, there were four at the road and two at the court itself."
1 Chronicles,26,19,These were the divisions of the gatekeepers who were descendants of Korah and Merari.
1 Chronicles,26,20,Their fellow Levites were in charge of the treasuries of the house of God and the treasuries for the dedicated things.
1 Chronicles,26,21,"The descendants of Ladan, who were Gershonites through Ladan and who were heads of families belonging to Ladan the Gershonite, were Jehieli,"
1 Chronicles,26,22,"the sons of Jehieli, Zetham and his brother Joel. They were in charge of the treasuries of the temple of the LORD."
1 Chronicles,26,23,"From the Amramites, the Izharites, the Hebronites and the Uzzielites:"
1 Chronicles,26,24,"Shubael, a descendant of Gershom son of Moses, was the official in charge of the treasuries."
1 Chronicles,26,25,"His relatives through Eliezer: Rehabiah his son, Jeshaiah his son, Joram his son, Zikri his son and Shelomith his son."
1 Chronicles,26,26,"Shelomith and his relatives were in charge of all the treasuries for the things dedicated by King David, by the heads of families who were the commanders of thousands and commanders of hundreds, and by the other army commanders."
1 Chronicles,26,27,Some of the plunder taken in battle they dedicated for the repair of the temple of the LORD.
1 Chronicles,26,28,"And everything dedicated by Samuel the seer and by Saul son of Kish, Abner son of Ner and Joab son of Zeruiah, and all the other dedicated things were in the care of Shelomith and his relatives."
1 Chronicles,26,29,"From the Izharites: Kenaniah and his sons were assigned duties away from the temple, as officials and judges over Israel."
1 Chronicles,26,30,From the Hebronites: Hashabiah and his relatives—seventeen hundred able men—were responsible in Israel west of the Jordan for all the work of the LORD and for the king’s service.
1 Chronicles,26,31,"As for the Hebronites, Jeriah was their chief according to the genealogical records of their families. In the fortieth year of David’s reign a search was made in the records, and capable men among the Hebronites were found at Jazer in Gilead."
1 Chronicles,26,32,"Jeriah had twenty-seven hundred relatives, who were able men and heads of families, and King David put them in charge of the Reubenites, the Gadites and the half-tribe of Manasseh for every matter pertaining to God and for the affairs of the king."
1 Chronicles,27,1,"This is the list of the Israelites—heads of families, commanders of thousands and commanders of hundreds, and their officers, who served the king in all that concerned the army divisions that were on duty month by month throughout the year. Each division consisted of 24,000 men."
1 Chronicles,27,2,"In charge of the first division, for the first month, was Jashobeam son of Zabdiel. There were 24,000 men in his division."
1 Chronicles,27,3,He was a descendant of Perez and chief of all the army officers for the first month.
1 Chronicles,27,4,"In charge of the division for the second month was Dodai the Ahohite; Mikloth was the leader of his division. There were 24,000 men in his division."
1 Chronicles,27,5,"The third army commander, for the third month, was Benaiah son of Jehoiada the priest. He was chief and there were 24,000 men in his division."
1 Chronicles,27,6,This was the Benaiah who was a mighty warrior among the Thirty and was over the Thirty. His son Ammizabad was in charge of his division.
1 Chronicles,27,7,"The fourth, for the fourth month, was Asahel the brother of Joab; his son Zebadiah was his successor. There were 24,000 men in his division."
1 Chronicles,27,8,"The fifth, for the fifth month, was the commander Shamhuth the Izrahite. There were 24,000 men in his division."
1 Chronicles,27,9,"The sixth, for the sixth month, was Ira the son of Ikkesh the Tekoite. There were 24,000 men in his division."
1 Chronicles,27,10,"The seventh, for the seventh month, was Helez the Pelonite, an Ephraimite. There were 24,000 men in his division."
1 Chronicles,27,11,"The eighth, for the eighth month, was Sibbekai the Hushathite, a Zerahite. There were 24,000 men in his division."
1 Chronicles,27,12,"The ninth, for the ninth month, was Abiezer the Anathothite, a Benjamite. There were 24,000 men in his division."
1 Chronicles,27,13,"The tenth, for the tenth month, was Maharai the Netophathite, a Zerahite. There were 24,000 men in his division."
1 Chronicles,27,14,"The eleventh, for the eleventh month, was Benaiah the Pirathonite, an Ephraimite. There were 24,000 men in his division."
1 Chronicles,27,15,"The twelfth, for the twelfth month, was Heldai the Netophathite, from the family of Othniel. There were 24,000 men in his division."
1 Chronicles,27,16,The leaders of the tribes of Israel: over the Reubenites: Eliezer son of Zikri; over the Simeonites: Shephatiah son of Maakah;
1 Chronicles,27,17,over Levi: Hashabiah son of Kemuel; over Aaron: Zadok;
1 Chronicles,27,18,"over Judah: Elihu, a brother of David; over Issachar: Omri son of Michael;"
1 Chronicles,27,19,over Zebulun: Ishmaiah son of Obadiah; over Naphtali: Jerimoth son of Azriel;
1 Chronicles,27,20,over the Ephraimites: Hoshea son of Azaziah; over half the tribe of Manasseh: Joel son of Pedaiah;
1 Chronicles,27,21,over the half-tribe of Manasseh in Gilead: Iddo son of Zechariah; over Benjamin: Jaasiel son of Abner;
1 Chronicles,27,22,over Dan: Azarel son of Jeroham. These were the leaders of the tribes of Israel.
1 Chronicles,27,23,"David did not take the number of the men twenty years old or less, because the LORD had promised to make Israel as numerous as the stars in the sky."
1 Chronicles,27,24,"Joab son of Zeruiah began to count the men but did not finish. God’s wrath came on Israel on account of this numbering, and the number was not entered in the book of the annals of King David."
1 Chronicles,27,25,"Azmaveth son of Adiel was in charge of the royal storehouses. Jonathan son of Uzziah was in charge of the storehouses in the outlying districts, in the towns, the villages and the watchtowers."
1 Chronicles,27,26,Ezri son of Kelub was in charge of the workers who farmed the land.
1 Chronicles,27,27,Shimei the Ramathite was in charge of the vineyards. Zabdi the Shiphmite was in charge of the produce of the vineyards for the wine vats.
1 Chronicles,27,28,Baal-Hanan the Gederite was in charge of the olive and sycamore-fig trees in the western foothills. Joash was in charge of the supplies of olive oil.
1 Chronicles,27,29,Shitrai the Sharonite was in charge of the herds grazing in Sharon. Shaphat son of Adlai was in charge of the herds in the valleys.
1 Chronicles,27,30,Obil the Ishmaelite was in charge of the camels. Jehdeiah the Meronothite was in charge of the donkeys.
1 Chronicles,27,31,Jaziz the Hagrite was in charge of the flocks. All these were the officials in charge of King David’s property.
1 Chronicles,27,32,"Jonathan, David’s uncle, was a counselor, a man of insight and a scribe. Jehiel son of Hakmoni took care of the king’s sons."
1 Chronicles,27,33,Ahithophel was the king’s counselor. Hushai the Arkite was the king’s confidant.
1 Chronicles,27,34,Ahithophel was succeeded by Jehoiada son of Benaiah and by Abiathar. Joab was the commander of the royal army.
1 Chronicles,28,1,"David summoned all the officials of Israel to assemble at Jerusalem: the officers over the tribes, the commanders of the divisions in the service of the king, the commanders of thousands and commanders of hundreds, and the officials in charge of all the property and livestock belonging to the king and his sons, together with the palace officials, the warriors and all the brave fighting men."
1 Chronicles,28,2,"King David rose to his feet and said: “Listen to me, my fellow Israelites, my people. I had it in my heart to build a house as a place of rest for the ark of the covenant of the LORD, for the footstool of our God, and I made plans to build it."
1 Chronicles,28,3,"But God said to me, ‘You are not to build a house for my Name, because you are a warrior and have shed blood.’"
1 Chronicles,28,4,"“Yet the LORD, the God of Israel, chose me from my whole family to be king over Israel forever. He chose Judah as leader, and from the tribe of Judah he chose my family, and from my father’s sons he was pleased to make me king over all Israel."
1 Chronicles,28,5,Of all my sons—and the LORD has given me many—he has chosen my son Solomon to sit on the throne of the kingdom of the LORD over Israel.
1 Chronicles,28,6,"He said to me: ‘Solomon your son is the one who will build my house and my courts, for I have chosen him to be my son, and I will be his father."
1 Chronicles,28,7,"I will establish his kingdom forever if he is unswerving in carrying out my commands and laws, as is being done at this time.’"
1 Chronicles,28,8,"“So now I charge you in the sight of all Israel and of the assembly of the LORD, and in the hearing of our God: Be careful to follow all the commands of the LORD your God, that you may possess this good land and pass it on as an inheritance to your descendants forever."
1 Chronicles,28,9,"“And you, my son Solomon, acknowledge the God of your father, and serve him with wholehearted devotion and with a willing mind, for the LORD searches every heart and understands every desire and every thought. If you seek him, he will be found by you; but if you forsake him, he will reject you forever."
1 Chronicles,28,10,"Consider now, for the LORD has chosen you to build a house as the sanctuary. Be strong and do the work.”"
1 Chronicles,28,11,"Then David gave his son Solomon the plans for the portico of the temple, its buildings, its storerooms, its upper parts, its inner rooms and the place of atonement."
1 Chronicles,28,12,"He gave him the plans of all that the Spirit had put in his mind for the courts of the temple of the LORD and all the surrounding rooms, for the treasuries of the temple of God and for the treasuries for the dedicated things."
1 Chronicles,28,13,"He gave him instructions for the divisions of the priests and Levites, and for all the work of serving in the temple of the LORD, as well as for all the articles to be used in its service."
1 Chronicles,28,14,"He designated the weight of gold for all the gold articles to be used in various kinds of service, and the weight of silver for all the silver articles to be used in various kinds of service:"
1 Chronicles,28,15,"the weight of gold for the gold lampstands and their lamps, with the weight for each lampstand and its lamps; and the weight of silver for each silver lampstand and its lamps, according to the use of each lampstand;"
1 Chronicles,28,16,the weight of gold for each table for consecrated bread; the weight of silver for the silver tables;
1 Chronicles,28,17,"the weight of pure gold for the forks, sprinkling bowls and pitchers; the weight of gold for each gold dish; the weight of silver for each silver dish;"
1 Chronicles,28,18,"and the weight of the refined gold for the altar of incense. He also gave him the plan for the chariot, that is, the cherubim of gold that spread their wings and overshadow the ark of the covenant of the LORD."
1 Chronicles,28,19,"“All this,” David said, “I have in writing as a result of the LORD’s hand on me, and he enabled me to understand all the details of the plan.”"
1 Chronicles,28,20,"David also said to Solomon his son, “Be strong and courageous, and do the work. Do not be afraid or discouraged, for the LORD God, my God, is with you. He will not fail you or forsake you until all the work for the service of the temple of the LORD is finished."
1 Chronicles,28,21,"The divisions of the priests and Levites are ready for all the work on the temple of God, and every willing person skilled in any craft will help you in all the work. The officials and all the people will obey your every command.”"
1 Chronicles,29,1,"Then King David said to the whole assembly: “My son Solomon, the one whom God has chosen, is young and inexperienced. The task is great, because this palatial structure is not for man but for the LORD God."
1 Chronicles,29,2,"With all my resources I have provided for the temple of my God—gold for the gold work, silver for the silver, bronze for the bronze, iron for the iron and wood for the wood, as well as onyx for the settings, turquoise, stones of various colors, and all kinds of fine stone and marble—all of these in large quantities."
1 Chronicles,29,3,"Besides, in my devotion to the temple of my God I now give my personal treasures of gold and silver for the temple of my God, over and above everything I have provided for this holy temple:"
1 Chronicles,29,4,"three thousand talents of gold (gold of Ophir) and seven thousand talents of refined silver, for the overlaying of the walls of the buildings,"
1 Chronicles,29,5,"for the gold work and the silver work, and for all the work to be done by the craftsmen. Now, who is willing to consecrate themselves to the LORD today?”"
1 Chronicles,29,6,"Then the leaders of families, the officers of the tribes of Israel, the commanders of thousands and commanders of hundreds, and the officials in charge of the king’s work gave willingly."
1 Chronicles,29,7,"They gave toward the work on the temple of God five thousand talents and ten thousand darics of gold, ten thousand talents of silver, eighteen thousand talents of bronze and a hundred thousand talents of iron."
1 Chronicles,29,8,Anyone who had precious stones gave them to the treasury of the temple of the LORD in the custody of Jehiel the Gershonite.
1 Chronicles,29,9,"The people rejoiced at the willing response of their leaders, for they had given freely and wholeheartedly to the LORD. David the king also rejoiced greatly."
1 Chronicles,29,10,"David praised the LORD in the presence of the whole assembly, saying, “Praise be to you, LORD, the God of our father Israel, from everlasting to everlasting."
1 Chronicles,29,11,"Yours, LORD, is the greatness and the power and the glory and the majesty and the splendor, for everything in heaven and earth is yours. Yours, LORD, is the kingdom; you are exalted as head over all."
1 Chronicles,29,12,Wealth and honor come from you; you are the ruler of all things. In your hands are strength and power to exalt and give strength to all.
