Isaiah,65,19,I will rejoice over Jerusalem and take delight in my people; the sound of weeping and of crying will be heard in it no more.
Isaiah,65,20,"“Never again will there be in it an infant who lives but a few days, or an old man who does not live out his years; the one who dies at a hundred will be thought a mere child; the one who fails to reach a hundred will be considered accursed."
Isaiah,65,21,They will build houses and dwell in them; they will plant vineyards and eat their fruit.
Isaiah,65,22,"No longer will they build houses and others live in them, or plant and others eat. For as the days of a tree, so will be the days of my people; my chosen ones will long enjoy the work of their hands."
Isaiah,65,23,"They will not labor in vain, nor will they bear children doomed to misfortune; for they will be a people blessed by the LORD, they and their descendants with them."
Isaiah,65,24,Before they call I will answer; while they are still speaking I will hear.
Isaiah,65,25,"The wolf and the lamb will feed together, and the lion will eat straw like the ox, and dust will be the serpent’s food. They will neither harm nor destroy on all my holy mountain,” says the LORD."
Isaiah,66,1,"This is what the LORD says: “Heaven is my throne, and the earth is my footstool. Where is the house you will build for me? Where will my resting place be?"
Isaiah,66,2,"Has not my hand made all these things, and so they came into being?” declares the LORD. “These are the ones I look on with favor: those who are humble and contrite in spirit, and who tremble at my word."
Isaiah,66,3,"But whoever sacrifices a bull is like one who kills a person, and whoever offers a lamb is like one who breaks a dog’s neck; whoever makes a grain offering is like one who presents pig’s blood, and whoever burns memorial incense is like one who worships an idol. They have chosen their own ways, and they delight in their abominations;"
Isaiah,66,4,"so I also will choose harsh treatment for them and will bring on them what they dread. For when I called, no one answered, when I spoke, no one listened. They did evil in my sight and chose what displeases me.”"
Isaiah,66,5,"Hear the word of the LORD, you who tremble at his word: “Your own people who hate you, and exclude you because of my name, have said, ‘Let the LORD be glorified, that we may see your joy!’ Yet they will be put to shame."
Isaiah,66,6,"Hear that uproar from the city, hear that noise from the temple! It is the sound of the LORD repaying his enemies all they deserve."
Isaiah,66,7,"“Before she goes into labor, she gives birth; before the pains come upon her, she delivers a son."
Isaiah,66,8,Who has ever heard of such things? Who has ever seen things like this? Can a country be born in a day or a nation be brought forth in a moment? Yet no sooner is Zion in labor than she gives birth to her children.
Isaiah,66,9,Do I bring to the moment of birth and not give delivery?” says the LORD. “Do I close up the womb when I bring to delivery?” says your God.
Isaiah,66,10,"“Rejoice with Jerusalem and be glad for her, all you who love her; rejoice greatly with her, all you who mourn over her."
Isaiah,66,11,For you will nurse and be satisfied at her comforting breasts; you will drink deeply and delight in her overflowing abundance.”
Isaiah,66,12,"For this is what the LORD says: “I will extend peace to her like a river, and the wealth of nations like a flooding stream; you will nurse and be carried on her arm and dandled on her knees."
Isaiah,66,13,"As a mother comforts her child, so will I comfort you; and you will be comforted over Jerusalem.”"
Isaiah,66,14,"When you see this, your heart will rejoice and you will flourish like grass; the hand of the LORD will be made known to his servants, but his fury will be shown to his foes."
Isaiah,66,15,"See, the LORD is coming with fire, and his chariots are like a whirlwind; he will bring down his anger with fury, and his rebuke with flames of fire."
Isaiah,66,16,"For with fire and with his sword the LORD will execute judgment on all people, and many will be those slain by the LORD."
Isaiah,66,17,"“Those who consecrate and purify themselves to go into the gardens, following one who is among those who eat the flesh of pigs, rats and other unclean things—they will meet their end together with the one they follow,” declares the LORD."
Isaiah,66,18,"“And I, because of what they have planned and done, am about to come and gather the people of all nations and languages, and they will come and see my glory."
Isaiah,66,19,"“I will set a sign among them, and I will send some of those who survive to the nations—to Tarshish, to the Libyans and Lydians (famous as archers), to Tubal and Greece, and to the distant islands that have not heard of my fame or seen my glory. They will proclaim my glory among the nations."
Isaiah,66,20,"And they will bring all your people, from all the nations, to my holy mountain in Jerusalem as an offering to the LORD—on horses, in chariots and wagons, and on mules and camels,” says the LORD. “They will bring them, as the Israelites bring their grain offerings, to the temple of the LORD in ceremonially clean vessels."
Isaiah,66,21,"And I will select some of them also to be priests and Levites,” says the LORD."
Isaiah,66,22,"“As the new heavens and the new earth that I make will endure before me,” declares the LORD, “so will your name and descendants endure."
Isaiah,66,23,"From one New Moon to another and from one Sabbath to another, all mankind will come and bow down before me,” says the LORD."
Isaiah,66,24,"“And they will go out and look on the dead bodies of those who rebelled against me; the worms that eat them will not die, the fire that burns them will not be quenched, and they will be loathsome to all mankind.”"
Jeremiah,1,1,"The words of Jeremiah son of Hilkiah, one of the priests at Anathoth in the territory of Benjamin."
Jeremiah,1,2,"The word of the LORD came to him in the thirteenth year of the reign of Josiah son of Amon king of Judah,"
Jeremiah,1,3,"and through the reign of Jehoiakim son of Josiah king of Judah, down to the fifth month of the eleventh year of Zedekiah son of Josiah king of Judah, when the people of Jerusalem went into exile."
Jeremiah,1,4,"The word of the LORD came to me, saying,"
Jeremiah,1,5,"“Before I formed you in the womb I knew you, before you were born I set you apart; I appointed you as a prophet to the nations.”"
Jeremiah,1,6,"“Alas, Sovereign LORD,” I said, “I do not know how to speak; I am too young.”"
Jeremiah,1,7,"But the LORD said to me, “Do not say, ‘I am too young.’ You must go to everyone I send you to and say whatever I command you."
Jeremiah,1,8,"Do not be afraid of them, for I am with you and will rescue you,” declares the LORD."
Jeremiah,1,9,"Then the LORD reached out his hand and touched my mouth and said to me, “I have put my words in your mouth."
Jeremiah,1,10,"See, today I appoint you over nations and kingdoms to uproot and tear down, to destroy and overthrow, to build and to plant.”"
Jeremiah,1,11,"The word of the LORD came to me: “What do you see, Jeremiah?” “I see the branch of an almond tree,” I replied."
Jeremiah,1,12,"The LORD said to me, “You have seen correctly, for I am watching to see that my word is fulfilled.”"
Jeremiah,1,13,"The word of the LORD came to me again: “What do you see?” “I see a pot that is boiling,” I answered. “It is tilting toward us from the north.”"
Jeremiah,1,14,"The LORD said to me, “From the north disaster will be poured out on all who live in the land."
Jeremiah,1,15,"I am about to summon all the peoples of the northern kingdoms,” declares the LORD. “Their kings will come and set up their thrones in the entrance of the gates of Jerusalem; they will come against all her surrounding walls and against all the towns of Judah."
Jeremiah,1,16,"I will pronounce my judgments on my people because of their wickedness in forsaking me, in burning incense to other gods and in worshiping what their hands have made."
Jeremiah,1,17,"“Get yourself ready! Stand up and say to them whatever I command you. Do not be terrified by them, or I will terrify you before them."
Jeremiah,1,18,"Today I have made you a fortified city, an iron pillar and a bronze wall to stand against the whole land—against the kings of Judah, its officials, its priests and the people of the land."
Jeremiah,1,19,"They will fight against you but will not overcome you, for I am with you and will rescue you,” declares the LORD."
Jeremiah,2,1,The word of the LORD came to me:
Jeremiah,2,2,"“Go and proclaim in the hearing of Jerusalem: “This is what the LORD says: “‘I remember the devotion of your youth, how as a bride you loved me and followed me through the wilderness, through a land not sown."
Jeremiah,2,3,"Israel was holy to the LORD, the firstfruits of his harvest; all who devoured her were held guilty, and disaster overtook them,’” declares the LORD."
Jeremiah,2,4,"Hear the word of the LORD, you descendants of Jacob, all you clans of Israel."
Jeremiah,2,5,"This is what the LORD says: “What fault did your ancestors find in me, that they strayed so far from me? They followed worthless idols and became worthless themselves."
Jeremiah,2,6,"They did not ask, ‘Where is the LORD, who brought us up out of Egypt and led us through the barren wilderness, through a land of deserts and ravines, a land of drought and utter darkness, a land where no one travels and no one lives?’"
Jeremiah,2,7,I brought you into a fertile land to eat its fruit and rich produce. But you came and defiled my land and made my inheritance detestable.
Jeremiah,2,8,"The priests did not ask, ‘Where is the LORD?’ Those who deal with the law did not know me; the leaders rebelled against me. The prophets prophesied by Baal, following worthless idols."
Jeremiah,2,9,"“Therefore I bring charges against you again,” declares the LORD. “And I will bring charges against your children’s children."
Jeremiah,2,10,"Cross over to the coasts of Cyprus and look, send to Kedar and observe closely; see if there has ever been anything like this:"
Jeremiah,2,11,Has a nation ever changed its gods? (Yet they are not gods at all.) But my people have exchanged their glorious God for worthless idols.
Jeremiah,2,12,"Be appalled at this, you heavens, and shudder with great horror,” declares the LORD."
Jeremiah,2,13,"“My people have committed two sins: They have forsaken me, the spring of living water, and have dug their own cisterns, broken cisterns that cannot hold water."
Jeremiah,2,14,"Is Israel a servant, a slave by birth? Why then has he become plunder?"
Jeremiah,2,15,Lions have roared; they have growled at him. They have laid waste his land; his towns are burned and deserted.
Jeremiah,2,16,"Also, the men of Memphis and Tahpanhes have cracked your skull."
Jeremiah,2,17,Have you not brought this on yourselves by forsaking the LORD your God when he led you in the way?
Jeremiah,2,18,Now why go to Egypt to drink water from the Nile? And why go to Assyria to drink water from the Euphrates?
Jeremiah,2,19,"Your wickedness will punish you; your backsliding will rebuke you. Consider then and realize how evil and bitter it is for you when you forsake the LORD your God and have no awe of me,” declares the Lord, the LORD Almighty."
Jeremiah,2,20,"“Long ago you broke off your yoke and tore off your bonds; you said, ‘I will not serve you!’ Indeed, on every high hill and under every spreading tree you lay down as a prostitute."
Jeremiah,2,21,"I had planted you like a choice vine of sound and reliable stock. How then did you turn against me into a corrupt, wild vine?"
Jeremiah,2,22,"Although you wash yourself with soap and use an abundance of cleansing powder, the stain of your guilt is still before me,” declares the Sovereign LORD."
Jeremiah,2,23,"“How can you say, ‘I am not defiled; I have not run after the Baals’? See how you behaved in the valley; consider what you have done. You are a swift she-camel running here and there,"
Jeremiah,2,24,"a wild donkey accustomed to the desert, sniffing the wind in her craving— in her heat who can restrain her? Any males that pursue her need not tire themselves; at mating time they will find her."
Jeremiah,2,25,"Do not run until your feet are bare and your throat is dry. But you said, ‘It’s no use! I love foreign gods, and I must go after them.’"
Jeremiah,2,26,"“As a thief is disgraced when he is caught, so the people of Israel are disgraced— they, their kings and their officials, their priests and their prophets."
Jeremiah,2,27,"They say to wood, ‘You are my father,’ and to stone, ‘You gave me birth.’ They have turned their backs to me and not their faces; yet when they are in trouble, they say, ‘Come and save us!’"
Jeremiah,2,28,"Where then are the gods you made for yourselves? Let them come if they can save you when you are in trouble! For you, Judah, have as many gods as you have towns."
Jeremiah,2,29,"“Why do you bring charges against me? You have all rebelled against me,” declares the LORD."
Jeremiah,2,30,“In vain I punished your people; they did not respond to correction. Your sword has devoured your prophets like a ravenous lion.
Jeremiah,2,31,"“You of this generation, consider the word of the LORD: “Have I been a desert to Israel or a land of great darkness? Why do my people say, ‘We are free to roam; we will come to you no more’?"
Jeremiah,2,32,"Does a young woman forget her jewelry, a bride her wedding ornaments? Yet my people have forgotten me, days without number."
Jeremiah,2,33,How skilled you are at pursuing love! Even the worst of women can learn from your ways.
Jeremiah,2,34,"On your clothes is found the lifeblood of the innocent poor, though you did not catch them breaking in. Yet in spite of all this"
Jeremiah,2,35,"you say, ‘I am innocent; he is not angry with me.’ But I will pass judgment on you because you say, ‘I have not sinned.’"
Jeremiah,2,36,"Why do you go about so much, changing your ways? You will be disappointed by Egypt as you were by Assyria."
Jeremiah,2,37,"You will also leave that place with your hands on your head, for the LORD has rejected those you trust; you will not be helped by them."
Jeremiah,3,1,"“If a man divorces his wife and she leaves him and marries another man, should he return to her again? Would not the land be completely defiled? But you have lived as a prostitute with many lovers— would you now return to me?” declares the LORD."
Jeremiah,3,2,"“Look up to the barren heights and see. Is there any place where you have not been ravished? By the roadside you sat waiting for lovers, sat like a nomad in the desert. You have defiled the land with your prostitution and wickedness."
Jeremiah,3,3,"Therefore the showers have been withheld, and no spring rains have fallen. Yet you have the brazen look of a prostitute; you refuse to blush with shame."
Jeremiah,3,4,"Have you not just called to me: ‘My Father, my friend from my youth,"
Jeremiah,3,5,"will you always be angry? Will your wrath continue forever?’ This is how you talk, but you do all the evil you can.”"
Jeremiah,3,6,"During the reign of King Josiah, the LORD said to me, “Have you seen what faithless Israel has done? She has gone up on every high hill and under every spreading tree and has committed adultery there."
Jeremiah,3,7,"I thought that after she had done all this she would return to me but she did not, and her unfaithful sister Judah saw it."
Jeremiah,3,8,I gave faithless Israel her certificate of divorce and sent her away because of all her adulteries. Yet I saw that her unfaithful sister Judah had no fear; she also went out and committed adultery.
Jeremiah,3,9,"Because Israel’s immorality mattered so little to her, she defiled the land and committed adultery with stone and wood."
Jeremiah,3,10,"In spite of all this, her unfaithful sister Judah did not return to me with all her heart, but only in pretense,” declares the LORD."
Jeremiah,3,11,"The LORD said to me, “Faithless Israel is more righteous than unfaithful Judah."
Jeremiah,3,12,"Go, proclaim this message toward the north: “‘Return, faithless Israel,’ declares the LORD, ‘I will frown on you no longer, for I am faithful,’ declares the LORD, ‘I will not be angry forever."
Jeremiah,3,13,"Only acknowledge your guilt— you have rebelled against the LORD your God, you have scattered your favors to foreign gods under every spreading tree, and have not obeyed me,’” declares the LORD."
Jeremiah,3,14,"“Return, faithless people,” declares the LORD, “for I am your husband. I will choose you—one from a town and two from a clan—and bring you to Zion."
Jeremiah,3,15,"Then I will give you shepherds after my own heart, who will lead you with knowledge and understanding."
Jeremiah,3,16,"In those days, when your numbers have increased greatly in the land,” declares the LORD, “people will no longer say, ‘The ark of the covenant of the LORD.’ It will never enter their minds or be remembered; it will not be missed, nor will another one be made."
Jeremiah,3,17,"At that time they will call Jerusalem The Throne of the LORD, and all nations will gather in Jerusalem to honor the name of the LORD. No longer will they follow the stubbornness of their evil hearts."
Jeremiah,3,18,"In those days the people of Judah will join the people of Israel, and together they will come from a northern land to the land I gave your ancestors as an inheritance."
Jeremiah,3,19,"“I myself said, “‘How gladly would I treat you like my children and give you a pleasant land, the most beautiful inheritance of any nation.’ I thought you would call me ‘Father’ and not turn away from following me."
Jeremiah,3,20,"But like a woman unfaithful to her husband, so you, Israel, have been unfaithful to me,” declares the LORD."
Jeremiah,3,21,"A cry is heard on the barren heights, the weeping and pleading of the people of Israel, because they have perverted their ways and have forgotten the LORD their God."
Jeremiah,3,22,"“Return, faithless people; I will cure you of backsliding.” “Yes, we will come to you, for you are the LORD our God."
Jeremiah,3,23,Surely the idolatrous commotion on the hills and mountains is a deception; surely in the LORD our God is the salvation of Israel.
Jeremiah,3,24,"From our youth shameful gods have consumed the fruits of our ancestors’ labor— their flocks and herds, their sons and daughters."
Jeremiah,3,25,"Let us lie down in our shame, and let our disgrace cover us. We have sinned against the LORD our God, both we and our ancestors; from our youth till this day we have not obeyed the LORD our God.”"
Jeremiah,4,1,"“If you, Israel, will return, then return to me,” declares the LORD. “If you put your detestable idols out of my sight and no longer go astray,"
Jeremiah,4,2,"and if in a truthful, just and righteous way you swear, ‘As surely as the LORD lives,’ then the nations will invoke blessings by him and in him they will boast.”"
Jeremiah,4,3,This is what the LORD says to the people of Judah and to Jerusalem: “Break up your unplowed ground and do not sow among thorns.
Jeremiah,4,4,"Circumcise yourselves to the LORD, circumcise your hearts, you people of Judah and inhabitants of Jerusalem, or my wrath will flare up and burn like fire because of the evil you have done— burn with no one to quench it."
Jeremiah,4,5,“Announce in Judah and proclaim in Jerusalem and say: ‘Sound the trumpet throughout the land!’ Cry aloud and say: ‘Gather together! Let us flee to the fortified cities!’
Jeremiah,4,6,"Raise the signal to go to Zion! Flee for safety without delay! For I am bringing disaster from the north, even terrible destruction.”"
Jeremiah,4,7,A lion has come out of his lair; a destroyer of nations has set out. He has left his place to lay waste your land. Your towns will lie in ruins without inhabitant.
Jeremiah,4,8,"So put on sackcloth, lament and wail, for the fierce anger of the LORD has not turned away from us."
Jeremiah,4,9,"“In that day,” declares the LORD, “the king and the officials will lose heart, the priests will be horrified, and the prophets will be appalled.”"
Jeremiah,4,10,"Then I said, “Alas, Sovereign LORD! How completely you have deceived this people and Jerusalem by saying, ‘You will have peace,’ when the sword is at our throats!”"
Jeremiah,4,11,"At that time this people and Jerusalem will be told, “A scorching wind from the barren heights in the desert blows toward my people, but not to winnow or cleanse;"
Jeremiah,4,12,a wind too strong for that comes from me. Now I pronounce my judgments against them.”
Jeremiah,4,13,"Look! He advances like the clouds, his chariots come like a whirlwind, his horses are swifter than eagles. Woe to us! We are ruined!"
Jeremiah,4,14,"Jerusalem, wash the evil from your heart and be saved. How long will you harbor wicked thoughts?"
Jeremiah,4,15,"A voice is announcing from Dan, proclaiming disaster from the hills of Ephraim."
Jeremiah,4,16,"“Tell this to the nations, proclaim concerning Jerusalem: ‘A besieging army is coming from a distant land, raising a war cry against the cities of Judah."
Jeremiah,4,17,"They surround her like men guarding a field, because she has rebelled against me,’” declares the LORD."
Jeremiah,4,18,“Your own conduct and actions have brought this on you. This is your punishment. How bitter it is! How it pierces to the heart!”
Jeremiah,4,19,"Oh, my anguish, my anguish! I writhe in pain. Oh, the agony of my heart! My heart pounds within me, I cannot keep silent. For I have heard the sound of the trumpet; I have heard the battle cry."
Jeremiah,4,20,"Disaster follows disaster; the whole land lies in ruins. In an instant my tents are destroyed, my shelter in a moment."
Jeremiah,4,21,How long must I see the battle standard and hear the sound of the trumpet?
Jeremiah,4,22,“My people are fools; they do not know me. They are senseless children; they have no understanding. They are skilled in doing evil; they know not how to do good.”
Jeremiah,4,23,"I looked at the earth, and it was formless and empty; and at the heavens, and their light was gone."
Jeremiah,4,24,"I looked at the mountains, and they were quaking; all the hills were swaying."
Jeremiah,4,25,"I looked, and there were no people; every bird in the sky had flown away."
Jeremiah,4,26,"I looked, and the fruitful land was a desert; all its towns lay in ruins before the LORD, before his fierce anger."
Jeremiah,4,27,"This is what the LORD says: “The whole land will be ruined, though I will not destroy it completely."
Jeremiah,4,28,"Therefore the earth will mourn and the heavens above grow dark, because I have spoken and will not relent, I have decided and will not turn back.”"
Jeremiah,4,29,At the sound of horsemen and archers every town takes to flight. Some go into the thickets; some climb up among the rocks. All the towns are deserted; no one lives in them.
Jeremiah,4,30,"What are you doing, you devastated one? Why dress yourself in scarlet and put on jewels of gold? Why highlight your eyes with makeup? You adorn yourself in vain. Your lovers despise you; they want to kill you."
Jeremiah,4,31,"I hear a cry as of a woman in labor, a groan as of one bearing her first child— the cry of Daughter Zion gasping for breath, stretching out her hands and saying, “Alas! I am fainting; my life is given over to murderers.”"
Jeremiah,5,1,"“Go up and down the streets of Jerusalem, look around and consider, search through her squares. If you can find but one person who deals honestly and seeks the truth, I will forgive this city."
Jeremiah,5,2,"Although they say, ‘As surely as the LORD lives,’ still they are swearing falsely.”"
Jeremiah,5,3,"LORD, do not your eyes look for truth? You struck them, but they felt no pain; you crushed them, but they refused correction. They made their faces harder than stone and refused to repent."
Jeremiah,5,4,"I thought, “These are only the poor; they are foolish, for they do not know the way of the LORD, the requirements of their God."
Jeremiah,5,5,"So I will go to the leaders and speak to them; surely they know the way of the LORD, the requirements of their God.” But with one accord they too had broken off the yoke and torn off the bonds."
Jeremiah,5,6,"Therefore a lion from the forest will attack them, a wolf from the desert will ravage them, a leopard will lie in wait near their towns to tear to pieces any who venture out, for their rebellion is great and their backslidings many."
Jeremiah,5,7,"“Why should I forgive you? Your children have forsaken me and sworn by gods that are not gods. I supplied all their needs, yet they committed adultery and thronged to the houses of prostitutes."
Jeremiah,5,8,"They are well-fed, lusty stallions, each neighing for another man’s wife."
Jeremiah,5,9,Should I not punish them for this?” declares the LORD. “Should I not avenge myself on such a nation as this?
Jeremiah,5,10,"“Go through her vineyards and ravage them, but do not destroy them completely. Strip off her branches, for these people do not belong to the LORD."
Jeremiah,5,11,"The people of Israel and the people of Judah have been utterly unfaithful to me,” declares the LORD."
Jeremiah,5,12,"They have lied about the LORD; they said, “He will do nothing! No harm will come to us; we will never see sword or famine."
Jeremiah,5,13,The prophets are but wind and the word is not in them; so let what they say be done to them.”
Jeremiah,5,14,"Therefore this is what the LORD God Almighty says: “Because the people have spoken these words, I will make my words in your mouth a fire and these people the wood it consumes."
