Lamentations,1,10,"The adversary has spread his hand Over all her pleasant things; For she has seen the nations enter her sanctuary, Those whom You commanded Not to enter Your assembly."
Lamentations,1,11,"All her people sigh, They seek bread; They have given their valuables for food to restore life. “See, O LORD, and consider, For I am scorned.”"
Lamentations,1,12,"“Is it nothing to you, all you who pass by? Behold and see If there is any sorrow like my sorrow, Which has been brought on me, Which the LORD has inflicted In the day of His fierce anger."
Lamentations,1,13,"“From above He has sent fire into my bones, And it overpowered them; He has spread a net for my feet And turned me back; He has made me desolate And faint all the day."
Lamentations,1,14,"“The yoke of my transgressions was bound; They were woven together by His hands, And thrust upon my neck. He made my strength fail; The Lord delivered me into the hands of those whom I am not able to withstand."
Lamentations,1,15,“The Lord has trampled underfoot all my mighty men in my midst; He has called an assembly against me To crush my young men; The Lord trampled as in a winepress The virgin daughter of Judah.
Lamentations,1,16,"“For these things I weep; My eye, my eye overflows with water; Because the comforter, who should restore my life, Is far from me. My children are desolate Because the enemy prevailed.”"
Lamentations,1,17,"Zion spreads out her hands, But no one comforts her; The LORD has commanded concerning Jacob That those around him become his adversaries; Jerusalem has become an unclean thing among them."
Lamentations,1,18,"“The LORD is righteous, For I rebelled against His commandment. Hear now, all peoples, And behold my sorrow; My virgins and my young men Have gone into captivity."
Lamentations,1,19,"“I called for my lovers, But they deceived me; My priests and my elders Breathed their last in the city, While they sought food To restore their life."
Lamentations,1,20,"“See, O LORD, that I am in distress; My soul is troubled; My heart is overturned within me, For I have been very rebellious. Outside the sword bereaves, At home it is like death."
Lamentations,1,21,"“They have heard that I sigh, But no one comforts me. All my enemies have heard of my trouble; They are glad that You have done it. Bring on the day You have announced, That they may become like me."
Lamentations,1,22,"“Let all their wickedness come before You, And do to them as You have done to me For all my transgressions; For my sighs are many, And my heart is faint.”"
Lamentations,2,1,"How the Lord has covered the daughter of Zion With a cloud in His anger! He cast down from heaven to the earth The beauty of Israel, And did not remember His footstool In the day of His anger."
Lamentations,2,2,The Lord has swallowed up and has not pitied All the dwelling places of Jacob. He has thrown down in His wrath The strongholds of the daughter of Judah; He has brought them down to the ground; He has profaned the kingdom and its princes.
Lamentations,2,3,He has cut off in fierce anger Every horn of Israel; He has drawn back His right hand From before the enemy. He has blazed against Jacob like a flaming fire Devouring all around.
Lamentations,2,4,"Standing like an enemy, He has bent His bow; With His right hand, like an adversary, He has slain all who were pleasing to His eye; On the tent of the daughter of Zion, He has poured out His fury like fire."
Lamentations,2,5,"The Lord was like an enemy. He has swallowed up Israel, He has swallowed up all her palaces; He has destroyed her strongholds, And has increased mourning and lamentation In the daughter of Judah."
Lamentations,2,6,"He has done violence to His tabernacle, As if it were a garden; He has destroyed His place of assembly; The LORD has caused The appointed feasts and Sabbaths to be forgotten in Zion. In His burning indignation He has spurned the king and the priest."
Lamentations,2,7,"The Lord has spurned His altar, He has abandoned His sanctuary; He has given up the walls of her palaces Into the hand of the enemy. They have made a noise in the house of the LORD As on the day of a set feast."
Lamentations,2,8,The LORD has purposed to destroy The wall of the daughter of Zion. He has stretched out a line; He has not withdrawn His hand from destroying; Therefore He has caused the rampart and wall to lament; They languished together.
Lamentations,2,9,"Her gates have sunk into the ground; He has destroyed and broken her bars. Her king and her princes are among the nations; The Law is no more, And her prophets find no vision from the LORD."
Lamentations,2,10,The elders of the daughter of Zion Sit on the ground and keep silence; They throw dust on their heads And gird themselves with sackcloth. The virgins of Jerusalem Bow their heads to the ground.
Lamentations,2,11,"My eyes fail with tears, My heart is troubled; My bile is poured on the ground Because of the destruction of the daughter of my people, Because the children and the infants Faint in the streets of the city."
Lamentations,2,12,"They say to their mothers, “Where is grain and wine?” As they swoon like the wounded In the streets of the city, As their life is poured out In their mothers’ bosom."
Lamentations,2,13,"How shall I console you? To what shall I liken you, O daughter of Jerusalem? What shall I compare with you, that I may comfort you, O virgin daughter of Zion? For your ruin is spread wide as the sea; Who can heal you?"
Lamentations,2,14,"Your prophets have seen for you False and deceptive visions; They have not uncovered your iniquity, To bring back your captives, But have envisioned for you false prophecies and delusions."
Lamentations,2,15,"All who pass by clap their hands at you; They hiss and shake their heads At the daughter of Jerusalem: “Is this the city that is called ‘The perfection of beauty, The joy of the whole earth’?”"
Lamentations,2,16,"All your enemies have opened their mouth against you; They hiss and gnash their teeth. They say, “We have swallowed her up! Surely this is the day we have waited for; We have found it, we have seen it!”"
Lamentations,2,17,"The LORD has done what He purposed; He has fulfilled His word Which He commanded in days of old. He has thrown down and has not pitied, And He has caused an enemy to rejoice over you; He has exalted the horn of your adversaries."
Lamentations,2,18,"Their heart cried out to the Lord, “O wall of the daughter of Zion, Let tears run down like a river day and night; Give yourself no relief; Give your eyes no rest."
Lamentations,2,19,"“Arise, cry out in the night, At the beginning of the watches; Pour out your heart like water before the face of the Lord. Lift your hands toward Him For the life of your young children, Who faint from hunger at the head of every street.”"
Lamentations,2,20,"“See, O LORD, and consider! To whom have You done this? Should the women eat their offspring, The children they have cuddled? Should the priest and prophet be slain In the sanctuary of the Lord?"
Lamentations,2,21,"“Young and old lie On the ground in the streets; My virgins and my young men Have fallen by the sword; You have slain them in the day of Your anger, You have slaughtered and not pitied."
Lamentations,2,22,“You have invited as to a feast day The terrors that surround me. In the day of the LORD’s anger There was no refugee or survivor. Those whom I have borne and brought up My enemies have destroyed.”
Lamentations,3,1,I am the man who has seen affliction by the rod of His wrath.
Lamentations,3,2,He has led me and made me walk In darkness and not in light.
Lamentations,3,3,Surely He has turned His hand against me Time and time again throughout the day.
Lamentations,3,4,"He has aged my flesh and my skin, And broken my bones."
Lamentations,3,5,He has besieged me And surrounded me with bitterness and woe.
Lamentations,3,6,He has set me in dark places Like the dead of long ago.
Lamentations,3,7,He has hedged me in so that I cannot get out; He has made my chain heavy.
Lamentations,3,8,"Even when I cry and shout, He shuts out my prayer."
Lamentations,3,9,He has blocked my ways with hewn stone; He has made my paths crooked.
Lamentations,3,10,"He has been to me a bear lying in wait, Like a lion in ambush."
Lamentations,3,11,He has turned aside my ways and torn me in pieces; He has made me desolate.
Lamentations,3,12,He has bent His bow And set me up as a target for the arrow.
Lamentations,3,13,He has caused the arrows of His quiver To pierce my loins.
Lamentations,3,14,I have become the ridicule of all my people— Their taunting song all the day.
Lamentations,3,15,"He has filled me with bitterness, He has made me drink wormwood."
Lamentations,3,16,"He has also broken my teeth with gravel, And covered me with ashes."
Lamentations,3,17,You have moved my soul far from peace; I have forgotten prosperity.
Lamentations,3,18,"And I said, “My strength and my hope Have perished from the LORD.”"
Lamentations,3,19,"Remember my affliction and roaming, The wormwood and the gall."
Lamentations,3,20,My soul still remembers And sinks within me.
Lamentations,3,21,"This I recall to my mind, Therefore I have hope."
Lamentations,3,22,"Through the LORD’s mercies we are not consumed, Because His compassions fail not."
Lamentations,3,23,They are new every morning; Great is Your faithfulness.
Lamentations,3,24,"“The LORD is my portion,” says my soul, “Therefore I hope in Him!”"
Lamentations,3,25,"The LORD is good to those who wait for Him, To the soul who seeks Him."
Lamentations,3,26,It is good that one should hope and wait quietly For the salvation of the LORD.
Lamentations,3,27,It is good for a man to bear The yoke in his youth.
Lamentations,3,28,"Let him sit alone and keep silent, Because God has laid it on him;"
Lamentations,3,29,Let him put his mouth in the dust— There may yet be hope.
Lamentations,3,30,"Let him give his cheek to the one who strikes him, And be full of reproach."
Lamentations,3,31,For the Lord will not cast off forever.
Lamentations,3,32,"Though He causes grief, Yet He will show compassion According to the multitude of His mercies."
Lamentations,3,33,"For He does not afflict willingly, Nor grieve the children of men."
Lamentations,3,34,"To crush under one’s feet All the prisoners of the earth,"
Lamentations,3,35,"To turn aside the justice due a man Before the face of the Most High,"
Lamentations,3,36,Or subvert a man in his cause— The Lord does not approve.
Lamentations,3,37,"Who is he who speaks and it comes to pass, When the Lord has not commanded it?"
Lamentations,3,38,Is it not from the mouth of the Most High That woe and well-being proceed?
Lamentations,3,39,"Why should a living man complain, A man for the punishment of his sins?"
Lamentations,3,40,"Let us search out and examine our ways, And turn back to the LORD;"
Lamentations,3,41,Let us lift our hearts and hands To God in heaven.
Lamentations,3,42,We have transgressed and rebelled; You have not pardoned.
Lamentations,3,43,You have covered Yourself with anger And pursued us; You have slain and not pitied.
Lamentations,3,44,"You have covered Yourself with a cloud, That prayer should not pass through."
Lamentations,3,45,You have made us an offscouring and refuse In the midst of the peoples.
Lamentations,3,46,All our enemies Have opened their mouths against us.
Lamentations,3,47,"Fear and a snare have come upon us, Desolation and destruction."
Lamentations,3,48,My eyes overflow with rivers of water For the destruction of the daughter of my people.
Lamentations,3,49,"My eyes flow and do not cease, Without interruption,"
Lamentations,3,50,Till the LORD from heaven Looks down and sees.
Lamentations,3,51,My eyes bring suffering to my soul Because of all the daughters of my city.
Lamentations,3,52,My enemies without cause Hunted me down like a bird.
Lamentations,3,53,They silenced my life in the pit And threw stones at me.
Lamentations,3,54,"The waters flowed over my head; I said, “I am cut off!”"
Lamentations,3,55,"I called on Your name, O LORD, From the lowest pit."
Lamentations,3,56,"You have heard my voice: “Do not hide Your ear From my sighing, from my cry for help.”"
Lamentations,3,57,"You drew near on the day I called on You, And said, “Do not fear!”"
Lamentations,3,58,"O Lord, You have pleaded the case for my soul; You have redeemed my life."
Lamentations,3,59,"O LORD, You have seen how I am wronged; Judge my case."
Lamentations,3,60,"You have seen all their vengeance, All their schemes against me."
Lamentations,3,61,"You have heard their reproach, O LORD, All their schemes against me,"
Lamentations,3,62,The lips of my enemies And their whispering against me all the day.
Lamentations,3,63,Look at their sitting down and their rising up; I am their taunting song.
Lamentations,3,64,"Repay them, O LORD, According to the work of their hands."
Lamentations,3,65,Give them a veiled heart; Your curse be upon them!
Lamentations,3,66,"In Your anger, Pursue and destroy them From under the heavens of the LORD."
Lamentations,4,1,How the gold has become dim! How changed the fine gold! The stones of the sanctuary are scattered At the head of every street.
Lamentations,4,2,"The precious sons of Zion, Valuable as fine gold, How they are regarded as clay pots, The work of the hands of the potter!"
Lamentations,4,3,"Even the jackals present their breasts To nurse their young; But the daughter of my people is cruel, Like ostriches in the wilderness."
Lamentations,4,4,"The tongue of the infant clings To the roof of its mouth for thirst; The young children ask for bread, But no one breaks it for them."
Lamentations,4,5,Those who ate delicacies Are desolate in the streets; Those who were brought up in scarlet Embrace ash heaps.
Lamentations,4,6,"The punishment of the iniquity of the daughter of my people Is greater than the punishment of the sin of Sodom, Which was overthrown in a moment, With no hand to help her!"
Lamentations,4,7,"Her Nazirites were brighter than snow And whiter than milk; They were more ruddy in body than rubies, Like sapphire in their appearance."
Lamentations,4,8,"Now their appearance is blacker than soot; They go unrecognized in the streets; Their skin clings to their bones, It has become as dry as wood."
Lamentations,4,9,"Those slain by the sword are better off Than those who die of hunger; For these pine away, Stricken for lack of the fruits of the field."
Lamentations,4,10,The hands of the compassionate women Have cooked their own children; They became food for them In the destruction of the daughter of my people.
Lamentations,4,11,"The LORD has fulfilled His fury, He has poured out His fierce anger. He kindled a fire in Zion, And it has devoured its foundations."
Lamentations,4,12,"The kings of the earth, And all inhabitants of the world, Would not have believed That the adversary and the enemy Could enter the gates of Jerusalem—"
Lamentations,4,13,"Because of the sins of her prophets And the iniquities of her priests, Who shed in her midst The blood of the just."
Lamentations,4,14,"They wandered blind in the streets; They have defiled themselves with blood, So that no one would touch their garments."
Lamentations,4,15,"They cried out to them, “Go away, unclean! Go away, go away, Do not touch us!” When they fled and wandered, Those among the nations said, “They shall no longer dwell here.”"
Lamentations,4,16,The face of the LORD scattered them; He no longer regards them. The people do not respect the priests Nor show favor to the elders.
Lamentations,4,17,"Still our eyes failed us, Watching vainly for our help; In our watching we watched For a nation that could not save us."
Lamentations,4,18,"They tracked our steps So that we could not walk in our streets. Our end was near; Our days were over, For our end had come."
Lamentations,4,19,Our pursuers were swifter Than the eagles of the heavens. They pursued us on the mountains And lay in wait for us in the wilderness.
Lamentations,4,20,"The breath of our nostrils, the anointed of the LORD, Was caught in their pits, Of whom we said, “Under his shadow We shall live among the nations.”"
Lamentations,4,21,"Rejoice and be glad, O daughter of Edom, You who dwell in the land of Uz! The cup shall also pass over to you And you shall become drunk and make yourself naked."
Lamentations,4,22,"The punishment of your iniquity is accomplished, O daughter of Zion; He will no longer send you into captivity. He will punish your iniquity, O daughter of Edom; He will uncover your sins!"
Lamentations,5,1,"Remember, O LORD, what has come upon us; Look, and behold our reproach!"
Lamentations,5,2,"Our inheritance has been turned over to aliens, And our houses to foreigners."
Lamentations,5,3,"We have become orphans and waifs, Our mothers are like widows."
Lamentations,5,4,"We pay for the water we drink, And our wood comes at a price."
Lamentations,5,5,They pursue at our heels; We labor and have no rest.
Lamentations,5,6,"We have given our hand to the Egyptians And the Assyrians, to be satisfied with bread."
Lamentations,5,7,"Our fathers sinned and are no more, But we bear their iniquities."
Lamentations,5,8,Servants rule over us; There is none to deliver us from their hand.
Lamentations,5,9,"We get our bread at the risk of our lives, Because of the sword in the wilderness."
Lamentations,5,10,"Our skin is hot as an oven, Because of the fever of famine."
Lamentations,5,11,"They ravished the women in Zion, The maidens in the cities of Judah."
Lamentations,5,12,"Princes were hung up by their hands, And elders were not respected."
Lamentations,5,13,Young men ground at the millstones; Boys staggered under loads of wood.
Lamentations,5,14,"The elders have ceased gathering at the gate, And the young men from their music."
Lamentations,5,15,The joy of our heart has ceased; Our dance has turned into mourning.
Lamentations,5,16,"The crown has fallen from our head. Woe to us, for we have sinned!"
Lamentations,5,17,Because of this our heart is faint; Because of these things our eyes grow dim;
Lamentations,5,18,"Because of Mount Zion which is desolate, With foxes walking about on it."
Lamentations,5,19,"You, O LORD, remain forever; Your throne from generation to generation."
Lamentations,5,20,"Why do You forget us forever, And forsake us for so long a time?"
Lamentations,5,21,"Turn us back to You, O LORD, and we will be restored; Renew our days as of old,"
Lamentations,5,22,"Unless You have utterly rejected us, And are very angry with us!"
Ezekiel,1,1,"Now it came to pass in the thirtieth year, in the fourth month, on the fifth day of the month, as I was among the captives by the River Chebar, that the heavens were opened and I saw visions of God."
Ezekiel,1,2,"On the fifth day of the month, which was in the fifth year of King Jehoiachin’s captivity,"
Ezekiel,1,3,"the word of the LORD came expressly to Ezekiel the priest, the son of Buzi, in the land of the Chaldeans by the River Chebar; and the hand of the LORD was upon him there."
Ezekiel,1,4,"Then I looked, and behold, a whirlwind was coming out of the north, a great cloud with raging fire engulfing itself; and brightness was all around it and radiating out of its midst like the color of amber, out of the midst of the fire."
Ezekiel,1,5,Also from within it came the likeness of four living creatures. And this was their appearance: they had the likeness of a man.
Ezekiel,1,6,"Each one had four faces, and each one had four wings."
Ezekiel,1,7,"Their legs were straight, and the soles of their feet were like the soles of calves’ feet. They sparkled like the color of burnished bronze."
Ezekiel,1,8,The hands of a man were under their wings on their four sides; and each of the four had faces and wings.
Ezekiel,1,9,"Their wings touched one another. The creatures did not turn when they went, but each one went straight forward."
Ezekiel,1,10,"As for the likeness of their faces, each had the face of a man; each of the four had the face of a lion on the right side, each of the four had the face of an ox on the left side, and each of the four had the face of an eagle."
Ezekiel,1,11,"Thus were their faces. Their wings stretched upward; two wings of each one touched one another, and two covered their bodies."
Ezekiel,1,12,"And each one went straight forward; they went wherever the spirit wanted to go, and they did not turn when they went."
Ezekiel,1,13,"As for the likeness of the living creatures, their appearance was like burning coals of fire, like the appearance of torches going back and forth among the living creatures. The fire was bright, and out of the fire went lightning."
Ezekiel,1,14,"And the living creatures ran back and forth, in appearance like a flash of lightning."
Ezekiel,1,15,"Now as I looked at the living creatures, behold, a wheel was on the earth beside each living creature with its four faces."
Ezekiel,1,16,"The appearance of the wheels and their workings was like the color of beryl, and all four had the same likeness. The appearance of their workings was, as it were, a wheel in the middle of a wheel."
Ezekiel,1,17,"When they moved, they went toward any one of four directions; they did not turn aside when they went."
Ezekiel,1,18,"As for their rims, they were so high they were awesome; and their rims were full of eyes, all around the four of them."
Ezekiel,1,19,"When the living creatures went, the wheels went beside them; and when the living creatures were lifted up from the earth, the wheels were lifted up."
Ezekiel,1,20,"Wherever the spirit wanted to go, they went, because there the spirit went; and the wheels were lifted together with them, for the spirit of the living creatures was in the wheels."
Ezekiel,1,21,"When those went, these went; when those stood, these stood; and when those were lifted up from the earth, the wheels were lifted up together with them, for the spirit of the living creatures was in the wheels."
Ezekiel,1,22,"The likeness of the firmament above the heads of the living creatures was like the color of an awesome crystal, stretched out over their heads."
Ezekiel,1,23,"And under the firmament their wings spread out straight, one toward another. Each one had two which covered one side, and each one had two which covered the other side of the body."
Ezekiel,1,24,"When they went, I heard the noise of their wings, like the noise of many waters, like the voice of the Almighty, a tumult like the noise of an army; and when they stood still, they let down their wings."
Ezekiel,1,25,"A voice came from above the firmament that was over their heads; whenever they stood, they let down their wings."
Ezekiel,1,26,"And above the firmament over their heads was the likeness of a throne, in appearance like a sapphire stone; on the likeness of the throne was a likeness with the appearance of a man high above it."
Ezekiel,1,27,"Also from the appearance of His waist and upward I saw, as it were, the color of amber with the appearance of fire all around within it; and from the appearance of His waist and downward I saw, as it were, the appearance of fire with brightness all around."
Ezekiel,1,28,"So when I saw it, I fell on my face, and I heard a voice of One speaking."
Ezekiel,2,1,"And He said to me, “Son of man, stand on your feet, and I will speak to you.”"
Ezekiel,2,2,"Then the Spirit entered me when He spoke to me, and set me on my feet; and I heard Him who spoke to me."
Ezekiel,2,3,"And He said to me: “Son of man, I am sending you to the children of Israel, to a rebellious nation that has rebelled against Me; they and their fathers have transgressed against Me to this very day."
Ezekiel,2,4,"For they are impudent and stubborn children. I am sending you to them, and you shall say to them, ‘Thus says the Lord GOD.’"
Ezekiel,2,5,"As for them, whether they hear or whether they refuse—for they are a rebellious house—yet they will know that a prophet has been among them."
Ezekiel,2,6,"“And you, son of man, do not be afraid of them nor be afraid of their words, though briers and thorns are with you and you dwell among scorpions; do not be afraid of their words or dismayed by their looks, though they are a rebellious house."
Ezekiel,2,7,"You shall speak My words to them, whether they hear or whether they refuse, for they are rebellious."
Ezekiel,2,8,"But you, son of man, hear what I say to you. Do not be rebellious like that rebellious house; open your mouth and eat what I give you.”"
Ezekiel,2,9,"Now when I looked, there was a hand stretched out to me; and behold, a scroll of a book was in it."
Ezekiel,2,10,"Then He spread it before me; and there was writing on the inside and on the outside, and written on it were lamentations and mourning and woe."
Ezekiel,3,1,"Moreover He said to me, “Son of man, eat what you find; eat this scroll, and go, speak to the house of Israel.”"
Ezekiel,3,2,"So I opened my mouth, and He caused me to eat that scroll."
Ezekiel,3,3,"And He said to me, “Son of man, feed your belly, and fill your stomach with this scroll that I give you.” So I ate, and it was in my mouth like honey in sweetness."
Ezekiel,3,4,"Then He said to me: “Son of man, go to the house of Israel and speak with My words to them."
Ezekiel,3,5,"For you are not sent to a people of unfamiliar speech and of hard language, but to the house of Israel,"
Ezekiel,3,6,"not to many people of unfamiliar speech and of hard language, whose words you cannot understand. Surely, had I sent you to them, they would have listened to you."
Ezekiel,3,7,"But the house of Israel will not listen to you, because they will not listen to Me; for all the house of Israel are impudent and hard-hearted."
Ezekiel,3,8,"Behold, I have made your face strong against their faces, and your forehead strong against their foreheads."
