Jeremiah,3,18,"“In those days the house of Judah shall walk with the house of Israel, and they shall come together out of the land of the north to the land that I have given as an inheritance to your fathers."
Jeremiah,3,19,"“But I said: ‘How can I put you among the children And give you a pleasant land, A beautiful heritage of the hosts of nations?’ “And I said: ‘You shall call Me, “My Father,” And not turn away from Me.’"
Jeremiah,3,20,"Surely, as a wife treacherously departs from her husband, So have you dealt treacherously with Me, O house of Israel,” says the LORD."
Jeremiah,3,21,"A voice was heard on the desolate heights, Weeping and supplications of the children of Israel. For they have perverted their way; They have forgotten the LORD their God."
Jeremiah,3,22,"“Return, you backsliding children, And I will heal your backslidings.” “Indeed we do come to You, For You are the LORD our God."
Jeremiah,3,23,"Truly, in vain is salvation hoped for from the hills, And from the multitude of mountains; Truly, in the LORD our God Is the salvation of Israel."
Jeremiah,3,24,"For shame has devoured The labor of our fathers from our youth— Their flocks and their herds, Their sons and their daughters."
Jeremiah,3,25,"We lie down in our shame, And our reproach covers us. For we have sinned against the LORD our God, We and our fathers, From our youth even to this day, And have not obeyed the voice of the LORD our God.”"
Jeremiah,4,1,"“If you will return, O Israel,” says the LORD, “Return to Me; And if you will put away your abominations out of My sight, Then you shall not be moved."
Jeremiah,4,2,"And you shall swear, ‘The LORD lives,’ In truth, in judgment, and in righteousness; The nations shall bless themselves in Him, And in Him they shall glory.”"
Jeremiah,4,3,"For thus says the LORD to the men of Judah and Jerusalem: “Break up your fallow ground, And do not sow among thorns."
Jeremiah,4,4,"Circumcise yourselves to the LORD, And take away the foreskins of your hearts, You men of Judah and inhabitants of Jerusalem, Lest My fury come forth like fire, And burn so that no one can quench it, Because of the evil of your doings.”"
Jeremiah,4,5,"Declare in Judah and proclaim in Jerusalem, and say: “Blow the trumpet in the land; Cry, ‘Gather together,’ And say, ‘Assemble yourselves, And let us go into the fortified cities.’"
Jeremiah,4,6,"Set up the standard toward Zion. Take refuge! Do not delay! For I will bring disaster from the north, And great destruction.”"
Jeremiah,4,7,"The lion has come up from his thicket, And the destroyer of nations is on his way. He has gone forth from his place To make your land desolate. Your cities will be laid waste, Without inhabitant."
Jeremiah,4,8,"For this, clothe yourself with sackcloth, Lament and wail. For the fierce anger of the LORD Has not turned back from us."
Jeremiah,4,9,"“And it shall come to pass in that day,” says the LORD, “That the heart of the king shall perish, And the heart of the princes; The priests shall be astonished, And the prophets shall wonder.”"
Jeremiah,4,10,"Then I said, “Ah, Lord GOD! Surely You have greatly deceived this people and Jerusalem, Saying, ‘You shall have peace,’ Whereas the sword reaches to the heart.”"
Jeremiah,4,11,"At that time it will be said To this people and to Jerusalem, “A dry wind of the desolate heights blows in the wilderness Toward the daughter of My people— Not to fan or to cleanse—"
Jeremiah,4,12,A wind too strong for these will come for Me; Now I will also speak judgment against them.”
Jeremiah,4,13,"“Behold, he shall come up like clouds, And his chariots like a whirlwind. His horses are swifter than eagles. Woe to us, for we are plundered!”"
Jeremiah,4,14,"O Jerusalem, wash your heart from wickedness, That you may be saved. How long shall your evil thoughts lodge within you?"
Jeremiah,4,15,For a voice declares from Dan And proclaims affliction from Mount Ephraim:
Jeremiah,4,16,"“Make mention to the nations, Yes, proclaim against Jerusalem, That watchers come from a far country And raise their voice against the cities of Judah."
Jeremiah,4,17,"Like keepers of a field they are against her all around, Because she has been rebellious against Me,” says the LORD."
Jeremiah,4,18,"“Your ways and your doings Have procured these things for you. This is your wickedness, Because it is bitter, Because it reaches to your heart.”"
Jeremiah,4,19,"O my soul, my soul! I am pained in my very heart! My heart makes a noise in me; I cannot hold my peace, Because you have heard, O my soul, The sound of the trumpet, The alarm of war."
Jeremiah,4,20,"Destruction upon destruction is cried, For the whole land is plundered. Suddenly my tents are plundered, And my curtains in a moment."
Jeremiah,4,21,"How long will I see the standard, And hear the sound of the trumpet?"
Jeremiah,4,22,"“For My people are foolish, They have not known Me. They are silly children, And they have no understanding. They are wise to do evil, But to do good they have no knowledge.”"
Jeremiah,4,23,"I beheld the earth, and indeed it was without form, and void; And the heavens, they had no light."
Jeremiah,4,24,"I beheld the mountains, and indeed they trembled, And all the hills moved back and forth."
Jeremiah,4,25,"I beheld, and indeed there was no man, And all the birds of the heavens had fled."
Jeremiah,4,26,"I beheld, and indeed the fruitful land was a wilderness, And all its cities were broken down At the presence of the LORD, By His fierce anger."
Jeremiah,4,27,For thus says the LORD: “The whole land shall be desolate; Yet I will not make a full end.
Jeremiah,4,28,"For this shall the earth mourn, And the heavens above be black, Because I have spoken. I have purposed and will not relent, Nor will I turn back from it."
Jeremiah,4,29,"The whole city shall flee from the noise of the horsemen and bowmen. They shall go into thickets and climb up on the rocks. Every city shall be forsaken, And not a man shall dwell in it."
Jeremiah,4,30,"“And when you are plundered, What will you do? Though you clothe yourself with crimson, Though you adorn yourself with ornaments of gold, Though you enlarge your eyes with paint, In vain you will make yourself fair; Your lovers will despise you; They will seek your life."
Jeremiah,4,31,"“For I have heard a voice as of a woman in labor, The anguish as of her who brings forth her first child, The voice of the daughter of Zion bewailing herself; She spreads her hands, saying, ‘Woe is me now, for my soul is weary Because of murderers!’"
Jeremiah,5,1,"“Run to and fro through the streets of Jerusalem; See now and know; And seek in her open places If you can find a man, If there is anyone who executes judgment, Who seeks the truth, And I will pardon her."
Jeremiah,5,2,"Though they say, ‘As the LORD lives,’ Surely they swear falsely.”"
Jeremiah,5,3,"O LORD, are not Your eyes on the truth? You have stricken them, But they have not grieved; You have consumed them, But they have refused to receive correction. They have made their faces harder than rock; They have refused to return."
Jeremiah,5,4,"Therefore I said, “Surely these are poor. They are foolish; For they do not know the way of the LORD, The judgment of their God."
Jeremiah,5,5,"I will go to the great men and speak to them, For they have known the way of the LORD, The judgment of their God.” But these have altogether broken the yoke And burst the bonds."
Jeremiah,5,6,"Therefore a lion from the forest shall slay them, A wolf of the deserts shall destroy them; A leopard will watch over their cities. Everyone who goes out from there shall be torn in pieces, Because their transgressions are many; Their backslidings have increased."
Jeremiah,5,7,"“How shall I pardon you for this? Your children have forsaken Me And sworn by those that are not gods. When I had fed them to the full, Then they committed adultery And assembled themselves by troops in the harlots’ houses."
Jeremiah,5,8,They were like well-fed lusty stallions; Every one neighed after his neighbor’s wife.
Jeremiah,5,9,Shall I not punish them for these things?” says the LORD. “And shall I not avenge Myself on such a nation as this?
Jeremiah,5,10,"“Go up on her walls and destroy, But do not make a complete end. Take away her branches, For they are not the LORD’s."
Jeremiah,5,11,"For the house of Israel and the house of Judah Have dealt very treacherously with Me,” says the LORD."
Jeremiah,5,12,"They have lied about the LORD, And said, “It is not He. Neither will evil come upon us, Nor shall we see sword or famine."
Jeremiah,5,13,"And the prophets become wind, For the word is not in them. Thus shall it be done to them.”"
Jeremiah,5,14,"Therefore thus says the LORD God of hosts: “Because you speak this word, Behold, I will make My words in your mouth fire, And this people wood, And it shall devour them."
Jeremiah,5,15,"Behold, I will bring a nation against you from afar, O house of Israel,” says the LORD. “It is a mighty nation, It is an ancient nation, A nation whose language you do not know, Nor can you understand what they say."
Jeremiah,5,16,Their quiver is like an open tomb; They are all mighty men.
Jeremiah,5,17,"And they shall eat up your harvest and your bread, Which your sons and daughters should eat. They shall eat up your flocks and your herds; They shall eat up your vines and your fig trees; They shall destroy your fortified cities, In which you trust, with the sword."
Jeremiah,5,18,"“Nevertheless in those days,” says the LORD, “I will not make a complete end of you."
Jeremiah,5,19,"And it will be when you say, ‘Why does the LORD our God do all these things to us?’ then you shall answer them, ‘Just as you have forsaken Me and served foreign gods in your land, so you shall serve aliens in a land that is not yours.’"
Jeremiah,5,20,"“Declare this in the house of Jacob And proclaim it in Judah, saying,"
Jeremiah,5,21,"‘Hear this now, O foolish people, Without understanding, Who have eyes and see not, And who have ears and hear not:"
Jeremiah,5,22,"Do you not fear Me?’ says the LORD. ‘Will you not tremble at My presence, Who have placed the sand as the bound of the sea, By a perpetual decree, that it cannot pass beyond it? And though its waves toss to and fro, Yet they cannot prevail; Though they roar, yet they cannot pass over it."
Jeremiah,5,23,But this people has a defiant and rebellious heart; They have revolted and departed.
Jeremiah,5,24,"They do not say in their heart, “Let us now fear the LORD our God, Who gives rain, both the former and the latter, in its season. He reserves for us the appointed weeks of the harvest.”"
Jeremiah,5,25,"Your iniquities have turned these things away, And your sins have withheld good from you."
Jeremiah,5,26,‘For among My people are found wicked men; They lie in wait as one who sets snares; They set a trap; They catch men.
Jeremiah,5,27,"As a cage is full of birds, So their houses are full of deceit. Therefore they have become great and grown rich."
Jeremiah,5,28,"They have grown fat, they are sleek; Yes, they surpass the deeds of the wicked; They do not plead the cause, The cause of the fatherless; Yet they prosper, And the right of the needy they do not defend."
Jeremiah,5,29,Shall I not punish them for these things?’ says the LORD. ‘Shall I not avenge Myself on such a nation as this?’
Jeremiah,5,30,“An astonishing and horrible thing Has been committed in the land:
Jeremiah,5,31,"The prophets prophesy falsely, And the priests rule by their own power; And My people love to have it so. But what will you do in the end?"
Jeremiah,6,1,"“O you children of Benjamin, Gather yourselves to flee from the midst of Jerusalem! Blow the trumpet in Tekoa, And set up a signal-fire in Beth Haccerem; For disaster appears out of the north, And great destruction."
Jeremiah,6,2,I have likened the daughter of Zion To a lovely and delicate woman.
Jeremiah,6,3,The shepherds with their flocks shall come to her. They shall pitch their tents against her all around. Each one shall pasture in his own place.”
Jeremiah,6,4,"“Prepare war against her; Arise, and let us go up at noon. Woe to us, for the day goes away, For the shadows of the evening are lengthening."
Jeremiah,6,5,"Arise, and let us go by night, And let us destroy her palaces.”"
Jeremiah,6,6,"For thus has the LORD of hosts said: “Cut down trees, And build a mound against Jerusalem. This is the city to be punished. She is full of oppression in her midst."
Jeremiah,6,7,"As a fountain wells up with water, So she wells up with her wickedness. Violence and plundering are heard in her. Before Me continually are grief and wounds."
Jeremiah,6,8,"Be instructed, O Jerusalem, Lest My soul depart from you; Lest I make you desolate, A land not inhabited.”"
Jeremiah,6,9,"Thus says the LORD of hosts: “They shall thoroughly glean as a vine the remnant of Israel; As a grape-gatherer, put your hand back into the branches.”"
Jeremiah,6,10,"To whom shall I speak and give warning, That they may hear? Indeed their ear is uncircumcised, And they cannot give heed. Behold, the word of the LORD is a reproach to them; They have no delight in it."
Jeremiah,6,11,"Therefore I am full of the fury of the LORD. I am weary of holding it in. “I will pour it out on the children outside, And on the assembly of young men together; For even the husband shall be taken with the wife, The aged with him who is full of days."
Jeremiah,6,12,"And their houses shall be turned over to others, Fields and wives together; For I will stretch out My hand Against the inhabitants of the land,” says the LORD."
Jeremiah,6,13,"“Because from the least of them even to the greatest of them, Everyone is given to covetousness; And from the prophet even to the priest, Everyone deals falsely."
Jeremiah,6,14,"They have also healed the hurt of My people slightly, Saying, ‘Peace, peace!’ When there is no peace."
Jeremiah,6,15,"Were they ashamed when they had committed abomination? No! They were not at all ashamed; Nor did they know how to blush. Therefore they shall fall among those who fall; At the time I punish them, They shall be cast down,” says the LORD."
Jeremiah,6,16,"Thus says the LORD: “Stand in the ways and see, And ask for the old paths, where the good way is, And walk in it; Then you will find rest for your souls. But they said, ‘We will not walk in it.’"
Jeremiah,6,17,"Also, I set watchmen over you, saying, ‘Listen to the sound of the trumpet!’ But they said, ‘We will not listen.’"
Jeremiah,6,18,"Therefore hear, you nations, And know, O congregation, what is among them."
Jeremiah,6,19,"Hear, O earth! Behold, I will certainly bring calamity on this people— The fruit of their thoughts, Because they have not heeded My words Nor My law, but rejected it."
Jeremiah,6,20,"For what purpose to Me Comes frankincense from Sheba, And sweet cane from a far country? Your burnt offerings are not acceptable, Nor your sacrifices sweet to Me.”"
Jeremiah,6,21,"Therefore thus says the LORD: “Behold, I will lay stumbling blocks before this people, And the fathers and the sons together shall fall on them. The neighbor and his friend shall perish.”"
Jeremiah,6,22,"Thus says the LORD: “Behold, a people comes from the north country, And a great nation will be raised from the farthest parts of the earth."
Jeremiah,6,23,"They will lay hold on bow and spear; They are cruel and have no mercy; Their voice roars like the sea; And they ride on horses, As men of war set in array against you, O daughter of Zion.”"
Jeremiah,6,24,"We have heard the report of it; Our hands grow feeble. Anguish has taken hold of us, Pain as of a woman in labor."
Jeremiah,6,25,"Do not go out into the field, Nor walk by the way. Because of the sword of the enemy, Fear is on every side."
Jeremiah,6,26,"O daughter of my people, Dress in sackcloth And roll about in ashes! Make mourning as for an only son, most bitter lamentation; For the plunderer will suddenly come upon us."
Jeremiah,6,27,"“I have set you as an assayer and a fortress among My people, That you may know and test their way."
Jeremiah,6,28,"They are all stubborn rebels, walking as slanderers. They are bronze and iron, They are all corrupters;"
Jeremiah,6,29,"The bellows blow fiercely, The lead is consumed by the fire; The smelter refines in vain, For the wicked are not drawn off."
Jeremiah,6,30,"People will call them rejected silver, Because the LORD has rejected them.”"
Jeremiah,7,1,"The word that came to Jeremiah from the LORD, saying,"
Jeremiah,7,2,"“Stand in the gate of the LORD’s house, and proclaim there this word, and say, ‘Hear the word of the LORD, all you of Judah who enter in at these gates to worship the LORD!’”"
Jeremiah,7,3,"Thus says the LORD of hosts, the God of Israel: “Amend your ways and your doings, and I will cause you to dwell in this place."
Jeremiah,7,4,"Do not trust in these lying words, saying, ‘The temple of the LORD, the temple of the LORD, the temple of the LORD are these.’"
Jeremiah,7,5,"“For if you thoroughly amend your ways and your doings, if you thoroughly execute judgment between a man and his neighbor,"
Jeremiah,7,6,"if you do not oppress the stranger, the fatherless, and the widow, and do not shed innocent blood in this place, or walk after other gods to your hurt,"
Jeremiah,7,7,"then I will cause you to dwell in this place, in the land that I gave to your fathers forever and ever."
Jeremiah,7,8,"“Behold, you trust in lying words that cannot profit."
Jeremiah,7,9,"Will you steal, murder, commit adultery, swear falsely, burn incense to Baal, and walk after other gods whom you do not know,"
Jeremiah,7,10,"and then come and stand before Me in this house which is called by My name, and say, ‘We are delivered to do all these abominations’?"
Jeremiah,7,11,"Has this house, which is called by My name, become a den of thieves in your eyes? Behold, I, even I, have seen it,” says the LORD."
Jeremiah,7,12,"“But go now to My place which was in Shiloh, where I set My name at the first, and see what I did to it because of the wickedness of My people Israel."
Jeremiah,7,13,"And now, because you have done all these works,” says the LORD, “and I spoke to you, rising up early and speaking, but you did not hear, and I called you, but you did not answer,"
Jeremiah,7,14,"therefore I will do to the house which is called by My name, in which you trust, and to this place which I gave to you and your fathers, as I have done to Shiloh."
Jeremiah,7,15,"And I will cast you out of My sight, as I have cast out all your brethren—the whole posterity of Ephraim."
Jeremiah,7,16,"“Therefore do not pray for this people, nor lift up a cry or prayer for them, nor make intercession to Me; for I will not hear you."
Jeremiah,7,17,Do you not see what they do in the cities of Judah and in the streets of Jerusalem?
Jeremiah,7,18,"The children gather wood, the fathers kindle the fire, and the women knead dough, to make cakes for the queen of heaven; and they pour out drink offerings to other gods, that they may provoke Me to anger."
Jeremiah,7,19,"Do they provoke Me to anger?” says the LORD. “Do they not provoke themselves, to the shame of their own faces?”"
Jeremiah,7,20,"Therefore thus says the Lord GOD: “Behold, My anger and My fury will be poured out on this place—on man and on beast, on the trees of the field and on the fruit of the ground. And it will burn and not be quenched.”"
Jeremiah,7,21,"Thus says the LORD of hosts, the God of Israel: “Add your burnt offerings to your sacrifices and eat meat."
Jeremiah,7,22,"For I did not speak to your fathers, or command them in the day that I brought them out of the land of Egypt, concerning burnt offerings or sacrifices."
Jeremiah,7,23,"But this is what I commanded them, saying, ‘Obey My voice, and I will be your God, and you shall be My people. And walk in all the ways that I have commanded you, that it may be well with you.’"
Jeremiah,7,24,"Yet they did not obey or incline their ear, but followed the counsels and the dictates of their evil hearts, and went backward and not forward."
Jeremiah,7,25,"Since the day that your fathers came out of the land of Egypt until this day, I have even sent to you all My servants the prophets, daily rising up early and sending them."
Jeremiah,7,26,"Yet they did not obey Me or incline their ear, but stiffened their neck. They did worse than their fathers."
Jeremiah,7,27,"“Therefore you shall speak all these words to them, but they will not obey you. You shall also call to them, but they will not answer you."
Jeremiah,7,28,"“So you shall say to them, ‘This is a nation that does not obey the voice of the LORD their God nor receive correction. Truth has perished and has been cut off from their mouth."
Jeremiah,7,29,"Cut off your hair and cast it away, and take up a lamentation on the desolate heights; for the LORD has rejected and forsaken the generation of His wrath.’"
Jeremiah,7,30,"For the children of Judah have done evil in My sight,” says the LORD. “They have set their abominations in the house which is called by My name, to pollute it."
Jeremiah,7,31,"And they have built the high places of Tophet, which is in the Valley of the Son of Hinnom, to burn their sons and their daughters in the fire, which I did not command, nor did it come into My heart."
Jeremiah,7,32,"“Therefore behold, the days are coming,” says the LORD, “when it will no more be called Tophet, or the Valley of the Son of Hinnom, but the Valley of Slaughter; for they will bury in Tophet until there is no room."
Jeremiah,7,33,The corpses of this people will be food for the birds of the heaven and for the beasts of the earth. And no one will frighten them away.
Jeremiah,7,34,"Then I will cause to cease from the cities of Judah and from the streets of Jerusalem the voice of mirth and the voice of gladness, the voice of the bridegroom and the voice of the bride. For the land shall be desolate."
Jeremiah,8,1,"“At that time,” says the LORD, “they shall bring out the bones of the kings of Judah, and the bones of its princes, and the bones of the priests, and the bones of the prophets, and the bones of the inhabitants of Jerusalem, out of their graves."
Jeremiah,8,2,"They shall spread them before the sun and the moon and all the host of heaven, which they have loved and which they have served and after which they have walked, which they have sought and which they have worshiped. They shall not be gathered nor buried; they shall be like refuse on the face of the earth."
Jeremiah,8,3,"Then death shall be chosen rather than life by all the residue of those who remain of this evil family, who remain in all the places where I have driven them,” says the LORD of hosts."
Jeremiah,8,4,"“Moreover you shall say to them, ‘Thus says the LORD: “Will they fall and not rise? Will one turn away and not return?"
Jeremiah,8,5,"Why has this people slidden back, Jerusalem, in a perpetual backsliding? They hold fast to deceit, They refuse to return."
Jeremiah,8,6,"I listened and heard, But they do not speak aright. No man repented of his wickedness, Saying, ‘What have I done?’ Everyone turned to his own course, As the horse rushes into the battle."
Jeremiah,8,7,"“Even the stork in the heavens Knows her appointed times; And the turtledove, the swift, and the swallow Observe the time of their coming. But My people do not know the judgment of the LORD."
Jeremiah,8,8,"“How can you say, ‘We are wise, And the law of the LORD is with us’? Look, the false pen of the scribe certainly works falsehood."
Jeremiah,8,9,"The wise men are ashamed, They are dismayed and taken. Behold, they have rejected the word of the LORD; So what wisdom do they have?"
Jeremiah,8,10,"Therefore I will give their wives to others, And their fields to those who will inherit them; Because from the least even to the greatest Everyone is given to covetousness; From the prophet even to the priest Everyone deals falsely."
Jeremiah,8,11,"For they have healed the hurt of the daughter of My people slightly, Saying, ‘Peace, peace!’ When there is no peace."
Jeremiah,8,12,"Were they ashamed when they had committed abomination? No! They were not at all ashamed, Nor did they know how to blush. Therefore they shall fall among those who fall; In the time of their punishment They shall be cast down,” says the LORD."
Jeremiah,8,13,"“I will surely consume them,” says the LORD. “No grapes shall be on the vine, Nor figs on the fig tree, And the leaf shall fade; And the things I have given them shall pass away from them.”’”"
Jeremiah,8,14,"“Why do we sit still? Assemble yourselves, And let us enter the fortified cities, And let us be silent there. For the LORD our God has put us to silence And given us water of gall to drink, Because we have sinned against the LORD."
Jeremiah,8,15,"“We looked for peace, but no good came; And for a time of health, and there was trouble!"
Jeremiah,8,16,"The snorting of His horses was heard from Dan. The whole land trembled at the sound of the neighing of His strong ones; For they have come and devoured the land and all that is in it, The city and those who dwell in it.”"
Jeremiah,8,17,"“For behold, I will send serpents among you, Vipers which cannot be charmed, And they shall bite you,” says the LORD."
Jeremiah,8,18,I would comfort myself in sorrow; My heart is faint in me.
Jeremiah,8,19,"Listen! The voice, The cry of the daughter of my people From a far country: “Is not the LORD in Zion? Is not her King in her?” “Why have they provoked Me to anger With their carved images— With foreign idols?”"
Jeremiah,8,20,"“The harvest is past, The summer is ended, And we are not saved!”"
