Ezekiel,43,6,"Then I heard Him speaking to me from the temple, while a man stood beside me."
Ezekiel,43,7,"And He said to me, “Son of man, this is the place of My throne and the place of the soles of My feet, where I will dwell in the midst of the children of Israel forever. No more shall the house of Israel defile My holy name, they nor their kings, by their harlotry or with the carcasses of their kings on their high places."
Ezekiel,43,8,"When they set their threshold by My threshold, and their doorpost by My doorpost, with a wall between them and Me, they defiled My holy name by the abominations which they committed; therefore I have consumed them in My anger."
Ezekiel,43,9,"Now let them put their harlotry and the carcasses of their kings far away from Me, and I will dwell in their midst forever."
Ezekiel,43,10,"“Son of man, describe the temple to the house of Israel, that they may be ashamed of their iniquities; and let them measure the pattern."
Ezekiel,43,11,"And if they are ashamed of all that they have done, make known to them the design of the temple and its arrangement, its exits and its entrances, its entire design and all its ordinances, all its forms and all its laws. Write it down in their sight, so that they may keep its whole design and all its ordinances, and perform them."
Ezekiel,43,12,"This is the law of the temple: The whole area surrounding the mountaintop is most holy. Behold, this is the law of the temple."
Ezekiel,43,13,"“These are the measurements of the altar in cubits (the cubit is one cubit and a handbreadth): the base one cubit high and one cubit wide, with a rim all around its edge of one span. This is the height of the altar:"
Ezekiel,43,14,"from the base on the ground to the lower ledge, two cubits; the width of the ledge, one cubit; from the smaller ledge to the larger ledge, four cubits; and the width of the ledge, one cubit."
Ezekiel,43,15,"The altar hearth is four cubits high, with four horns extending upward from the hearth."
Ezekiel,43,16,"The altar hearth is twelve cubits long, twelve wide, square at its four corners;"
Ezekiel,43,17,"the ledge, fourteen cubits long and fourteen wide on its four sides, with a rim of half a cubit around it; its base, one cubit all around; and its steps face toward the east.”"
Ezekiel,43,18,"And He said to me, “Son of man, thus says the Lord GOD: ‘These are the ordinances for the altar on the day when it is made, for sacrificing burnt offerings on it, and for sprinkling blood on it."
Ezekiel,43,19,"You shall give a young bull for a sin offering to the priests, the Levites, who are of the seed of Zadok, who approach Me to minister to Me,’ says the Lord GOD."
Ezekiel,43,20,"‘You shall take some of its blood and put it on the four horns of the altar, on the four corners of the ledge, and on the rim around it; thus you shall cleanse it and make atonement for it."
Ezekiel,43,21,"Then you shall also take the bull of the sin offering, and burn it in the appointed place of the temple, outside the sanctuary."
Ezekiel,43,22,"On the second day you shall offer a kid of the goats without blemish for a sin offering; and they shall cleanse the altar, as they cleansed it with the bull."
Ezekiel,43,23,"When you have finished cleansing it, you shall offer a young bull without blemish, and a ram from the flock without blemish."
Ezekiel,43,24,"When you offer them before the LORD, the priests shall throw salt on them, and they will offer them up as a burnt offering to the LORD."
Ezekiel,43,25,"Every day for seven days you shall prepare a goat for a sin offering; they shall also prepare a young bull and a ram from the flock, both without blemish."
Ezekiel,43,26,"Seven days they shall make atonement for the altar and purify it, and so consecrate it."
Ezekiel,43,27,"When these days are over it shall be, on the eighth day and thereafter, that the priests shall offer your burnt offerings and your peace offerings on the altar; and I will accept you,’ says the Lord GOD.”"
Ezekiel,44,1,"Then He brought me back to the outer gate of the sanctuary which faces toward the east, but it was shut."
Ezekiel,44,2,"And the LORD said to me, “This gate shall be shut; it shall not be opened, and no man shall enter by it, because the LORD God of Israel has entered by it; therefore it shall be shut."
Ezekiel,44,3,"As for the prince, because he is the prince, he may sit in it to eat bread before the LORD; he shall enter by way of the vestibule of the gateway, and go out the same way.”"
Ezekiel,44,4,"Also He brought me by way of the north gate to the front of the temple; so I looked, and behold, the glory of the LORD filled the house of the LORD; and I fell on my face."
Ezekiel,44,5,"And the LORD said to me, “Son of man, mark well, see with your eyes and hear with your ears, all that I say to you concerning all the ordinances of the house of the LORD and all its laws. Mark well who may enter the house and all who go out from the sanctuary."
Ezekiel,44,6,"“Now say to the rebellious, to the house of Israel, ‘Thus says the Lord GOD: “O house of Israel, let Us have no more of all your abominations."
Ezekiel,44,7,"When you brought in foreigners, uncircumcised in heart and uncircumcised in flesh, to be in My sanctuary to defile it—My house—and when you offered My food, the fat and the blood, then they broke My covenant because of all your abominations."
Ezekiel,44,8,"And you have not kept charge of My holy things, but you have set others to keep charge of My sanctuary for you.”"
Ezekiel,44,9,"Thus says the Lord GOD: “No foreigner, uncircumcised in heart or uncircumcised in flesh, shall enter My sanctuary, including any foreigner who is among the children of Israel."
Ezekiel,44,10,"“And the Levites who went far from Me, when Israel went astray, who strayed away from Me after their idols, they shall bear their iniquity."
Ezekiel,44,11,"Yet they shall be ministers in My sanctuary, as gatekeepers of the house and ministers of the house; they shall slay the burnt offering and the sacrifice for the people, and they shall stand before them to minister to them."
Ezekiel,44,12,"Because they ministered to them before their idols and caused the house of Israel to fall into iniquity, therefore I have raised My hand in an oath against them,” says the Lord GOD, “that they shall bear their iniquity."
Ezekiel,44,13,"And they shall not come near Me to minister to Me as priest, nor come near any of My holy things, nor into the Most Holy Place; but they shall bear their shame and their abominations which they have committed."
Ezekiel,44,14,"Nevertheless I will make them keep charge of the temple, for all its work, and for all that has to be done in it."
Ezekiel,44,15,"“But the priests, the Levites, the sons of Zadok, who kept charge of My sanctuary when the children of Israel went astray from Me, they shall come near Me to minister to Me; and they shall stand before Me to offer to Me the fat and the blood,” says the Lord GOD."
Ezekiel,44,16,"“They shall enter My sanctuary, and they shall come near My table to minister to Me, and they shall keep My charge."
Ezekiel,44,17,"And it shall be, whenever they enter the gates of the inner court, that they shall put on linen garments; no wool shall come upon them while they minister within the gates of the inner court or within the house."
Ezekiel,44,18,They shall have linen turbans on their heads and linen trousers on their bodies; they shall not clothe themselves with anything that causes sweat.
Ezekiel,44,19,"When they go out to the outer court, to the outer court to the people, they shall take off their garments in which they have ministered, leave them in the holy chambers, and put on other garments; and in their holy garments they shall not sanctify the people."
Ezekiel,44,20,"“They shall neither shave their heads nor let their hair grow long, but they shall keep their hair well trimmed."
Ezekiel,44,21,No priest shall drink wine when he enters the inner court.
Ezekiel,44,22,"They shall not take as wife a widow or a divorced woman, but take virgins of the descendants of the house of Israel, or widows of priests."
Ezekiel,44,23,"“And they shall teach My people the difference between the holy and the unholy, and cause them to discern between the unclean and the clean."
Ezekiel,44,24,"In controversy they shall stand as judges, and judge it according to My judgments. They shall keep My laws and My statutes in all My appointed meetings, and they shall hallow My Sabbaths."
Ezekiel,44,25,"“They shall not defile themselves by coming near a dead person. Only for father or mother, for son or daughter, for brother or unmarried sister may they defile themselves."
Ezekiel,44,26,"After he is cleansed, they shall count seven days for him."
Ezekiel,44,27,"And on the day that he goes to the sanctuary to minister in the sanctuary, he must offer his sin offering in the inner court,” says the Lord GOD."
Ezekiel,44,28,"“It shall be, in regard to their inheritance, that I am their inheritance. You shall give them no possession in Israel, for I am their possession."
Ezekiel,44,29,"They shall eat the grain offering, the sin offering, and the trespass offering; every dedicated thing in Israel shall be theirs."
Ezekiel,44,30,"The best of all firstfruits of any kind, and every sacrifice of any kind from all your sacrifices, shall be the priest’s; also you shall give to the priest the first of your ground meal, to cause a blessing to rest on your house."
Ezekiel,44,31,"The priests shall not eat anything, bird or beast, that died naturally or was torn by wild beasts."
Ezekiel,45,1,"“Moreover, when you divide the land by lot into inheritance, you shall set apart a district for the LORD, a holy section of the land; its length shall be twenty-five thousand cubits, and the width ten thousand. It shall be holy throughout its territory all around."
Ezekiel,45,2,"Of this there shall be a square plot for the sanctuary, five hundred by five hundred rods, with fifty cubits around it for an open space."
Ezekiel,45,3,"So this is the district you shall measure: twenty-five thousand cubits long and ten thousand wide; in it shall be the sanctuary, the Most Holy Place."
Ezekiel,45,4,"It shall be a holy section of the land, belonging to the priests, the ministers of the sanctuary, who come near to minister to the LORD; it shall be a place for their houses and a holy place for the sanctuary."
Ezekiel,45,5,"An area twenty-five thousand cubits long and ten thousand wide shall belong to the Levites, the ministers of the temple; they shall have twenty chambers as a possession."
Ezekiel,45,6,"“You shall appoint as the property of the city an area five thousand cubits wide and twenty-five thousand long, adjacent to the district of the holy section; it shall belong to the whole house of Israel."
Ezekiel,45,7,"“The prince shall have a section on one side and the other of the holy district and the city’s property; and bordering on the holy district and the city’s property, extending westward on the west side and eastward on the east side, the length shall be side by side with one of the tribal portions, from the west border to the east border."
Ezekiel,45,8,"The land shall be his possession in Israel; and My princes shall no more oppress My people, but they shall give the rest of the land to the house of Israel, according to their tribes.”"
Ezekiel,45,9,"‘Thus says the Lord GOD: “Enough, O princes of Israel! Remove violence and plundering, execute justice and righteousness, and stop dispossessing My people,” says the Lord GOD."
Ezekiel,45,10,"“You shall have honest scales, an honest ephah, and an honest bath."
Ezekiel,45,11,"The ephah and the bath shall be of the same measure, so that the bath contains one-tenth of a homer, and the ephah one-tenth of a homer; their measure shall be according to the homer."
Ezekiel,45,12,"The shekel shall be twenty gerahs; twenty shekels, twenty-five shekels, and fifteen shekels shall be your mina."
Ezekiel,45,13,"“This is the offering which you shall offer: you shall give one-sixth of an ephah from a homer of wheat, and one-sixth of an ephah from a homer of barley."
Ezekiel,45,14,"The ordinance concerning oil, the bath of oil, is one-tenth of a bath from a kor. A kor is a homer or ten baths, for ten baths are a homer."
Ezekiel,45,15,"And one lamb shall be given from a flock of two hundred, from the rich pastures of Israel. These shall be for grain offerings, burnt offerings, and peace offerings, to make atonement for them,” says the Lord GOD."
Ezekiel,45,16,“All the people of the land shall give this offering for the prince in Israel.
Ezekiel,45,17,"Then it shall be the prince’s part to give burnt offerings, grain offerings, and drink offerings, at the feasts, the New Moons, the Sabbaths, and at all the appointed seasons of the house of Israel. He shall prepare the sin offering, the grain offering, the burnt offering, and the peace offerings to make atonement for the house of Israel.”"
Ezekiel,45,18,"‘Thus says the Lord GOD: “In the first month, on the first day of the month, you shall take a young bull without blemish and cleanse the sanctuary."
Ezekiel,45,19,"The priest shall take some of the blood of the sin offering and put it on the doorposts of the temple, on the four corners of the ledge of the altar, and on the gateposts of the gate of the inner court."
Ezekiel,45,20,And so you shall do on the seventh day of the month for everyone who has sinned unintentionally or in ignorance. Thus you shall make atonement for the temple.
Ezekiel,45,21,"“In the first month, on the fourteenth day of the month, you shall observe the Passover, a feast of seven days; unleavened bread shall be eaten."
Ezekiel,45,22,And on that day the prince shall prepare for himself and for all the people of the land a bull for a sin offering.
Ezekiel,45,23,"On the seven days of the feast he shall prepare a burnt offering to the LORD, seven bulls and seven rams without blemish, daily for seven days, and a kid of the goats daily for a sin offering."
Ezekiel,45,24,"And he shall prepare a grain offering of one ephah for each bull and one ephah for each ram, together with a hin of oil for each ephah."
Ezekiel,45,25,"“In the seventh month, on the fifteenth day of the month, at the feast, he shall do likewise for seven days, according to the sin offering, the burnt offering, the grain offering, and the oil.”"
Ezekiel,46,1,"‘Thus says the Lord GOD: “The gateway of the inner court that faces toward the east shall be shut the six working days; but on the Sabbath it shall be opened, and on the day of the New Moon it shall be opened."
Ezekiel,46,2,"The prince shall enter by way of the vestibule of the gateway from the outside, and stand by the gatepost. The priests shall prepare his burnt offering and his peace offerings. He shall worship at the threshold of the gate. Then he shall go out, but the gate shall not be shut until evening."
Ezekiel,46,3,Likewise the people of the land shall worship at the entrance to this gateway before the LORD on the Sabbaths and the New Moons.
Ezekiel,46,4,"The burnt offering that the prince offers to the LORD on the Sabbath day shall be six lambs without blemish, and a ram without blemish;"
Ezekiel,46,5,"and the grain offering shall be one ephah for a ram, and the grain offering for the lambs, as much as he wants to give, as well as a hin of oil with every ephah."
Ezekiel,46,6,"On the day of the New Moon it shall be a young bull without blemish, six lambs, and a ram; they shall be without blemish."
Ezekiel,46,7,"He shall prepare a grain offering of an ephah for a bull, an ephah for a ram, as much as he wants to give for the lambs, and a hin of oil with every ephah."
Ezekiel,46,8,"When the prince enters, he shall go in by way of the vestibule of the gateway, and go out the same way."
Ezekiel,46,9,"“But when the people of the land come before the LORD on the appointed feast days, whoever enters by way of the north gate to worship shall go out by way of the south gate; and whoever enters by way of the south gate shall go out by way of the north gate. He shall not return by way of the gate through which he came, but shall go out through the opposite gate."
Ezekiel,46,10,"The prince shall then be in their midst. When they go in, he shall go in; and when they go out, he shall go out."
Ezekiel,46,11,"At the festivals and the appointed feast days the grain offering shall be an ephah for a bull, an ephah for a ram, as much as he wants to give for the lambs, and a hin of oil with every ephah."
Ezekiel,46,12,"“Now when the prince makes a voluntary burnt offering or voluntary peace offering to the LORD, the gate that faces toward the east shall then be opened for him; and he shall prepare his burnt offering and his peace offerings as he did on the Sabbath day. Then he shall go out, and after he goes out the gate shall be shut."
Ezekiel,46,13,“You shall daily make a burnt offering to the LORD of a lamb of the first year without blemish; you shall prepare it every morning.
Ezekiel,46,14,"And you shall prepare a grain offering with it every morning, a sixth of an ephah, and a third of a hin of oil to moisten the fine flour. This grain offering is a perpetual ordinance, to be made regularly to the LORD."
Ezekiel,46,15,"Thus they shall prepare the lamb, the grain offering, and the oil, as a regular burnt offering every morning.”"
Ezekiel,46,16,"‘Thus says the Lord GOD: “If the prince gives a gift of some of his inheritance to any of his sons, it shall belong to his sons; it is their possession by inheritance."
Ezekiel,46,17,"But if he gives a gift of some of his inheritance to one of his servants, it shall be his until the year of liberty, after which it shall return to the prince. But his inheritance shall belong to his sons; it shall become theirs."
Ezekiel,46,18,"Moreover the prince shall not take any of the people’s inheritance by evicting them from their property; he shall provide an inheritance for his sons from his own property, so that none of My people may be scattered from his property.”’”"
Ezekiel,46,19,"Now he brought me through the entrance, which was at the side of the gate, into the holy chambers of the priests which face toward the north; and there a place was situated at their extreme western end."
Ezekiel,46,20,"And he said to me, “This is the place where the priests shall boil the trespass offering and the sin offering, and where they shall bake the grain offering, so that they do not bring them out into the outer court to sanctify the people.”"
Ezekiel,46,21,"Then he brought me out into the outer court and caused me to pass by the four corners of the court; and in fact, in every corner of the court there was another court."
Ezekiel,46,22,"In the four corners of the court were enclosed courts, forty cubits long and thirty wide; all four corners were the same size."
Ezekiel,46,23,"There was a row of building stones all around in them, all around the four of them; and cooking hearths were made under the rows of stones all around."
Ezekiel,46,24,"And he said to me, “These are the kitchens where the ministers of the temple shall boil the sacrifices of the people.”"
Ezekiel,47,1,"Then he brought me back to the door of the temple; and there was water, flowing from under the threshold of the temple toward the east, for the front of the temple faced east; the water was flowing from under the right side of the temple, south of the altar."
Ezekiel,47,2,"He brought me out by way of the north gate, and led me around on the outside to the outer gateway that faces east; and there was water, running out on the right side."
Ezekiel,47,3,"And when the man went out to the east with the line in his hand, he measured one thousand cubits, and he brought me through the waters; the water came up to my ankles."
Ezekiel,47,4,Again he measured one thousand and brought me through the waters; the water came up to my knees. Again he measured one thousand and brought me through; the water came up to my waist.
Ezekiel,47,5,"Again he measured one thousand, and it was a river that I could not cross; for the water was too deep, water in which one must swim, a river that could not be crossed."
Ezekiel,47,6,"He said to me, “Son of man, have you seen this?” Then he brought me and returned me to the bank of the river."
Ezekiel,47,7,"When I returned, there, along the bank of the river, were very many trees on one side and the other."
Ezekiel,47,8,"Then he said to me: “This water flows toward the eastern region, goes down into the valley, and enters the sea. When it reaches the sea, its waters are healed."
Ezekiel,47,9,"And it shall be that every living thing that moves, wherever the rivers go, will live. There will be a very great multitude of fish, because these waters go there; for they will be healed, and everything will live wherever the river goes."
Ezekiel,47,10,"It shall be that fishermen will stand by it from En Gedi to En Eglaim; they will be places for spreading their nets. Their fish will be of the same kinds as the fish of the Great Sea, exceedingly many."
Ezekiel,47,11,But its swamps and marshes will not be healed; they will be given over to salt.
Ezekiel,47,12,"Along the bank of the river, on this side and that, will grow all kinds of trees used for food; their leaves will not wither, and their fruit will not fail. They will bear fruit every month, because their water flows from the sanctuary. Their fruit will be for food, and their leaves for medicine.”"
Ezekiel,47,13,Thus says the Lord GOD: “These are the borders by which you shall divide the land as an inheritance among the twelve tribes of Israel. Joseph shall have two portions.
Ezekiel,47,14,"You shall inherit it equally with one another; for I raised My hand in an oath to give it to your fathers, and this land shall fall to you as your inheritance."
Ezekiel,47,15,"“This shall be the border of the land on the north: from the Great Sea, by the road to Hethlon, as one goes to Zedad,"
Ezekiel,47,16,"Hamath, Berothah, Sibraim (which is between the border of Damascus and the border of Hamath), to Hazar Hatticon (which is on the border of Hauran)."
Ezekiel,47,17,"Thus the boundary shall be from the Sea to Hazar Enan, the border of Damascus; and as for the north, northward, it is the border of Hamath. This is the north side."
Ezekiel,47,18,"“On the east side you shall mark out the border from between Hauran and Damascus, and between Gilead and the land of Israel, along the Jordan, and along the eastern side of the sea. This is the east side."
Ezekiel,47,19,"“The south side, toward the South, shall be from Tamar to the waters of Meribah by Kadesh, along the brook to the Great Sea. This is the south side, toward the South."
Ezekiel,47,20,"“The west side shall be the Great Sea, from the southern boundary until one comes to a point opposite Hamath. This is the west side."
Ezekiel,47,21,“Thus you shall divide this land among yourselves according to the tribes of Israel.
Ezekiel,47,22,"It shall be that you will divide it by lot as an inheritance for yourselves, and for the strangers who dwell among you and who bear children among you. They shall be to you as native-born among the children of Israel; they shall have an inheritance with you among the tribes of Israel."
Ezekiel,47,23,"And it shall be that in whatever tribe the stranger dwells, there you shall give him his inheritance,” says the Lord GOD."
Ezekiel,48,1,"“Now these are the names of the tribes: From the northern border along the road to Hethlon at the entrance of Hamath, to Hazar Enan, the border of Damascus northward, in the direction of Hamath, there shall be one section for Dan from its east to its west side;"
Ezekiel,48,2,"by the border of Dan, from the east side to the west, one section for Asher;"
Ezekiel,48,3,"by the border of Asher, from the east side to the west, one section for Naphtali;"
Ezekiel,48,4,"by the border of Naphtali, from the east side to the west, one section for Manasseh;"
Ezekiel,48,5,"by the border of Manasseh, from the east side to the west, one section for Ephraim;"
Ezekiel,48,6,"by the border of Ephraim, from the east side to the west, one section for Reuben;"
Ezekiel,48,7,"by the border of Reuben, from the east side to the west, one section for Judah;"
Ezekiel,48,8,"by the border of Judah, from the east side to the west, shall be the district which you shall set apart, twenty-five thousand cubits in width, and in length the same as one of the other portions, from the east side to the west, with the sanctuary in the center."
Ezekiel,48,9,“The district that you shall set apart for the LORD shall be twenty-five thousand cubits in length and ten thousand in width.
Ezekiel,48,10,"To these—to the priests—the holy district shall belong: on the north twenty-five thousand cubits in length, on the west ten thousand in width, on the east ten thousand in width, and on the south twenty-five thousand in length. The sanctuary of the LORD shall be in the center."
Ezekiel,48,11,"It shall be for the priests of the sons of Zadok, who are sanctified, who have kept My charge, who did not go astray when the children of Israel went astray, as the Levites went astray."
Ezekiel,48,12,And this district of land that is set apart shall be to them a thing most holy by the border of the Levites.
Ezekiel,48,13,"“Opposite the border of the priests, the Levites shall have an area twenty-five thousand cubits in length and ten thousand in width; its entire length shall be twenty-five thousand and its width ten thousand."
Ezekiel,48,14,"And they shall not sell or exchange any of it; they may not alienate this best part of the land, for it is holy to the LORD."
